Order ID,Customer Name,Mobile Model,Quantity,Price per Unit,Total Price,Promotion Code,Order Amount,GST,Order Date,Payment Status,Shipping Status,Payment Method,Payment Provider,Mobile,Delivery Address
L7BEQQ1KJ184730442873,Ye Ling,OnePlus/9/Purple/128GB,1,147592,147592,SUMMER15,125453.2,18817.98,2023-02-12 00:00:00,Pending,Shipped,PayPal,PayPal,18706110449,Hu Nan Sheng Wu Zhou Shi Huang Pu Zheng Lu O Zuo  125557
HHO8YW2II184730443045,Zhang Zhi Qiang,Oppo/Reno5/Black/254GB,4,113945,455780,AUTUMN5,432991.0,64948.649999999994,2023-02-12 00:00:00,Pending,Pending,Credit Card,WeChat Pay,15874890066,Hai Nan Sheng Bo Xian Bin Cheng Chao Hu Lu J Zuo  701521
PJXKY25UZ184730443207,Wang Ping,Huawei/P40/Red/64GB,2,113712,227424,FESTIVE30,159196.8,23879.519999999997,2023-02-12 00:00:00,Pending,Pending,Credit Card,WeChat Pay,15795004146,Hei Long Jiang Sheng Ying Xian Dong Li Nan Ning Jie P Zuo  158364
4SZY8B1ZB184730443375,Qing Qin,iPhone/13 Pro/Purple/64GB,3,82004,246012,FESTIVE30,172208.4,25831.26,2023-02-12 00:00:00,Failed,Shipped,Debit Card,Visa,15237145368,Yun Nan Sheng Zhang Sha Shi Men Tou Gou Mou Lu B Zuo  467133
SMPLRQV8U184730443557,Wang Fang,iPhone/13 Pro/Red/254GB,5,73848,369240,AUTUMN5,350778.0,52616.7,2023-02-12 00:00:00,Paid,Shipped,Bank Transfer,Alipay,13263104353,Hei Long Jiang Sheng Ying Shi Gao Ping Xin Ji Lu P Zuo  373440
CB7B6AF4K184730443726,Gu Xiu Hua,Oppo/Reno5/Purple/1TB,2,77698,155396,SPRING20,124316.8,18647.52,2023-02-12 00:00:00,Pending,Pending,Debit Card,Alipay,18960128456,He Nan Sheng Liu Zhou Shi Bin Cheng Zhou Jie E Zuo  348250
C76N356DW184730443905,Xiong Lin,iPhone/13 Pro/White/254GB,8,114110,912880,SUMMER15,775948.0,116392.2,2023-02-12 00:00:00,Failed,In Transit,PayPal,MasterCard,15031227665,Hai Nan Sheng Han Dan Shi Xi Feng Hai Men Jie P Zuo  642944
G6JFV6F3N184730444067,Dang Ning,iPhone/13/White/254GB,10,135401,1354010,SUMMER15,1150908.5,172636.275,2023-02-12 00:00:00,Pending,Delivered,Debit Card,WeChat Pay,15579482183,He Bei Sheng Nan Jing Shi Shuang Luan Hu Jie N Zuo  505388
EQG7RTRAB184730444240,Zhang Xue,Huawei/P40/Purple/1TB,7,138953,972671,FESTIVE30,680869.7,102130.45499999999,2023-02-12 00:00:00,Paid,In Transit,PayPal,American Express,14542524500,Xiang Gang Te Bie Xing Zheng Qu Kai Shi Ping Shan Bei Zhen Jie Q Zuo  558441
HI8X7BLXB184730444412,Xu Kai,Xiaomi/Mi 11/Purple/32GB,2,71213,142426,SPRING20,113940.8,17091.12,2023-02-12 00:00:00,Pending,In Transit,Credit Card,American Express,13051248978,Liao Ning Sheng Fei Xian Nan Xi Xie Lu Y Zuo  974296
Z6FK2NTK3184730444574,Ju Gui Rong,Galaxy/S21/Red/128GB,2,120289,240578,SUMMER15,204491.3,30673.694999999996,2023-02-12 00:00:00,Pending,Delivered,Debit Card,MasterCard,13397252767,Shang Hai Shi Jing Shi Zhang Shou Nan Chang Lu E Zuo  721816
5HARLVY6V184730444734,Qu Hong Xia,OnePlus/9/Blue/64GB,9,71030,639270,FESTIVE30,447489.0,67123.34999999999,2023-02-12 00:00:00,Paid,Delivered,Debit Card,Visa,15569031867,Gan Su Sheng Nan Jing Shi Gao Ping Dong Guan Jie A Zuo  695579
V9A2AWWK5184730444903,Feng Xiang,iPhone/13/Black/1TB,8,71583,572664,WINTER10,515397.60000000003,77309.64,2023-02-12 00:00:00,Pending,Shipped,Credit Card,WeChat Pay,18107396071,Shan Xi Sheng Lu Shi Xiao Nan He Jie S Zuo  577250
FWYDY0H62184730445066,Liu Gui Zhen,OnePlus/9/Black/64GB,6,73999,443994,SUMMER15,377394.89999999997,56609.23499999999,2023-02-12 00:00:00,Paid,Shipped,PayPal,American Express,15814547098,Ao Men Te Bie Xing Zheng Qu Fo Shan Shi Huai Rou Shi Jia Zhuang Lu N Zuo  638576
69D1P3GF1184730445250,Li Shu Ying,iPhone/13/Red/1TB,8,118215,945720,FESTIVE30,662004.0,99300.59999999999,2023-02-12 00:00:00,Failed,In Transit,PayPal,Alipay,15791148773,Ning Xia Hui Zu Zi Zhi Qu Shang Hai Shi Cheng Bei Qian Jiang Jie A Zuo  187663
0D13UKN5A184730445431,Ma Gui Rong,Oppo/Reno5/White/128GB,9,67678,609102,FESTIVE30,426371.39999999997,63955.70999999999,2023-02-12 00:00:00,Paid,In Transit,Credit Card,Visa,18800594562,Guang Xi Zhuang Zu Zi Zhi Qu Xiao Hong Xian Gao Ming Wu Jie U Zuo  834388
I9OCW34AU184730445625,Liu Hui,Huawei/P40/Black/1TB,10,63133,631330,WINTER10,568197.0,85229.55,2023-02-12 00:00:00,Failed,In Transit,Credit Card,American Express,13227235794,Hei Long Jiang Sheng Ping Shi Xi Xia Qian Jiang Jie Z Zuo  216522
TF4CUBBDI184730445781,Fan Gui Zhi,Galaxy/S21/Black/128GB,6,74561,447366,SUMMER15,380261.1,57039.16499999999,2023-02-12 00:00:00,Failed,In Transit,PayPal,American Express,13960914510,Si Chuan Sheng Qian Jiang Xian Fu Cheng He Lu T Zuo  483817
XEJHW7G07184730445951,Han Yan,Oppo/Reno5/Red/1TB,7,67843,474901,SUMMER15,403665.85,60549.877499999995,2023-02-12 00:00:00,Failed,Delivered,Credit Card,MasterCard,14574174292,He Nan Sheng Huai An Xian Zhang Shou Shen Yang Lu S Zuo  944624
YOCHL424O184730446108,Wang Bin,Galaxy/S21/Purple/8GB,7,140561,983927,SPRING20,787141.6000000001,118071.24,2023-02-12 00:00:00,Failed,Shipped,Bank Transfer,WeChat Pay,18656337804,Xiang Gang Te Bie Xing Zheng Qu Jia Shi Xin Cheng Nie Lu U Zuo  875762
UZUZ4LC2Q184730446292,He Xiu Hua,Galaxy/S21/Blue/254GB,9,56501,508509,FESTIVE30,355956.3,53393.445,2023-02-12 00:00:00,Failed,In Transit,Credit Card,Visa,18875548484,He Bei Sheng Hui Shi An Ci Zhou Lu G Zuo  612896
1S7ANEO18184730446458,Lin Xue Mei,Xiaomi/Mi 11/Blue/64GB,5,60338,301690,FESTIVE30,211183.0,31677.449999999997,2023-02-12 00:00:00,Paid,In Transit,Credit Card,Visa,15205161155,Nei Meng Gu Zi Zhi Qu Li Li Shi Feng Dou Tai Bei Jie L Zuo  857749
HO2VBBP6A184730446636,Duan Bin,OnePlus/9/Black/64GB,6,87570,525420,SUMMER15,446607.0,66991.05,2023-02-12 00:00:00,Failed,Shipped,PayPal,MasterCard,18780855302,Yun Nan Sheng Lin Xian Sha Wan Li Lu V Zuo  422279
57D6XTE8J184730446800,Wang Yu,Oppo/Reno5/Red/32GB,6,68616,411696,AUTUMN5,391111.19999999995,58666.67999999999,2023-02-12 00:00:00,Pending,Delivered,Bank Transfer,PayPal,18662209057,Hai Nan Sheng Chao Xian Jiang Bei Tong Liao Lu Q Zuo  146588
R2E8E81SI184730446959,Huang Lin,Galaxy/S21/White/1TB,8,84515,676120,SUMMER15,574702.0,86205.3,2023-02-12 00:00:00,Paid,In Transit,PayPal,Visa,13079418210,Ji Lin Sheng Fu Xin Xian Xing Shan Zhang Jie B Zuo  248433
A6R0UUKPZ184730447127,Xiao Ling,iPhone/13 Pro/Blue/1TB,10,143474,1434740,NEWYEAR25,1076055.0,161408.25,2023-02-12 00:00:00,Failed,Delivered,PayPal,WeChat Pay,18121667205,Hai Nan Sheng Li Juan Shi Ping Shan Li Jie P Zuo  967945
8UNYD5QV3184730447295,Ke Yang,OnePlus/9/Black/128GB,7,147529,1032703,WINTER10,929432.7000000001,139414.905,2023-02-12 00:00:00,Failed,Delivered,PayPal,PayPal,15823575233,Jiang Su Sheng Shu Hua Shi Liu Zhi Te Cui Lu L Zuo  801234
6TZ009GX5184730447474,Liu Juan,iPhone/13 Pro/White/128GB,3,108864,326592,NEWYEAR25,244944.0,36741.6,2023-02-12 00:00:00,Paid,Delivered,Credit Card,WeChat Pay,15080585109,Gui Zhou Sheng Jian Ping Shi Hai Gang Da Ye Jie N Zuo  336118
6GIR1QDYT184730447633,Cai Gui Xiang,Oppo/Reno5/White/32GB,4,131455,525820,NEWYEAR25,394365.0,59154.75,2023-02-12 00:00:00,Pending,In Transit,Debit Card,American Express,13238995068,Guang Dong Sheng Tao Xian Da Dong La Sa Jie C Zuo  948156
40QVLN82B184730447792,Fan Xiang,Huawei/P40/White/8GB,4,115286,461144,SUMMER15,391972.39999999997,58795.85999999999,2023-02-12 00:00:00,Pending,In Transit,Bank Transfer,PayPal,13682832781,Hu Nan Sheng Chang Xian Shuang Luan Ma An Shan Jie J Zuo  714295
4HQOAEVB8184730447949,Ye Li Hua,iPhone/13 Pro/Blue/64GB,5,137900,689500,SPRING20,551600.0,82740.0,2023-02-12 00:00:00,Paid,In Transit,PayPal,WeChat Pay,13708413939,Gui Zhou Sheng Xing Cheng Xian Da Dong Chang Chun Jie M Zuo  903159
SGGE4T1CI184730448110,Li Ping,Galaxy/S21/Red/254GB,8,147058,1176464,WINTER10,1058817.6,158822.64,2023-02-12 00:00:00,Paid,In Transit,Debit Card,American Express,13774474320,Si Chuan Sheng Huai An Shi Feng Dou Cheng Du Lu U Zuo  349815
OG9JZ2WZZ184730448267,Cao Jun,OnePlus/9/Purple/254GB,5,101940,509700,WINTER10,458730.0,68809.5,2023-02-12 00:00:00,Pending,Delivered,Debit Card,WeChat Pay,18169654463,Hai Nan Sheng Dong Mei Shi Xi Shan Hai Kou Lu E Zuo  858304
5FTJHAEOE184730448425,Zhang Yu Zhen,Galaxy/S21/Black/128GB,1,82201,82201,FESTIVE30,57540.7,8631.105,2023-02-12 00:00:00,Pending,Pending,PayPal,Alipay,13151640168,Jiang Xi Sheng Yang Shi Nan Zhang Zhou Lu A Zuo  471730
IO5Y2U5BN184730448599,Huang Xiu Yun,Oppo/Reno5/Black/1TB,3,58722,176166,WINTER10,158549.4,23782.41,2023-02-12 00:00:00,Pending,Pending,Bank Transfer,PayPal,13464521813,Guang Dong Sheng Xiu Fang Shi An Ci Wang Lu S Zuo  780813
O8MQGSF5Y184730448779,Du Jun,OnePlus/9/Red/64GB,5,100391,501955,SUMMER15,426661.75,63999.2625,2023-02-12 00:00:00,Pending,In Transit,Debit Card,Alipay,13581121689,Shan Dong Sheng Yi Du Shi Chong Wen Chen Jie X Zuo  489566
QPGBXGHNY184730448950,Feng Shu Lan,Galaxy/S21/Red/254GB,7,96665,676655,WINTER10,608989.5,91348.425,2023-02-12 00:00:00,Failed,In Transit,Bank Transfer,Alipay,18013424925,Ning Xia Hui Zu Zi Zhi Qu Li Hua Shi Min Xing Xi Ning Lu O Zuo  690343
PH16D9Q8M184730449132,Chai Xiu Ying,OnePlus/9/Red/128GB,4,86382,345528,WINTER10,310975.2,46646.28,2023-02-12 00:00:00,Failed,Shipped,PayPal,American Express,18263937922,Jiang Su Sheng Cheng Xian Fang Shan Kang Jie S Zuo  581879
LFI6Q67NU184730449301,Bai Gui Ying,Vivo/X60/Red/1TB,4,76930,307720,NEWYEAR25,230790.0,34618.5,2023-02-12 00:00:00,Failed,In Transit,Debit Card,WeChat Pay,15184290609,Hei Long Jiang Sheng Nan Jing Xian Xiao Shan Geng Lu Z Zuo  364626
06ACSAFD0184730449480,He Dan,Galaxy/S21/Purple/64GB,4,108593,434372,WINTER10,390934.8,58640.219999999994,2023-02-12 00:00:00,Failed,Delivered,Bank Transfer,Alipay,13251488665,Si Chuan Sheng Nan Shi Sha Wan Huang Jie T Zuo  690909
39QG2SGWO184730449642,Zhang Lan Ying,Galaxy/S21/Blue/64GB,6,118565,711390,FESTIVE30,497972.99999999994,74695.94999999998,2023-02-12 00:00:00,Failed,Pending,Debit Card,MasterCard,18127060354,He Bei Sheng Fan Xian Da Xing Liang Lu Q Zuo  873619
MWSMOTBNA184730449809,Sun Jian Hua,Xiaomi/Mi 11/Red/1TB,8,52038,416304,FESTIVE30,291412.8,43711.92,2023-02-12 00:00:00,Pending,In Transit,Bank Transfer,WeChat Pay,15695131767,Zhe Jiang Sheng Chong Qing Xian Xin Cheng Liao Yang Lu X Zuo  609008
TTOUWZVES184730449973,Lu Li Juan,Vivo/X60/Red/64GB,1,133889,133889,SPRING20,107111.20000000001,16066.68,2023-02-12 00:00:00,Failed,In Transit,Bank Transfer,American Express,14595594229,Shang Hai Shi Feng Ying Shi Liang Ping Hang Zhou Lu Z Zuo  700950
GZ9KSWAIV184730450140,Gan Lin,iPhone/13 Pro/Red/32GB,8,63081,504648,SUMMER15,428950.8,64342.619999999995,2023-02-12 00:00:00,Paid,Shipped,Debit Card,MasterCard,14743425171,Nei Meng Gu Zi Zhi Qu Xiu Ying Shi Shuang Luan Zhang Lu I Zuo  300592
M513A2URM184730450324,Wang Xiu Fang,Huawei/P40/Black/32GB,3,137463,412389,WINTER10,371150.10000000003,55672.51500000001,2023-02-12 00:00:00,Pending,In Transit,Credit Card,American Express,13386136022,Ao Men Te Bie Xing Zheng Qu Yin Chuan Xian Zi Chuan Zhan Jie P Zuo  549676
Q0WBURRGQ184730450520,Hu Chen,Oppo/Reno5/Black/8GB,3,119100,357300,FESTIVE30,250109.99999999997,37516.49999999999,2023-02-12 00:00:00,Pending,Delivered,PayPal,MasterCard,18104318034,Tai Wan Sheng Hui Zhou Xian Feng Dou Gao Lu Z Zuo  855115
NPPUI3VKC184730450691,Mo Xiu Fang,OnePlus/9/Purple/8GB,1,149261,149261,WINTER10,134334.9,20150.234999999997,2023-02-12 00:00:00,Pending,In Transit,Credit Card,PayPal,13100436342,Hu Bei Sheng Xia Xian Shuang Luan Chong Qing Lu K Zuo  785556
A9XXG863J184730450853,Yang Lei,Oppo/Reno5/White/254GB,7,88737,621159,FESTIVE30,434811.3,65221.69499999999,2023-02-12 00:00:00,Pending,Delivered,PayPal,PayPal,18991631031,Xi Zang Zi Zhi Qu Guan Ling Xian Gao Gang Kun Ming Jie Q Zuo  914826
UYKXSM8JT184730451023,Zhang Yu Ying,iPhone/13 Pro/Purple/64GB,5,103137,515685,FESTIVE30,360979.5,54146.924999999996,2023-02-12 00:00:00,Failed,In Transit,Debit Card,WeChat Pay,15951463187,Hei Long Jiang Sheng Lan Zhou Xian Da Xing Kang Lu G Zuo  948495
PWGW73KRF184730451208,Liu Gui Lan,Xiaomi/Mi 11/Purple/64GB,2,85538,171076,WINTER10,153968.4,23095.26,2023-02-12 00:00:00,Failed,Delivered,Bank Transfer,PayPal,18747501817,Shan Xi Sheng Xin Ji Shi You Hao Chong Qing Jie K Zuo  135181
KWMS4BOU7184730451374,Song Ling,Xiaomi/Mi 11/Red/128GB,1,141766,141766,NEWYEAR25,106324.5,15948.675,2023-02-12 00:00:00,Failed,Delivered,Bank Transfer,MasterCard,13299263416,Shan Dong Sheng Xu Shi Zhang Shou Yang Lu O Zuo  899179
FWSHGEL0O184730451541,Du Jing,iPhone/13 Pro/Red/8GB,5,113678,568390,NEWYEAR25,426292.5,63943.875,2023-02-12 00:00:00,Pending,Delivered,Bank Transfer,Visa,15764420807,Ning Xia Hui Zu Zi Zhi Qu Kun Ming Shi He Ping Li Lu S Zuo  294496
PVJOSEJF8184730451731,Yan Ping,Vivo/X60/White/128GB,9,134317,1208853,AUTUMN5,1148410.3499999999,172261.55249999996,2023-02-12 00:00:00,Pending,Delivered,Bank Transfer,WeChat Pay,14554603219,Xiang Gang Te Bie Xing Zheng Qu Lin Shi He Chuan Nan Jing Jie S Zuo  802888
7BEPUPL5F184730451906,Yang Lan Ying,Huawei/P40/White/64GB,4,109615,438460,SUMMER15,372691.0,55903.65,2023-02-12 00:00:00,Failed,Delivered,PayPal,Alipay,13231234631,Ji Lin Sheng Guan Ling Xian Ji Qu Shi Jie L Zuo  722019
N04L8AKV2184730452081,Dong Li,Vivo/X60/Purple/32GB,9,80006,720054,WINTER10,648048.6,97207.29,2023-02-12 00:00:00,Paid,In Transit,Debit Card,Visa,13749489599,Ao Men Te Bie Xing Zheng Qu Kun Xian Yong Chuan Shan Wei Jie R Zuo  239639
FWTYCK6SR184730452256,Wu Yang,Vivo/X60/Purple/1TB,8,123750,990000,FESTIVE30,693000.0,103950.0,2023-02-12 00:00:00,Paid,Pending,Debit Card,Alipay,15187360052,Gan Su Sheng Shu Ying Shi Nan Zhang Ye Jie H Zuo  601102
VC9ZZL8YG184730452426,Liu Bo,Galaxy/S21/White/128GB,6,60713,364278,NEWYEAR25,273208.5,40981.275,2023-02-12 00:00:00,Failed,In Transit,Debit Card,American Express,18725851790,Gui Zhou Sheng Shen Yang Shi Pu Tuo Wu Lu N Zuo  619470
0NJ8ZR6BH184730452595,Xu Fan,iPhone/13 Pro/Purple/128GB,8,110147,881176,NEWYEAR25,660882.0,99132.3,2023-02-12 00:00:00,Pending,In Transit,PayPal,Visa,13426983722,Chong Qing Shi Shen Yang Xian Min Xing Lu Jie X Zuo  949608
17VPS19ZE184730452765,Zhang Bo,Vivo/X60/Red/254GB,6,137219,823314,WINTER10,740982.6,111147.39,2023-02-12 00:00:00,Paid,Shipped,PayPal,Alipay,13134679138,Guang Xi Zhuang Zu Zi Zhi Qu Da Ye Shi Xi Xia Yong An Lu I Zuo  315373
RUEPWQZJ6184730452943,Li Rui,OnePlus/9/Blue/1TB,2,71432,142864,FESTIVE30,100004.79999999999,15000.719999999998,2023-02-12 00:00:00,Failed,In Transit,PayPal,American Express,14715564458,Hai Nan Sheng Chang Xian Mu Ye Lei Jie T Zuo  544311
RSN31NZY2184730453113,Zhang Shu Zhen,Oppo/Reno5/Purple/1TB,8,95798,766384,NEWYEAR25,574788.0,86218.2,2023-02-12 00:00:00,Failed,Pending,Debit Card,American Express,13994964851,An Hui Sheng Da Ye Shi Xiang An Sun Lu K Zuo  976833
YNT3QZSBQ184730453286,Chen Ning,Xiaomi/Mi 11/White/64GB,5,125490,627450,SPRING20,501960.0,75294.0,2023-02-12 00:00:00,Pending,In Transit,Debit Card,Alipay,18167882725,An Hui Sheng Kai Shi Xiang An Hang Zhou Lu O Zuo  273147
BERWF5RJ5184730453435,Liang Jin Feng,iPhone/13/Red/128GB,2,61642,123284,AUTUMN5,117119.79999999999,17567.969999999998,2023-02-12 00:00:00,Paid,Shipped,Debit Card,Visa,13576979567,Hai Nan Sheng Nan Jing Xian Sha Shi Cheng Jie X Zuo  724950
SBJZWR293184730453607,Ji Xu,Huawei/P40/Black/254GB,1,53772,53772,SPRING20,43017.600000000006,6452.64,2023-02-12 00:00:00,Pending,Pending,Debit Card,Alipay,13841103968,Qing Hai Sheng Shen Yang Xian Qing Cheng Lu An Lu N Zuo  687933
4J64NNFEZ184730453773,Ma Li Juan,Galaxy/S21/Purple/8GB,7,103868,727076,SUMMER15,618014.6,92702.18999999999,2023-02-12 00:00:00,Failed,In Transit,PayPal,WeChat Pay,15249242586,Xin Jiang Wei Wu Er Zi Zhi Qu Zhang Jia Gang Shi Hua Long Xiang Gang Jie K Zuo  426261
3FHAUR9F9184730453970,Yao Xiu Mei,iPhone/13 Pro/Blue/254GB,6,76239,457434,FESTIVE30,320203.8,48030.57,2023-02-12 00:00:00,Failed,In Transit,PayPal,MasterCard,18299308325,Hei Long Jiang Sheng Chong Qing Xian Da Xing Liu Jie G Zuo  848515
882M3ACBT184730454152,Zhong Wen,OnePlus/9/Blue/254GB,8,92338,738704,SUMMER15,627898.4,94184.76,2023-02-12 00:00:00,Pending,Pending,Credit Card,American Express,15292432751,Shang Hai Shi Hai Men Xian Xu Hui Pan Jie L Zuo  387801
CCO3PCVQ7184730454325,Yao Wei,Oppo/Reno5/Black/128GB,9,56313,506817,FESTIVE30,354771.89999999997,53215.784999999996,2023-02-12 00:00:00,Pending,Delivered,Bank Transfer,Visa,13141194686,Jiang Xi Sheng Fan Shi Liang Ping Chen Jie Z Zuo  788437
5GFM61PIU184730454494,Zhou Jian Guo,OnePlus/9/Red/32GB,10,71823,718230,AUTUMN5,682318.5,102347.775,2023-02-12 00:00:00,Failed,Delivered,Debit Card,PayPal,13828246160,Chong Qing Shi Shi Jia Zhuang Shi Bai Yun Zhong Lu F Zuo  447265
FLXWKRVCL184730454678,Shao Yu Ying,Vivo/X60/Red/128GB,6,101718,610308,FESTIVE30,427215.6,64082.34,2023-02-12 00:00:00,Pending,Delivered,PayPal,WeChat Pay,18209395946,Jiang Su Sheng Nan Jing Xian Xi Feng Zhu Jie O Zuo  378300
BKXUERQNV184730454857,Xie Lei,iPhone/13/Red/128GB,8,91633,733064,SUMMER15,623104.4,93465.66,2023-02-12 00:00:00,Paid,In Transit,Credit Card,American Express,14591384042,Ao Men Te Bie Xing Zheng Qu Fo Shan Xian Xun Yang Xiao Lu W Zuo  632124
51FW9HNQ3184730455097,Chen Xiu Lan,Xiaomi/Mi 11/Purple/64GB,1,146943,146943,SPRING20,117554.40000000001,17633.16,2023-02-12 00:00:00,Pending,Shipped,Bank Transfer,PayPal,15306187554,Xi Zang Zi Zhi Qu Rong Xian Xun Yang Chao Hu Lu R Zuo  422899
JSLHS7TTN184730455350,Dong Liang,iPhone/13 Pro/Blue/1TB,6,140223,841338,AUTUMN5,799271.1,119890.665,2023-02-12 00:00:00,Failed,Pending,Credit Card,PayPal,14579792264,Liao Ning Sheng Xin Shi He Ping Hai Kou Lu G Zuo  728686
8EGHAUMB6184730455552,Tian Jie,Huawei/P40/Black/254GB,3,62594,187782,SUMMER15,159614.69999999998,23942.204999999998,2023-02-12 00:00:00,Paid,In Transit,Bank Transfer,PayPal,15026192771,Zhe Jiang Sheng Fei Xian Shen He Wen Jie V Zuo  591939
OUJ7W1OYF184730456085,Jiang Jin Feng,iPhone/13/White/32GB,7,139909,979363,AUTUMN5,930394.85,139559.22749999998,2023-02-12 00:00:00,Paid,Pending,Bank Transfer,WeChat Pay,15878369154,An Hui Sheng Ha Er Bin Shi Hua Xi Han Jie I Zuo  545208
55TOZ995G184730456329,Liang Feng,Oppo/Reno5/Red/1TB,4,56014,224056,SPRING20,179244.80000000002,26886.72,2023-02-12 00:00:00,Pending,Delivered,PayPal,MasterCard,13696874542,Jiang Xi Sheng Liu Zhou Shi Zhang Shou Gao Lu P Zuo  126374
O1CJM84KG184730456526,Wang Bo,Vivo/X60/Black/8GB,3,103321,309963,AUTUMN5,294464.85,44169.72749999999,2023-02-12 00:00:00,Paid,Pending,Debit Card,American Express,15141480855,An Hui Sheng Bing Xian Xi Xia Ji Nan Jie I Zuo  448758
QNM5GN0FC184730456707,Xie Yan,OnePlus/9/White/1TB,5,94628,473140,WINTER10,425826.0,63873.899999999994,2023-02-12 00:00:00,Pending,Shipped,Credit Card,American Express,13898206177,Gui Zhou Sheng Jian Hua Xian Mu Ye Shi Jia Zhuang Lu W Zuo  393285
VJ065QXSX184730456878,Feng Li,iPhone/13 Pro/Black/32GB,2,84447,168894,FESTIVE30,118225.79999999999,17733.87,2023-02-12 00:00:00,Failed,Delivered,Bank Transfer,Alipay,18041922098,Ji Lin Sheng Chao Hu Shi Sha Shi Yin Chuan Jie B Zuo  388270
Y73T0LMUW184730457043,Gou Yu,OnePlus/9/Purple/254GB,8,52445,419560,AUTUMN5,398582.0,59787.299999999996,2023-02-12 00:00:00,Paid,In Transit,Bank Transfer,Alipay,18194308136,Liao Ning Sheng Nan Ning Shi Long Tan Chao Hu Jie I Zuo  887946
QRFLJBM7B184730457203,Qin Ting Ting,iPhone/13 Pro/Red/8GB,7,105649,739543,SUMMER15,628611.5499999999,94291.73249999998,2023-02-12 00:00:00,Pending,Pending,Credit Card,MasterCard,15665416309,He Bei Sheng Xiang Xian Jing An Shen Yang Jie J Zuo  650982
SFJWEZ5CF184730457362,Hu Xin,iPhone/13 Pro/Purple/128GB,9,122371,1101339,AUTUMN5,1046272.0499999999,156940.8075,2023-02-12 00:00:00,Pending,Pending,Bank Transfer,Alipay,15227099086,Hu Nan Sheng Ha Er Bin Shi Bin Cheng Hang Zhou Jie R Zuo  780704
T8QZI5ASV184730457527,Tao Ping,Galaxy/S21/Black/128GB,8,50498,403984,AUTUMN5,383784.8,57567.719999999994,2023-02-12 00:00:00,Paid,In Transit,Debit Card,Visa,18964313545,Fu Jian Sheng Xing An Meng Xian Dong Li Feng Lu K Zuo  634526
4S58YG47S184730457705,Wang Chen,OnePlus/9/Blue/1TB,2,60526,121052,FESTIVE30,84736.4,12710.46,2023-02-12 00:00:00,Paid,Pending,PayPal,PayPal,15837822141,Qing Hai Sheng Shen Yang Xian He Chuan Qi Jie Y Zuo  909708
GD8MJQN09184730457874,Luo Ying,Xiaomi/Mi 11/Black/1TB,10,104228,1042280,AUTUMN5,990166.0,148524.9,2023-02-12 00:00:00,Pending,In Transit,PayPal,WeChat Pay,13777720546,Gan Su Sheng Nan Jing Shi Xiu Ying Li Jie Z Zuo  281117
992DOX4P2184730458043,Lu Bo,Huawei/P40/Red/254GB,2,124784,249568,FESTIVE30,174697.59999999998,26204.639999999996,2023-02-12 00:00:00,Paid,In Transit,PayPal,Alipay,13542448187,Shang Hai Shi Yu Xian Jing An Zhao Lu V Zuo  498678
S9A9PYBRF184730458206,Zhang Yu Mei,Oppo/Reno5/Blue/8GB,6,73043,438258,WINTER10,394432.2,59164.83,2023-02-12 00:00:00,Failed,Shipped,Debit Card,WeChat Pay,15628564645,Xiang Gang Te Bie Xing Zheng Qu Bei Zhen Shi Gao Gang Shen Jie Z Zuo  570126
U4XOBBU5J184730458403,Xu Hong Mei,Galaxy/S21/White/64GB,1,119289,119289,NEWYEAR25,89466.75,13420.012499999999,2023-02-12 00:00:00,Pending,Shipped,Bank Transfer,Alipay,14796055806,Bei Jing Shi Hu He Hao Te Shi Sha Shi Gao Lu D Zuo  162885
2V5PJKKTH184730458585,Zhang Li,iPhone/13/Red/128GB,8,90879,727032,SUMMER15,617977.2,92696.57999999999,2023-02-12 00:00:00,Pending,In Transit,Credit Card,PayPal,18055605171,Shan Xi Sheng Rui Shi Da Xing Li Lu H Zuo  853453
Q8PKOG32Y184730458753,Qu Li,Oppo/Reno5/Blue/64GB,4,125441,501764,NEWYEAR25,376323.0,56448.45,2023-02-12 00:00:00,Failed,Shipped,Credit Card,Alipay,14576066472,He Nan Sheng Fu Xin Xian Xin Cheng Chao Zhou Lu D Zuo  719758
0A90KXTV1184730458917,Zhao Yong,Huawei/P40/Blue/128GB,6,80120,480720,AUTUMN5,456684.0,68502.59999999999,2023-02-12 00:00:00,Pending,Shipped,Debit Card,PayPal,13855410220,Ji Lin Sheng Shu Zhen Shi Sha Shi Zhang Jie N Zuo  610827
XMVE4FRSQ184730459090,Yang Chang,Oppo/Reno5/Red/254GB,10,56127,561270,NEWYEAR25,420952.5,63142.875,2023-02-12 00:00:00,Pending,Delivered,PayPal,WeChat Pay,15243107911,Guang Xi Zhuang Zu Zi Zhi Qu Ying Shi Dong Cheng Nan Chang Lu K Zuo  271720
W76JXMN1S184730459269,Qi Yu Mei,Oppo/Reno5/Purple/64GB,3,129537,388611,FESTIVE30,272027.7,40804.155,2023-02-12 00:00:00,Failed,Pending,PayPal,PayPal,13057650690,Xi Zang Zi Zhi Qu Lan Zhou Xian Xi Xia Qian Jiang Jie U Zuo  453167
7NZSLJR37184730459446,Zhang Yu Mei,Huawei/P40/Blue/64GB,7,129046,903322,FESTIVE30,632325.3999999999,94848.80999999998,2023-02-12 00:00:00,Paid,Pending,Credit Card,American Express,13323972556,He Bei Sheng Tai Yuan Xian Yong Chuan Guang Zhou Lu X Zuo  834586
MGJHN8N35184730459614,Huang Qian,Vivo/X60/Black/254GB,8,111393,891144,AUTUMN5,846586.7999999999,126988.01999999999,2023-02-12 00:00:00,Failed,Delivered,Debit Card,WeChat Pay,13425358519,Hei Long Jiang Sheng Shang Hai Shi Xiang An Shen Yang Jie P Zuo  289184
ISCT6STCE184730459780,Zhang Qiang,Huawei/P40/Red/32GB,1,58766,58766,AUTUMN5,55827.7,8374.154999999999,2023-02-12 00:00:00,Pending,Delivered,PayPal,Alipay,13465980399,Shang Hai Shi Xiu Mei Xian You Hao Qi Qi Ha Er Lu Y Zuo  749310
WAV13W2HX184730459955,Guan Jian,Vivo/X60/Red/128GB,10,60869,608690,WINTER10,547821.0,82173.15,2023-02-12 00:00:00,Failed,In Transit,PayPal,WeChat Pay,15269551701,Bei Jing Shi Shen Yang Xian Xi Feng Bian Jie I Zuo  961838
DYOY6WAK2184730460132,He Li Hua,Oppo/Reno5/Purple/1TB,1,51995,51995,SPRING20,41596.0,6239.4,2023-02-12 00:00:00,Pending,In Transit,Bank Transfer,Visa,18245433453,Xiang Gang Te Bie Xing Zheng Qu Gui Xiang Xian Liang Ping Fu Lu T Zuo  984254
1BQHD99PD184730460335,Zhu Yan,iPhone/13/White/64GB,6,94862,569172,AUTUMN5,540713.4,81107.01,2023-02-12 00:00:00,Pending,Shipped,Bank Transfer,MasterCard,15945699314,Xin Jiang Wei Wu Er Zi Zhi Qu Ao Men Xian Xiao Shan Yin Chuan Lu E Zuo  948133
LHNP2LODO184730460520,Wu Xu,OnePlus/9/Black/8GB,3,78116,234348,WINTER10,210913.2,31636.98,2023-02-12 00:00:00,Pending,In Transit,Credit Card,PayPal,13183661546,Chong Qing Shi Xue Mei Shi He Chuan Liu Pan Shui Lu I Zuo  510230
1EJCFJM3K184730460688,Jing Qian,Vivo/X60/Purple/1TB,7,74990,524930,AUTUMN5,498683.5,74802.525,2023-02-12 00:00:00,Failed,Shipped,PayPal,Visa,13695212675,Si Chuan Sheng Lan Zhou Shi Xi Shan Huang Lu F Zuo  647002
J2INN57X5184730460860,Yin Min,Oppo/Reno5/Purple/8GB,9,80552,724968,FESTIVE30,507477.6,76121.64,2023-02-12 00:00:00,Failed,Shipped,Debit Card,MasterCard,13725289876,Nei Meng Gu Zi Zhi Qu La Sa Xian Liu Zhi Te Jiang Jie T Zuo  994378
XV7RVMATP184730461053,Wang Yu Zhen,Galaxy/S21/Purple/32GB,8,134285,1074280,SUMMER15,913138.0,136970.69999999998,2023-02-12 00:00:00,Paid,Pending,Credit Card,WeChat Pay,15143089576,Tai Wan Sheng Long Shi Gao Ming Cheng Du Jie V Zuo  320273
SDHBD9H1M184730461215,Xie Shu Ying,Galaxy/S21/Black/32GB,9,95284,857556,AUTUMN5,814678.2,122201.72999999998,2023-02-12 00:00:00,Pending,Pending,Debit Card,MasterCard,14755884391,Si Chuan Sheng Shu Zhen Xian Cheng Dong Zhao Jie T Zuo  219136
MYBS4D5OP184730461399,Wang Hong,Galaxy/S21/Blue/64GB,8,127082,1016656,SUMMER15,864157.6,129623.63999999998,2023-02-12 00:00:00,Failed,Pending,Bank Transfer,WeChat Pay,13613285880,Ji Lin Sheng Tai Yuan Shi Shuang Luan Qi Qi Ha Er Jie Z Zuo  359125
TBB7NEQH0184730461569,Wang Tao,Vivo/X60/Purple/32GB,2,74963,149926,NEWYEAR25,112444.5,16866.675,2023-02-12 00:00:00,Failed,Delivered,Credit Card,WeChat Pay,15756310727,An Hui Sheng Yu Mei Shi Gao Ping Xi Ning Jie E Zuo  423153
YQ86I8MHM184730461727,Zhang Gui Lan,Oppo/Reno5/Black/128GB,9,50303,452727,AUTUMN5,430090.64999999997,64513.59749999999,2023-02-12 00:00:00,Failed,Delivered,PayPal,Alipay,18039623931,Hei Long Jiang Sheng Jian Guo Xian Cheng Dong Xu Lu O Zuo  841815
FSCRNLSOW184730461908,Yin Lu,iPhone/13/White/32GB,5,146148,730740,FESTIVE30,511517.99999999994,76727.69999999998,2023-02-12 00:00:00,Paid,Delivered,PayPal,PayPal,15927674982,Zhe Jiang Sheng Jing Men Xian Bai Yun Tian Jin Jie E Zuo  158444
FWQ95QN05184730462072,Li Yu,OnePlus/9/White/254GB,7,146895,1028265,WINTER10,925438.5,138815.775,2023-02-12 00:00:00,Paid,In Transit,Credit Card,PayPal,18863827990,He Nan Sheng Qi Qi Ha Er Shi Qing Pu Chen Jie G Zuo  375156
