Order ID,Customer Name,Mobile Model,Quantity,Price per Unit,Total Price,Promotion Code,Order Amount,GST,Order Date,Payment Status,Shipping Status,Payment Method,Payment Provider,Mobile,Delivery Address
U9YQAE03M184730462254,Xue Xiao Hong,Xiaomi/Mi 11/Black/8GB,8,126686,1013488,SPRING20,810790.4,121618.56,2023-02-12 00:00:00,Pending,Pending,Bank Transfer,American Express,13622277720,Liao Ning Sheng Ping Xian Cheng Dong Qu Lu U Zuo  624250
FNS5EWBUV184730462427,Yang Yan,Huawei/P40/Red/1TB,7,117071,819497,AUTUMN5,778522.1499999999,116778.32249999998,2023-02-12 00:00:00,Pending,In Transit,Credit Card,PayPal,15588139157,Jiang Su Sheng Xi An Shi Jiang Bei Hai Men Lu J Zuo  250989
UDD28NSHR184730462587,Mi Jia,iPhone/13 Pro/Blue/1TB,8,110247,881976,WINTER10,793778.4,119066.76,2023-02-12 00:00:00,Failed,Shipped,PayPal,MasterCard,15369753916,Shang Hai Shi Jia Shi Huai Rou Xing An Meng Lu J Zuo  514654
B514V7B1R184730462749,Fang Ting Ting,Huawei/P40/Red/32GB,1,123416,123416,SUMMER15,104903.59999999999,15735.539999999997,2023-02-12 00:00:00,Failed,In Transit,Debit Card,PayPal,13572641604,Si Chuan Sheng Nan Jing Xian Cheng Dong Su Lu Q Zuo  656832
HMLPHPT3O184730462927,Liang Yu Zhen,OnePlus/9/Black/32GB,2,131352,262704,FESTIVE30,183892.8,27583.92,2023-02-12 00:00:00,Paid,Delivered,Debit Card,Visa,15795329638,Bei Jing Shi Gui Xiang Shi Bin Cheng Luo Jie Y Zuo  265960
B1840MDXB184730463110,Wang Ling,iPhone/13/Black/254GB,8,126012,1008096,SPRING20,806476.8,120971.52,2023-02-12 00:00:00,Paid,In Transit,Bank Transfer,American Express,15336152232,Liao Ning Sheng Chao Zhou Shi Bi Shan He Lu C Zuo  536389
LWVUXY6XP184730463284,Jiang Gui Zhi,OnePlus/9/Red/8GB,6,60875,365250,AUTUMN5,346987.5,52048.125,2023-02-12 00:00:00,Pending,Shipped,PayPal,Visa,14585425299,An Hui Sheng Qin Xian Dong Cheng Liang Lu K Zuo  979742
ZY5I8KM3Y184730463463,Xing Gui Fang,iPhone/13/Red/128GB,9,121056,1089504,SPRING20,871603.2000000001,130740.48000000001,2023-02-12 00:00:00,Pending,In Transit,Bank Transfer,Visa,13380312238,Hai Nan Sheng Zheng Zhou Xian Liang Ping Cheng Du Lu B Zuo  830731
3T6434X74184730463633,Wei Ling,iPhone/13 Pro/Purple/32GB,8,135308,1082464,AUTUMN5,1028340.7999999999,154251.12,2023-02-12 00:00:00,Failed,Delivered,Credit Card,American Express,18933350199,Hei Long Jiang Sheng Liu Pan Shui Xian Da Dong Pan Lu L Zuo  737005
7NGIB0LTY184730463823,Jiao Gui Rong,Huawei/P40/White/8GB,3,76518,229554,FESTIVE30,160687.8,24103.17,2023-02-12 00:00:00,Paid,Delivered,PayPal,MasterCard,13697776398,Ji Lin Sheng Ying Shi Xu Hui Hu Jie O Zuo  432989
K5K14KQG8184730464004,Rao Gui Xiang,Vivo/X60/Red/32GB,7,149438,1046066,SPRING20,836852.8,125527.92,2023-02-12 00:00:00,Failed,Pending,Debit Card,American Express,13927073758,Fu Jian Sheng Qian Jiang Xian Jing An Ao Jie A Zuo  935496
3G0LF629J184730464191,Rui Jian Guo,Vivo/X60/Purple/254GB,8,78532,628256,WINTER10,565430.4,84814.56,2023-02-12 00:00:00,Pending,Shipped,Bank Transfer,Alipay,15643962164,He Bei Sheng Shuai Shi Xiao Shan Jing Jie H Zuo  877390
TJM95TPSS184730464379,Tian Rong,iPhone/13 Pro/Purple/64GB,8,97378,779024,NEWYEAR25,584268.0,87640.2,2023-02-12 00:00:00,Failed,Shipped,Debit Card,American Express,18232363632,Qing Hai Sheng Lei Xian You Hao Huai An Lu K Zuo  875911
V0U1LYWP2184730464543,Fan Chun Mei,OnePlus/9/White/32GB,5,78608,393040,WINTER10,353736.0,53060.4,2023-02-12 00:00:00,Paid,In Transit,PayPal,Alipay,13745850770,Ning Xia Hui Zu Zi Zhi Qu Xin Ji Shi Shen Bei Xin Yan Jie S Zuo  236880
H28BUO7R5184730464754,Zhang Xin,Huawei/P40/Black/8GB,2,134631,269262,FESTIVE30,188483.4,28272.51,2023-02-12 00:00:00,Failed,Pending,PayPal,WeChat Pay,13499220123,Hu Bei Sheng Wen Shi Mu Ye Zhang Lu C Zuo  147234
5Z6AJRUG1184730464924,Wu Peng,Huawei/P40/Purple/32GB,10,63080,630800,WINTER10,567720.0,85158.0,2023-02-12 00:00:00,Failed,Shipped,Debit Card,American Express,18254524177,An Hui Sheng Qian Jiang Xian Jing An La Sa Jie R Zuo  298786
LIRV9WJV6184730465091,Huang Gui Xiang,Oppo/Reno5/Purple/1TB,4,106236,424944,WINTER10,382449.60000000003,57367.44,2023-02-12 00:00:00,Pending,Shipped,Debit Card,MasterCard,13511620842,Tian Jin Shi Ming Shi Qing He Zheng Zhou Jie F Zuo  834221
QUOLNS5AB184730465260,Shen Feng Ying,Galaxy/S21/White/8GB,6,60922,365532,WINTER10,328978.8,49346.82,2023-02-12 00:00:00,Failed,In Transit,Debit Card,Visa,15076547080,Guang Xi Zhuang Zu Zi Zhi Qu Yu Shi Huai Rou Li Lu M Zuo  190678
MW51D8AC1184730465460,Huang Hao,Galaxy/S21/Red/64GB,2,57663,115326,NEWYEAR25,86494.5,12974.175,2023-02-12 00:00:00,Paid,Pending,Debit Card,Visa,13782404603,He Nan Sheng Yu Shi Sha Shi Bei Zhen Jie P Zuo  544444
WYTRNK5AH184730465616,Wen Ming,Galaxy/S21/White/128GB,1,84914,84914,FESTIVE30,59439.799999999996,8915.97,2023-02-12 00:00:00,Paid,In Transit,PayPal,MasterCard,18036317135,Gan Su Sheng Xiang Shi Cheng Bei Ye Lu N Zuo  992299
XIZYJBS8Y184730465780,Ma Mei,Huawei/P40/Black/1TB,7,116871,818097,NEWYEAR25,613572.75,92035.91249999999,2023-02-12 00:00:00,Pending,Pending,Bank Transfer,WeChat Pay,15814763785,Xin Jiang Wei Wu Er Zi Zhi Qu Qian Jiang Shi Huang Pu Wu Han Lu P Zuo  521241
UXG4R3JWB184730465958,Tang Long,Oppo/Reno5/Red/8GB,6,86082,516492,SUMMER15,439018.2,65852.73,2023-02-12 00:00:00,Failed,Delivered,PayPal,PayPal,13063315866,Xin Jiang Wei Wu Er Zi Zhi Qu Guan Ling Shi Bai Yun Rong Lu B Zuo  937844
1MPNBHTVQ184730466145,Wang Ying,Oppo/Reno5/Blue/32GB,6,123844,743064,AUTUMN5,705910.7999999999,105886.61999999998,2023-02-12 00:00:00,Paid,In Transit,Credit Card,American Express,13240855036,Hu Nan Sheng Kun Ming Xian Wei Dou Wang Jie R Zuo  491264
16O4OH2G0184730466317,Xiang Yu Zhen,Huawei/P40/Purple/32GB,5,131584,657920,NEWYEAR25,493440.0,74016.0,2023-02-12 00:00:00,Pending,Delivered,Bank Transfer,Alipay,13457979494,Nei Meng Gu Zi Zhi Qu Bin Xian Feng Dou Zhao Lu E Zuo  834965
LC7QID2WO184730466508,Sun Lei,Vivo/X60/White/64GB,9,81617,734553,FESTIVE30,514187.1,77128.06499999999,2023-02-12 00:00:00,Paid,Delivered,PayPal,Alipay,18897308358,An Hui Sheng Qian Jiang Xian Xiu Ying Shang Hai Jie V Zuo  457893
3MM5Z0C5E184730466665,Liu Juan,Xiaomi/Mi 11/Black/128GB,10,140753,1407530,NEWYEAR25,1055647.5,158347.125,2023-02-12 00:00:00,Paid,Shipped,Debit Card,American Express,14503746718,Si Chuan Sheng Dong Guan Shi Huang Pu Chao Zhou Lu P Zuo  717630
CXDKT0I1Y184730466826,Peng Jia,Vivo/X60/Purple/32GB,4,62668,250672,SUMMER15,213071.19999999998,31960.679999999997,2023-02-12 00:00:00,Failed,Pending,PayPal,WeChat Pay,15875071424,Hu Nan Sheng Fu Zhou Xian Jin Ping Chao Hu Lu U Zuo  278228
9P9TCQTK5184730466986,Sun Dong Mei,iPhone/13 Pro/Red/254GB,5,50901,254505,NEWYEAR25,190878.75,28631.8125,2023-02-12 00:00:00,Paid,Pending,Credit Card,Visa,15095642335,Gui Zhou Sheng Jing Xian Hua Xi Wang Lu O Zuo  649158
M73XHRLVW184730467157,Liu Yu Zhen,iPhone/13 Pro/Blue/32GB,8,59667,477336,AUTUMN5,453469.19999999995,68020.37999999999,2023-02-12 00:00:00,Paid,Shipped,PayPal,Visa,18865258726,He Nan Sheng Wen Xian Xi Shan Xie Jie P Zuo  177819
A0TN7AEB5184730467326,Yang Jian Jun,OnePlus/9/Red/8GB,6,101445,608670,WINTER10,547803.0,82170.45,2023-02-12 00:00:00,Failed,Delivered,Credit Card,WeChat Pay,14708947253,Hai Nan Sheng Guang Zhou Shi Gao Gang Quan Jie S Zuo  799252
SCMASSF3U184730467502,Su Lei,Vivo/X60/Red/254GB,10,105650,1056500,SPRING20,845200.0,126780.0,2023-02-12 00:00:00,Failed,Delivered,Bank Transfer,Visa,14500169825,Guang Dong Sheng Xiu Lan Xian Shen He Lin Lu A Zuo  193784
FBXU5QI53184730467679,Wu Ling,Huawei/P40/Black/254GB,3,101965,305895,WINTER10,275305.5,41295.825,2023-02-12 00:00:00,Pending,Pending,Debit Card,PayPal,15884384926,Liao Ning Sheng Bei Zhen Shi Zhao Yang Liang Lu I Zuo  105624
OE5RA5FSN184730467853,Wang Xu,Xiaomi/Mi 11/Black/64GB,5,110570,552850,WINTER10,497565.0,74634.75,2023-02-12 00:00:00,Paid,In Transit,Bank Transfer,MasterCard,18500610230,Tai Wan Sheng Tong Liao Shi Xiang An Tai Yuan Lu Z Zuo  389891
26KVYIEFM184730468012,Huang Cheng,iPhone/13/White/32GB,4,75835,303340,SPRING20,242672.0,36400.799999999996,2023-02-12 00:00:00,Pending,In Transit,Debit Card,PayPal,13613778275,Zhe Jiang Sheng Chang Sha Xian An Ci Ren Lu P Zuo  114630
VARICPHNR184730468189,Wu Fan,iPhone/13/Purple/254GB,5,73602,368010,WINTER10,331209.0,49681.35,2023-02-12 00:00:00,Pending,Pending,Bank Transfer,Visa,15984386680,Jiang Xi Sheng Xiao Hong Xian Zhang Shou Jia He Lu K Zuo  160530
94WWTXMHI184730468357,Hu Yu,iPhone/13 Pro/Purple/64GB,10,101899,1018990,AUTUMN5,968040.5,145206.07499999998,2023-02-12 00:00:00,Paid,Shipped,Bank Transfer,MasterCard,15656010677,Hu Bei Sheng Zhi Qiang Xian Xiang An Tian Jie M Zuo  755607
LEEIU07NH184730468536,Huang Li,Galaxy/S21/Purple/32GB,9,87868,790812,AUTUMN5,751271.3999999999,112690.70999999998,2023-02-12 00:00:00,Failed,In Transit,Credit Card,MasterCard,15995342654,He Nan Sheng Hai Men Xian Pu Tuo Huang Jie M Zuo  161510
QE4LJPOV1184730468717,Song Yan,Oppo/Reno5/Purple/128GB,6,106670,640020,AUTUMN5,608019.0,91202.84999999999,2023-02-12 00:00:00,Paid,Shipped,PayPal,WeChat Pay,15801344953,Xiang Gang Te Bie Xing Zheng Qu Liu Xian Shuang Luan Li Jie C Zuo  317790
HEN1LQ257184730468918,Tan Ting Ting,Galaxy/S21/Black/128GB,10,55882,558820,FESTIVE30,391174.0,58676.1,2023-02-12 00:00:00,Failed,In Transit,Credit Card,PayPal,13338123846,He Bei Sheng Jia He Xian Xu Hui Diao Jie Z Zuo  729937
MCBDRB44Z184730469101,Dong Yu Zhen,Oppo/Reno5/Blue/64GB,6,131044,786264,WINTER10,707637.6,106145.64,2023-02-12 00:00:00,Pending,Delivered,Bank Transfer,Visa,13347471312,Xin Jiang Wei Wu Er Zi Zhi Qu Liang Xian Wei Dou Nan Ning Lu R Zuo  582901
BGL1DUTGU184730469287,Tian Ping,iPhone/13 Pro/Blue/128GB,7,72841,509887,FESTIVE30,356920.89999999997,53538.134999999995,2023-02-12 00:00:00,Pending,Pending,Bank Transfer,Alipay,15185182385,Si Chuan Sheng Ting Ting Shi Hai Ling Wu Zhou Jie S Zuo  810596
BSG9J23BW184730469451,Liao Yan,Galaxy/S21/Red/64GB,1,110238,110238,WINTER10,99214.2,14882.13,2023-02-12 00:00:00,Pending,Pending,Debit Card,PayPal,15004185790,Chong Qing Shi Kai Shi Ji Zhou Ma An Shan Jie N Zuo  335569
M5VK9EIJ2184730469617,Hu Mei,iPhone/13 Pro/Blue/128GB,5,103591,517955,SPRING20,414364.0,62154.6,2023-02-12 00:00:00,Failed,Shipped,Debit Card,PayPal,18547129071,Guang Dong Sheng Fu Xin Shi Nan Zhang Jia He Lu A Zuo  267242
JSASRFS88184730469778,Chen Hua,Xiaomi/Mi 11/Blue/1TB,4,123807,495228,FESTIVE30,346659.6,51998.939999999995,2023-02-12 00:00:00,Paid,Shipped,PayPal,Alipay,13509796464,Shan Dong Sheng Wu Zhou Xian Hua Long Nan Chang Jie H Zuo  644503
9TE2DW7NQ184730469940,Chen Gui Lan,OnePlus/9/Purple/254GB,7,59346,415422,NEWYEAR25,311566.5,46734.975,2023-02-12 00:00:00,Failed,Pending,Bank Transfer,American Express,15856090322,Hu Bei Sheng Yun Shi Gao Ping Song Lu D Zuo  998733
WXYG1QG98184730470108,Zheng Hao,Vivo/X60/Blue/254GB,8,52210,417680,WINTER10,375912.0,56386.799999999996,2023-02-12 00:00:00,Pending,Shipped,PayPal,MasterCard,18784452674,He Bei Sheng He Fei Shi Feng Dou Bei Jing Lu C Zuo  153766
AD31YOPCD184730470271,Yang Dan,iPhone/13/Black/128GB,6,96980,581880,NEWYEAR25,436410.0,65461.5,2023-02-12 00:00:00,Failed,Shipped,PayPal,American Express,13216190339,Fu Jian Sheng Dong Mei Shi Liu Zhi Te Liu Lu F Zuo  571565
DF22L2G4Z184730470447,Han Gui Rong,iPhone/13/Purple/64GB,6,82902,497412,SUMMER15,422800.2,63420.03,2023-02-12 00:00:00,Failed,In Transit,PayPal,Visa,13468440895,Hu Bei Sheng Han Dan Shi He Chuan Liu Jie S Zuo  769576
C7P6X6OGW184730470624,Li Ping,OnePlus/9/Purple/254GB,1,87218,87218,FESTIVE30,61052.6,9157.89,2023-02-12 00:00:00,Paid,Delivered,Bank Transfer,MasterCard,13300683089,Shan Xi Sheng Qiang Shi Nan Xi Han Dan Lu K Zuo  482440
MT5XNWW3U184730470779,Wang Jin Feng,Galaxy/S21/Red/64GB,3,62566,187698,FESTIVE30,131388.6,19708.29,2023-02-12 00:00:00,Pending,In Transit,Debit Card,Alipay,14775677590,Liao Ning Sheng Dan Shi Mu Ye Ma Lu X Zuo  432976
KJC4P9GD5184730470948,Zhang Yu Lan,Huawei/P40/Black/8GB,9,116581,1049229,AUTUMN5,996767.5499999999,149515.13249999998,2023-02-12 00:00:00,Paid,Delivered,Debit Card,Visa,18192232643,Tian Jin Shi Xue Mei Shi Nan Zhang Duan Jie F Zuo  439228
0N1YRPGTV184730471120,Sun Jian Guo,OnePlus/9/Purple/8GB,4,50070,200280,FESTIVE30,140196.0,21029.399999999998,2023-02-12 00:00:00,Paid,Shipped,PayPal,MasterCard,14783859630,Tai Wan Sheng Ming Shi Shuang Luan Qu Jie O Zuo  422639
AD26QW52A184730471289,Wu Yang,iPhone/13 Pro/Red/32GB,1,65646,65646,SUMMER15,55799.1,8369.865,2023-02-12 00:00:00,Paid,Pending,PayPal,WeChat Pay,15083428197,Shan Xi Sheng Yi Du Shi Feng Dou Huai An Jie P Zuo  123364
B20HV7S2H184730471450,Ren Lan Ying,iPhone/13/Black/32GB,3,135715,407145,NEWYEAR25,305358.75,45803.8125,2023-02-12 00:00:00,Failed,Delivered,Bank Transfer,MasterCard,15329088985,Bei Jing Shi Hong Mei Shi Fang Shan Wu Lu C Zuo  595455
5IV4TJQMP184730471698,Luo Xin,Galaxy/S21/Purple/254GB,1,98525,98525,NEWYEAR25,73893.75,11084.0625,2023-02-12 00:00:00,Pending,Pending,Bank Transfer,WeChat Pay,15888157377,Chong Qing Shi Shang Hai Shi Zhang Shou Ding Jie R Zuo  417940
14JBQLH9W184730471897,Li Wen,iPhone/13 Pro/Black/128GB,10,110775,1107750,WINTER10,996975.0,149546.25,2023-02-12 00:00:00,Pending,Pending,Debit Card,MasterCard,15057646389,Xin Jiang Wei Wu Er Zi Zhi Qu Hao Xian Zi Chuan Xiang Gang Lu N Zuo  564137
GXETZMFYL184730472107,Wei Hai Yan,Xiaomi/Mi 11/Blue/64GB,1,147927,147927,FESTIVE30,103548.9,15532.335,2023-02-12 00:00:00,Pending,In Transit,Bank Transfer,WeChat Pay,15203579729,Gui Zhou Sheng Li Shi Liang Ping Xi Ning Lu P Zuo  655951
87NJRFAGB184730472526,Fan Yang,Xiaomi/Mi 11/White/32GB,10,100892,1008920,SPRING20,807136.0,121070.4,2023-02-12 00:00:00,Paid,Shipped,PayPal,American Express,18286893449,Yun Nan Sheng Ha Er Bin Shi Shuang Luan Shen Yang Lu J Zuo  169304
PL5S5QKXB184730472821,Xiong Li,OnePlus/9/Purple/8GB,1,74286,74286,AUTUMN5,70571.7,10585.755,2023-02-12 00:00:00,Pending,In Transit,Credit Card,WeChat Pay,13827806899,Guang Dong Sheng Ting Xian Xu Hui Dong Jie M Zuo  862195
N3GB9W3JE184730473011,Zhang Jing,Oppo/Reno5/Purple/8GB,8,137769,1102152,SUMMER15,936829.2,140524.37999999998,2023-02-12 00:00:00,Failed,Delivered,Debit Card,Alipay,18626331021,An Hui Sheng Huai An Shi Gao Ming Gui Yang Jie O Zuo  918540
2TI316C7H184730473183,Duan Lu,Oppo/Reno5/Black/254GB,1,65764,65764,NEWYEAR25,49323.0,7398.45,2023-02-12 00:00:00,Failed,In Transit,Credit Card,PayPal,14516048650,Tian Jin Shi Gui Lan Xian Min Xing Cheng Du Lu Z Zuo  878160
VZUL3ONC8184730473359,Yang Cheng,iPhone/13/White/1TB,1,104119,104119,SUMMER15,88501.15,13275.172499999999,2023-02-12 00:00:00,Paid,Shipped,Bank Transfer,Visa,13339084913,Qing Hai Sheng Ma An Shan Shi Xun Yang Geng Lu W Zuo  286931
PC6QHG28B184730473542,Huang Jia,Oppo/Reno5/Black/64GB,3,108357,325071,NEWYEAR25,243803.25,36570.487499999996,2023-02-12 00:00:00,Failed,Shipped,Debit Card,American Express,15261564125,Ning Xia Hui Zu Zi Zhi Qu Chang Chun Shi Nan Zhang Hu Jie X Zuo  323876
2KJ64W1M2184730473740,Wu Yan,Oppo/Reno5/Blue/128GB,9,114562,1031058,AUTUMN5,979505.1,146925.76499999998,2023-02-12 00:00:00,Paid,Delivered,Bank Transfer,PayPal,18985710568,Ning Xia Hui Zu Zi Zhi Qu Xue Mei Shi He Ping He Jie L Zuo  275563
0BU4ES4PU184730473937,Jin Gui Xiang,Xiaomi/Mi 11/Red/64GB,2,78250,156500,SPRING20,125200.0,18780.0,2023-02-12 00:00:00,Pending,Delivered,Bank Transfer,Alipay,18026712898,Yun Nan Sheng Hong Xian Da Dong Ye Jie C Zuo  442464
NIXQSI290184730474125,Zhao Li,Galaxy/S21/Blue/1TB,9,98938,890442,SPRING20,712353.6000000001,106853.04000000001,2023-02-12 00:00:00,Failed,Pending,Bank Transfer,American Express,18280003624,Jiang Xi Sheng Min Shi Fang Shan Zhang Jie N Zuo  959574
PU04HE8AW184730474299,Zhu Xin,Xiaomi/Mi 11/Red/32GB,5,64896,324480,SUMMER15,275808.0,41371.2,2023-02-12 00:00:00,Failed,In Transit,Bank Transfer,WeChat Pay,18994737831,Qing Hai Sheng Qin Shi Sha Wan Yu Lu R Zuo  105978
18VMN42F4184730474470,Tan Hui,Vivo/X60/Purple/1TB,7,111713,781991,SUMMER15,664692.35,99703.8525,2023-02-12 00:00:00,Failed,In Transit,Debit Card,WeChat Pay,18595732490,Nei Meng Gu Zi Zhi Qu Chen Shi Min Xing Ha Er Bin Jie D Zuo  504369
T5BI733M8184730474652,Wang Lan Ying,OnePlus/9/Red/64GB,10,132403,1324030,SUMMER15,1125425.5,168813.82499999998,2023-02-12 00:00:00,Failed,Delivered,Bank Transfer,Alipay,15662948424,Bei Jing Shi Yang Xian Chong Wen Xiang Gang Lu Q Zuo  283122
XLK9VEFKN184730474813,Yang Yu Lan,iPhone/13/Blue/128GB,3,78402,235206,AUTUMN5,223445.69999999998,33516.854999999996,2023-02-12 00:00:00,Paid,Shipped,Bank Transfer,PayPal,18652646086,Tian Jin Shi Li Shi Qing He Ji Nan Lu K Zuo  467887
5N8NPHIRD184730474974,Wang Jian,Galaxy/S21/Red/64GB,8,77817,622536,FESTIVE30,435775.19999999995,65366.27999999999,2023-02-12 00:00:00,Failed,Delivered,Debit Card,WeChat Pay,13843729504,Yun Nan Sheng Shen Yang Shi Min Xing Chao Hu Lu M Zuo  873180
8F7YDOUBJ184730475134,Shen Kun,Vivo/X60/Purple/8GB,1,131261,131261,NEWYEAR25,98445.75,14766.8625,2023-02-12 00:00:00,Pending,Shipped,PayPal,WeChat Pay,13478849267,Fu Jian Sheng Nan Jing Shi Xiao Shan Liu Zhou Jie P Zuo  420228
ZW9NOII4B184730475304,Li Hui,OnePlus/9/Black/8GB,4,113021,452084,SPRING20,361667.2,54250.08,2023-02-12 00:00:00,Failed,In Transit,PayPal,Visa,14596112659,Guang Dong Sheng Bin Shi Cheng Bei Hui Zhou Jie V Zuo  545310
9C770JP40184730475462,Gao Rong,Galaxy/S21/Red/64GB,6,76835,461010,SUMMER15,391858.5,58778.775,2023-02-12 00:00:00,Paid,In Transit,Credit Card,Alipay,15753813589,Jiang Su Sheng Li Hua Xian You Hao Jing Men Jie Y Zuo  603206
34LPK73A3184730475621,Zhou Xiu Mei,iPhone/13/White/64GB,5,72374,361870,SUMMER15,307589.5,46138.424999999996,2023-02-12 00:00:00,Pending,In Transit,Debit Card,Visa,15346230468,Jiang Su Sheng Li Xian Qing Pu Wu Han Lu K Zuo  455076
MXW97VL2L184730475782,Long Yan,Xiaomi/Mi 11/Black/64GB,9,124405,1119645,WINTER10,1007680.5,151152.07499999998,2023-02-12 00:00:00,Paid,Pending,Credit Card,American Express,18536482998,Ning Xia Hui Zu Zi Zhi Qu Ao Men Shi Huang Pu Ma Jie L Zuo  876554
25N523WH2184730475971,Zhang Yang,Huawei/P40/Red/64GB,1,93413,93413,SPRING20,74730.40000000001,11209.560000000001,2023-02-12 00:00:00,Pending,In Transit,PayPal,MasterCard,13016188309,Hei Long Jiang Sheng Xia Xian Ping Shan Ma An Shan Jie Z Zuo  556431
BQK4NJ0I9184730476134,Xu Gui Fang,iPhone/13 Pro/Purple/8GB,9,78274,704466,SUMMER15,598796.1,89819.415,2023-02-12 00:00:00,Pending,Delivered,PayPal,Visa,15313759262,Fu Jian Sheng Yu Shi Shan Ting Shen Zhen Jie W Zuo  861476
BRVPO68NG184730476293,Luo Li Juan,Huawei/P40/Blue/254GB,1,73005,73005,NEWYEAR25,54753.75,8213.0625,2023-02-12 00:00:00,Pending,Pending,PayPal,PayPal,14734747667,Nei Meng Gu Zi Zhi Qu Xue Mei Shi Hua Long Xiang Gang Lu X Zuo  928472
A1VAJB5QO184730476477,Zhang Xiu Zhen,Huawei/P40/Blue/1TB,6,64820,388920,SPRING20,311136.0,46670.4,2023-02-12 00:00:00,Paid,Delivered,Credit Card,Alipay,13238214590,Tian Jin Shi Ma An Shan Shi Min Xing Zhang Jie F Zuo  889817
FFKBAVFA0184730476658,Guo Feng Ying,iPhone/13 Pro/Blue/254GB,5,126463,632315,WINTER10,569083.5,85362.525,2023-02-12 00:00:00,Pending,Delivered,Bank Transfer,PayPal,14533684954,Guang Xi Zhuang Zu Zi Zhi Qu Yu Zhen Shi Gao Ping Hai Men Lu X Zuo  704431
7RCQC5Z1Q184730476844,Zhang Jing,Oppo/Reno5/Red/64GB,7,134110,938770,SUMMER15,797954.5,119693.17499999999,2023-02-12 00:00:00,Paid,Pending,Bank Transfer,Alipay,13116318363,Ao Men Te Bie Xing Zheng Qu Fu Xin Xian Hai Ling Ha Er Bin Lu M Zuo  667124
JEQQVAFDU184730477030,Liu Yang,iPhone/13/Blue/254GB,1,63784,63784,WINTER10,57405.6,8610.84,2023-02-12 00:00:00,Pending,In Transit,PayPal,MasterCard,18203444248,Shan Dong Sheng Qian Jiang Xian Fu Cheng Zhang Jie J Zuo  700636
SJY332AWS184730477200,Jiang Qian,iPhone/13/Black/8GB,7,129382,905674,NEWYEAR25,679255.5,101888.325,2023-02-12 00:00:00,Paid,Pending,PayPal,Alipay,13306149647,Jiang Su Sheng Bin Xian Cheng Dong He Jie E Zuo  338622
MK6NJOOKJ184730477366,Rao Xue Mei,Huawei/P40/White/254GB,4,73199,292796,SPRING20,234236.80000000002,35135.520000000004,2023-02-12 00:00:00,Failed,Pending,Credit Card,Visa,18016382015,Jiang Xi Sheng Chao Shi Xiao Nan Jia He Jie S Zuo  225239
XISGFDF6P184730477527,Wang Jian Ping,Huawei/P40/White/254GB,6,68663,411978,SUMMER15,350181.3,52527.195,2023-02-12 00:00:00,Paid,Delivered,PayPal,WeChat Pay,15883320188,Xiang Gang Te Bie Xing Zheng Qu Yin Chuan Xian Shen Bei Xin Niu Lu A Zuo  929190
DB9ZUCOQV184730477729,Chen Ying,Oppo/Reno5/Red/254GB,6,141339,848034,SPRING20,678427.2000000001,101764.08,2023-02-12 00:00:00,Paid,In Transit,Bank Transfer,WeChat Pay,15892853443,Shang Hai Shi Xi An Shi Zi Chuan Chao Zhou Lu L Zuo  775866
3WQEPQGXW184730477891,Li Gui Lan,iPhone/13 Pro/Black/8GB,9,93455,841095,SUMMER15,714930.75,107239.6125,2023-02-12 00:00:00,Pending,Pending,Bank Transfer,PayPal,14529803751,Hei Long Jiang Sheng Xing Cheng Xian Yong Chuan Hui Zhou Lu P Zuo  356617
YKT1O4ISZ184730478063,Zou Yu Lan,iPhone/13/White/128GB,4,80203,320812,NEWYEAR25,240609.0,36091.35,2023-02-12 00:00:00,Failed,Delivered,Credit Card,PayPal,13046946686,Nei Meng Gu Zi Zhi Qu Wu Lu Mu Qi Xian Da Dong Ning De Jie P Zuo  685845
7Z6QRKS26184730478253,Xiao Kun,iPhone/13 Pro/Purple/64GB,8,76152,609216,AUTUMN5,578755.2,86813.27999999998,2023-02-12 00:00:00,Failed,Delivered,Debit Card,MasterCard,15647169216,Shang Hai Shi Huai An Xian Chong Wen Duan Lu Q Zuo  970294
HTEWXTARN184730478424,Zhang Shu Ying,Huawei/P40/Black/32GB,6,106524,639144,AUTUMN5,607186.7999999999,91078.01999999999,2023-02-12 00:00:00,Pending,In Transit,Credit Card,PayPal,18846304652,Yun Nan Sheng Liang Shi Qing Pu Liu Lu H Zuo  716565
2ZO2BC1LG184730478595,Guo Ming,Vivo/X60/Purple/128GB,7,66409,464863,FESTIVE30,325404.1,48810.615,2023-02-12 00:00:00,Failed,In Transit,Bank Transfer,PayPal,18985572104,Liao Ning Sheng Xiang Gang Shi Gao Ming Gui Yang Lu Z Zuo  175617
BT9RWTIMY184730478755,Ji Hui,Galaxy/S21/Blue/8GB,1,136197,136197,AUTUMN5,129387.15,19408.0725,2023-02-12 00:00:00,Failed,Shipped,PayPal,WeChat Pay,15081344646,Shang Hai Shi Hang Zhou Xian Hai Ling Li Jie B Zuo  868714
C952KLYLY184730478929,Luo Gui Lan,Galaxy/S21/Black/64GB,5,115935,579675,AUTUMN5,550691.25,82603.6875,2023-02-12 00:00:00,Failed,Pending,Bank Transfer,WeChat Pay,15681108826,Bei Jing Shi Shen Yang Xian Zhang Shou Liu Jie T Zuo  965906
XDL5446K9184730479109,Ming Lan Ying,OnePlus/9/Red/32GB,6,139192,835152,NEWYEAR25,626364.0,93954.59999999999,2023-02-12 00:00:00,Paid,Pending,Bank Transfer,Alipay,13949711457,Nei Meng Gu Zi Zhi Qu Kai Xian Shuang Luan Zheng Zhou Jie P Zuo  134175
CGAGL60N3184730479289,Guo Yu Ying,Galaxy/S21/Purple/1TB,6,122860,737160,FESTIVE30,516011.99999999994,77401.79999999999,2023-02-12 00:00:00,Failed,Shipped,Bank Transfer,PayPal,14568310654,Tian Jin Shi Hu He Hao Te Xian Xun Yang Lin Lu Y Zuo  231454
8MOGM4MYB184730479478,Li Min,Vivo/X60/Blue/1TB,8,60431,483448,SUMMER15,410930.8,61639.619999999995,2023-02-12 00:00:00,Pending,Pending,Bank Transfer,PayPal,15640785863,An Hui Sheng Gui Rong Xian Huang Pu Sun Jie H Zuo  375454
2IENSAK6D184730479651,Zhu Ting,Huawei/P40/Red/32GB,1,106576,106576,SPRING20,85260.8,12789.12,2023-02-12 00:00:00,Pending,Delivered,PayPal,WeChat Pay,18109826761,Bei Jing Shi Tai Yuan Xian Hai Ling Ma An Shan Lu S Zuo  167979
1M4S4XHFO184730479817,Lv Yang,iPhone/13/Purple/1TB,8,113770,910160,FESTIVE30,637112.0,95566.8,2023-02-12 00:00:00,Failed,Delivered,Bank Transfer,WeChat Pay,15783573877,Guang Dong Sheng Chao Zhou Xian Sha Wan Huang Jie Q Zuo  567588
5AOWMQ32G184730479991,Tan Gui Xiang,Vivo/X60/White/1TB,6,92038,552228,AUTUMN5,524616.6,78692.48999999999,2023-02-12 00:00:00,Failed,In Transit,PayPal,MasterCard,13150615587,Qing Hai Sheng Hai Yan Shi Qing Pu Ma An Shan Lu L Zuo  190557
WQK7LG7KJ184730480165,Bi Feng,OnePlus/9/Black/254GB,9,89303,803727,SPRING20,642981.6000000001,96447.24,2023-02-12 00:00:00,Paid,Pending,Debit Card,Alipay,14567979767,Fu Jian Sheng Cheng Shi Sha Wan Xu Lu S Zuo  675567
VOI3VZPI1184730480340,Meng Lu,Huawei/P40/Blue/1TB,6,58096,348576,SUMMER15,296289.6,44443.439999999995,2023-02-12 00:00:00,Paid,Shipped,Bank Transfer,WeChat Pay,15583409777,Xi Zang Zi Zhi Qu Fang Shi Xi Shan Xing Cheng Jie O Zuo  552252
3KW99YY81184730480508,Zhou Jun,OnePlus/9/White/128GB,4,78227,312908,SPRING20,250326.40000000002,37548.96,2023-02-12 00:00:00,Paid,Pending,Debit Card,Visa,14730496788,Xiang Gang Te Bie Xing Zheng Qu Gui Lan Xian Xi Xia Ha Er Bin Jie Y Zuo  810907
9BWCZN7QD184730480696,Chen Yong,Oppo/Reno5/Black/128GB,3,114447,343341,FESTIVE30,240338.69999999998,36050.80499999999,2023-02-12 00:00:00,Paid,Delivered,Credit Card,MasterCard,14557783809,Hei Long Jiang Sheng Jian Shi Chong Wen Ning De Jie T Zuo  658725
MFZK6OZQE184730480859,Han Xue,Oppo/Reno5/White/64GB,1,127712,127712,SUMMER15,108555.2,16283.279999999999,2023-02-12 00:00:00,Paid,Shipped,PayPal,WeChat Pay,18106523620,An Hui Sheng Gui Hua Xian Nan Hu Gao Lu Z Zuo  309285
BOSHRMOZ1184730481033,Chen Yan,Galaxy/S21/Purple/8GB,7,105265,736855,SUMMER15,626326.75,93949.0125,2023-02-12 00:00:00,Failed,Shipped,Debit Card,Alipay,13614508396,Xi Zang Zi Zhi Qu Jia Shi Bin Cheng Zhang Lu M Zuo  523887
2H0SH9BSV184730481207,Yu Long,Galaxy/S21/Blue/254GB,2,91818,183636,FESTIVE30,128545.2,19281.78,2023-02-12 00:00:00,Failed,In Transit,PayPal,Visa,15627152055,Shan Dong Sheng Jia He Xian Xiu Ying Jing Men Lu S Zuo  286917
1CWYWGQMF184730481368,Chen Shu Lan,iPhone/13 Pro/Red/1TB,2,136554,273108,SUMMER15,232141.8,34821.27,2023-02-12 00:00:00,Paid,Delivered,Debit Card,Alipay,15172523276,Tian Jin Shi Cheng Shi Bai Yun Jian Jie I Zuo  532013
M6EXAK0E1184730481547,Ji Li,OnePlus/9/Blue/8GB,4,129328,517312,SPRING20,413849.60000000003,62077.44,2023-02-12 00:00:00,Paid,Pending,PayPal,Visa,18619303347,Si Chuan Sheng Yin Chuan Shi Sha Shi Sun Lu R Zuo  416484
KG7SN1CIY184730481728,Chen Yan,Vivo/X60/Red/8GB,9,143379,1290411,NEWYEAR25,967808.25,145171.2375,2023-02-12 00:00:00,Pending,In Transit,Debit Card,WeChat Pay,13322913464,Tian Jin Shi Tai Yuan Shi Mu Ye Wang Lu P Zuo  643947
