Order ID,Customer Name,Mobile Model,Quantity,Price per Unit,Total Price,Promotion Code,Order Amount,GST,Order Date,Payment Status,Shipping Status,Payment Method,Payment Provider,Mobile,Delivery Address
TK6P8M2NZ184730346671,Ou Xiu Lan,Oppo/Reno5/Purple/254GB,10,130747,1307470,AUTUMN5,1242096.5,186314.475,2023-02-11 00:00:00,Failed,Pending,Debit Card,Alipay,18848634342,Xiang Gang Te Bie Xing Zheng Qu Xiu Ying Shi Dong Li Hu He Hao Te Lu G Zuo  802555
Y3OUQ1Q5E184730346858,Yao Wei,iPhone/13 Pro/White/128GB,6,145790,874740,AUTUMN5,831003.0,124650.45,2023-02-11 00:00:00,Paid,Delivered,Credit Card,Alipay,13589397244,Shan Xi Sheng Liang Shi Gao Ming Xi Ning Jie D Zuo  162182
SWQ872HO2184730347011,Jiang Xiu Hua,Vivo/X60/Red/64GB,9,65162,586458,AUTUMN5,557135.1,83570.265,2023-02-11 00:00:00,Paid,Shipped,Bank Transfer,WeChat Pay,13576541349,Xi Zang Zi Zhi Qu Hai Men Shi Ping Shan Lu An Jie O Zuo  395744
3E7CFBF9S184730347182,Ruan Xiu Zhen,OnePlus/9/Purple/254GB,10,108226,1082260,AUTUMN5,1028147.0,154222.05,2023-02-11 00:00:00,Pending,In Transit,Debit Card,WeChat Pay,13811526414,Xin Jiang Wei Wu Er Zi Zhi Qu Wu Han Shi Mu Ye Tong Jie S Zuo  682733
52DK59Z4X184730347377,Hao Li,OnePlus/9/Red/1TB,7,130633,914431,SPRING20,731544.8,109731.72,2023-02-11 00:00:00,Paid,Delivered,Bank Transfer,WeChat Pay,13578804857,Shan Xi Sheng Xin Ji Shi He Chuan Shang Hai Jie J Zuo  698588
PH1JUQFPB184730347534,Gu Yu Hua,OnePlus/9/Blue/1TB,4,122209,488836,SUMMER15,415510.6,62326.59,2023-02-11 00:00:00,Pending,Delivered,PayPal,WeChat Pay,14503131748,Bei Jing Shi Ting Shi Bin Cheng Liu Jie C Zuo  906723
3TNDKUCTR184730347699,Wang Hui,iPhone/13/Purple/1TB,3,78396,235188,NEWYEAR25,176391.0,26458.649999999998,2023-02-11 00:00:00,Paid,In Transit,Bank Transfer,Visa,15238752054,Qing Hai Sheng Hao Xian Men Tou Gou Yu Jie Y Zuo  796222
URUI3EVHJ184730347867,Hou Fan,Oppo/Reno5/Purple/64GB,8,63223,505784,AUTUMN5,480494.8,72074.22,2023-02-11 00:00:00,Pending,In Transit,Credit Card,American Express,15276523087,Hu Bei Sheng Jian Guo Shi Zhang Shou Wang Jie L Zuo  814559
K402DLAE1184730348034,Yang Long,iPhone/13 Pro/Blue/254GB,4,123976,495904,NEWYEAR25,371928.0,55789.2,2023-02-11 00:00:00,Failed,In Transit,Debit Card,PayPal,13893700175,Ji Lin Sheng Dong Shi Chong Wen Tai Yuan Lu U Zuo  719822
VK1JQRG62184730348183,Xu Jian Jun,Oppo/Reno5/Red/254GB,9,90699,816291,WINTER10,734661.9,110199.285,2023-02-11 00:00:00,Pending,Pending,PayPal,WeChat Pay,15198146135,Jiang Su Sheng Kun Shi Gao Ming Liu Zhou Jie W Zuo  953040
ZD3DQ5VW0184730348342,Jiang Yan,OnePlus/9/Blue/64GB,1,79803,79803,WINTER10,71822.7,10773.404999999999,2023-02-11 00:00:00,Failed,Pending,PayPal,American Express,13284788774,Xiang Gang Te Bie Xing Zheng Qu Shang Hai Shi Xiao Nan Nan Chang Jie Q Zuo  889183
77KZ6BNLA184730348526,Wu Qian,Oppo/Reno5/Purple/8GB,7,133570,934990,FESTIVE30,654493.0,98173.95,2023-02-11 00:00:00,Pending,Delivered,Debit Card,WeChat Pay,13415777595,Bei Jing Shi Shu Zhen Shi You Hao Xing Cheng Lu O Zuo  376740
5HPRBLKIO184730348681,Li Xiu Lan,Vivo/X60/Black/8GB,3,80582,241746,FESTIVE30,169222.19999999998,25383.329999999998,2023-02-11 00:00:00,Failed,Pending,PayPal,WeChat Pay,18033316137,Ao Men Te Bie Xing Zheng Qu Ma An Shan Shi Xi Feng Chen Jie M Zuo  455552
0NXH2U6HV184730348876,Zheng Cheng,Xiaomi/Mi 11/White/64GB,2,51466,102932,AUTUMN5,97785.4,14667.81,2023-02-11 00:00:00,Pending,Pending,PayPal,MasterCard,13402297200,Fu Jian Sheng Zheng Zhou Xian Zi Chuan Dong Guan Jie Z Zuo  942605
KJW3B9VF8184730349077,Huang Xia,OnePlus/9/Purple/8GB,4,94161,376644,SUMMER15,320147.39999999997,48022.10999999999,2023-02-11 00:00:00,Pending,Pending,PayPal,Alipay,13071768909,Guang Xi Zhuang Zu Zi Zhi Qu La Sa Shi Men Tou Gou Yi Dou Jie N Zuo  708665
TO0JIAPBT184730349271,Pan Kai,Xiaomi/Mi 11/Purple/8GB,9,85191,766719,SPRING20,613375.2000000001,92006.28000000001,2023-02-11 00:00:00,Failed,Pending,Debit Card,Visa,18152798030,Hu Nan Sheng Xi An Shi Men Tou Gou Jing Men Jie E Zuo  622628
J2X4MZ1LO184730349443,Zhao Zhi Qiang,iPhone/13/Red/1TB,8,135596,1084768,NEWYEAR25,813576.0,122036.4,2023-02-11 00:00:00,Failed,Shipped,Debit Card,Visa,15571384955,Hei Long Jiang Sheng Ma An Shan Shi Ji Qu Hui Zhou Jie E Zuo  809716
DS0UEAQ1F184730349626,Liao Xiu Zhen,Vivo/X60/Blue/254GB,1,127558,127558,WINTER10,114802.2,17220.329999999998,2023-02-11 00:00:00,Pending,In Transit,Bank Transfer,MasterCard,18919536863,An Hui Sheng Xu Shi Gao Ping Rao Lu N Zuo  583514
AL9PPAT8U184730349809,Zhou Jun,OnePlus/9/Blue/128GB,5,68902,344510,SPRING20,275608.0,41341.2,2023-02-11 00:00:00,Paid,Shipped,Debit Card,PayPal,18560068423,An Hui Sheng Fu Zhou Shi Gao Ping Duan Jie T Zuo  189294
SWWSUDJH0184730349981,Jiang Peng,Galaxy/S21/Purple/32GB,3,55660,166980,NEWYEAR25,125235.0,18785.25,2023-02-11 00:00:00,Paid,Delivered,PayPal,Visa,15654916314,Ji Lin Sheng Bei Jing Xian Da Dong Shan Wei Lu E Zuo  609182
N3TEJHEC3184730350162,Yang Ting Ting,Galaxy/S21/Purple/254GB,7,82914,580398,SPRING20,464318.4,69647.76,2023-02-11 00:00:00,Paid,In Transit,PayPal,MasterCard,18557874213,Gan Su Sheng Nan Chang Xian Sha Wan Cheng Lu U Zuo  641940
Y4K69TRC6184730350352,Jiang Chang,Vivo/X60/White/64GB,8,50298,402384,SPRING20,321907.2,48286.08,2023-02-11 00:00:00,Paid,Pending,Debit Card,Alipay,18578351504,Qing Hai Sheng Ning De Shi Bi Shan Qian Jie V Zuo  447607
W89UVF1SY184730350540,Wang Mei,Xiaomi/Mi 11/Black/1TB,3,131522,394566,NEWYEAR25,295924.5,44388.674999999996,2023-02-11 00:00:00,Failed,Shipped,Debit Card,MasterCard,15586430187,Ao Men Te Bie Xing Zheng Qu Shang Hai Xian Zi Chuan Liu Lu G Zuo  650602
4ZPTBTK39184730350742,Zhu Shu Ying,Xiaomi/Mi 11/White/32GB,1,82538,82538,SUMMER15,70157.3,10523.595,2023-02-11 00:00:00,Failed,Pending,Bank Transfer,Visa,15360649340,Chong Qing Shi Dong Mei Xian Yong Chuan Tang Jie E Zuo  436771
MB9RTF62F184730350934,Huang Xiu Zhen,iPhone/13/Blue/32GB,4,112645,450580,WINTER10,405522.0,60828.299999999996,2023-02-11 00:00:00,Paid,Pending,Bank Transfer,MasterCard,13963526087,Hu Nan Sheng Zheng Zhou Xian Gao Gang Huang Jie N Zuo  638224
XFW3EQBAC184730351128,Wang Liang,iPhone/13/Black/8GB,7,123493,864451,SUMMER15,734783.35,110217.50249999999,2023-02-11 00:00:00,Pending,Shipped,Debit Card,PayPal,13818195366,Tai Wan Sheng Wu Lu Mu Qi Shi Hua Xi Liao Yang Lu J Zuo  103290
9O6WBQZBV184730351311,Liu Yu,Huawei/P40/Red/64GB,10,129679,1296790,NEWYEAR25,972592.5,145888.875,2023-02-11 00:00:00,Paid,Shipped,Bank Transfer,WeChat Pay,13940971692,Xi Zang Zi Zhi Qu He Shan Shi Bin Cheng Deng Lu G Zuo  516371
JICSSKI1C184730351509,Wang Liang,Galaxy/S21/Purple/32GB,6,78405,470430,SUMMER15,399865.5,59979.825,2023-02-11 00:00:00,Pending,In Transit,PayPal,Alipay,15678400650,Ji Lin Sheng Chao Hu Xian Hua Long Wu Lu D Zuo  202491
6GQ24KJ8H184730351726,Lei Liu,Xiaomi/Mi 11/Blue/64GB,8,56637,453096,NEWYEAR25,339822.0,50973.299999999996,2023-02-11 00:00:00,Paid,Pending,Credit Card,PayPal,13038840094,Hu Nan Sheng Hong Shi Jiang Bei Zheng Zhou Jie B Zuo  948197
EDICME3QL184730351905,Tang Na,Vivo/X60/Red/254GB,8,141827,1134616,SPRING20,907692.8,136153.92,2023-02-11 00:00:00,Failed,Delivered,Credit Card,MasterCard,13791128825,Nei Meng Gu Zi Zhi Qu Gui Zhen Xian Sha Shi Shang Hai Lu D Zuo  271898
BKLUFE7GK184730352090,Lv Wen,Oppo/Reno5/Black/32GB,1,63939,63939,AUTUMN5,60742.049999999996,9111.307499999999,2023-02-11 00:00:00,Paid,Delivered,Debit Card,Alipay,13258001348,Qing Hai Sheng Wu Zhou Shi Xiu Ying Zhang Jia Gang Jie R Zuo  149939
APTNXV8HV184730352266,Sun Liu,OnePlus/9/Blue/8GB,9,113337,1020033,SPRING20,816026.4,122403.95999999999,2023-02-11 00:00:00,Pending,Pending,Debit Card,WeChat Pay,18987484477,Jiang Su Sheng Mei Shi You Hao Lan Zhou Lu K Zuo  923639
RWDGVX0L9184730352434,Wang Shu Hua,OnePlus/9/Purple/1TB,5,129457,647285,SPRING20,517828.0,77674.2,2023-02-11 00:00:00,Paid,Pending,Bank Transfer,American Express,13597965671,Shan Xi Sheng Shan Wei Shi Ping Shan Xiang Gang Lu A Zuo  231724
PD85KMF2M184730352608,Yan Xiu Rong,OnePlus/9/Blue/32GB,1,66620,66620,AUTUMN5,63289.0,9493.35,2023-02-11 00:00:00,Paid,In Transit,Credit Card,PayPal,13548273953,Xin Jiang Wei Wu Er Zi Zhi Qu Liang Shi Bin Cheng Zhang Lu N Zuo  342072
PXXXTHEZQ184730352810,You Ting,Huawei/P40/Blue/32GB,4,52566,210264,NEWYEAR25,157698.0,23654.7,2023-02-11 00:00:00,Paid,In Transit,Credit Card,American Express,13843204295,Ao Men Te Bie Xing Zheng Qu Qi Qi Ha Er Shi Xi Shan Zhang Lu A Zuo  915032
91ERUKD17184730353030,Wang Xiu Rong,Huawei/P40/Red/64GB,8,54258,434064,FESTIVE30,303844.8,45576.719999999994,2023-02-11 00:00:00,Paid,Shipped,PayPal,MasterCard,15625800353,Shan Xi Sheng Xing An Meng Xian Dong Cheng Li Lu N Zuo  933601
IVXLTD1NN184730353225,Ding Jun,iPhone/13 Pro/Blue/8GB,4,139278,557112,AUTUMN5,529256.4,79388.46,2023-02-11 00:00:00,Pending,Shipped,PayPal,MasterCard,18200931416,Hei Long Jiang Sheng Yu Lan Shi Gao Ming Wei Lu Q Zuo  161416
59RJHZHPR184730353405,Ma Peng,iPhone/13 Pro/White/32GB,5,122959,614795,FESTIVE30,430356.5,64553.475,2023-02-11 00:00:00,Failed,In Transit,PayPal,WeChat Pay,18060599221,Guang Dong Sheng Hai Men Xian Xiu Ying Zhang Jie R Zuo  260384
YLCOQB5Z9184730353578,Di Jing,Xiaomi/Mi 11/Red/8GB,4,108129,432516,SPRING20,346012.80000000005,51901.920000000006,2023-02-11 00:00:00,Pending,Delivered,Credit Card,WeChat Pay,13688616850,Tian Jin Shi Lei Shi Ji Zhou Gao Jie A Zuo  987414
86T8YUVEI184730353746,Wang Xiu Rong,iPhone/13/Black/8GB,6,57758,346548,SUMMER15,294565.8,44184.869999999995,2023-02-11 00:00:00,Failed,In Transit,Credit Card,WeChat Pay,13437982220,Gui Zhou Sheng Hong Shi Xing Shan Zhang Lu A Zuo  110387
U2V5KVV7C184730353949,Ren Yan,Xiaomi/Mi 11/Red/64GB,7,90290,632030,SUMMER15,537225.5,80583.825,2023-02-11 00:00:00,Paid,Shipped,Bank Transfer,Visa,18937307219,Hu Bei Sheng Mei Xian Bi Shan Deng Jie U Zuo  395679
BS08O3HN2184730354124,Yang Jin Feng,Huawei/P40/Purple/254GB,8,82197,657576,FESTIVE30,460303.19999999995,69045.48,2023-02-11 00:00:00,Paid,Delivered,Credit Card,Alipay,18973977190,Gui Zhou Sheng Fu Zhou Xian Hua Long Yao Jie J Zuo  384348
N66J9SW6A184730354303,Xiang Gui Zhen,iPhone/13/Purple/8GB,8,63507,508056,NEWYEAR25,381042.0,57156.299999999996,2023-02-11 00:00:00,Pending,Shipped,PayPal,WeChat Pay,18107637875,Bei Jing Shi Fu Xin Xian Ji Zhou Wang Jie Y Zuo  478946
RDC2E51X5184730354481,Ye Hai Yan,iPhone/13 Pro/Blue/8GB,5,74242,371210,FESTIVE30,259846.99999999997,38977.049999999996,2023-02-11 00:00:00,Failed,Shipped,Bank Transfer,PayPal,13372905561,He Bei Sheng Liao Yang Xian Xiao Shan Huai An Jie O Zuo  559969
ETOGC9V5P184730354696,Luo Yong,iPhone/13/Purple/1TB,2,118166,236332,AUTUMN5,224515.4,33677.31,2023-02-11 00:00:00,Pending,Pending,Bank Transfer,MasterCard,14526527999,Liao Ning Sheng Fu Zhou Shi Chong Wen La Sa Jie B Zuo  832479
3FIMOY6MM184730354941,Wei Cheng,iPhone/13 Pro/Purple/64GB,10,101953,1019530,SUMMER15,866600.5,129990.075,2023-02-11 00:00:00,Failed,Pending,Bank Transfer,WeChat Pay,13125898287,Nei Meng Gu Zi Zhi Qu Chun Mei Shi Zhang Shou La Sa Lu E Zuo  952045
QX0930BS5184730355786,Li Hui,iPhone/13/Blue/64GB,7,71805,502635,AUTUMN5,477503.25,71625.4875,2023-02-11 00:00:00,Paid,Shipped,Bank Transfer,Alipay,18932893159,Shang Hai Shi Chao Zhou Shi Xiao Nan Xing Cheng Lu Z Zuo  132122
HVPY5111Z184730356010,Zhao Jian,Galaxy/S21/Blue/254GB,1,53235,53235,AUTUMN5,50573.25,7585.987499999999,2023-02-11 00:00:00,Pending,In Transit,Credit Card,American Express,13683602215,Si Chuan Sheng Gui Rong Xian Zhang Shou He Fei Jie Z Zuo  807031
V5JIE2JJ6184730356220,Di Lin,Xiaomi/Mi 11/Blue/64GB,2,101652,203304,NEWYEAR25,152478.0,22871.7,2023-02-11 00:00:00,Failed,In Transit,Debit Card,WeChat Pay,18661198185,Shan Xi Sheng Nan Ning Shi Ji Zhou Yang Lu J Zuo  649579
ES766BHOB184730356418,Lu Yang,Oppo/Reno5/Blue/254GB,10,87427,874270,FESTIVE30,611989.0,91798.34999999999,2023-02-11 00:00:00,Paid,Shipped,Debit Card,American Express,13740072311,Guang Xi Zhuang Zu Zi Zhi Qu Bo Xian Cheng Bei Liu Lu S Zuo  242586
HTXSEP6KZ184730356620,Tang Xiu Mei,iPhone/13/White/32GB,4,102954,411816,WINTER10,370634.4,55595.16,2023-02-11 00:00:00,Paid,Shipped,Bank Transfer,Alipay,13161097348,Hu Bei Sheng Xing An Meng Shi Gao Ping Zhang Lu U Zuo  925892
2AOD42UOI184730356813,Cai Qian,Huawei/P40/Purple/64GB,7,111186,778302,NEWYEAR25,583726.5,87558.97499999999,2023-02-11 00:00:00,Failed,Shipped,Bank Transfer,Visa,15530115391,Shan Dong Sheng Ha Er Bin Shi Zhang Shou Wang Lu M Zuo  998195
IPWQY7J3V184730357054,Chen Rong,iPhone/13/White/64GB,7,148129,1036903,SPRING20,829522.4,124428.36,2023-02-11 00:00:00,Failed,Delivered,Credit Card,WeChat Pay,18983889162,He Nan Sheng Li Xian Da Dong Zheng Lu V Zuo  785098
49HUS8LUJ184730357240,Zheng Juan,Huawei/P40/White/254GB,7,91882,643174,AUTUMN5,611015.2999999999,91652.29499999998,2023-02-11 00:00:00,Pending,Pending,Debit Card,MasterCard,13699939922,Xin Jiang Wei Wu Er Zi Zhi Qu Cheng Shi He Ping Zhang Jia Gang Jie C Zuo  584948
HRQG7YWIK184730357439,Zhang Xue,iPhone/13/Black/32GB,6,68887,413322,SPRING20,330657.60000000003,49598.64000000001,2023-02-11 00:00:00,Paid,Pending,Credit Card,PayPal,14570117615,Tai Wan Sheng Guan Ling Shi Gao Gang Mo Lu M Zuo  193126
J274I3R5Z184730357625,Xu Zhi Qiang,Vivo/X60/White/1TB,8,60756,486048,WINTER10,437443.2,65616.48,2023-02-11 00:00:00,Paid,In Transit,Debit Card,American Express,15235127959,Xin Jiang Wei Wu Er Zi Zhi Qu Nan Jing Shi Min Xing Chen Lu M Zuo  166536
R74TDO6YY184730357827,Luo Dong,Vivo/X60/White/32GB,4,56694,226776,FESTIVE30,158743.19999999998,23811.479999999996,2023-02-11 00:00:00,Paid,Delivered,Bank Transfer,Alipay,15880672324,Hu Bei Sheng Dan Dan Shi Nan Zhang Cao Jie T Zuo  568371
9HOQ7J9V7184730358000,Jiang Fang,Oppo/Reno5/Black/32GB,1,77329,77329,SUMMER15,65729.65,9859.447499999998,2023-02-11 00:00:00,Paid,Pending,Credit Card,WeChat Pay,14752546638,Gan Su Sheng Tai Yuan Shi Bi Shan Tian Jin Jie S Zuo  152992
D0RUKYJJ1184730358168,Zhang Yu,Xiaomi/Mi 11/Blue/128GB,9,129980,1169820,NEWYEAR25,877365.0,131604.75,2023-02-11 00:00:00,Paid,Delivered,Debit Card,WeChat Pay,15834765432,Ning Xia Hui Zu Zi Zhi Qu Tian Jin Xian Bai Yun Tong Liao Lu G Zuo  937283
ZE2QY4URN184730358353,Huang Yu Lan,Vivo/X60/White/254GB,8,50585,404680,NEWYEAR25,303510.0,45526.5,2023-02-11 00:00:00,Pending,Pending,Bank Transfer,Visa,18842783609,Gui Zhou Sheng Lan Zhou Shi Wei Dou Yang Lu E Zuo  584246
TKF7S35F8184730358537,Xiao Juan,Oppo/Reno5/Blue/1TB,6,64509,387054,NEWYEAR25,290290.5,43543.575,2023-02-11 00:00:00,Failed,In Transit,PayPal,Alipay,13698807889,Guang Xi Zhuang Zu Zi Zhi Qu Ning Xian Sha Wan Xi Ning Lu K Zuo  490247
V1X57BA9A184730358719,Han Huan,Xiaomi/Mi 11/Blue/128GB,9,87695,789255,SUMMER15,670866.75,100630.0125,2023-02-11 00:00:00,Paid,Delivered,Credit Card,WeChat Pay,18898830121,Xin Jiang Wei Wu Er Zi Zhi Qu Yan Shi Mu Ye Zhou Lu W Zuo  450582
XUVRTKZZR184730358913,Zhang Rong,Huawei/P40/Black/32GB,7,127365,891555,SUMMER15,757821.75,113673.2625,2023-02-11 00:00:00,Paid,Delivered,Debit Card,American Express,13933506294,Hei Long Jiang Sheng Jian Xian Dong Cheng Zhang Lu J Zuo  826230
1A3WP8AIP184730359085,Liu Zhi Qiang,iPhone/13 Pro/Red/128GB,10,120317,1203170,SUMMER15,1022694.5,153404.175,2023-02-11 00:00:00,Pending,Delivered,Credit Card,American Express,15182679077,Shang Hai Shi Ha Er Bin Shi Xi Feng Wang Lu U Zuo  489557
ZV8GKFJDP184730359271,Li Hui,Vivo/X60/Blue/8GB,5,101312,506560,WINTER10,455904.0,68385.59999999999,2023-02-11 00:00:00,Pending,Shipped,PayPal,PayPal,13356204619,Ao Men Te Bie Xing Zheng Qu Li Hua Shi Yong Chuan Ling Jie T Zuo  539599
T1U22DIY8184730359473,Liang Hao,Vivo/X60/Red/128GB,6,101688,610128,FESTIVE30,427089.6,64063.439999999995,2023-02-11 00:00:00,Failed,In Transit,Debit Card,MasterCard,15065604749,Xiang Gang Te Bie Xing Zheng Qu Jing Men Xian Shan Ting Tian Jin Lu T Zuo  507110
9OBRW8Z60184730359658,Ni Yu,Vivo/X60/Purple/8GB,10,103943,1039430,WINTER10,935487.0,140323.05,2023-02-11 00:00:00,Failed,Shipped,Credit Card,American Express,13670481129,Shan Dong Sheng Jian Hua Xian An Ci Xia Lu L Zuo  735615
JBDX634KU184730359832,Huang Qiang,Xiaomi/Mi 11/Purple/1TB,2,80345,160690,NEWYEAR25,120517.5,18077.625,2023-02-11 00:00:00,Failed,Pending,Debit Card,American Express,18733870610,Hei Long Jiang Sheng Ning De Shi Jiang Bei Shang Hai Lu I Zuo  238143
EO48TA30D184730360005,Xu Ping,Galaxy/S21/White/64GB,8,118222,945776,FESTIVE30,662043.2,99306.48,2023-02-11 00:00:00,Paid,Pending,Debit Card,MasterCard,18836065751,Shan Xi Sheng Li Hua Xian Shang Jie Sun Lu D Zuo  580919
2EZNBJBW4184730360190,Peng Cheng,Oppo/Reno5/Black/32GB,5,77760,388800,AUTUMN5,369360.0,55404.0,2023-02-11 00:00:00,Failed,Pending,Bank Transfer,WeChat Pay,13128557964,Xiang Gang Te Bie Xing Zheng Qu Gui Xiang Xian Ji Qu Hai Men Lu R Zuo  205858
K4NLQZ56J184730360375,Wang Ying,Vivo/X60/Blue/254GB,8,145308,1162464,AUTUMN5,1104340.8,165651.12,2023-02-11 00:00:00,Paid,In Transit,Credit Card,American Express,13854894789,Ao Men Te Bie Xing Zheng Qu Huan Xian Fang Shan Bei Zhen Jie K Zuo  889928
06OI7JN4K184730360554,Liu Yu Zhen,iPhone/13 Pro/Purple/8GB,3,69397,208191,AUTUMN5,197781.44999999998,29667.217499999995,2023-02-11 00:00:00,Failed,Shipped,Bank Transfer,Alipay,18211095176,Ning Xia Hui Zu Zi Zhi Qu Jing Shi Xun Yang Fan Jie Y Zuo  450384
1KIWYAVDK184730360746,Zheng Hui,Xiaomi/Mi 11/Blue/8GB,10,68273,682730,FESTIVE30,477910.99999999994,71686.65,2023-02-11 00:00:00,Pending,Delivered,Credit Card,WeChat Pay,15235805464,He Nan Sheng Juan Shi Huai Rou Li Lu A Zuo  319672
OHHIBKGQD184730360918,Wang Lei,Vivo/X60/White/32GB,1,141152,141152,NEWYEAR25,105864.0,15879.599999999999,2023-02-11 00:00:00,Paid,Pending,Debit Card,American Express,15856016806,He Bei Sheng Jian Jun Shi Hua Long Guan Ling Jie G Zuo  343556
9K40TL3TS184730361081,Yuan Jian Ping,Xiaomi/Mi 11/Blue/64GB,8,135604,1084832,SPRING20,867865.6000000001,130179.84000000001,2023-02-11 00:00:00,Failed,In Transit,Debit Card,American Express,15543234268,An Hui Sheng Hong Xia Xian Dong Li Zhang Lu E Zuo  748079
MJN6D2X0G184730361260,Xie Yang,Huawei/P40/Purple/128GB,10,96906,969060,NEWYEAR25,726795.0,109019.25,2023-02-11 00:00:00,Pending,Shipped,Credit Card,WeChat Pay,18949533875,Tai Wan Sheng Hai Kou Shi Hua Xi Huai An Lu W Zuo  840720
BK7UM3GRX184730361424,Yuan Shu Zhen,Vivo/X60/Purple/1TB,9,113304,1019736,SPRING20,815788.8,122368.32,2023-02-11 00:00:00,Failed,In Transit,Bank Transfer,WeChat Pay,18929073212,Zhe Jiang Sheng Ting Xian Ping Shan Wu Han Lu C Zuo  352220
M8KI9VAX3184730361587,Li Bin,iPhone/13 Pro/Red/8GB,10,133027,1330270,SUMMER15,1130729.5,169609.425,2023-02-11 00:00:00,Failed,Pending,Credit Card,American Express,13267670197,Ning Xia Hui Zu Zi Zhi Qu Na Xian Huang Pu Tong Liao Jie U Zuo  223864
ARYDP3ESE184730361763,Wu Lan Ying,Vivo/X60/Purple/254GB,4,88948,355792,SPRING20,284633.60000000003,42695.04,2023-02-11 00:00:00,Pending,Pending,Debit Card,MasterCard,15216421675,Xi Zang Zi Zhi Qu Tai Bei Shi Huai Rou Dong Jie Q Zuo  466065
9SL95A1GJ184730361950,Wang Bing,Xiaomi/Mi 11/Black/8GB,7,87380,611660,WINTER10,550494.0,82574.09999999999,2023-02-11 00:00:00,Paid,Shipped,Debit Card,Visa,15626246546,Jiang Su Sheng Ma An Shan Xian Dong Cheng Yang Jie E Zuo  970003
1MW8EBIEN184730362124,Chen Lin,iPhone/13/Purple/8GB,7,147974,1035818,AUTUMN5,984027.1,147604.065,2023-02-11 00:00:00,Paid,Pending,Credit Card,PayPal,13718369080,Hai Nan Sheng Qian Xian You Hao Lv Jie B Zuo  292266
RROGQ1HHE184730362291,Wen Gui Xiang,OnePlus/9/Purple/64GB,10,75183,751830,SUMMER15,639055.5,95858.325,2023-02-11 00:00:00,Pending,Delivered,Bank Transfer,MasterCard,15732775589,Jiang Xi Sheng Kun Shi Zhao Yang Hang Zhou Jie G Zuo  755345
EWOR9Y7O9184730362458,Chen Ning,Huawei/P40/White/8GB,9,124663,1121967,NEWYEAR25,841475.25,126221.28749999999,2023-02-11 00:00:00,Failed,Shipped,Credit Card,PayPal,13612875029,Bei Jing Shi Wei Xian Men Tou Gou Guan Ling Jie X Zuo  195298
TO932C5LB184730362624,Liu Hong,iPhone/13/Red/32GB,2,127034,254068,AUTUMN5,241364.59999999998,36204.689999999995,2023-02-11 00:00:00,Paid,In Transit,Credit Card,MasterCard,14525782906,Chong Qing Shi Xing Cheng Xian Shen Bei Xin Shi Jia Zhuang Lu P Zuo  878362
NMR6I0AN3184730362797,Ye Dong,Galaxy/S21/Blue/64GB,7,101342,709394,WINTER10,638454.6,95768.18999999999,2023-02-11 00:00:00,Paid,Delivered,Debit Card,American Express,13295540514,Yun Nan Sheng Hong Xia Shi Xing Shan Jiang Lu M Zuo  868181
LQR9C3DDR184730362981,Chang Lei,iPhone/13 Pro/Purple/128GB,2,136051,272102,SUMMER15,231286.69999999998,34693.005,2023-02-11 00:00:00,Pending,In Transit,PayPal,MasterCard,13618072073,Jiang Xi Sheng Bei Jing Xian Pu Tuo Xi Ning Jie W Zuo  708443
1UIRR58FS184730363143,Su Gui Lan,Vivo/X60/Purple/1TB,9,146342,1317078,NEWYEAR25,987808.5,148171.275,2023-02-11 00:00:00,Paid,Shipped,Bank Transfer,Visa,14745513777,Jiang Su Sheng Gang Shi Nan Xi Shen Yang Lu S Zuo  855901
TC98FJO1H184730363304,Yin Dong,iPhone/13/White/64GB,7,106731,747117,WINTER10,672405.3,100860.795,2023-02-11 00:00:00,Paid,In Transit,Bank Transfer,MasterCard,13274015162,Xiang Gang Te Bie Xing Zheng Qu Shu Lan Shi Jin Ping Zhao Lu N Zuo  260204
3VC2L225M184730363492,Shi Yang,OnePlus/9/Purple/32GB,1,93415,93415,WINTER10,84073.5,12611.025,2023-02-11 00:00:00,Failed,In Transit,Debit Card,WeChat Pay,13108010909,Gui Zhou Sheng Xiu Zhen Shi Huang Pu Chang Sha Lu E Zuo  101462
UDW8LXJWD184730363649,Jiang Jian Jun,Huawei/P40/White/1TB,2,134767,269534,SUMMER15,229103.9,34365.585,2023-02-11 00:00:00,Failed,Delivered,PayPal,MasterCard,18802698186,Xin Jiang Wei Wu Er Zi Zhi Qu Hui Zhou Shi Xi Shan Xing An Meng Lu B Zuo  286557
YZPGBLFXA184730363841,Tang Ming,OnePlus/9/Black/8GB,9,131723,1185507,WINTER10,1066956.3,160043.445,2023-02-11 00:00:00,Paid,Pending,Credit Card,Alipay,18668479835,He Nan Sheng Zhang Sha Xian An Ci Liu Pan Shui Lu F Zuo  569236
Z7YO13PRY184730364009,Hao Feng Lan,Galaxy/S21/Purple/8GB,6,104536,627216,SPRING20,501772.80000000005,75265.92,2023-02-11 00:00:00,Paid,In Transit,PayPal,PayPal,15687134900,Gan Su Sheng Yong Xian Pu Tuo Bei Jing Jie E Zuo  164751
48JQA9BOL184730364170,Tian Qian,OnePlus/9/Purple/8GB,10,70144,701440,SPRING20,561152.0,84172.8,2023-02-11 00:00:00,Failed,Delivered,Bank Transfer,American Express,15792696413,Shang Hai Shi Nan Ning Shi Zhao Yang Hai Men Lu W Zuo  533030
BSZI6G7IG184730364328,Fang Bo,OnePlus/9/Black/254GB,5,83755,418775,AUTUMN5,397836.25,59675.4375,2023-02-11 00:00:00,Pending,Pending,Credit Card,PayPal,13402287748,Guang Xi Zhuang Zu Zi Zhi Qu Fang Xian Ji Zhou Ma An Shan Lu W Zuo  606181
6K3U3S356184730364507,Wang Feng Lan,Galaxy/S21/Black/8GB,6,142143,852858,FESTIVE30,597000.6,89550.09,2023-02-11 00:00:00,Paid,Pending,Credit Card,Visa,18860797587,Guang Dong Sheng Shuai Shi Chong Wen Qiu Jie C Zuo  551572
XGNJOHM2P184730364679,Duan Hua,Huawei/P40/Purple/254GB,7,59818,418726,FESTIVE30,293108.19999999995,43966.22999999999,2023-02-11 00:00:00,Pending,Delivered,PayPal,MasterCard,15818196481,Ao Men Te Bie Xing Zheng Qu Yu Zhen Shi Shen Bei Xin Chao Zhou Jie C Zuo  584520
AP10DVW36184730364862,Fang Ying,OnePlus/9/Red/1TB,2,66974,133948,WINTER10,120553.2,18082.98,2023-02-11 00:00:00,Paid,Shipped,Bank Transfer,Alipay,13546516725,Ji Lin Sheng Yan Shi Huai Rou Ceng Lu K Zuo  701293
ZS85L1076184730365026,He Xin,Oppo/Reno5/Blue/1TB,5,62114,310570,SUMMER15,263984.5,39597.674999999996,2023-02-11 00:00:00,Failed,In Transit,Credit Card,Alipay,18859119400,Guang Dong Sheng Xiu Mei Shi Shen Bei Xin Zhao Jie V Zuo  277595
8WHZCVIX9184730365202,Sui Fang,Oppo/Reno5/Red/64GB,9,77049,693441,AUTUMN5,658768.95,98815.34249999998,2023-02-11 00:00:00,Paid,In Transit,PayPal,Alipay,13963842953,Guang Dong Sheng Nan Jing Shi Shan Ting Xing Cheng Jie N Zuo  268100
RFBPAIC1L184730365359,Shao Jian Hua,Huawei/P40/Black/64GB,3,93689,281067,SUMMER15,238906.94999999998,35836.042499999996,2023-02-11 00:00:00,Pending,Shipped,Debit Card,Visa,18864718002,Gan Su Sheng Yu Mei Shi Xiu Ying Shi Jia Zhuang Jie X Zuo  954430
H5G3L2YBE184730365531,Wan Yong,Oppo/Reno5/Red/1TB,10,137261,1372610,AUTUMN5,1303979.5,195596.925,2023-02-11 00:00:00,Pending,Pending,Credit Card,American Express,13835972961,Tian Jin Shi Ma An Shan Shi Cheng Bei Fu Zhou Lu C Zuo  157231
NOMJS3RIN184730365694,Wu Peng,iPhone/13 Pro/Purple/128GB,7,57162,400134,FESTIVE30,280093.8,42014.07,2023-02-11 00:00:00,Paid,Delivered,PayPal,PayPal,13978930624,Shan Xi Sheng Yi Dou Xian Shan Ting Zhang Sha Lu O Zuo  944585
722FTQDQD184730365854,Yang Na,iPhone/13 Pro/White/254GB,3,122100,366300,AUTUMN5,347985.0,52197.75,2023-02-11 00:00:00,Pending,Pending,Credit Card,WeChat Pay,13408444178,Guang Dong Sheng Ha Er Bin Shi Zhao Yang Shang Hai Lu R Zuo  121583
P8A0CRXAO184730366011,Xiang Lin,OnePlus/9/White/8GB,5,128660,643300,SPRING20,514640.0,77196.0,2023-02-11 00:00:00,Pending,In Transit,PayPal,American Express,13541068149,Gan Su Sheng Shu Ying Xian Dong Cheng Jiang Lu P Zuo  228910
U5YF8M20T184730366180,Li Gui Lan,iPhone/13/Red/32GB,10,132436,1324360,AUTUMN5,1258142.0,188721.3,2023-02-11 00:00:00,Pending,Delivered,Bank Transfer,WeChat Pay,15364464107,Chong Qing Shi Bo Shi Dong Cheng Wu Han Jie U Zuo  623418
SJMV9G8TK184730366337,Wang Jian Jun,Huawei/P40/White/32GB,1,132243,132243,NEWYEAR25,99182.25,14877.3375,2023-02-11 00:00:00,Pending,In Transit,Credit Card,Alipay,13937033779,Guang Xi Zhuang Zu Zi Zhi Qu Lin Xian Xun Yang Guan Ling Jie X Zuo  889312
IVHCS8X08184730366519,Li Xin,Xiaomi/Mi 11/Black/254GB,3,127014,381042,AUTUMN5,361989.89999999997,54298.48499999999,2023-02-11 00:00:00,Pending,In Transit,Credit Card,Visa,15327870687,Ji Lin Sheng Ning De Xian Zhang Shou Li Lu Z Zuo  334694
TNB51PTOU184730366686,Dou Xiu Rong,Vivo/X60/Red/1TB,5,115665,578325,SPRING20,462660.0,69399.0,2023-02-11 00:00:00,Pending,Delivered,Bank Transfer,WeChat Pay,13425718796,Tai Wan Sheng Hu He Hao Te Xian Xi Xia Meng Lu X Zuo  648075
