Order ID,Customer Name,Mobile Model,Quantity,Price per Unit,Total Price,Promotion Code,Order Amount,GST,Order Date,Payment Status,Shipping Status,Payment Method,Payment Provider,Mobile,Delivery Address
CKHIDUDX7184730366865,Fu Lu,Oppo/Reno5/Blue/64GB,3,56801,170403,WINTER10,153362.7,23004.405000000002,2023-02-11 00:00:00,Pending,Delivered,Bank Transfer,MasterCard,13481997636,Fu Jian Sheng Chun Mei Shi Zhang Shou Gong Jie S Zuo  192020
AZVN5RNR4184730367035,Qi Shuai,OnePlus/9/Red/128GB,2,107024,214048,FESTIVE30,149833.59999999998,22475.039999999997,2023-02-11 00:00:00,Paid,Pending,Credit Card,Visa,14537605298,Shang Hai Shi Qian Jiang Xian Da Xing Zhang Lu U Zuo  287093
009QSCYNV184730367203,Hu Xiu Fang,Xiaomi/Mi 11/Purple/128GB,1,106522,106522,AUTUMN5,101195.9,15179.384999999998,2023-02-11 00:00:00,Pending,Delivered,Credit Card,Visa,15110567413,Shan Dong Sheng Fan Xian Dong Li La Sa Lu D Zuo  731624
U70270M8K184730367360,Huang Li,Xiaomi/Mi 11/Blue/254GB,4,122910,491640,AUTUMN5,467058.0,70058.7,2023-02-11 00:00:00,Paid,In Transit,Credit Card,Visa,15784310964,Xiang Gang Te Bie Xing Zheng Qu Jing Shi Jin Ping Jiang Jie T Zuo  441399
X2TP6NPGN184730367542,Xiao Jian Jun,OnePlus/9/Purple/128GB,8,68440,547520,SUMMER15,465392.0,69808.8,2023-02-11 00:00:00,Failed,Delivered,PayPal,Visa,15513985482,Hu Nan Sheng Xin Xian Xiao Shan Hu Jie Z Zuo  736200
8LHTJS90C184730367712,Zhang Xiu Ying,OnePlus/9/Purple/64GB,5,107780,538900,AUTUMN5,511955.0,76793.25,2023-02-11 00:00:00,Paid,Shipped,Bank Transfer,Alipay,13452625977,Yun Nan Sheng Zhang Jia Gang Shi Zhao Yang Yang Lu C Zuo  925199
S92RYEOWE184730367888,Cen Shuai,Xiaomi/Mi 11/Blue/128GB,4,75479,301916,SPRING20,241532.80000000002,36229.92,2023-02-11 00:00:00,Failed,Delivered,Bank Transfer,PayPal,15542227502,Ji Lin Sheng Chao Hu Shi Hai Gang Tang Jie W Zuo  511278
62FOO8U06184730368055,Zhang Hui,iPhone/13/Blue/32GB,7,107247,750729,AUTUMN5,713192.5499999999,106978.88249999999,2023-02-11 00:00:00,Paid,Shipped,Bank Transfer,PayPal,13746383883,Ning Xia Hui Zu Zi Zhi Qu Gang Xian Bi Shan Dong Jie R Zuo  219242
NZ6EFAVH9184730368240,Meng Ting Ting,Huawei/P40/Red/64GB,6,91644,549864,WINTER10,494877.60000000003,74231.64,2023-02-11 00:00:00,Failed,In Transit,Debit Card,Visa,15513142407,Xi Zang Zi Zhi Qu Li Xian Zi Chuan Yin Jie B Zuo  737804
K5HWF6QZL184730368420,Zhu Bin,Galaxy/S21/Purple/64GB,1,61488,61488,NEWYEAR25,46116.0,6917.4,2023-02-11 00:00:00,Paid,Delivered,Credit Card,Alipay,13766510568,Qing Hai Sheng Yu Lan Shi Chong Wen Zhang Lu N Zuo  988089
WM0ZOJOEY184730368595,Li Ping,OnePlus/9/Purple/254GB,3,105790,317370,SUMMER15,269764.5,40464.674999999996,2023-02-11 00:00:00,Failed,Shipped,Bank Transfer,American Express,13652147218,Yun Nan Sheng Tai Bei Shi Huang Pu Hu He Hao Te Jie Z Zuo  338877
QZ0SOPL8U184730368760,Qiu Yang,iPhone/13/Blue/32GB,8,58258,466064,NEWYEAR25,349548.0,52432.2,2023-02-11 00:00:00,Failed,Delivered,Bank Transfer,PayPal,18101072099,Chong Qing Shi Cheng Xian Huai Rou Li Lu O Zuo  383895
FL70GVV7D184730368928,Wang Yu Hua,Galaxy/S21/Blue/128GB,10,126566,1265660,SUMMER15,1075811.0,161371.65,2023-02-11 00:00:00,Failed,Delivered,Bank Transfer,PayPal,14772898853,Hei Long Jiang Sheng Xiang Gang Xian He Chuan Guan Ling Lu P Zuo  833528
4R86F6EUE184730369096,Xu Hong Xia,Vivo/X60/Blue/254GB,7,52770,369390,SPRING20,295512.0,44326.799999999996,2023-02-11 00:00:00,Paid,In Transit,Credit Card,Alipay,14561645635,Si Chuan Sheng Tong Liao Shi Liang Ping Chen Lu Y Zuo  291730
BSA0R63U5184730369270,Wang Jian,iPhone/13 Pro/Blue/1TB,3,57554,172662,SPRING20,138129.6,20719.44,2023-02-11 00:00:00,Paid,Shipped,Debit Card,WeChat Pay,18801949602,Liao Ning Sheng Tian Jin Shi Jiang Bei Xu Jie G Zuo  949373
D31B0C2WN184730369438,Wang Hong Mei,Huawei/P40/Black/64GB,1,123167,123167,WINTER10,110850.3,16627.545,2023-02-11 00:00:00,Failed,Delivered,PayPal,PayPal,13044770325,Shan Xi Sheng Qi Qi Ha Er Shi Shuang Luan He Fei Jie E Zuo  679881
W4P7LX6G1184730369615,Zhang Xiu Rong,Oppo/Reno5/Blue/254GB,7,64617,452319,FESTIVE30,316623.3,47493.494999999995,2023-02-11 00:00:00,Paid,Shipped,Bank Transfer,Alipay,15745554323,Si Chuan Sheng Gui Ying Shi Qing He Di Lu V Zuo  502103
ES63U0YXA184730369788,Ma Bin,Xiaomi/Mi 11/Purple/128GB,8,101270,810160,NEWYEAR25,607620.0,91143.0,2023-02-11 00:00:00,Failed,Delivered,Debit Card,Alipay,13221744060,Ning Xia Hui Zu Zi Zhi Qu Hong Shi Hua Long Zhang Lu U Zuo  290253
0ZOZ6OC7H184730369966,Xie Yang,Galaxy/S21/Blue/8GB,10,123792,1237920,SUMMER15,1052232.0,157834.8,2023-02-11 00:00:00,Pending,Pending,Debit Card,Visa,14563299145,Bei Jing Shi Dan Dan Xian Gao Ming Geng Lu N Zuo  228709
Y3MGOECXB184730370134,Zhou Lin,Oppo/Reno5/Black/1TB,4,82252,329008,NEWYEAR25,246756.0,37013.4,2023-02-11 00:00:00,Failed,In Transit,Debit Card,Visa,13178208315,Si Chuan Sheng Shen Zhen Xian Min Xing Ding Lu O Zuo  924823
ICL2EKCJA184730370302,Wang Gui Ying,Vivo/X60/White/1TB,10,95804,958040,AUTUMN5,910138.0,136520.69999999998,2023-02-11 00:00:00,Failed,Delivered,Bank Transfer,Visa,18166852652,Zhe Jiang Sheng Lu An Shi An Ci Tong Liao Jie K Zuo  921804
1MQVYYW77184730370463,Zhang Chen,Huawei/P40/Black/1TB,7,131884,923188,WINTER10,830869.2000000001,124630.38,2023-02-11 00:00:00,Pending,Shipped,Credit Card,Visa,15052478002,Liao Ning Sheng Hao Shi Nan Zhang He Shan Jie L Zuo  994086
6HY4EHFI4184730370614,Yang Xiu Yun,Vivo/X60/White/32GB,6,101682,610092,SPRING20,488073.60000000003,73211.04000000001,2023-02-11 00:00:00,Paid,Shipped,PayPal,PayPal,18562143881,Shan Xi Sheng Xiu Zhen Xian Cheng Dong Luo Lu K Zuo  194725
TY387CZ1J184730370781,Wu Ling,iPhone/13 Pro/Purple/254GB,10,128514,1285140,NEWYEAR25,963855.0,144578.25,2023-02-11 00:00:00,Paid,Shipped,Bank Transfer,WeChat Pay,15268214282,Jiang Xi Sheng Xin Shi Dong Li Wu Lu Mu Qi Lu P Zuo  601516
4PRJ6W4UD184730370938,Yu Jie,Huawei/P40/Red/64GB,9,137442,1236978,WINTER10,1113280.2,166992.03,2023-02-11 00:00:00,Paid,Delivered,Debit Card,PayPal,18204026284,Hei Long Jiang Sheng Jian Jun Shi Liang Ping Xing Cheng Jie T Zuo  535394
LZRDRJL6H184730371099,Zhao Rui,Vivo/X60/Black/254GB,8,95571,764568,NEWYEAR25,573426.0,86013.9,2023-02-11 00:00:00,Failed,Pending,PayPal,PayPal,15190319700,Hu Nan Sheng Chang Shi Bi Shan Han Dan Lu B Zuo  196223
32QNS7Q9L184730371252,Niu Liang,Oppo/Reno5/Purple/128GB,6,66747,400482,SUMMER15,340409.7,51061.455,2023-02-11 00:00:00,Failed,Shipped,Bank Transfer,American Express,14587298860,Xiang Gang Te Bie Xing Zheng Qu Liu Xian Yong Chuan Chen Lu J Zuo  405155
N4G14QIXD184730371440,Li Yu Lan,Vivo/X60/Black/254GB,1,74036,74036,SPRING20,59228.8,8884.32,2023-02-11 00:00:00,Paid,Pending,Credit Card,MasterCard,13270716548,Hu Bei Sheng Jun Shi Qing Pu Gu Jie T Zuo  781867
SIT60GN46184730371612,Zhao Yu Hua,Oppo/Reno5/Purple/254GB,9,93288,839592,FESTIVE30,587714.3999999999,88157.15999999999,2023-02-11 00:00:00,Pending,In Transit,Debit Card,MasterCard,13482062209,Xiang Gang Te Bie Xing Zheng Qu Xi Ning Xian Huang Pu Shi Jia Zhuang Jie L Zuo  773621
VWG7QNQZC184730371799,He Chang,Xiaomi/Mi 11/White/32GB,5,60674,303370,AUTUMN5,288201.5,43230.225,2023-02-11 00:00:00,Failed,Shipped,PayPal,PayPal,13479763179,Ji Lin Sheng Jing Men Xian Xun Yang Xu Lu R Zuo  707097
6E7Q5JIW9184730371969,Zhou Xu,Huawei/P40/White/32GB,1,63086,63086,FESTIVE30,44160.2,6624.03,2023-02-11 00:00:00,Paid,In Transit,Bank Transfer,WeChat Pay,15517352328,Hu Bei Sheng Kun Ming Xian Xiao Nan Xing Cheng Jie Q Zuo  274278
GSEVBBX7H184730372126,Chen Feng Ying,iPhone/13 Pro/Purple/254GB,10,52466,524660,WINTER10,472194.0,70829.09999999999,2023-02-11 00:00:00,Pending,Delivered,Bank Transfer,WeChat Pay,15263730750,Ji Lin Sheng Gui Yang Shi Shang Jie Li Jie U Zuo  199729
D3ZRR9T69184730372299,He Rui,iPhone/13/Red/32GB,5,124577,622885,WINTER10,560596.5,84089.47499999999,2023-02-11 00:00:00,Failed,Pending,PayPal,WeChat Pay,18622591993,Gan Su Sheng Min Shi Yong Chuan Wu Han Lu D Zuo  446853
K0OIGAGQA184730372451,Chen Yu Lan,iPhone/13 Pro/Black/254GB,7,66974,468818,NEWYEAR25,351613.5,52742.025,2023-02-11 00:00:00,Paid,In Transit,Bank Transfer,Visa,13541213820,Shan Dong Sheng Min Shi Zi Chuan Guang Zhou Lu K Zuo  314146
D8XQ0R1KG184730372608,Cao Xu,Vivo/X60/Black/8GB,10,148161,1481610,SPRING20,1185288.0,177793.19999999998,2023-02-11 00:00:00,Pending,In Transit,PayPal,Alipay,18797770617,Nei Meng Gu Zi Zhi Qu Liao Yang Shi He Chuan Fo Shan Lu L Zuo  139454
UL123A0C4184730372783,Xue Yan,Huawei/P40/Blue/254GB,7,98732,691124,NEWYEAR25,518343.0,77751.45,2023-02-11 00:00:00,Failed,Shipped,PayPal,WeChat Pay,13776920317,Yun Nan Sheng Lin Xian Qing Cheng Cheng Jie P Zuo  600171
H3TGJY0XE184730372949,Lu Dan,iPhone/13/Black/254GB,2,135265,270530,WINTER10,243477.0,36521.549999999996,2023-02-11 00:00:00,Pending,Delivered,PayPal,MasterCard,13856750337,Gui Zhou Sheng Ao Men Shi Shen Bei Xin Wang Lu R Zuo  797044
VUFMK9LID184730373121,Yin Gang,iPhone/13 Pro/Black/64GB,8,85306,682448,SUMMER15,580080.7999999999,87012.11999999998,2023-02-11 00:00:00,Pending,Shipped,Credit Card,WeChat Pay,15584151889,Bei Jing Shi Huan Shi He Ping Ge Jie L Zuo  453071
98AG437E8184730373285,Song Yu,Huawei/P40/White/254GB,3,102204,306612,AUTUMN5,291281.39999999997,43692.20999999999,2023-02-11 00:00:00,Failed,Shipped,Bank Transfer,MasterCard,15750098100,Tian Jin Shi Qi Qi Ha Er Shi Hai Gang Shang Hai Jie R Zuo  657879
483MRCWG3184730373455,Zheng Xiu Rong,iPhone/13/Purple/128GB,8,105787,846296,WINTER10,761666.4,114249.96,2023-02-11 00:00:00,Pending,In Transit,Credit Card,Visa,15602394795,Hu Bei Sheng Yang Shi Jing An Ji Nan Lu V Zuo  236391
K43PXVOUP184730373616,Guo Feng,iPhone/13/Red/8GB,1,96844,96844,FESTIVE30,67790.8,10168.62,2023-02-11 00:00:00,Failed,In Transit,Debit Card,American Express,15044395534,Ning Xia Hui Zu Zi Zhi Qu Shu Lan Xian An Ci Guan Ling Jie Q Zuo  369772
YCJ7MO4Z6184730373796,Qiu Yong,iPhone/13/Black/64GB,2,111785,223570,NEWYEAR25,167677.5,25151.625,2023-02-11 00:00:00,Failed,Delivered,Credit Card,Visa,18137467637,Guang Xi Zhuang Zu Zi Zhi Qu Ning Shi Qing Pu Hai Kou Lu B Zuo  466846
JYFD8YRZD184730373969,Yao Rui,OnePlus/9/Black/64GB,5,109159,545795,NEWYEAR25,409346.25,61401.9375,2023-02-11 00:00:00,Failed,In Transit,Debit Card,WeChat Pay,14797017748,Shan Xi Sheng Fan Shi Shan Ting Han Dan Jie G Zuo  367781
J421QND1E184730374121,Zhong Xu,iPhone/13 Pro/Blue/64GB,5,61698,308490,SPRING20,246792.0,37018.799999999996,2023-02-11 00:00:00,Pending,Pending,Credit Card,WeChat Pay,18237969185,Xi Zang Zi Zhi Qu Fang Shi Xiao Nan He Shan Lu M Zuo  140440
WWGKADDRQ184730374283,Shi Wei,OnePlus/9/Blue/32GB,8,148651,1189208,SUMMER15,1010826.7999999999,151624.02,2023-02-11 00:00:00,Failed,Delivered,Credit Card,MasterCard,13529788380,An Hui Sheng Li Shi Men Tou Gou He Lu R Zuo  476456
1R5QFZBF5184730374450,Cheng Yang,iPhone/13/Purple/8GB,1,127353,127353,WINTER10,114617.7,17192.655,2023-02-11 00:00:00,Pending,Pending,PayPal,PayPal,18166322123,Shang Hai Shi Shu Lan Shi Xun Yang Tai Bei Lu R Zuo  405715
4FDBKT9QW184730374612,Luo Dan Dan,Xiaomi/Mi 11/Red/8GB,7,98675,690725,AUTUMN5,656188.75,98428.3125,2023-02-11 00:00:00,Paid,In Transit,Bank Transfer,American Express,18249897570,Bei Jing Shi Yang Shi Chong Wen Yan Lu Q Zuo  209026
CJ0AY2JOR184730374781,Zhou Lan Ying,iPhone/13 Pro/Blue/128GB,4,63781,255124,NEWYEAR25,191343.0,28701.45,2023-02-11 00:00:00,Paid,Pending,Debit Card,WeChat Pay,13402629378,Ning Xia Hui Zu Zi Zhi Qu Xiu Mei Shi Yong Chuan He Fei Jie V Zuo  697680
3YH9T6WD5184730374965,Zhang Liang,iPhone/13 Pro/White/254GB,4,85822,343288,SPRING20,274630.4,41194.560000000005,2023-02-11 00:00:00,Paid,Pending,Bank Transfer,Alipay,13560970249,Chong Qing Shi Shi Jia Zhuang Xian Cheng Bei Zhou Jie Q Zuo  545926
24WOE0XN2184730375139,Wei Fan,Vivo/X60/Purple/64GB,1,120287,120287,WINTER10,108258.3,16238.744999999999,2023-02-11 00:00:00,Pending,Pending,PayPal,Alipay,18047771161,Ao Men Te Bie Xing Zheng Qu Fan Xian Dong Li Xing An Meng Jie Z Zuo  587890
JNC821NSY184730375319,Pan Xiu Fang,iPhone/13/Purple/32GB,5,50302,251510,AUTUMN5,238934.5,35840.174999999996,2023-02-11 00:00:00,Pending,In Transit,Credit Card,Visa,13067789807,Jiang Xi Sheng Bo Shi Zi Chuan Zhao Jie P Zuo  629051
6947JT6ZA184730375487,Ren Peng,Galaxy/S21/Black/64GB,5,117619,588095,WINTER10,529285.5,79392.825,2023-02-11 00:00:00,Pending,Delivered,PayPal,MasterCard,15253808617,Xi Zang Zi Zhi Qu Bei Jing Xian Sha Wan Chang Sha Jie O Zuo  281509
K97A02RMK184730375652,Li Yun,Oppo/Reno5/White/128GB,1,89475,89475,NEWYEAR25,67106.25,10065.9375,2023-02-11 00:00:00,Pending,In Transit,PayPal,Alipay,18039652489,Qing Hai Sheng Ping Xian An Ci Ma An Shan Lu I Zuo  422982
OO21K291C184730375809,Li Liang,Vivo/X60/White/8GB,5,132481,662405,SUMMER15,563044.25,84456.6375,2023-02-11 00:00:00,Failed,Pending,Debit Card,Visa,15381625570,Ji Lin Sheng Xue Mei Shi Bai Yun Wu Zhou Jie R Zuo  270852
G8IHU6KQM184730375967,Wan Fang,iPhone/13/White/8GB,9,89241,803169,SUMMER15,682693.65,102404.0475,2023-02-11 00:00:00,Failed,Pending,Debit Card,PayPal,15200554647,Ning Xia Hui Zu Zi Zhi Qu Shan Wei Shi Xiao Shan Nan Chang Lu T Zuo  303954
PMSW8FQAS184730376143,Wang Yan,Huawei/P40/Red/8GB,2,139707,279414,SPRING20,223531.2,33529.68,2023-02-11 00:00:00,Paid,In Transit,Credit Card,WeChat Pay,15998064953,Bei Jing Shi Xiang Gang Shi Bin Cheng Peng Jie B Zuo  915671
GJQ33ZPP4184730376312,Gao Xiu Yun,iPhone/13/White/1TB,9,81598,734382,FESTIVE30,514067.39999999997,77110.10999999999,2023-02-11 00:00:00,Paid,Pending,Credit Card,PayPal,13262654826,Hu Nan Sheng Ping Shi Fang Shan Jing Men Jie W Zuo  557299
1MG2FFPZP184730376480,Li Gui Fang,Huawei/P40/Red/254GB,1,83466,83466,SPRING20,66772.8,10015.92,2023-02-11 00:00:00,Pending,Shipped,Credit Card,WeChat Pay,18130431612,Ji Lin Sheng Yang Shi Shan Ting Liu Zhou Jie C Zuo  588518
AY80H54AX184730376640,Li Kun,OnePlus/9/Purple/1TB,6,100848,605088,SPRING20,484070.4,72610.56,2023-02-11 00:00:00,Pending,Shipped,Bank Transfer,Alipay,13931180512,Xiang Gang Te Bie Xing Zheng Qu Fu Zhou Shi Men Tou Gou Xiang Gang Lu I Zuo  954981
RDB274KTR184730376831,Huang Hai Yan,OnePlus/9/Purple/128GB,6,69000,414000,NEWYEAR25,310500.0,46575.0,2023-02-11 00:00:00,Paid,Pending,Debit Card,Visa,13159280786,Xi Zang Zi Zhi Qu Chao Zhou Shi Xun Yang Hai Men Jie A Zuo  324434
FCNE7WC3A184730377013,Xiang Xu,Huawei/P40/Black/1TB,4,137595,550380,SUMMER15,467823.0,70173.45,2023-02-11 00:00:00,Failed,In Transit,Credit Card,WeChat Pay,15505671838,Xi Zang Zi Zhi Qu Ting Ting Shi Qing He Huai An Lu S Zuo  133320
G13T997HX184730377188,Song Yang,Galaxy/S21/Purple/64GB,1,143693,143693,NEWYEAR25,107769.75,16165.4625,2023-02-11 00:00:00,Paid,Shipped,Bank Transfer,MasterCard,15581423448,Gan Su Sheng Yu Ying Xian Xiao Shan Guan Ling Jie N Zuo  156890
VR9D21UH5184730377351,Tian Jing,OnePlus/9/White/128GB,6,66717,400302,SPRING20,320241.60000000003,48036.240000000005,2023-02-11 00:00:00,Failed,Pending,Debit Card,Visa,13802686717,Shan Dong Sheng Ha Er Bin Shi Zi Chuan Nan Chang Lu G Zuo  858565
UM2TGC9D9184730377515,Li Li,Oppo/Reno5/Blue/64GB,9,136995,1232955,NEWYEAR25,924716.25,138707.4375,2023-02-11 00:00:00,Paid,Shipped,Credit Card,Alipay,18246354633,Hai Nan Sheng Wu Zhou Xian Jiang Bei Xiong Lu C Zuo  529650
C3X48J7F3184730377696,Chen Jun,Oppo/Reno5/Red/8GB,5,148156,740780,NEWYEAR25,555585.0,83337.75,2023-02-11 00:00:00,Paid,Shipped,Debit Card,WeChat Pay,15794874226,Xi Zang Zi Zhi Qu Liao Yang Shi Gao Ming Xi An Jie Z Zuo  606252
T2OGOU41F184730377870,Lu Jing,Galaxy/S21/Black/1TB,2,66110,132220,SUMMER15,112387.0,16858.05,2023-02-11 00:00:00,Failed,In Transit,PayPal,MasterCard,13391705721,Ning Xia Hui Zu Zi Zhi Qu Hong Mei Shi Men Tou Gou Ma Jie V Zuo  685295
MAHKA6OWZ184730378070,Chen Yu,Galaxy/S21/Red/1TB,3,134391,403173,WINTER10,362855.7,54428.355,2023-02-11 00:00:00,Paid,Pending,Debit Card,Alipay,13911570227,Jiang Xi Sheng Gui Rong Shi Ji Qu Zhao Jie I Zuo  321521
VKV3XHAYC184730378247,Xie Lan Ying,Xiaomi/Mi 11/Blue/32GB,8,141804,1134432,AUTUMN5,1077710.4,161656.55999999997,2023-02-11 00:00:00,Paid,Pending,Credit Card,PayPal,13093280874,Guang Xi Zhuang Zu Zi Zhi Qu Yan Xian Ji Zhou Shan Wei Jie X Zuo  273605
S0GDYF3QP184730378435,Jiang Jing,Vivo/X60/Purple/1TB,1,60514,60514,FESTIVE30,42359.799999999996,6353.969999999999,2023-02-11 00:00:00,Failed,In Transit,PayPal,Visa,15385048795,Si Chuan Sheng Dong Shi Ji Zhou Li Jie V Zuo  980970
KFP3FUE71184730378658,Lei Ting Ting,iPhone/13 Pro/Purple/64GB,1,71091,71091,SPRING20,56872.8,8530.92,2023-02-11 00:00:00,Failed,Pending,Bank Transfer,MasterCard,15233761911,Fu Jian Sheng Qian Jiang Shi Zhang Shou Hai Men Jie F Zuo  135840
8GBMX6H67184730378848,Jiang Bin,Galaxy/S21/Blue/254GB,4,141567,566268,AUTUMN5,537954.6,80693.18999999999,2023-02-11 00:00:00,Paid,Shipped,Bank Transfer,PayPal,13147595781,Tian Jin Shi La Sa Shi Nan Xi Zheng Zhou Lu Q Zuo  732362
MHWXGK147184730379033,Lin Ying,Galaxy/S21/Black/32GB,8,69375,555000,AUTUMN5,527250.0,79087.5,2023-02-11 00:00:00,Paid,Shipped,Debit Card,American Express,13684770535,Shan Xi Sheng La Sa Shi Wei Dou Dong Lu Y Zuo  293210
GIDKI3SHE184730379215,Qin Li,Galaxy/S21/Purple/8GB,5,110747,553735,WINTER10,498361.5,74754.22499999999,2023-02-11 00:00:00,Failed,Pending,Debit Card,Alipay,15844139072,Hei Long Jiang Sheng Xing An Meng Xian Nan Hu Shan Wei Jie V Zuo  109005
H98YOCLS8184730379395,Huang Qian,Xiaomi/Mi 11/Red/32GB,3,68642,205926,WINTER10,185333.4,27800.01,2023-02-11 00:00:00,Failed,In Transit,Debit Card,MasterCard,18683008729,He Nan Sheng Ting Xian Zhao Yang Lu An Jie V Zuo  314272
D46UJ79N0184730379557,Fu Rui,iPhone/13 Pro/White/64GB,6,120177,721062,SUMMER15,612902.7,91935.40499999998,2023-02-11 00:00:00,Failed,Shipped,Credit Card,Alipay,18851349400,Bei Jing Shi Huan Shi Long Tan Tian Jin Lu D Zuo  358316
OEGU6A5LF184730379717,Li Ling,Xiaomi/Mi 11/White/32GB,2,117868,235736,NEWYEAR25,176802.0,26520.3,2023-02-11 00:00:00,Paid,Delivered,Bank Transfer,American Express,15903919757,Hu Bei Sheng Ping Shi Shen He Chao Zhou Lu Z Zuo  628974
5K5M6Y9VN184730379876,Deng Gui Lan,Oppo/Reno5/Red/8GB,9,61010,549090,NEWYEAR25,411817.5,61772.625,2023-02-11 00:00:00,Failed,Delivered,Bank Transfer,Alipay,18129368107,Shan Xi Sheng Hang Zhou Shi Sha Shi Zhong Jie Z Zuo  586598
34R7F01ZD184730380059,Yang Nan,Oppo/Reno5/Red/32GB,6,96252,577512,AUTUMN5,548636.4,82295.46,2023-02-11 00:00:00,Failed,Delivered,Bank Transfer,Visa,13730734829,Shan Xi Sheng Hai Yan Xian Da Xing Cong Lu P Zuo  530714
OJS9AV8UY184730380237,Zhao Tao,Xiaomi/Mi 11/Blue/64GB,5,130010,650050,WINTER10,585045.0,87756.75,2023-02-11 00:00:00,Failed,In Transit,Credit Card,Alipay,18565988344,Shan Dong Sheng Shen Yang Shi Shuang Luan Da Ye Lu M Zuo  491347
3TXJ25ZQ2184730380402,Yan Yun,iPhone/13 Pro/Red/254GB,4,117798,471192,FESTIVE30,329834.39999999997,49475.159999999996,2023-02-11 00:00:00,Paid,Delivered,Debit Card,WeChat Pay,13015999627,Si Chuan Sheng Xiao Hong Xian An Ci Zhang Lu U Zuo  713682
R5WCOZ785184730380576,Cai Jing,Galaxy/S21/White/64GB,10,130270,1302700,SPRING20,1042160.0,156324.0,2023-02-11 00:00:00,Paid,Pending,Bank Transfer,WeChat Pay,14588509760,Tai Wan Sheng Xiu Zhen Shi Gao Gang Ji Nan Jie F Zuo  888831
L282XJLAV184730380740,Luo Min,Oppo/Reno5/Red/254GB,6,68592,411552,AUTUMN5,390974.39999999997,58646.159999999996,2023-02-11 00:00:00,Paid,In Transit,Credit Card,PayPal,13875605522,Xin Jiang Wei Wu Er Zi Zhi Qu Shen Zhen Xian Da Dong Gui Yang Jie O Zuo  236606
2Q2HEFKOR184730380925,Dai Dong Mei,Xiaomi/Mi 11/Black/128GB,4,95742,382968,AUTUMN5,363819.6,54572.939999999995,2023-02-11 00:00:00,Failed,Delivered,Credit Card,WeChat Pay,15687813151,He Bei Sheng Xin Shi Shan Ting Liao Yang Lu N Zuo  762889
Z1CQVTF25184730381090,Shi Lei,Galaxy/S21/Purple/8GB,1,97546,97546,SUMMER15,82914.09999999999,12437.114999999998,2023-02-11 00:00:00,Pending,Shipped,PayPal,Alipay,13715168825,Zhe Jiang Sheng Lu An Xian Zhang Shou Guang Zhou Lu A Zuo  115806
DFBYTBBHS184730381254,Wen Ping,Oppo/Reno5/Red/128GB,2,129688,259376,SPRING20,207500.80000000002,31125.120000000003,2023-02-11 00:00:00,Pending,Pending,Credit Card,Alipay,18028581702,Ao Men Te Bie Xing Zheng Qu Gui Yang Shi Shan Ting Duan Jie L Zuo  803181
F7X32Z42B184730381457,Zhang Jie,Vivo/X60/Red/8GB,6,66660,399960,SUMMER15,339966.0,50994.9,2023-02-11 00:00:00,Failed,Pending,PayPal,American Express,15382086145,Hu Nan Sheng Wu Lu Mu Qi Xian Long Tan Zhu Jie T Zuo  603517
PX46ELP9C184730381651,Zhang Yu Mei,Galaxy/S21/Purple/8GB,10,94318,943180,NEWYEAR25,707385.0,106107.75,2023-02-11 00:00:00,Failed,In Transit,Bank Transfer,Alipay,18711665264,Ao Men Te Bie Xing Zheng Qu Nan Ning Shi Ji Qu Ji Jie O Zuo  985130
KVTX6M0BY184730381862,Ye Xiu Lan,iPhone/13/Blue/64GB,9,75706,681354,NEWYEAR25,511015.5,76652.325,2023-02-11 00:00:00,Pending,Shipped,Bank Transfer,PayPal,13344176125,Zhe Jiang Sheng Ming Shi Gao Ping Zhang Jie M Zuo  752737
1RK3QTRZC184730382039,Gong Li,Oppo/Reno5/White/1TB,1,128367,128367,NEWYEAR25,96275.25,14441.2875,2023-02-11 00:00:00,Failed,Pending,PayPal,WeChat Pay,18142909876,Ji Lin Sheng Lei Shi Xin Cheng La Sa Jie O Zuo  627700
M5BQDQHXG184730382199,Su Na,Vivo/X60/Blue/64GB,4,127057,508228,NEWYEAR25,381171.0,57175.65,2023-02-11 00:00:00,Paid,In Transit,Bank Transfer,American Express,13131834700,Shan Dong Sheng Ning Xian Zhang Shou Wei Jie F Zuo  570234
R61B656KC184730382371,Wang Jie,Huawei/P40/Blue/254GB,10,92840,928400,NEWYEAR25,696300.0,104445.0,2023-02-11 00:00:00,Paid,Pending,PayPal,Alipay,13636140966,He Bei Sheng Qian Xian Qing Cheng Meng Lu C Zuo  294912
FZCBPHCP7184730382545,Liu Hai Yan,Oppo/Reno5/Black/1TB,5,105075,525375,SPRING20,420300.0,63045.0,2023-02-11 00:00:00,Paid,Pending,Credit Card,WeChat Pay,18939852886,Guang Xi Zhuang Zu Zi Zhi Qu Gui Hua Shi Ji Zhou Zhang Sha Jie R Zuo  847061
53I0DQXPH184730382755,Zhang Wei,Vivo/X60/Red/32GB,7,68655,480585,SPRING20,384468.0,57670.2,2023-02-11 00:00:00,Paid,In Transit,Credit Card,Alipay,15701773513,Shan Dong Sheng Yu Hua Xian Xiu Ying Zhang Jia Gang Lu Z Zuo  370709
QLXOO1BB2184730382949,Zhang Jie,Oppo/Reno5/Purple/64GB,7,101810,712670,SUMMER15,605769.5,90865.425,2023-02-11 00:00:00,Paid,Shipped,Debit Card,WeChat Pay,18859479607,He Bei Sheng Chong Qing Shi Nan Hu Nan Ning Lu W Zuo  425206
G8REZT8Q2184730383113,Chang Liu,Xiaomi/Mi 11/Red/64GB,10,110475,1104750,FESTIVE30,773325.0,115998.75,2023-02-11 00:00:00,Pending,Delivered,Bank Transfer,Visa,15982138898,Tian Jin Shi Wu Lu Mu Qi Xian Qing Cheng Lin Jie T Zuo  624667
89SC549P0184730383295,Lin Yu Zhen,iPhone/13/Purple/64GB,8,113301,906408,SUMMER15,770446.7999999999,115567.01999999999,2023-02-11 00:00:00,Pending,Pending,PayPal,WeChat Pay,14771269719,Ao Men Te Bie Xing Zheng Qu Lin Xian Xin Cheng Wei Lu Z Zuo  352100
F1QUM3QEC184730383487,Liu Li,iPhone/13 Pro/Blue/32GB,2,118712,237424,SPRING20,189939.2,28490.88,2023-02-11 00:00:00,Pending,Pending,Debit Card,Alipay,13094066312,Jiang Su Sheng Ma An Shan Xian Yong Chuan Li Lu M Zuo  832844
CC8NSXSKK184730383672,Li Hong,Galaxy/S21/Red/1TB,4,136722,546888,WINTER10,492199.2,73829.88,2023-02-11 00:00:00,Failed,Delivered,Credit Card,PayPal,14562303917,He Nan Sheng Nan Jing Xian Fu Cheng Li Lu I Zuo  721304
INYO35TID184730383850,Wang Jing,Galaxy/S21/Blue/1TB,3,67791,203373,WINTER10,183035.7,27455.355,2023-02-11 00:00:00,Paid,In Transit,Bank Transfer,MasterCard,15584557642,An Hui Sheng Xi Ning Shi Feng Dou Zhou Lu G Zuo  133800
CX7EVSR22184730384032,Ren Rong,OnePlus/9/White/254GB,4,87782,351128,AUTUMN5,333571.6,50035.74,2023-02-11 00:00:00,Failed,Pending,PayPal,MasterCard,15584697322,Qing Hai Sheng Xiang Gang Xian Shang Jie Shang Jie B Zuo  544208
6WOH5KUJ4184730384215,Shao Jie,iPhone/13 Pro/Red/128GB,5,114007,570035,NEWYEAR25,427526.25,64128.9375,2023-02-11 00:00:00,Failed,In Transit,Credit Card,American Express,18638816900,Xi Zang Zi Zhi Qu Yu Ying Xian Xiu Ying Qian Jiang Lu I Zuo  427775
455VI573J184730384391,Ma Liang,Vivo/X60/Red/8GB,10,85718,857180,SUMMER15,728603.0,109290.45,2023-02-11 00:00:00,Failed,Shipped,Bank Transfer,Alipay,14762398723,Hu Nan Sheng Dong Mei Shi Gao Ping Xi Ning Lu F Zuo  543132
2XIL0M7OY184730384555,Lin Ning,iPhone/13 Pro/Blue/64GB,3,103330,309990,AUTUMN5,294490.5,44173.575,2023-02-11 00:00:00,Pending,Delivered,Debit Card,Visa,18691896746,Shan Dong Sheng Shu Hua Xian Ji Zhou Chen Lu X Zuo  830427
USI9ZNUPX184730384731,Liu Xin,Vivo/X60/Black/128GB,10,126652,1266520,SPRING20,1013216.0,151982.4,2023-02-11 00:00:00,Pending,Shipped,Credit Card,American Express,13488035365,He Bei Sheng Jin Feng Xian Yong Chuan Liang Jie H Zuo  948158
RCSPIMJOU184730384901,Liu Yu Ying,Oppo/Reno5/White/254GB,3,89497,268491,SPRING20,214792.80000000002,32218.920000000002,2023-02-11 00:00:00,Pending,Pending,Credit Card,WeChat Pay,14567592372,Chong Qing Shi Jun Xian Hua Xi Sun Lu R Zuo  463949
XE2IR2KTU184730385068,Zhou Jie,OnePlus/9/White/1TB,2,53362,106724,NEWYEAR25,80043.0,12006.449999999999,2023-02-11 00:00:00,Paid,Shipped,PayPal,American Express,13064351929,Liao Ning Sheng Gui Rong Xian Xiang An Shen Yang Jie L Zuo  559222
O19LKMUOG184730385223,Jia Liu,Xiaomi/Mi 11/Red/1TB,1,108875,108875,SPRING20,87100.0,13065.0,2023-02-11 00:00:00,Failed,Shipped,Debit Card,Alipay,13066650384,Tian Jin Shi Xing Cheng Xian Xiao Shan Yong An Jie G Zuo  466835
FAE0U9XI4184730385385,Wu Li,iPhone/13 Pro/White/64GB,5,62720,313600,SPRING20,250880.0,37632.0,2023-02-11 00:00:00,Paid,Delivered,Debit Card,Alipay,13333008667,Tian Jin Shi Jian Shi Xun Yang Ha Er Bin Lu U Zuo  837180
2V1RM0MAL184730385541,Jiang Ying,iPhone/13/Purple/128GB,2,91170,182340,WINTER10,164106.0,24615.899999999998,2023-02-11 00:00:00,Pending,Shipped,PayPal,Alipay,13417361503,Shan Xi Sheng Wu Han Xian Sha Wan Ren Lu V Zuo  459930
IVYUXRQM8184730385709,Liu Bin,Galaxy/S21/White/32GB,9,125282,1127538,FESTIVE30,789276.6,118391.48999999999,2023-02-11 00:00:00,Paid,Delivered,Bank Transfer,American Express,15174009167,Xiang Gang Te Bie Xing Zheng Qu Shu Ying Shi Hai Ling Wang Lu F Zuo  925063
