Order ID,Customer Name,Mobile Model,Quantity,Price per Unit,Total Price,Promotion Code,Order Amount,GST,Order Date,Payment Status,Shipping Status,Payment Method,Payment Provider,Mobile,Delivery Address
MZ09Z848U184750933586,Hu Liang,Galaxy/S21/Blue/8GB,7,117607,823249,SPRING20,658599.2000000001,98789.88,2023-07-25 00:00:00,Pending,Pending,Bank Transfer,American Express,15093882284,Shang Hai Shi Chong Qing Xian Hai Ling Tai Yuan Lu Z Zuo  988774
0VWBGUU55184750933775,Ma Ping,Oppo/Reno5/Blue/254GB,9,64674,582066,NEWYEAR25,436549.5,65482.424999999996,2023-07-25 00:00:00,Pending,Shipped,Bank Transfer,PayPal,13129547296,Jiang Xi Sheng Li Juan Shi Xiu Ying Hu He Hao Te Jie N Zuo  957822
4ZLMG6ADA184750933955,Gao Feng Ying,Oppo/Reno5/Blue/32GB,6,77645,465870,SPRING20,372696.0,55904.4,2023-07-25 00:00:00,Paid,Shipped,Credit Card,PayPal,18685475253,He Nan Sheng Xin Ji Xian Xi Shan Fan Lu E Zuo  198810
NRWSNIJGN184750934147,Chai Bo,OnePlus/9/Black/1TB,1,74220,74220,AUTUMN5,70509.0,10576.35,2023-07-25 00:00:00,Pending,Delivered,Credit Card,MasterCard,18604649821,Qing Hai Sheng Jian Hua Shi Liu Zhi Te Xin Ji Jie A Zuo  150214
2TDB4G5KL184750934323,Chen Zhi Qiang,Galaxy/S21/Blue/128GB,1,50633,50633,SUMMER15,43038.049999999996,6455.7074999999995,2023-07-25 00:00:00,Failed,In Transit,Debit Card,WeChat Pay,18004307434,Hei Long Jiang Sheng Xiang Xian Feng Dou Ha Er Bin Lu Y Zuo  581083
MYV6B98IU184750934503,Wang Ming,Xiaomi/Mi 11/Red/64GB,8,109834,878672,SUMMER15,746871.2,112030.68,2023-07-25 00:00:00,Paid,Delivered,PayPal,American Express,13491562482,An Hui Sheng Shan Wei Xian Da Dong Yang Jie B Zuo  423957
XQSUD7MFF184750934679,Shang Jin Feng,Huawei/P40/Black/128GB,2,86033,172066,SPRING20,137652.80000000002,20647.920000000002,2023-07-25 00:00:00,Pending,Delivered,Bank Transfer,Visa,13016539983,Jiang Su Sheng Nan Jing Shi Qing Cheng Deng Jie S Zuo  695483
523D1MZ6N184750934861,Gan Jian Guo,iPhone/13 Pro/Black/128GB,4,101436,405744,AUTUMN5,385456.8,57818.52,2023-07-25 00:00:00,Failed,Pending,Debit Card,PayPal,18868325939,Shan Xi Sheng Nan Chang Xian Xi Shan Huang Jie B Zuo  101163
4GA9155A9184750935043,Zhao Huan,Galaxy/S21/Red/8GB,5,75228,376140,AUTUMN5,357333.0,53599.95,2023-07-25 00:00:00,Failed,Pending,Bank Transfer,Alipay,14562705576,Shang Hai Shi La Sa Shi Xiu Ying Xie Jie X Zuo  977679
TXZ67B5MY184750935220,Mu Xiu Fang,Oppo/Reno5/White/8GB,10,64691,646910,SUMMER15,549873.5,82481.025,2023-07-25 00:00:00,Pending,Delivered,Debit Card,American Express,13206372767,Shan Xi Sheng Hao Shi Jin Ping Da Ye Jie S Zuo  758713
VBJVMYHP2184750935388,Chang Yan,iPhone/13 Pro/Black/254GB,4,106144,424576,AUTUMN5,403347.19999999995,60502.07999999999,2023-07-25 00:00:00,Pending,Shipped,Debit Card,Alipay,15554669045,An Hui Sheng Feng Lan Xian Bi Shan Lin Jie K Zuo  342459
9WSJAQ217184750935565,Jia Ning,iPhone/13/Red/254GB,9,134257,1208313,FESTIVE30,845819.1,126872.86499999999,2023-07-25 00:00:00,Pending,In Transit,Bank Transfer,Visa,18950573306,He Nan Sheng Xiao Hong Shi Shang Jie Shang Hai Lu S Zuo  291445
C0FHIQBG1184750935731,Xu Xiu Ying,Huawei/P40/Red/8GB,10,123958,1239580,AUTUMN5,1177601.0,176640.15,2023-07-25 00:00:00,Pending,Pending,Credit Card,Visa,18094921756,Ning Xia Hui Zu Zi Zhi Qu Jie Xian Bai Yun Shen Yang Lu U Zuo  584601
EW0ZXM81Q184750935920,Wang Yu,iPhone/13 Pro/Purple/8GB,2,107115,214230,SUMMER15,182095.5,27314.325,2023-07-25 00:00:00,Paid,Pending,Credit Card,American Express,15611505292,Jiang Xi Sheng Yu Mei Xian Gao Gang Lu Jie C Zuo  360573
YH2DZD9Q0184750936098,Li Gui Zhen,Oppo/Reno5/Blue/254GB,4,85368,341472,NEWYEAR25,256104.0,38415.6,2023-07-25 00:00:00,Pending,Delivered,Credit Card,Visa,15061835385,Yun Nan Sheng Guan Ling Xian Gao Gang Shen Yang Jie V Zuo  260325
XC963M3LW184750936266,Guo Hong,Huawei/P40/Blue/1TB,7,140217,981519,NEWYEAR25,736139.25,110420.8875,2023-07-25 00:00:00,Failed,Shipped,Bank Transfer,MasterCard,13769759676,Xin Jiang Wei Wu Er Zi Zhi Qu Ting Shi Zhao Yang Yang Lu R Zuo  651436
C9U1NJW6Q184750936455,Zhang Li Juan,Galaxy/S21/Blue/32GB,8,141398,1131184,WINTER10,1018065.6,152709.84,2023-07-25 00:00:00,Failed,In Transit,Debit Card,MasterCard,13971437779,Ao Men Te Bie Xing Zheng Qu Chang Chun Xian Cheng Dong Luo Lu Q Zuo  761508
F972F2KMZ184750936655,Chen Xin,iPhone/13 Pro/Black/8GB,2,58762,117524,SPRING20,94019.20000000001,14102.880000000001,2023-07-25 00:00:00,Paid,In Transit,PayPal,American Express,14738412997,Guang Dong Sheng Cheng Shi Xin Cheng Shen Yang Jie R Zuo  667613
M8IX7ZKS8184750936814,Li Chen,Oppo/Reno5/White/8GB,8,117445,939560,SPRING20,751648.0,112747.2,2023-07-25 00:00:00,Paid,In Transit,PayPal,PayPal,15148441162,Si Chuan Sheng He Shan Shi Yong Chuan He Fei Lu E Zuo  913010
JCJ4YKFXD184750936979,Bai Hong Xia,Huawei/P40/Red/254GB,4,92064,368256,FESTIVE30,257779.19999999998,38666.88,2023-07-25 00:00:00,Pending,Shipped,Debit Card,MasterCard,14779423840,Fu Jian Sheng Chao Hu Shi Bai Yun Hu He Hao Te Lu K Zuo  399702
9D9LIT6IN184750937158,Geng Liang,OnePlus/9/Red/32GB,8,137123,1096984,AUTUMN5,1042134.7999999999,156320.21999999997,2023-07-25 00:00:00,Failed,Delivered,Debit Card,MasterCard,15995487550,Shan Dong Sheng Nan Ning Xian Liu Zhi Te Ji Nan Lu M Zuo  371102
QR19WPRCG184750937330,Liang Li,Oppo/Reno5/Red/128GB,7,87491,612437,FESTIVE30,428705.89999999997,64305.884999999995,2023-07-25 00:00:00,Failed,Delivered,Credit Card,Visa,18786823613,Fu Jian Sheng Qi Qi Ha Er Xian Huang Pu Fo Shan Lu J Zuo  566872
NZ75S8F0Y184750937512,Chen Dan Dan,Huawei/P40/Red/32GB,8,131098,1048784,WINTER10,943905.6,141585.84,2023-07-25 00:00:00,Pending,Delivered,PayPal,MasterCard,13833634007,Gan Su Sheng Wen Shi Ji Qu Ji Nan Jie E Zuo  888489
JF5IIZL5X184750937675,Xiao Wen,iPhone/13 Pro/Purple/32GB,4,120512,482048,SUMMER15,409740.8,61461.119999999995,2023-07-25 00:00:00,Pending,Pending,Credit Card,American Express,18242293604,Hu Bei Sheng Li Juan Xian Gao Gang Cao Jie G Zuo  972723
5VBLGH2Q6184750937850,Ruan Hong Xia,iPhone/13 Pro/Red/32GB,6,72608,435648,SUMMER15,370300.8,55545.119999999995,2023-07-25 00:00:00,Paid,Pending,Bank Transfer,PayPal,15715886109,He Bei Sheng Tao Xian Bi Shan Ji Jie Y Zuo  584036
YBLGW44AU184750938026,Zhou Yan,Xiaomi/Mi 11/Red/254GB,5,128539,642695,WINTER10,578425.5,86763.825,2023-07-25 00:00:00,Pending,Shipped,Bank Transfer,Alipay,15963763371,Xiang Gang Te Bie Xing Zheng Qu Ying Shi An Ci Jia Lu L Zuo  995405
JK2I8AVC6184750938213,Liang Gui Zhen,Galaxy/S21/White/64GB,2,129402,258804,SUMMER15,219983.4,32997.509999999995,2023-07-25 00:00:00,Paid,Delivered,Debit Card,Alipay,18629877812,Qing Hai Sheng Feng Ying Shi Xiang An Wang Jie E Zuo  688961
17HV29T7I184750938387,Yang Yu Hua,iPhone/13 Pro/Blue/1TB,7,54770,383390,SUMMER15,325881.5,48882.225,2023-07-25 00:00:00,Pending,In Transit,Bank Transfer,Visa,18075826503,Ao Men Te Bie Xing Zheng Qu Xiang Xian Hua Xi Shi Jia Zhuang Jie U Zuo  569355
YPOOT6X7F184750938574,Song Xiu Fang,Oppo/Reno5/Blue/254GB,3,105124,315372,FESTIVE30,220760.4,33114.06,2023-07-25 00:00:00,Pending,Shipped,Credit Card,Visa,15313821373,Nei Meng Gu Zi Zhi Qu Hui Zhou Shi Bin Cheng Wang Jie N Zuo  826227
XLKVHLY84184750938771,Shi Xiu Fang,Huawei/P40/Blue/64GB,3,129079,387237,WINTER10,348513.3,52276.994999999995,2023-07-25 00:00:00,Paid,In Transit,Debit Card,PayPal,15973759295,Xiang Gang Te Bie Xing Zheng Qu Gang Shi Bi Shan Wan Jie D Zuo  900417
TYF9S1JW7184750938967,Sun Juan,Huawei/P40/Black/128GB,1,134621,134621,FESTIVE30,94234.7,14135.205,2023-07-25 00:00:00,Pending,Pending,PayPal,Alipay,13269509980,Zhe Jiang Sheng Kun Ming Xian Liang Ping Zhang Jie Y Zuo  814894
VDLONG9Z7184750939139,Sun Jie,iPhone/13 Pro/White/32GB,7,112010,784070,WINTER10,705663.0,105849.45,2023-07-25 00:00:00,Paid,Shipped,Credit Card,WeChat Pay,18045715566,Shan Dong Sheng Hong Mei Shi Long Tan Sang Lu U Zuo  838507
EZ5EREQGA184750939309,Luo Juan,Xiaomi/Mi 11/Purple/1TB,8,86229,689832,NEWYEAR25,517374.0,77606.09999999999,2023-07-25 00:00:00,Pending,Delivered,PayPal,PayPal,18928226619,Nei Meng Gu Zi Zhi Qu Wu Lu Mu Qi Xian An Ci Liu Pan Shui Lu K Zuo  533426
400Q1GFW6184750939497,Wang Yu,Galaxy/S21/Blue/254GB,2,123639,247278,FESTIVE30,173094.59999999998,25964.189999999995,2023-07-25 00:00:00,Paid,In Transit,Debit Card,PayPal,18752191408,Shang Hai Shi Nan Xian Xi Shan Xing Cheng Jie V Zuo  725998
3KMA2M8HS184750939658,Xiang Hai Yan,Huawei/P40/Blue/1TB,9,140346,1263114,FESTIVE30,884179.7999999999,132626.96999999997,2023-07-25 00:00:00,Paid,Pending,Debit Card,WeChat Pay,13941886899,Chong Qing Shi Yan Xian Jiang Bei Xing An Meng Lu A Zuo  889978
S9BYY0O9Y184750939828,Gao Liang,iPhone/13/Purple/128GB,7,107631,753417,SPRING20,602733.6,90410.04,2023-07-25 00:00:00,Failed,In Transit,Credit Card,Alipay,13684069438,Tian Jin Shi La Sa Shi Xiang An Chong Qing Lu S Zuo  237358
KBUE1PLOJ184750939997,Wu Jian Guo,Xiaomi/Mi 11/Blue/128GB,5,116243,581215,SPRING20,464972.0,69745.8,2023-07-25 00:00:00,Failed,In Transit,Credit Card,MasterCard,13759034305,Zhe Jiang Sheng Yan Shi Da Xing La Sa Lu R Zuo  796947
X0DPXCOZJ184750940162,Wang Xiu Rong,Vivo/X60/White/8GB,8,85324,682592,WINTER10,614332.8,92149.92,2023-07-25 00:00:00,Paid,Delivered,Credit Card,American Express,14551439295,Tai Wan Sheng Wu Lu Mu Qi Shi Shuang Luan Jia He Jie N Zuo  319867
KC7ZME34V184750940337,Wang Peng,iPhone/13/Red/1TB,4,91924,367696,SUMMER15,312541.6,46881.24,2023-07-25 00:00:00,Failed,Shipped,Bank Transfer,American Express,14563193316,Si Chuan Sheng Ping Xian Xi Feng Gao Jie G Zuo  759969
6P1YMDRAJ184750940505,Zhong Jian,iPhone/13 Pro/White/8GB,6,98285,589710,WINTER10,530739.0,79610.84999999999,2023-07-25 00:00:00,Failed,In Transit,Credit Card,WeChat Pay,18613280586,Guang Dong Sheng Lei Shi Fu Cheng Li Lu E Zuo  377578
1DDJBAKCP184750940675,Zhang Jia,iPhone/13/Purple/254GB,9,63634,572706,SUMMER15,486800.1,73020.015,2023-07-25 00:00:00,Pending,In Transit,Credit Card,MasterCard,15396381992,An Hui Sheng Xue Xian Sha Wan Huang Lu Y Zuo  462364
W1KHT7Y95184750940848,Hu Long,Huawei/P40/Blue/8GB,5,110635,553175,WINTER10,497857.5,74678.625,2023-07-25 00:00:00,Paid,Delivered,PayPal,Visa,15032747284,He Nan Sheng Yan Xian Jiang Bei Gao Jie M Zuo  158639
YC1VRCK8O184750941017,Guo Dan,Oppo/Reno5/Red/32GB,10,143971,1439710,NEWYEAR25,1079782.5,161967.375,2023-07-25 00:00:00,Paid,Pending,Credit Card,Visa,14544319489,Fu Jian Sheng Xin Shi Gao Ming Nan Jing Jie J Zuo  705651
5HVY3C0AL184750941178,Qiu Huan,iPhone/13/Purple/32GB,4,147054,588216,WINTER10,529394.4,79409.16,2023-07-25 00:00:00,Pending,Shipped,PayPal,Visa,13053206162,Shan Xi Sheng Gui Lan Xian Fang Shan Ma An Shan Lu Y Zuo  430376
YNG5D0SVP184750941349,Fang Jie,Xiaomi/Mi 11/White/8GB,1,104754,104754,SPRING20,83803.20000000001,12570.480000000001,2023-07-25 00:00:00,Pending,Delivered,Debit Card,American Express,13773362341,Hu Bei Sheng Lin Shi Ji Zhou Liu Lu B Zuo  686049
6ZGS3DUH0184750941520,Li Yong,Xiaomi/Mi 11/Purple/1TB,5,94264,471320,AUTUMN5,447754.0,67163.09999999999,2023-07-25 00:00:00,Pending,Shipped,Credit Card,American Express,15084227737,Jiang Su Sheng Jun Shi Jin Ping Yang Lu W Zuo  465450
R3ZN6V8T7184750941691,Yan Tao,Oppo/Reno5/Blue/8GB,9,73230,659070,SUMMER15,560209.5,84031.425,2023-07-25 00:00:00,Paid,Pending,Debit Card,MasterCard,14587221614,Si Chuan Sheng Fu Zhou Xian Huai Rou Hu He Hao Te Jie T Zuo  322137
UQ2SJ3W96184750941862,Hong Yu Hua,Galaxy/S21/Blue/1TB,8,55933,447464,AUTUMN5,425090.8,63763.619999999995,2023-07-25 00:00:00,Paid,In Transit,Bank Transfer,Alipay,15115112139,Ji Lin Sheng Shan Wei Shi Xin Cheng Qi Qi Ha Er Lu Q Zuo  888176
GHB4BFQLU184750942083,Sun Kun,iPhone/13/White/128GB,8,82341,658728,AUTUMN5,625791.6,93868.73999999999,2023-07-25 00:00:00,Failed,In Transit,Bank Transfer,WeChat Pay,15236664035,Nei Meng Gu Zi Zhi Qu Xue Xian Zi Chuan Guang Zhou Jie R Zuo  432687
6CBSOFEG0184750942281,Jia Qin,iPhone/13 Pro/Red/32GB,6,98051,588306,NEWYEAR25,441229.5,66184.425,2023-07-25 00:00:00,Paid,In Transit,Credit Card,PayPal,15630981828,Hu Bei Sheng Bei Jing Shi Huang Pu Ji Nan Jie P Zuo  928661
CLF0T6SF5184750942454,Chen Li Hua,Xiaomi/Mi 11/Purple/1TB,10,131304,1313040,AUTUMN5,1247388.0,187108.19999999998,2023-07-25 00:00:00,Pending,Pending,PayPal,PayPal,15727124975,Liao Ning Sheng Wu Lu Mu Qi Xian Shen Bei Xin Ceng Jie V Zuo  393821
UJNL7G33Y184750942655,Jin Li,OnePlus/9/Purple/32GB,8,110109,880872,WINTER10,792784.8,118917.72,2023-07-25 00:00:00,Paid,In Transit,PayPal,MasterCard,18081282693,Gan Su Sheng Chao Hu Shi Nan Zhang Zuo Lu Y Zuo  376071
YXKBG4I8E184750942831,Zhang Shuai,Huawei/P40/Blue/1TB,9,58441,525969,WINTER10,473372.10000000003,71005.815,2023-07-25 00:00:00,Paid,Delivered,PayPal,WeChat Pay,15247688091,Shan Xi Sheng Zhang Sha Xian Nan Xi Li Lu X Zuo  504372
0E3C4C3CK184750943008,Wang Yu,iPhone/13/Red/128GB,10,113636,1136360,FESTIVE30,795452.0,119317.79999999999,2023-07-25 00:00:00,Pending,In Transit,Debit Card,PayPal,15619452266,Xiang Gang Te Bie Xing Zheng Qu Zhang Jia Gang Shi Huai Rou Li Lu M Zuo  944577
CMNH6NSL0184750943214,Li Rong,iPhone/13/Blue/1TB,7,94642,662494,SUMMER15,563119.9,84467.985,2023-07-25 00:00:00,Paid,In Transit,Bank Transfer,MasterCard,18804663762,Ning Xia Hui Zu Zi Zhi Qu Hai Kou Shi Cheng Bei Zhao Lu C Zuo  143289
JEFKRRJDS184750943413,Zhu Hui,Vivo/X60/Purple/128GB,6,123951,743706,SUMMER15,632150.1,94822.515,2023-07-25 00:00:00,Pending,Delivered,Debit Card,Alipay,13259217758,Guang Xi Zhuang Zu Zi Zhi Qu Xiang Gang Shi Bin Cheng Bei Jing Lu O Zuo  725753
N4EUB7ULG184750943601,Huang Li,Oppo/Reno5/Red/64GB,9,89422,804798,SPRING20,643838.4,96575.76,2023-07-25 00:00:00,Failed,Delivered,Bank Transfer,Visa,18967775627,He Bei Sheng Feng Lan Shi Gao Ming Hu He Hao Te Lu S Zuo  298226
FWV552X0D184750943774,Wang Hui,Huawei/P40/White/64GB,8,81948,655584,FESTIVE30,458908.8,68836.31999999999,2023-07-25 00:00:00,Failed,Shipped,Debit Card,American Express,13029529173,Shan Dong Sheng Jing Xian Min Xing Xin Ji Lu Y Zuo  724661
RJQHK41GZ184750943935,Duan Jun,Vivo/X60/Red/32GB,3,74517,223551,AUTUMN5,212373.44999999998,31856.017499999994,2023-07-25 00:00:00,Failed,Pending,Credit Card,PayPal,15773866612,Gui Zhou Sheng Yang Xian Xiu Ying Lu An Lu E Zuo  785873
ZN5MEHBOP184750944096,Liu Qin,iPhone/13/Red/64GB,5,61918,309590,NEWYEAR25,232192.5,34828.875,2023-07-25 00:00:00,Paid,Shipped,Credit Card,PayPal,14722516264,Ao Men Te Bie Xing Zheng Qu Yang Xian Jing An Chu Jie T Zuo  602910
T6K8QJG77184750944288,Guo Jie,Xiaomi/Mi 11/Black/64GB,7,105353,737471,WINTER10,663723.9,99558.585,2023-07-25 00:00:00,Pending,In Transit,Bank Transfer,Visa,15772399314,An Hui Sheng Li Hua Xian Shang Jie Xiang Lu M Zuo  308749
HIWYSPMAR184750944464,Zhang Yang,iPhone/13/Blue/1TB,8,95354,762832,FESTIVE30,533982.4,80097.36,2023-07-25 00:00:00,Failed,Shipped,PayPal,MasterCard,18852217071,Ao Men Te Bie Xing Zheng Qu Tai Yuan Shi Xiao Shan Tao Jie R Zuo  785486
85NS1XBJE184750944662,Duan Xiu Hua,Xiaomi/Mi 11/White/64GB,1,106478,106478,SPRING20,85182.40000000001,12777.36,2023-07-25 00:00:00,Failed,Shipped,Debit Card,MasterCard,13287812596,Shan Xi Sheng Xi Ning Xian Xi Xia Lu An Jie T Zuo  148205
SIJSXGFLI184750944847,Zhang Xue,Huawei/P40/Black/128GB,1,50326,50326,SUMMER15,42777.1,6416.565,2023-07-25 00:00:00,Failed,In Transit,PayPal,PayPal,18117195406,Gui Zhou Sheng Rong Shi Xiao Nan Zhang Lu C Zuo  649192
T5HZUNHKQ184750945024,Dong Dan Dan,OnePlus/9/Black/32GB,10,123133,1231330,SUMMER15,1046630.5,156994.57499999998,2023-07-25 00:00:00,Paid,Delivered,Debit Card,Visa,13792919624,Jiang Su Sheng Yong Shi Fu Cheng Xiong Lu O Zuo  713949
5ZTMHRIHM184750945214,Zhang Hua,Huawei/P40/Red/64GB,2,144358,288716,WINTER10,259844.4,38976.659999999996,2023-07-25 00:00:00,Pending,Shipped,Bank Transfer,MasterCard,15918822122,Hei Long Jiang Sheng Wu Zhou Xian Cheng Dong Li Lu S Zuo  386766
X7IF5JMSC184750945405,Deng Qin,Xiaomi/Mi 11/White/32GB,5,143511,717555,FESTIVE30,502288.49999999994,75343.275,2023-07-25 00:00:00,Failed,In Transit,Debit Card,PayPal,14557570769,Chong Qing Shi Tai Bei Xian Dong Li Chen Lu C Zuo  482440
12E5KEJGS184750945585,Huang Gui Zhen,Oppo/Reno5/Black/8GB,10,80940,809400,SPRING20,647520.0,97128.0,2023-07-25 00:00:00,Paid,Pending,Credit Card,MasterCard,15303280876,Xiang Gang Te Bie Xing Zheng Qu Wu Lu Mu Qi Shi Hua Xi Zhang Jie J Zuo  461943
GVY60QW3Q184750945798,Liu Li Li,Xiaomi/Mi 11/Blue/32GB,7,135215,946505,AUTUMN5,899179.75,134876.9625,2023-07-25 00:00:00,Paid,Pending,Bank Transfer,WeChat Pay,18839754031,Gan Su Sheng Bo Xian Dong Li Lu Jie B Zuo  161513
I8UHSKUEJ184750945969,Yu Ting,Oppo/Reno5/White/1TB,9,65901,593109,NEWYEAR25,444831.75,66724.7625,2023-07-25 00:00:00,Paid,Shipped,PayPal,PayPal,15690230068,Chong Qing Shi Qian Jiang Xian Zhang Shou Yang Jie J Zuo  376396
Q3PIDQB7J184750946145,Fan Yang,Oppo/Reno5/Red/8GB,1,131103,131103,SPRING20,104882.40000000001,15732.36,2023-07-25 00:00:00,Failed,Delivered,PayPal,WeChat Pay,18654669430,Tian Jin Shi Hua Shi Bi Shan Liao Lu W Zuo  904697
N0W43NSGP184750946314,Han Chen,iPhone/13 Pro/Red/1TB,9,128784,1159056,SUMMER15,985197.6,147779.63999999998,2023-07-25 00:00:00,Paid,In Transit,Debit Card,MasterCard,13412919933,Hu Nan Sheng Yang Xian Hai Ling Li Lu L Zuo  440011
4TR321JKR184750946480,Xiang Xiu Rong,iPhone/13 Pro/Red/1TB,5,112100,560500,FESTIVE30,392350.0,58852.5,2023-07-25 00:00:00,Failed,Shipped,Credit Card,American Express,13829289210,Xi Zang Zi Zhi Qu Wei Xian He Ping He Jie P Zuo  987956
7HK31G1BV184750946662,Hu Hui,Galaxy/S21/Purple/254GB,10,62553,625530,SPRING20,500424.0,75063.59999999999,2023-07-25 00:00:00,Pending,Pending,Credit Card,PayPal,15005775541,He Nan Sheng Wei Shi He Chuan Deng Lu L Zuo  393019
GKSRYBCC3184750946828,Zhang Ling,iPhone/13 Pro/White/128GB,4,142733,570932,FESTIVE30,399652.39999999997,59947.85999999999,2023-07-25 00:00:00,Pending,In Transit,Bank Transfer,MasterCard,13802464018,Jiang Su Sheng Xing Cheng Shi Bi Shan Ha Er Bin Jie G Zuo  886930
QNVXT99LE184750946990,Fu Li Hua,Vivo/X60/Blue/254GB,9,96364,867276,SPRING20,693820.8,104073.12000000001,2023-07-25 00:00:00,Pending,Pending,PayPal,American Express,13473360852,Gan Su Sheng Hai Men Shi Zi Chuan Ma Lu R Zuo  332224
O436HMPCM184750947166,Gu Cheng,Xiaomi/Mi 11/Purple/1TB,7,101114,707798,SUMMER15,601628.2999999999,90244.24499999998,2023-07-25 00:00:00,Failed,In Transit,Debit Card,Alipay,14734270378,Nei Meng Gu Zi Zhi Qu Chang Chun Xian Gao Gang Guan Ling Jie P Zuo  342224
YW42ME2ZG184750947350,Huang Ming,OnePlus/9/White/128GB,3,133728,401184,SUMMER15,341006.39999999997,51150.95999999999,2023-07-25 00:00:00,Pending,In Transit,Bank Transfer,MasterCard,15046025362,Hei Long Jiang Sheng Hui Xian Fu Cheng Liang Jie Q Zuo  696512
2U1S8BFXP184750947526,Sun Zhi Qiang,Huawei/P40/Purple/128GB,2,103630,207260,FESTIVE30,145082.0,21762.3,2023-07-25 00:00:00,Pending,Pending,PayPal,American Express,14533102731,Gui Zhou Sheng Shu Zhen Shi Liu Zhi Te Li Jie Y Zuo  272008
9BVYHUMVX184750947708,Gu Hong Xia,Oppo/Reno5/White/128GB,5,126775,633875,NEWYEAR25,475406.25,71310.9375,2023-07-25 00:00:00,Failed,Delivered,Credit Card,WeChat Pay,15670581523,Yun Nan Sheng Jia Shi Shen He Ji Nan Jie O Zuo  729931
4D2XND6R6184750947872,Liang Ling,Oppo/Reno5/White/32GB,8,107497,859976,SUMMER15,730979.6,109646.93999999999,2023-07-25 00:00:00,Failed,Shipped,Credit Card,Visa,15083494585,Xi Zang Zi Zhi Qu Huai An Xian Da Dong Wang Jie A Zuo  504554
3XH5Q6Z2O184750948055,Gao Nan,Xiaomi/Mi 11/Black/32GB,6,124294,745764,SUMMER15,633899.4,95084.91,2023-07-25 00:00:00,Pending,In Transit,Bank Transfer,Visa,15389461493,Bei Jing Shi Huan Xian Fu Cheng Xiang Jie V Zuo  657836
F8VK5RSUQ184750948224,Liu Yu Zhen,iPhone/13 Pro/Black/254GB,1,112994,112994,AUTUMN5,107344.29999999999,16101.644999999997,2023-07-25 00:00:00,Paid,In Transit,Bank Transfer,WeChat Pay,18039855444,Bei Jing Shi Jin Feng Xian Cheng Bei Zhang Jie Z Zuo  422091
DAQKQJ93U184750948408,Sun Long,Oppo/Reno5/Black/64GB,3,86807,260421,WINTER10,234378.9,35156.835,2023-07-25 00:00:00,Pending,Delivered,Debit Card,PayPal,15892111498,Jiang Su Sheng Jia He Shi Nan Hu Dong Jie E Zuo  793171
M8HNRN1FZ184750948586,Tang Jun,Oppo/Reno5/Red/8GB,6,118715,712290,WINTER10,641061.0,96159.15,2023-07-25 00:00:00,Paid,Shipped,Credit Card,Visa,15072719128,Shan Dong Sheng Li Hua Shi Mu Ye Xu Jie M Zuo  366276
LYXNWCU8E184750948764,He Gui Hua,Xiaomi/Mi 11/Blue/1TB,3,125408,376224,AUTUMN5,357412.8,53611.92,2023-07-25 00:00:00,Failed,Delivered,Bank Transfer,PayPal,13788070614,Chong Qing Shi Chao Zhou Shi Shuang Luan Yan Lu V Zuo  824995
WOIQ45I25184750948953,Gong Xiu Fang,iPhone/13 Pro/Black/254GB,3,93481,280443,NEWYEAR25,210332.25,31549.837499999998,2023-07-25 00:00:00,Failed,Delivered,Bank Transfer,American Express,13962735106,Bei Jing Shi Jian Ping Xian He Chuan Fu Jie G Zuo  477174
8U9W2CSM7184750949133,Sun Gang,Vivo/X60/Red/32GB,10,65251,652510,AUTUMN5,619884.5,92982.675,2023-07-25 00:00:00,Paid,Delivered,Bank Transfer,WeChat Pay,14789867629,He Bei Sheng Bin Shi An Ci Bei Zhen Lu O Zuo  965412
3BH0H3VG3184750949290,Chen Fang,OnePlus/9/Red/64GB,10,71543,715430,AUTUMN5,679658.5,101948.775,2023-07-25 00:00:00,Failed,Shipped,Credit Card,Alipay,15197421365,Guang Xi Zhuang Zu Zi Zhi Qu Xi Ning Xian Gao Gang Xi Ning Lu V Zuo  225682
7WNKPXO54184750949521,Cai Yan,iPhone/13/Blue/1TB,10,94747,947470,SUMMER15,805349.5,120802.42499999999,2023-07-25 00:00:00,Failed,Shipped,Credit Card,PayPal,18877710614,Zhe Jiang Sheng Hong Xia Xian Xu Hui Hai Men Lu Z Zuo  208395
M93QHO7NH184750949703,Su Qiang,Xiaomi/Mi 11/Black/32GB,4,89618,358472,WINTER10,322624.8,48393.719999999994,2023-07-25 00:00:00,Failed,Delivered,PayPal,WeChat Pay,13407626272,He Bei Sheng Bing Xian Ji Qu Liu Jie X Zuo  455376
FO5Q5MO4T184750950047,Ma Jun,Huawei/P40/Black/128GB,4,96543,386172,WINTER10,347554.8,52133.219999999994,2023-07-25 00:00:00,Failed,In Transit,Bank Transfer,Visa,13308545437,Si Chuan Sheng Ma An Shan Xian Sha Wan Liu Lu H Zuo  747093
CPCRPB563184750950230,Wang Jian Ping,Oppo/Reno5/White/32GB,9,100790,907110,NEWYEAR25,680332.5,102049.875,2023-07-25 00:00:00,Failed,In Transit,Debit Card,Visa,15067253575,An Hui Sheng Ao Men Shi Yong Chuan Fo Shan Lu G Zuo  796542
IU8SP1TU1184750950401,Zhao Xue Mei,Galaxy/S21/Blue/254GB,7,126067,882469,FESTIVE30,617728.2999999999,92659.24499999998,2023-07-25 00:00:00,Pending,Shipped,PayPal,Visa,18511016714,Qing Hai Sheng Jian Ping Shi Sha Shi Jia He Jie W Zuo  631368
HZABAGAI0184750950573,Li Gui Fang,iPhone/13 Pro/Red/64GB,9,81431,732879,SUMMER15,622947.15,93442.0725,2023-07-25 00:00:00,Failed,In Transit,Credit Card,MasterCard,15839024608,Hu Bei Sheng Chao Zhou Xian Gao Gang Wu Han Lu L Zuo  992679
XX4YT46V2184750950743,Tian Li Juan,Vivo/X60/Blue/254GB,5,113322,566610,WINTER10,509949.0,76492.34999999999,2023-07-25 00:00:00,Paid,Pending,Bank Transfer,MasterCard,13805957322,Guang Xi Zhuang Zu Zi Zhi Qu Shen Yang Shi Men Tou Gou Xia Lu L Zuo  965553
0YD88N3VJ184750950948,Fu Xiu Yun,iPhone/13 Pro/Purple/64GB,3,65690,197070,WINTER10,177363.0,26604.45,2023-07-25 00:00:00,Pending,Shipped,PayPal,American Express,13315473666,Guang Dong Sheng Gui Ying Xian Men Tou Gou Fan Lu W Zuo  267030
766T6A67E184750951135,Xu Jie,Galaxy/S21/Blue/8GB,3,71481,214443,AUTUMN5,203720.84999999998,30558.127499999995,2023-07-25 00:00:00,Failed,Delivered,Bank Transfer,WeChat Pay,13007018811,Ji Lin Sheng Jian Hua Shi Yong Chuan Gui Yang Lu L Zuo  941822
AECK578VB184750951297,Yang Ting Ting,iPhone/13 Pro/Red/64GB,10,51520,515200,FESTIVE30,360640.0,54096.0,2023-07-25 00:00:00,Paid,In Transit,Bank Transfer,Visa,13945047391,Nei Meng Gu Zi Zhi Qu Tai Yuan Shi Xiang An Jia He Jie Y Zuo  914867
OD7634LZE184750951483,Zhang Xiao Hong,iPhone/13/Red/254GB,6,91445,548670,SUMMER15,466369.5,69955.425,2023-07-25 00:00:00,Paid,In Transit,PayPal,PayPal,18771940784,Ji Lin Sheng Chao Zhou Shi Xi Shan Jiang Lu G Zuo  907809
7L8GIG6M9184750951660,Lu Kai,Vivo/X60/Blue/32GB,5,64688,323440,SPRING20,258752.0,38812.799999999996,2023-07-25 00:00:00,Pending,Pending,Bank Transfer,American Express,18610926739,Xi Zang Zi Zhi Qu Qian Shi You Hao Shen Zhen Jie N Zuo  988143
CUF35LR3F184750951829,Liu Feng Ying,iPhone/13/Blue/1TB,3,139970,419910,SPRING20,335928.0,50389.2,2023-07-25 00:00:00,Failed,Pending,PayPal,Visa,18257627016,Hu Bei Sheng Yi Du Shi Cheng Dong Qi Lu N Zuo  742417
R3G41LQ7J184750952011,Sun Gui Xiang,iPhone/13 Pro/White/254GB,9,127625,1148625,SPRING20,918900.0,137835.0,2023-07-25 00:00:00,Failed,Delivered,Credit Card,Alipay,15354265040,Hu Nan Sheng Xue Xian Gao Gang Cai Jie C Zuo  880625
MF8YP4YD6184750952187,Wang Xu,OnePlus/9/Purple/32GB,6,62119,372714,AUTUMN5,354078.3,53111.744999999995,2023-07-25 00:00:00,Paid,Delivered,PayPal,American Express,15154120402,Yun Nan Sheng Ha Er Bin Shi Bin Cheng Xiang Gang Lu J Zuo  166672
YUNAH0V9A184750952357,Hu Xue Mei,OnePlus/9/Blue/64GB,9,70902,638118,SPRING20,510494.4,76574.16,2023-07-25 00:00:00,Pending,Delivered,Credit Card,MasterCard,18210443533,Yun Nan Sheng Long Xian He Ping Fo Shan Jie K Zuo  852014
HY3ZGFZDR184750952524,Yang Dan,Oppo/Reno5/White/1TB,8,131204,1049632,AUTUMN5,997150.3999999999,149572.55999999997,2023-07-25 00:00:00,Paid,Delivered,Bank Transfer,American Express,18071879393,Liao Ning Sheng Fu Zhou Xian Xiao Shan Xia Jie E Zuo  725537
PG47XR1HD184750952702,Jia Xiu Rong,Oppo/Reno5/Red/8GB,1,82246,82246,SPRING20,65796.8,9869.52,2023-07-25 00:00:00,Failed,Pending,Debit Card,PayPal,13415277509,Chong Qing Shi Ting Ting Shi Gao Gang Ao Men Lu H Zuo  117770
6RJ8VVUCJ184750952870,Zu Kun,OnePlus/9/White/32GB,4,105650,422600,AUTUMN5,401470.0,60220.5,2023-07-25 00:00:00,Paid,Delivered,PayPal,MasterCard,13059824583,Ji Lin Sheng Hu He Hao Te Xian Zhang Shou Song Jie Y Zuo  959468
5ADFOHG99184750953059,Chen Xiu Hua,OnePlus/9/Red/8GB,5,123389,616945,SUMMER15,524403.25,78660.4875,2023-07-25 00:00:00,Failed,Pending,Bank Transfer,American Express,15279128242,Shan Xi Sheng Ma An Shan Xian Xiang An Xing An Meng Lu X Zuo  592860
