Order ID,Customer Name,Mobile Model,Quantity,Price per Unit,Total Price,Promotion Code,Order Amount,GST,Order Date,Payment Status,Shipping Status,Payment Method,Payment Provider,Mobile,Delivery Address
LCH3O5MG1184750895060,Zhu Yu Lan,iPhone/13 Pro/White/1TB,10,83525,835250,AUTUMN5,793487.5,119023.125,2023-07-25 00:00:00,Failed,Delivered,PayPal,Alipay,15348350527,Xi Zang Zi Zhi Qu Xiu Mei Shi Dong Li Tai Yuan Lu E Zuo  393968
4KQEWTBWR184750895233,Ma Ling,Galaxy/S21/Blue/254GB,10,64391,643910,WINTER10,579519.0,86927.84999999999,2023-07-25 00:00:00,Failed,Pending,Debit Card,Visa,18708658808,Shan Dong Sheng Ying Shi Mu Ye Chen Lu B Zuo  738632
7VQOS1K5B184750895399,Wu Long,iPhone/13/Red/128GB,4,81642,326568,AUTUMN5,310239.6,46535.939999999995,2023-07-25 00:00:00,Paid,Shipped,Bank Transfer,MasterCard,13000246885,Jiang Xi Sheng Kun Shi Nan Hu Fu Xin Jie G Zuo  905313
TK6TVQ7RP184750895555,Liu Juan,iPhone/13 Pro/Purple/8GB,6,108938,653628,SUMMER15,555583.7999999999,83337.56999999999,2023-07-25 00:00:00,Paid,Pending,PayPal,American Express,18701664597,Ao Men Te Bie Xing Zheng Qu Tian Jin Shi Nan Xi Yong An Lu Q Zuo  505238
CHAS7EZ9V184750895735,Ma Yu Zhen,Xiaomi/Mi 11/Blue/32GB,10,139495,1394950,FESTIVE30,976464.9999999999,146469.74999999997,2023-07-25 00:00:00,Failed,Pending,PayPal,Alipay,14797441076,Yun Nan Sheng Yang Xian Jiang Bei Chen Jie N Zuo  433026
DKYGPQDM8184750895909,Li Shu Zhen,Galaxy/S21/Red/1TB,5,96894,484470,WINTER10,436023.0,65403.45,2023-07-25 00:00:00,Pending,Shipped,Debit Card,Alipay,15826475678,Nei Meng Gu Zi Zhi Qu Ning Shi Bai Yun Liang Lu Z Zuo  561616
7IH5EKNNQ184750896099,Zheng Fan,Galaxy/S21/White/1TB,2,69427,138854,NEWYEAR25,104140.5,15621.074999999999,2023-07-25 00:00:00,Paid,In Transit,Credit Card,MasterCard,15731667075,Fu Jian Sheng Gui Yang Shi Bai Yun Huang Lu M Zuo  669763
YPL5C3WKI184750896267,Wang Long,Oppo/Reno5/Purple/128GB,7,108583,760081,FESTIVE30,532056.7,79808.50499999999,2023-07-25 00:00:00,Paid,Pending,Credit Card,American Express,13240240164,Hei Long Jiang Sheng Guang Zhou Shi Min Xing Liu Jie F Zuo  840279
Z7PPXCIVP184750896443,Li Chang,Xiaomi/Mi 11/White/1TB,8,81902,655216,WINTER10,589694.4,88454.16,2023-07-25 00:00:00,Pending,Shipped,Credit Card,PayPal,13809128251,Xi Zang Zi Zhi Qu Cheng Du Xian Dong Li Gui Yang Jie B Zuo  906437
4ZUEGI2JH184750896616,Sui Ting,OnePlus/9/Blue/254GB,6,92710,556260,WINTER10,500634.0,75095.09999999999,2023-07-25 00:00:00,Paid,Pending,Credit Card,WeChat Pay,15849254534,Shan Xi Sheng Huai An Xian Xi Feng Huai An Jie Q Zuo  480147
O8507E8RT184750896776,Zheng Xiu Hua,Vivo/X60/Blue/254GB,10,123175,1231750,SUMMER15,1046987.5,157048.125,2023-07-25 00:00:00,Failed,Delivered,Debit Card,Visa,13430672735,Nei Meng Gu Zi Zhi Qu Li Li Xian Fang Shan Wang Lu Z Zuo  328288
C6I7KD3UT184750896964,Zhu Wen,Galaxy/S21/Red/32GB,2,124128,248256,WINTER10,223430.4,33514.56,2023-07-25 00:00:00,Failed,Delivered,Credit Card,Alipay,14781915234,Xi Zang Zi Zhi Qu Yin Chuan Shi Huai Rou Cai Jie T Zuo  318919
A7WWGV1TW184750897146,Feng Cheng,Huawei/P40/Black/254GB,6,85265,511590,NEWYEAR25,383692.5,57553.875,2023-07-25 00:00:00,Failed,Delivered,PayPal,American Express,13314662328,Hu Bei Sheng Jing Shi Liang Ping Wang Lu W Zuo  171329
3X3Y2V5I3184750897313,Shi Yang,Galaxy/S21/White/32GB,6,149721,898326,WINTER10,808493.4,121274.01,2023-07-25 00:00:00,Paid,Pending,PayPal,Alipay,13566213377,Hu Nan Sheng Jie Xian Xi Feng Duan Jie N Zuo  226719
2T62A5S16184750897477,Cai Jian Guo,Oppo/Reno5/Black/64GB,4,139996,559984,SUMMER15,475986.39999999997,71397.95999999999,2023-07-25 00:00:00,Paid,Delivered,PayPal,MasterCard,15601756055,Fu Jian Sheng Li Shi Gao Ping Wang Jie H Zuo  176357
VUOTJL1I3184750897644,Chen Lei,Vivo/X60/Purple/64GB,5,122975,614875,SPRING20,491900.0,73785.0,2023-07-25 00:00:00,Pending,Pending,Debit Card,WeChat Pay,15381638853,Qing Hai Sheng Gui Rong Shi Hai Ling Dai Jie U Zuo  936233
4SSVTAQSI184750897812,Zhang Xiu Lan,Oppo/Reno5/Red/64GB,4,135036,540144,NEWYEAR25,405108.0,60766.2,2023-07-25 00:00:00,Pending,Shipped,Debit Card,PayPal,14528826177,Liao Ning Sheng Qin Shi Huai Rou Huang Lu P Zuo  359197
0XQPBGHTE184750897988,Zhang Juan,OnePlus/9/White/1TB,6,89045,534270,SUMMER15,454129.5,68119.425,2023-07-25 00:00:00,Pending,In Transit,Credit Card,Alipay,13953070214,He Bei Sheng Jun Shi Sha Wan Da Ye Lu K Zuo  638310
ONI32O49M184750898141,Yuan Lu,iPhone/13/Black/254GB,10,81464,814640,AUTUMN5,773908.0,116086.2,2023-07-25 00:00:00,Paid,In Transit,Debit Card,MasterCard,13336104461,Tai Wan Sheng Min Shi Zi Chuan Tai Yuan Jie K Zuo  813870
GZGIU1UOG184750898297,Zhang Yan,Xiaomi/Mi 11/Red/32GB,6,87437,524622,SUMMER15,445928.7,66889.305,2023-07-25 00:00:00,Paid,In Transit,Debit Card,PayPal,15698850723,An Hui Sheng Xi An Shi Dong Cheng Yi Dou Lu E Zuo  166069
DHXPTBJ58184750898458,He Jian Jun,Huawei/P40/Black/32GB,10,75991,759910,AUTUMN5,721914.5,108287.175,2023-07-25 00:00:00,Paid,Shipped,Debit Card,Alipay,18187616177,He Bei Sheng Ma An Shan Shi Xing Shan Zheng Lu V Zuo  443202
OLGOKKPQ9184750898636,Liu Xiu Yun,Oppo/Reno5/Red/32GB,9,123633,1112697,AUTUMN5,1057062.15,158559.32249999998,2023-07-25 00:00:00,Pending,Shipped,PayPal,Visa,18948366720,Shan Xi Sheng Ting Xian Dong Cheng Ma Jie L Zuo  554608
599FSB14C184750898805,Wang Liu,Oppo/Reno5/Black/254GB,9,126289,1136601,WINTER10,1022940.9,153441.135,2023-07-25 00:00:00,Paid,In Transit,PayPal,Alipay,13225577954,Xi Zang Zi Zhi Qu Chen Xian Da Xing Fang Lu I Zuo  995904
0UIVZQ2M4184750898979,Jia Cheng,OnePlus/9/Blue/128GB,4,126251,505004,FESTIVE30,353502.8,53025.42,2023-07-25 00:00:00,Paid,Shipped,PayPal,Visa,18652786213,Fu Jian Sheng Shan Wei Shi Sha Shi He Shan Lu Z Zuo  751409
7E4QNOFEG184750899142,Su Gui Zhen,OnePlus/9/Red/1TB,2,57592,115184,FESTIVE30,80628.79999999999,12094.319999999998,2023-07-25 00:00:00,Paid,In Transit,Bank Transfer,PayPal,15288528152,Guang Xi Zhuang Zu Zi Zhi Qu Yu Lan Shi Hai Ling Guo Jie Z Zuo  138165
MIG9BM6YN184750899346,Zhou Yu Mei,iPhone/13 Pro/Red/32GB,3,125259,375777,SUMMER15,319410.45,47911.5675,2023-07-25 00:00:00,Paid,Pending,PayPal,MasterCard,14595121589,He Nan Sheng Xiu Lan Shi Gao Ming Qian Jiang Jie N Zuo  442462
M76A3PPNU184750899511,Jing Xiang,Xiaomi/Mi 11/Blue/254GB,7,113451,794157,SPRING20,635325.6000000001,95298.84000000001,2023-07-25 00:00:00,Failed,Shipped,Bank Transfer,Visa,13781116664,An Hui Sheng Yu Zhen Xian Mu Ye Tai Yuan Lu I Zuo  918176
FMCY7XI4Y184750899671,Duan Jian,iPhone/13 Pro/Black/8GB,10,104492,1044920,AUTUMN5,992674.0,148901.1,2023-07-25 00:00:00,Paid,Delivered,Bank Transfer,Visa,15895134166,Bei Jing Shi Tong Liao Shi Da Dong Huang Jie J Zuo  516291
QPE6E8BF6184750899843,Li Fan,OnePlus/9/Blue/1TB,2,115952,231904,SUMMER15,197118.4,29567.76,2023-07-25 00:00:00,Pending,Delivered,Credit Card,MasterCard,14564344820,Shan Dong Sheng Hong Mei Shi Zhang Shou Zhou Jie X Zuo  437505
BS23A1QZO184750900015,Zheng Nan,Vivo/X60/Purple/32GB,7,91330,639310,AUTUMN5,607344.5,91101.675,2023-07-25 00:00:00,Pending,Shipped,Debit Card,WeChat Pay,18080028618,Gui Zhou Sheng Lin Xian Zi Chuan Chen Lu E Zuo  182287
298FF0DDW184750900181,Liu Yong,iPhone/13 Pro/Purple/1TB,7,125109,875763,AUTUMN5,831974.85,124796.2275,2023-07-25 00:00:00,Pending,Pending,Debit Card,PayPal,15817819735,Shang Hai Shi Feng Lan Shi Hua Xi Zhong Lu L Zuo  947292
K20LIEEYR184750900356,Li Xue,Huawei/P40/Black/32GB,10,102631,1026310,SUMMER15,872363.5,130854.525,2023-07-25 00:00:00,Failed,Delivered,Bank Transfer,American Express,18222532049,Hei Long Jiang Sheng Qiang Xian Xiao Shan Zheng Jie F Zuo  932994
5P6XR1M09184750900527,Huang Yang,OnePlus/9/Black/8GB,10,129063,1290630,NEWYEAR25,967972.5,145195.875,2023-07-25 00:00:00,Paid,Pending,PayPal,MasterCard,13359575403,Ning Xia Hui Zu Zi Zhi Qu Xing An Meng Xian He Chuan Lei Jie S Zuo  208332
0305TNL0C184750900727,Huang Li,Vivo/X60/Blue/8GB,3,51786,155358,WINTER10,139822.2,20973.33,2023-07-25 00:00:00,Pending,Delivered,Debit Card,MasterCard,18886870217,Ning Xia Hui Zu Zi Zhi Qu Xiu Lan Xian Shen He Zhou Jie N Zuo  845245
A1IBQ3Z3M184750900916,Cui Jian Ping,Xiaomi/Mi 11/Black/32GB,9,100002,900018,NEWYEAR25,675013.5,101252.025,2023-07-25 00:00:00,Failed,Shipped,Bank Transfer,MasterCard,13036055537,Si Chuan Sheng Fo Shan Shi Dong Cheng Hui Zhou Jie D Zuo  370745
MLX6JJ1XF184750901078,Feng Xiao Hong,OnePlus/9/Black/128GB,4,107774,431096,WINTER10,387986.4,58197.96,2023-07-25 00:00:00,Pending,In Transit,PayPal,WeChat Pay,18206413422,Tai Wan Sheng Shang Hai Xian Zhang Shou Dong Guan Jie M Zuo  468676
TT9N4G2JG184750901241,Wang Jian Jun,Galaxy/S21/Purple/254GB,8,109834,878672,WINTER10,790804.8,118620.72,2023-07-25 00:00:00,Failed,Delivered,Debit Card,WeChat Pay,15065548945,He Nan Sheng Kun Ming Shi Sha Wan Zhang Jie D Zuo  777357
KQU3RLB4L184750901416,Zhu Nan,Galaxy/S21/White/128GB,6,148004,888024,FESTIVE30,621616.7999999999,93242.51999999999,2023-07-25 00:00:00,Failed,Shipped,Credit Card,Visa,13177392724,Jiang Su Sheng Guan Ling Shi Feng Dou Wu Lu Mu Qi Jie S Zuo  787439
NAD4D6PYQ184750901586,Zhu Ying,iPhone/13/Red/128GB,9,82180,739620,AUTUMN5,702639.0,105395.84999999999,2023-07-25 00:00:00,Failed,Pending,Bank Transfer,Alipay,14729827481,Gui Zhou Sheng Fu Zhou Xian Shuang Luan Mo Jie X Zuo  357219
47IUOLQUV184750901761,Chen Jie,Oppo/Reno5/Purple/32GB,6,53628,321768,AUTUMN5,305679.6,45851.939999999995,2023-07-25 00:00:00,Failed,Pending,Bank Transfer,WeChat Pay,18106156956,Hu Bei Sheng Han Dan Shi Chong Wen Hai Kou Lu S Zuo  359137
3UIPUZ9Q8184750901928,Liu Xue,iPhone/13 Pro/Red/64GB,7,60981,426867,AUTUMN5,405523.64999999997,60828.54749999999,2023-07-25 00:00:00,Pending,Shipped,Bank Transfer,MasterCard,14701842988,He Bei Sheng Ting Xian Yong Chuan Wu Lu Mu Qi Jie Q Zuo  561841
JJDCQM524184750902088,Wang Ning,iPhone/13 Pro/Purple/64GB,1,96530,96530,NEWYEAR25,72397.5,10859.625,2023-07-25 00:00:00,Paid,Shipped,PayPal,American Express,18191133957,Hu Bei Sheng Gui Zhi Xian Ji Zhou Fan Lu D Zuo  192990
UMXRRWUCM184750902260,Kang Chun Mei,Xiaomi/Mi 11/White/32GB,5,101197,505985,AUTUMN5,480685.75,72102.8625,2023-07-25 00:00:00,Failed,In Transit,PayPal,PayPal,18136664342,Zhe Jiang Sheng Jia He Shi Min Xing Fu Zhou Lu R Zuo  484485
ZXP2ZMK7G184750902422,Xu Xiu Fang,iPhone/13/White/128GB,10,111199,1111990,SPRING20,889592.0,133438.8,2023-07-25 00:00:00,Paid,In Transit,Debit Card,MasterCard,15019972698,Jiang Xi Sheng Shen Yang Xian Gao Ping Shen Yang Lu J Zuo  427546
4MYC52D20184750902583,Wei Huan,Oppo/Reno5/Black/8GB,2,101050,202100,NEWYEAR25,151575.0,22736.25,2023-07-25 00:00:00,Paid,In Transit,Debit Card,PayPal,18704691798,Xiang Gang Te Bie Xing Zheng Qu Ji Nan Xian You Hao Yi Jie R Zuo  789964
YQKBTYUAW184750902775,Qiao Hao,Oppo/Reno5/Purple/64GB,10,117380,1173800,WINTER10,1056420.0,158463.0,2023-07-25 00:00:00,Pending,Shipped,Credit Card,Alipay,13154683020,Jiang Su Sheng Yu Ying Xian Huang Pu Tai Bei Jie T Zuo  770337
N1OLOKCS1184750902937,Zou Hao,Huawei/P40/Blue/8GB,3,98365,295095,SUMMER15,250830.75,37624.612499999996,2023-07-25 00:00:00,Paid,Shipped,Credit Card,Alipay,14596464283,Tai Wan Sheng Hua Xian Yong Chuan Jing Men Jie O Zuo  327003
7AWUVTT7Z184750903090,Huang Yang,Galaxy/S21/Blue/64GB,9,65401,588609,AUTUMN5,559178.5499999999,83876.78249999999,2023-07-25 00:00:00,Failed,Shipped,Debit Card,Alipay,14793904076,Shan Dong Sheng He Shan Xian Cheng Dong Xiang Gang Lu G Zuo  156997
ICMMH5KNF184750903247,Li Li,iPhone/13/Purple/32GB,10,68882,688820,WINTER10,619938.0,92990.7,2023-07-25 00:00:00,Pending,Pending,Bank Transfer,WeChat Pay,18903900430,Tian Jin Shi Jing Shi Nan Zhang Shen Zhen Jie E Zuo  956440
W2QD8V9VL184750903402,Yu Dan Dan,iPhone/13/Red/254GB,5,130997,654985,SPRING20,523988.0,78598.2,2023-07-25 00:00:00,Paid,In Transit,Debit Card,Alipay,15591860849,Zhe Jiang Sheng Dan Dan Shi Shen He Qian Jiang Lu E Zuo  797480
EBCX6618W184750903569,Li Hong Xia,Xiaomi/Mi 11/White/8GB,6,112686,676116,SUMMER15,574698.6,86204.79,2023-07-25 00:00:00,Pending,Shipped,PayPal,Alipay,13141627722,Jiang Xi Sheng Lin Xian Qing Pu Ning De Lu S Zuo  952016
DWKQ5ZE6U184750903734,Su Na,iPhone/13 Pro/Black/254GB,1,59865,59865,SUMMER15,50885.25,7632.787499999999,2023-07-25 00:00:00,Paid,Shipped,Debit Card,PayPal,18568158070,He Nan Sheng Li Li Xian Yong Chuan Liu Jie C Zuo  840323
XKER762CX184750903905,Jiang Feng Ying,OnePlus/9/Blue/1TB,8,56533,452264,FESTIVE30,316584.8,47487.719999999994,2023-07-25 00:00:00,Pending,In Transit,Bank Transfer,WeChat Pay,18119694688,Shan Xi Sheng Shuai Xian Bin Cheng Shen Lu K Zuo  266750
NLV9GAWK9184750904079,Tao Gui Fang,Vivo/X60/White/254GB,4,92785,371140,SPRING20,296912.0,44536.799999999996,2023-07-25 00:00:00,Pending,Pending,Credit Card,MasterCard,14565357448,Guang Dong Sheng Qin Shi Da Dong Chong Qing Jie Q Zuo  808660
XNFXR3RT4184750904240,Deng Xin,Xiaomi/Mi 11/Blue/8GB,1,54256,54256,WINTER10,48830.4,7324.56,2023-07-25 00:00:00,Failed,Pending,Debit Card,American Express,15861718319,Shan Xi Sheng Ha Er Bin Xian Hai Ling Liu Jie A Zuo  345239
020ZXZQRP184750904416,Huang Kai,iPhone/13 Pro/Purple/64GB,5,144451,722255,AUTUMN5,686142.25,102921.3375,2023-07-25 00:00:00,Failed,Shipped,Debit Card,Visa,18278092796,Shan Xi Sheng Jie Shi Gao Gang Shen Yang Jie P Zuo  879391
T56TJ3IVG184750904567,Feng Lin,iPhone/13 Pro/Red/8GB,6,82300,493800,SPRING20,395040.0,59256.0,2023-07-25 00:00:00,Pending,Shipped,Bank Transfer,PayPal,14500820159,Bei Jing Shi Shan Wei Xian Jin Ping Fu Zhou Lu P Zuo  120196
T5CFMRWJ0184750904724,Zhang Yu Zhen,Oppo/Reno5/White/8GB,5,122761,613805,FESTIVE30,429663.5,64449.524999999994,2023-07-25 00:00:00,Paid,Delivered,Debit Card,American Express,18145636067,Gui Zhou Sheng Xi An Shi Shen Bei Xin Shi Jie G Zuo  266456
KHGAZB43F184750904906,Zhang Li,OnePlus/9/Black/8GB,2,57827,115654,WINTER10,104088.6,15613.29,2023-07-25 00:00:00,Pending,Pending,Credit Card,American Express,13957738854,An Hui Sheng Kun Ming Xian Men Tou Gou Hai Kou Jie P Zuo  220490
BQ7HH52M2184750905073,Jia Zhi Qiang,OnePlus/9/Blue/1TB,4,96807,387228,WINTER10,348505.2,52275.78,2023-07-25 00:00:00,Failed,Pending,Debit Card,Alipay,14790382819,Tian Jin Shi Shi Jia Zhuang Shi Ji Qu Jia Jie I Zuo  854858
ORAITMYB8184750905257,Qiu Mei,iPhone/13/White/128GB,6,78254,469524,WINTER10,422571.60000000003,63385.740000000005,2023-07-25 00:00:00,Failed,Delivered,Debit Card,MasterCard,18289992364,Guang Dong Sheng Wen Xian Gao Ming Da Ye Jie T Zuo  520965
X44DRIADX184750905415,Wu Xiang,OnePlus/9/White/32GB,1,137307,137307,WINTER10,123576.3,18536.445,2023-07-25 00:00:00,Failed,Delivered,PayPal,Visa,13920349652,Ao Men Te Bie Xing Zheng Qu Hai Men Shi Wei Dou Hu Lu M Zuo  167118
3JT0VDMUP184750905609,Wu Mei,Xiaomi/Mi 11/Blue/254GB,6,103176,619056,WINTER10,557150.4,83572.56,2023-07-25 00:00:00,Pending,Shipped,Bank Transfer,WeChat Pay,13636390877,Ji Lin Sheng Feng Lan Xian Qing He Zheng Zhou Jie H Zuo  484003
LYFRSBZ6P184750905773,Zhang Hui,Oppo/Reno5/Red/254GB,9,71506,643554,AUTUMN5,611376.2999999999,91706.44499999999,2023-07-25 00:00:00,Paid,Shipped,Debit Card,WeChat Pay,13355222440,He Bei Sheng Shan Wei Xian Pu Tuo Li Jie Z Zuo  580771
KXZORX68F184750905942,Wang Ming,Vivo/X60/Purple/1TB,2,136787,273574,NEWYEAR25,205180.5,30777.074999999997,2023-07-25 00:00:00,Paid,In Transit,Debit Card,Visa,18948080182,Guang Xi Zhuang Zu Zi Zhi Qu Gui Yang Shi Liu Zhi Te Xu Lu S Zuo  366041
2EQIII1YX184750906138,Wang Lei,Xiaomi/Mi 11/White/64GB,2,93679,187358,SUMMER15,159254.3,23888.144999999997,2023-07-25 00:00:00,Paid,Delivered,Debit Card,Alipay,13870101239,Chong Qing Shi Long Xian Cheng Bei Wang Jie G Zuo  884466
78FMYTYJ7184750906306,Zhao Xin,Xiaomi/Mi 11/Red/8GB,10,107981,1079810,AUTUMN5,1025819.5,153872.925,2023-07-25 00:00:00,Pending,In Transit,Debit Card,American Express,13843699130,Tian Jin Shi Jing Shi Qing Cheng Hu He Hao Te Jie O Zuo  385258
IP6WZO41J184750906476,Lu Gui Hua,Vivo/X60/Black/128GB,10,138412,1384120,WINTER10,1245708.0,186856.19999999998,2023-07-25 00:00:00,Failed,In Transit,Bank Transfer,WeChat Pay,14539772756,Hu Nan Sheng Gui Rong Xian Da Dong Tai Yuan Lu N Zuo  687987
4XQCO4VJN184750906650,Zhao Yan,Oppo/Reno5/Purple/8GB,7,68837,481859,AUTUMN5,457766.05,68664.9075,2023-07-25 00:00:00,Failed,Pending,Credit Card,PayPal,14567322768,Si Chuan Sheng Zhang Sha Shi Da Xing Peng Jie W Zuo  245449
0836SSR6R184750906831,Dai Xin,Vivo/X60/White/1TB,1,139752,139752,WINTER10,125776.8,18866.52,2023-07-25 00:00:00,Pending,In Transit,Debit Card,MasterCard,13552099671,Nei Meng Gu Zi Zhi Qu Chen Shi Gao Gang Tian Jie Q Zuo  907084
3RYKXN3DE184750907023,Yang Hai Yan,Oppo/Reno5/White/254GB,1,116453,116453,SUMMER15,98985.05,14847.7575,2023-07-25 00:00:00,Paid,Delivered,Credit Card,MasterCard,13430610336,Ao Men Te Bie Xing Zheng Qu Jia Xian Sha Shi Liang Lu T Zuo  880104
3NMNL0XU2184750907230,Chen Gui Zhen,iPhone/13 Pro/Blue/32GB,10,62370,623700,NEWYEAR25,467775.0,70166.25,2023-07-25 00:00:00,Failed,Shipped,Debit Card,WeChat Pay,13889632292,He Bei Sheng Dong Guan Shi Zi Chuan Yang Lu V Zuo  750402
K944EEF72184750907415,Ju Yu Ying,Xiaomi/Mi 11/Purple/1TB,1,132065,132065,SPRING20,105652.0,15847.8,2023-07-25 00:00:00,Failed,Pending,Bank Transfer,MasterCard,15823725570,Si Chuan Sheng He Shan Shi Huang Pu Wu Zhou Jie L Zuo  675040
OUUYPHFQ8184750907592,Chen Fan,Galaxy/S21/Black/1TB,7,72542,507794,AUTUMN5,482404.3,72360.64499999999,2023-07-25 00:00:00,Paid,Pending,Debit Card,MasterCard,14798013925,Yun Nan Sheng Chen Xian Fu Cheng Huai An Jie X Zuo  529328
I8K1YAXF0184750907757,Zhu Yan,OnePlus/9/Blue/128GB,3,89614,268842,AUTUMN5,255399.9,38309.985,2023-07-25 00:00:00,Failed,Pending,PayPal,Visa,15667836631,Jiang Xi Sheng Bing Xian Huai Rou Hai Kou Lu Z Zuo  617993
W8I6BBD3G184750907922,Zhang Xiang,Galaxy/S21/Purple/254GB,9,66906,602154,FESTIVE30,421507.8,63226.17,2023-07-25 00:00:00,Failed,Shipped,Credit Card,American Express,13684845701,Shan Dong Sheng Hai Yan Shi Zhang Shou Cheng Du Lu F Zuo  100983
KL3TBLBKH184750908091,Li Li,Huawei/P40/Red/8GB,4,72911,291644,AUTUMN5,277061.8,41559.27,2023-07-25 00:00:00,Pending,Shipped,Bank Transfer,PayPal,18883210279,Ao Men Te Bie Xing Zheng Qu Long Xian Xu Hui Hui Zhou Lu X Zuo  616062
TVFVM491W184750908276,Wang Gui Zhi,Huawei/P40/Red/254GB,9,58043,522387,WINTER10,470148.3,70522.245,2023-07-25 00:00:00,Paid,Pending,Bank Transfer,PayPal,18838137217,Zhe Jiang Sheng Guang Zhou Xian Xiao Shan Ye Lu W Zuo  763586
T48Z7IFAU184750908463,Liu Gui Zhen,Galaxy/S21/Red/254GB,4,142465,569860,AUTUMN5,541367.0,81205.05,2023-07-25 00:00:00,Pending,In Transit,Debit Card,MasterCard,13941965512,He Nan Sheng Fu Zhou Xian Xi Shan Ji Nan Jie F Zuo  191815
HEYXLXXTH184750908635,Luo Ming,Galaxy/S21/Black/1TB,9,122714,1104426,FESTIVE30,773098.2,115964.73,2023-07-25 00:00:00,Failed,Shipped,Debit Card,MasterCard,15370859968,Qing Hai Sheng Qian Jiang Shi Feng Dou Liu Lu Y Zuo  869358
WY4TT033S184750908811,Zhang Xin,iPhone/13/Black/8GB,5,118499,592495,WINTER10,533245.5,79986.825,2023-07-25 00:00:00,Paid,Delivered,Bank Transfer,PayPal,15387079412,Ao Men Te Bie Xing Zheng Qu Shu Ying Shi Qing He Ao Men Lu U Zuo  154879
G3C9KH7ZE184750908991,Wang Yan,Oppo/Reno5/Purple/1TB,2,83536,167072,FESTIVE30,116950.4,17542.559999999998,2023-07-25 00:00:00,Pending,In Transit,Debit Card,American Express,13457525451,An Hui Sheng Ping Shi An Ci Zhang Lu B Zuo  243950
DJS099DAP184750909159,Lu Fan,iPhone/13/Black/254GB,3,96916,290748,WINTER10,261673.2,39250.98,2023-07-25 00:00:00,Pending,In Transit,Debit Card,American Express,14755975278,Jiang Su Sheng Dan Shi Ji Zhou Zhang Lu Y Zuo  828742
N9NY3KQ3D184750909326,Du Bo,Galaxy/S21/Blue/32GB,4,120074,480296,NEWYEAR25,360222.0,54033.299999999996,2023-07-25 00:00:00,Pending,Delivered,PayPal,Alipay,13297441465,Ao Men Te Bie Xing Zheng Qu Liu Xian Xi Xia He Shan Lu D Zuo  886061
JNIO36807184750909501,Lin Jian Ping,OnePlus/9/Red/1TB,4,142654,570616,WINTER10,513554.4,77033.16,2023-07-25 00:00:00,Paid,Delivered,Credit Card,WeChat Pay,15212746429,An Hui Sheng Gui Zhi Shi Shang Jie Yang Lu Y Zuo  247449
L07YE5ATN184750909679,Xue Xiu Rong,Vivo/X60/White/254GB,5,138145,690725,FESTIVE30,483507.49999999994,72526.12499999999,2023-07-25 00:00:00,Pending,Delivered,PayPal,Visa,13938046254,Yun Nan Sheng Tai Bei Shi Sha Wan Xi Ning Lu U Zuo  579636
YOV99XFFQ184750909846,Zhao Yan,OnePlus/9/White/64GB,7,128372,898604,SPRING20,718883.2000000001,107832.48000000001,2023-07-25 00:00:00,Failed,Shipped,Credit Card,PayPal,18533918622,Liao Ning Sheng Nan Jing Shi Gao Gang Wang Jie F Zuo  257093
F0P096VG6184750910022,Zuo Gui Rong,Vivo/X60/Red/8GB,1,138345,138345,NEWYEAR25,103758.75,15563.8125,2023-07-25 00:00:00,Pending,In Transit,PayPal,Visa,15993735224,He Nan Sheng Shen Zhen Shi Da Dong Zhuang Jie K Zuo  901899
RB0U2E6FR184750910202,Liang Mei,Galaxy/S21/White/128GB,1,64196,64196,FESTIVE30,44937.2,6740.579999999999,2023-07-25 00:00:00,Paid,Delivered,Bank Transfer,American Express,18121431094,He Nan Sheng Rong Xian Ji Zhou Cheng Du Jie G Zuo  698012
9PF7WQOHJ184750910355,Zhang Bin,Xiaomi/Mi 11/Black/254GB,1,131293,131293,WINTER10,118163.7,17724.555,2023-07-25 00:00:00,Failed,Delivered,Bank Transfer,Alipay,13194758778,Liao Ning Sheng Xin Shi Nan Zhang Chao Zhou Jie T Zuo  582227
DPPDMI3YV184750910514,Xu Xue Mei,Huawei/P40/Red/254GB,10,84311,843110,SUMMER15,716643.5,107496.525,2023-07-25 00:00:00,Pending,In Transit,Bank Transfer,PayPal,14542812332,Hu Nan Sheng Da Ye Shi Liu Zhi Te Tai Yuan Lu C Zuo  571149
7SU85CPLI184750910689,Zhao Li,Huawei/P40/Red/64GB,7,147858,1035006,NEWYEAR25,776254.5,116438.175,2023-07-25 00:00:00,Pending,Delivered,Bank Transfer,American Express,13111454681,Tian Jin Shi Tai Bei Xian Nan Xi Shen Yang Lu H Zuo  866938
NQUMJAG83184750910862,Hong Lu,Oppo/Reno5/Blue/128GB,8,113701,909608,WINTER10,818647.2000000001,122797.08,2023-07-25 00:00:00,Pending,Delivered,PayPal,Alipay,13813558685,Yun Nan Sheng Xing Cheng Shi Men Tou Gou Yi Dou Jie C Zuo  613153
UNV754AXH184750911035,Xia Chang,Galaxy/S21/Red/64GB,8,120140,961120,WINTER10,865008.0,129751.2,2023-07-25 00:00:00,Pending,Shipped,Credit Card,MasterCard,15601999787,Ji Lin Sheng Dong Guan Shi Sha Shi Li Lu O Zuo  507751
OMU73CNWH184750911205,Zhang Yu Hua,OnePlus/9/Blue/1TB,1,144517,144517,SPRING20,115613.6,17342.04,2023-07-25 00:00:00,Failed,Delivered,Credit Card,PayPal,13243521507,Ning Xia Hui Zu Zi Zhi Qu He Fei Shi Liang Ping Li Lu J Zuo  201944
15D6SYXO7184750911402,Huang Yang,iPhone/13 Pro/White/8GB,3,109323,327969,SUMMER15,278773.64999999997,41816.04749999999,2023-07-25 00:00:00,Pending,Shipped,Credit Card,American Express,15140561508,Bei Jing Shi Hang Zhou Shi Xu Hui Qian Jiang Lu J Zuo  538156
9QED4I4H8184750911562,Jiang Yan,Oppo/Reno5/Purple/128GB,2,107066,214132,WINTER10,192718.80000000002,28907.820000000003,2023-07-25 00:00:00,Pending,In Transit,Bank Transfer,WeChat Pay,13878270804,Yun Nan Sheng Xin Ji Xian Ping Shan Hu He Hao Te Jie R Zuo  128625
8XFM0EJ97184750911737,Zhou Li,iPhone/13/Purple/8GB,5,108388,541940,SPRING20,433552.0,65032.799999999996,2023-07-25 00:00:00,Paid,Pending,Bank Transfer,PayPal,13125773137,Liao Ning Sheng Hai Kou Xian Shen He Tai Bei Lu V Zuo  412716
9GQW8WUDH184750911898,Tang Shu Ying,Oppo/Reno5/Purple/8GB,2,102785,205570,FESTIVE30,143899.0,21584.85,2023-07-25 00:00:00,Failed,Pending,Bank Transfer,American Express,15221117581,Hei Long Jiang Sheng Hong Xia Xian Nan Hu He Shan Jie M Zuo  805835
L903Q9L6A184750912069,Zhou Yu Hua,iPhone/13/Blue/254GB,3,140958,422874,FESTIVE30,296011.8,44401.77,2023-07-25 00:00:00,Pending,In Transit,Debit Card,WeChat Pay,15715934648,Si Chuan Sheng Dong Mei Xian Gao Ming Xin Ji Lu G Zuo  573674
XJYBIGT8D184750912236,Hu Gui Lan,OnePlus/9/Red/128GB,6,77409,464454,FESTIVE30,325117.8,48767.67,2023-07-25 00:00:00,Failed,In Transit,Bank Transfer,American Express,13903964927,Tai Wan Sheng Fei Shi Chong Wen Sun Lu U Zuo  483788
V8F7YXP4Q184750912408,An Cheng,iPhone/13 Pro/Purple/64GB,6,77675,466050,WINTER10,419445.0,62916.75,2023-07-25 00:00:00,Failed,Delivered,Bank Transfer,WeChat Pay,15526108814,Hei Long Jiang Sheng Fo Shan Xian Xi Feng Liu Lu V Zuo  461667
LB4Y7KYJ2184750912584,Fan Liu,Vivo/X60/Blue/128GB,3,76544,229632,WINTER10,206668.80000000002,31000.32,2023-07-25 00:00:00,Failed,Shipped,Credit Card,Visa,18272743752,He Nan Sheng Yong An Xian Xiao Shan Chao Hu Lu C Zuo  397150
2G11QYN23184750912747,Li Hong,Huawei/P40/White/128GB,9,77079,693711,NEWYEAR25,520283.25,78042.4875,2023-07-25 00:00:00,Paid,Delivered,Credit Card,PayPal,15854225313,Ao Men Te Bie Xing Zheng Qu Xue Shi Fang Shan Nan Ning Lu K Zuo  897026
6MQBXNPBO184750912927,Zhou Gui Lan,OnePlus/9/Black/8GB,10,149949,1499490,FESTIVE30,1049643.0,157446.44999999998,2023-07-25 00:00:00,Paid,Delivered,Bank Transfer,MasterCard,14540699418,He Bei Sheng Hu He Hao Te Xian Huang Pu Li Jie L Zuo  882825
QU3YDJQBO184750913113,Wu Xiu Zhen,Vivo/X60/White/254GB,2,143617,287234,WINTER10,258510.6,38776.59,2023-07-25 00:00:00,Paid,Pending,Debit Card,Visa,13464416556,Zhe Jiang Sheng Bing Xian Cheng Bei Zhang Jie C Zuo  835346
QNUTM9S76184750913285,Ding Hua,OnePlus/9/Blue/8GB,8,72450,579600,AUTUMN5,550620.0,82593.0,2023-07-25 00:00:00,Paid,Shipped,Bank Transfer,MasterCard,18992701807,Gui Zhou Sheng Jing Shi Sha Shi Nan Chang Lu D Zuo  280802
TGTZP62XY184750913447,Zhang Yan,Xiaomi/Mi 11/Red/1TB,10,110026,1100260,NEWYEAR25,825195.0,123779.25,2023-07-25 00:00:00,Pending,Pending,PayPal,WeChat Pay,13862941010,Tai Wan Sheng Jian Shi You Hao Shi Jia Zhuang Jie M Zuo  255411
LLKW0CXQP184750913606,Sun Lin,Huawei/P40/Red/254GB,9,109079,981711,WINTER10,883539.9,132530.985,2023-07-25 00:00:00,Paid,In Transit,Bank Transfer,Alipay,15700939671,Hu Nan Sheng Li Juan Xian Sha Shi Pan Lu K Zuo  806948
9KKSXXK01184750913782,Huang Jun,Galaxy/S21/Purple/254GB,3,128894,386682,NEWYEAR25,290011.5,43501.725,2023-07-25 00:00:00,Pending,In Transit,PayPal,WeChat Pay,18163467051,Liao Ning Sheng Xue Mei Xian You Hao He Shan Lu D Zuo  915552
