Order ID,Customer Name,Mobile Model,Quantity,Price per Unit,Total Price,Promotion Code,Order Amount,GST,Order Date,Payment Status,Shipping Status,Payment Method,Payment Provider,Mobile,Delivery Address
38BCG4S8G184804228275,Bao Li Hua,OnePlus/9/White/32GB,8,69174,553392,SPRING20,442713.60000000003,66407.04000000001,2023-11-18 00:00:00,Paid,In Transit,Credit Card,Alipay,13128295805,Chong Qing Shi Dan Dan Xian Nan Hu Qi Qi Ha Er Lu Y Zuo  322939
ZUEZW7ZIL184804228450,Li Peng,iPhone/13 Pro/Black/128GB,3,109190,327570,WINTER10,294813.0,44221.95,2023-11-18 00:00:00,Pending,Shipped,Bank Transfer,American Express,14577915459,Gan Su Sheng Hai Men Xian Shen Bei Xin Guo Jie Y Zuo  351057
RMW5R4PQG184804228623,Shi Qiang,iPhone/13/Red/1TB,2,79921,159842,FESTIVE30,111889.4,16783.41,2023-11-18 00:00:00,Paid,Shipped,Credit Card,Visa,18163015587,Chong Qing Shi Gui Fang Xian Dong Cheng Fu Xin Jie S Zuo  729027
NXRHFIINR184804228779,Xue Cheng,Huawei/P40/Blue/32GB,10,127657,1276570,SPRING20,1021256.0,153188.4,2023-11-18 00:00:00,Paid,Shipped,Credit Card,Alipay,15821850355,Qing Hai Sheng Hai Kou Xian Jing An Ma Jie J Zuo  738889
KUL0JFWZX184804228950,Hou Jia,iPhone/13 Pro/Blue/254GB,10,143723,1437230,AUTUMN5,1365368.5,204805.275,2023-11-18 00:00:00,Pending,In Transit,Bank Transfer,American Express,18644784206,Hei Long Jiang Sheng Wu Lu Mu Qi Xian Xiao Shan Wu Zhou Jie N Zuo  649295
B9U37SWAD184804229123,Yang Jian Guo,Oppo/Reno5/Purple/128GB,8,102976,823808,NEWYEAR25,617856.0,92678.4,2023-11-18 00:00:00,Paid,Delivered,Debit Card,WeChat Pay,13239996433,Shan Xi Sheng Peng Xian Fang Shan Wang Lu M Zuo  620350
XGU6P1OV2184804229291,Huang Xiu Ying,Xiaomi/Mi 11/Purple/254GB,10,52234,522340,AUTUMN5,496223.0,74433.45,2023-11-18 00:00:00,Pending,Shipped,Bank Transfer,Visa,15193583505,Ning Xia Hui Zu Zi Zhi Qu Jing Men Xian Cheng Dong Chen Lu N Zuo  517042
FPW5RMPSQ184804229485,Li Wei,iPhone/13 Pro/Red/64GB,5,79882,399410,WINTER10,359469.0,53920.35,2023-11-18 00:00:00,Pending,Delivered,Credit Card,Alipay,18144440999,Hai Nan Sheng Ji Nan Shi Huai Rou Wang Jie P Zuo  943876
4FGTMSWH2184804229653,Zhou Gui Rong,iPhone/13/Purple/128GB,10,135743,1357430,WINTER10,1221687.0,183253.05,2023-11-18 00:00:00,Pending,Shipped,Debit Card,PayPal,15557951490,Bei Jing Shi Ping Xian Yong Chuan Hu Jie X Zuo  897760
WWJ4OJI6I184804229822,Ren Liang,iPhone/13/White/128GB,8,102084,816672,FESTIVE30,571670.3999999999,85750.55999999998,2023-11-18 00:00:00,Paid,Delivered,Debit Card,MasterCard,15024791961,Zhe Jiang Sheng Liao Yang Xian Hai Gang Tai Yuan Jie B Zuo  499425
1MQSNLWBB184804229979,Guo Yang,iPhone/13 Pro/Red/32GB,3,52443,157329,NEWYEAR25,117996.75,17699.5125,2023-11-18 00:00:00,Failed,Delivered,Bank Transfer,PayPal,13999756069,Zhe Jiang Sheng Yu Mei Xian Xun Yang Tai Yuan Lu I Zuo  483462
EVC77P2XF184804230141,Di Feng Lan,Huawei/P40/Blue/254GB,7,145560,1018920,SUMMER15,866082.0,129912.29999999999,2023-11-18 00:00:00,Paid,Delivered,Debit Card,PayPal,13255470686,Si Chuan Sheng Bing Xian Feng Dou Wei Lu Z Zuo  888906
SSVQ0YK35184804230310,Yang Ping,iPhone/13 Pro/Black/64GB,1,62141,62141,WINTER10,55926.9,8389.035,2023-11-18 00:00:00,Failed,Delivered,Credit Card,WeChat Pay,15981978364,Hei Long Jiang Sheng Tai Bei Xian Xing Shan Bao Lu B Zuo  412918
5GHSUCCWW184804230483,Wang Dan,Huawei/P40/White/32GB,6,97271,583626,NEWYEAR25,437719.5,65657.925,2023-11-18 00:00:00,Failed,Delivered,Bank Transfer,MasterCard,15144732951,Gui Zhou Sheng Jia He Xian Hua Long Lei Lu I Zuo  285884
L6SIPF3IO184804230651,Wang Bo,iPhone/13 Pro/White/1TB,1,113147,113147,SPRING20,90517.6,13577.640000000001,2023-11-18 00:00:00,Pending,In Transit,Debit Card,PayPal,13260036516,Guang Dong Sheng Kai Xian Chong Wen Wang Jie Z Zuo  827245
GW9B5R2P5184804230814,Wang Xin,iPhone/13 Pro/Black/1TB,8,92546,740368,NEWYEAR25,555276.0,83291.4,2023-11-18 00:00:00,Paid,Pending,Bank Transfer,American Express,15526517564,Hu Nan Sheng Wu Lu Mu Qi Shi Zhang Shou Jing Men Jie A Zuo  288518
0MCICHMTU184804230980,Ye Na,Galaxy/S21/Purple/8GB,8,147616,1180928,SUMMER15,1003788.7999999999,150568.31999999998,2023-11-18 00:00:00,Pending,Pending,Debit Card,WeChat Pay,18557936240,Gui Zhou Sheng Huai An Shi Pu Tuo Xing Lu R Zuo  120566
C1VTQB60N184804231148,Ye Xin,Oppo/Reno5/Blue/64GB,1,114959,114959,SPRING20,91967.20000000001,13795.080000000002,2023-11-18 00:00:00,Failed,Pending,Debit Card,Visa,15313740448,Qing Hai Sheng Hai Kou Shi Dong Li Fu Xin Lu I Zuo  455208
20SAMO6J7184804231303,Qiu Lin,Oppo/Reno5/Black/64GB,1,79096,79096,SUMMER15,67231.59999999999,10084.739999999998,2023-11-18 00:00:00,Failed,In Transit,Credit Card,American Express,13675248232,Liao Ning Sheng Chen Xian Xiao Shan Fu Xin Jie M Zuo  451888
LELNDLBJ8184804231457,Xu Mei,Xiaomi/Mi 11/White/254GB,1,82300,82300,FESTIVE30,57609.99999999999,8641.499999999998,2023-11-18 00:00:00,Pending,In Transit,Debit Card,MasterCard,15972158063,Ji Lin Sheng Tong Liao Shi Qing Pu Xu Jie D Zuo  669381
FYL00O1P1184804231622,Hu Xiu Mei,Galaxy/S21/Red/254GB,7,101166,708162,NEWYEAR25,531121.5,79668.22499999999,2023-11-18 00:00:00,Pending,In Transit,Bank Transfer,Visa,18220073718,Xin Jiang Wei Wu Er Zi Zhi Qu Gui Yang Shi Xiao Nan Long Jie A Zuo  581121
UBCFA3N9O184804231813,Song Jie,Vivo/X60/Red/32GB,9,126104,1134936,SPRING20,907948.8,136192.32,2023-11-18 00:00:00,Pending,Delivered,PayPal,MasterCard,13428001037,Ao Men Te Bie Xing Zheng Qu Jian Hua Xian Xiang An Yang Lu S Zuo  801369
T3EKMTJ60184804232007,Dou Fei,Galaxy/S21/Red/254GB,10,107170,1071700,SUMMER15,910945.0,136641.75,2023-11-18 00:00:00,Failed,Delivered,Bank Transfer,WeChat Pay,15821225185,Gan Su Sheng Bo Xian Bin Cheng Wang Lu O Zuo  168889
8SDKDMUEP184804232174,Zhu Hong Mei,OnePlus/9/White/8GB,7,100946,706622,WINTER10,635959.8,95393.97,2023-11-18 00:00:00,Paid,In Transit,Bank Transfer,Visa,15728283286,Bei Jing Shi Yan Shi Xiang An Nan Chang Jie N Zuo  157310
WKPGIVPGH184804232334,Si Lan Ying,Xiaomi/Mi 11/White/32GB,10,95475,954750,WINTER10,859275.0,128891.25,2023-11-18 00:00:00,Pending,In Transit,Debit Card,PayPal,18097250123,Hu Nan Sheng Mei Shi You Hao Xu Lu H Zuo  838169
D95O1M0P8184804232509,Xiao Cheng,Huawei/P40/Purple/64GB,3,63258,189774,AUTUMN5,180285.3,27042.795,2023-11-18 00:00:00,Failed,Pending,Credit Card,American Express,15765345891,Yun Nan Sheng Tian Jin Xian Gao Ming Wei Jie Z Zuo  104289
05UD0REBG184804232684,Wang Xue Mei,Galaxy/S21/Black/128GB,1,84415,84415,SUMMER15,71752.75,10762.9125,2023-11-18 00:00:00,Failed,Delivered,Bank Transfer,Visa,18253615815,Xin Jiang Wei Wu Er Zi Zhi Qu Li Li Shi Shen Bei Xin Hang Zhou Jie W Zuo  118267
9UJ8VY38V184804232869,Xie Hao,Oppo/Reno5/Purple/254GB,7,133579,935053,AUTUMN5,888300.35,133245.0525,2023-11-18 00:00:00,Failed,Delivered,Bank Transfer,American Express,15507763855,Nei Meng Gu Zi Zhi Qu Liao Yang Shi Xing Shan Xu Jie Q Zuo  327296
SQH0TL9LK184804233095,Du Bin,OnePlus/9/White/128GB,1,133379,133379,NEWYEAR25,100034.25,15005.137499999999,2023-11-18 00:00:00,Paid,Shipped,Debit Card,PayPal,13717862768,Shang Hai Shi Chong Qing Shi Jiang Bei Zheng Zhou Jie S Zuo  179211
5BJ3IO5EA184804233284,Li Juan,iPhone/13 Pro/Black/254GB,9,147318,1325862,SUMMER15,1126982.7,169047.405,2023-11-18 00:00:00,Pending,Pending,Credit Card,American Express,13674330992,Gui Zhou Sheng Liu Pan Shui Xian Zhang Shou Zhong Jie M Zuo  960510
528YOC7HM184804233475,Deng Jian Hua,OnePlus/9/White/254GB,2,55755,111510,SPRING20,89208.0,13381.199999999999,2023-11-18 00:00:00,Failed,Shipped,Bank Transfer,Visa,13478743691,Ning Xia Hui Zu Zi Zhi Qu Gang Shi Dong Li Zheng Jie K Zuo  795526
8N2AGFVDV184804233674,Pi Bo,iPhone/13 Pro/Blue/254GB,5,85655,428275,SPRING20,342620.0,51393.0,2023-11-18 00:00:00,Failed,Shipped,PayPal,Visa,13920570912,Tian Jin Shi Yi Du Shi Cheng Bei Zhao Jie H Zuo  371745
YMUK232ET184804233851,Guo Chao,iPhone/13/Black/32GB,8,127018,1016144,SUMMER15,863722.4,129558.36,2023-11-18 00:00:00,Failed,Shipped,Bank Transfer,Visa,18827258456,Shan Dong Sheng Qian Jiang Shi Xiu Ying Chong Qing Jie O Zuo  293395
IYZTHNXF8184804234018,Yu Hong,iPhone/13 Pro/Blue/32GB,3,147424,442272,SPRING20,353817.60000000003,53072.64000000001,2023-11-18 00:00:00,Pending,Pending,Bank Transfer,Visa,15303997022,Gui Zhou Sheng Hai Kou Shi Shen He Xi Ning Jie P Zuo  346411
LPK8QQ3JQ184804234182,Geng Yu Zhen,iPhone/13 Pro/Purple/128GB,1,75140,75140,SUMMER15,63869.0,9580.35,2023-11-18 00:00:00,Paid,Delivered,Debit Card,Visa,15912311390,Nei Meng Gu Zi Zhi Qu Li Shi Xu Hui Zhang Lu D Zuo  153701
XFLBV1AGZ184804234373,Luo Lin,iPhone/13 Pro/White/64GB,4,107794,431176,SPRING20,344940.80000000005,51741.12,2023-11-18 00:00:00,Failed,Delivered,Bank Transfer,MasterCard,13335644405,Nei Meng Gu Zi Zhi Qu Zhang Jia Gang Shi Min Xing Su Jie P Zuo  276580
1607HT8FH184804234570,Lin Fan,Galaxy/S21/Red/32GB,7,70641,494487,FESTIVE30,346140.89999999997,51921.134999999995,2023-11-18 00:00:00,Failed,Pending,Bank Transfer,MasterCard,15937068440,Gui Zhou Sheng Nan Ning Xian You Hao Hu Jie E Zuo  517780
DINKK773O184804234743,Li Jian,Galaxy/S21/White/254GB,8,73561,588488,AUTUMN5,559063.6,83859.54,2023-11-18 00:00:00,Failed,Delivered,Debit Card,American Express,18094835414,Yun Nan Sheng Nan Jing Xian Huang Pu Hang Zhou Jie O Zuo  128717
UOOOOWW2T184804234905,Sun Gui Xiang,Galaxy/S21/Red/8GB,7,126700,886900,WINTER10,798210.0,119731.5,2023-11-18 00:00:00,Pending,Shipped,PayPal,Visa,13662808106,Gui Zhou Sheng Ha Er Bin Xian Sha Shi Kun Ming Lu M Zuo  819297
RG16LLDC0184804235080,Lin Kai,Huawei/P40/White/1TB,6,56478,338868,WINTER10,304981.2,45747.18,2023-11-18 00:00:00,Pending,Delivered,PayPal,PayPal,18207638131,Hei Long Jiang Sheng Xiu Fang Xian Nan Xi Wu Han Lu J Zuo  185083
F6NKJXXXS184804235255,Ceng Xiu Rong,OnePlus/9/Purple/64GB,4,50056,200224,SPRING20,160179.2,24026.88,2023-11-18 00:00:00,Failed,Delivered,Credit Card,PayPal,18091638141,Ji Lin Sheng Shu Zhen Shi Hai Ling Shao Lu M Zuo  543806
TT5QC30R2184804235436,Zou Ning,Oppo/Reno5/Purple/8GB,10,149018,1490180,SPRING20,1192144.0,178821.6,2023-11-18 00:00:00,Pending,Shipped,Debit Card,Alipay,18053753864,Tai Wan Sheng Shan Wei Shi Dong Cheng Chen Jie N Zuo  514274
H2IQ09576184804235609,Yang Gui Zhi,Huawei/P40/Black/1TB,7,110272,771904,FESTIVE30,540332.7999999999,81049.91999999998,2023-11-18 00:00:00,Paid,In Transit,PayPal,American Express,15398872340,Hai Nan Sheng Yong An Shi Gao Ping Shao Lu J Zuo  428535
CTSDY5IXH184804235786,Lin Yun,Huawei/P40/Black/254GB,6,79783,478698,SUMMER15,406893.3,61033.994999999995,2023-11-18 00:00:00,Pending,In Transit,Bank Transfer,American Express,14712348070,Si Chuan Sheng Zhang Jia Gang Xian Xi Shan Zhu Jie F Zuo  771095
XIBWYXYYW184804235965,Zhu Xiu Lan,OnePlus/9/Purple/32GB,5,70904,354520,SPRING20,283616.0,42542.4,2023-11-18 00:00:00,Pending,Shipped,PayPal,Visa,14557371387,Si Chuan Sheng Nan Chang Shi Xi Shan Ban Jie C Zuo  304068
ER17TBZB1184804236141,Xiao Xiu Rong,iPhone/13/Blue/8GB,9,135944,1223496,FESTIVE30,856447.2,128467.07999999999,2023-11-18 00:00:00,Failed,In Transit,Bank Transfer,PayPal,14739521618,Guang Xi Zhuang Zu Zi Zhi Qu Gui Rong Shi Dong Li Zhu Jie R Zuo  532430
QF2KV9YF6184804236339,Dan Yong,Huawei/P40/Purple/8GB,5,59157,295785,WINTER10,266206.5,39930.975,2023-11-18 00:00:00,Paid,In Transit,Bank Transfer,PayPal,13471289044,Chong Qing Shi Ting Xian Xiao Nan Gui Yang Lu K Zuo  212110
CG7O14LKD184804236499,Li Li,iPhone/13/Purple/8GB,5,135950,679750,WINTER10,611775.0,91766.25,2023-11-18 00:00:00,Paid,In Transit,Debit Card,PayPal,13357022253,Gui Zhou Sheng Hu He Hao Te Shi Nan Zhang Sun Lu U Zuo  998357
G8M646R2L184804236682,Chen Xue,Oppo/Reno5/White/32GB,6,136411,818466,FESTIVE30,572926.2,85938.93,2023-11-18 00:00:00,Paid,Pending,Debit Card,WeChat Pay,15330451822,Zhe Jiang Sheng Xiang Gang Shi Bi Shan Liu Pan Shui Lu Q Zuo  420822
HG41SCK78184804236849,Cao Xin,iPhone/13/Red/32GB,4,51290,205160,FESTIVE30,143612.0,21541.8,2023-11-18 00:00:00,Paid,Delivered,Debit Card,Alipay,13372606968,Liao Ning Sheng Yu Hua Xian Sha Wan Guang Zhou Lu R Zuo  457495
66BB79QZA184804237012,Jia Qiang,Huawei/P40/White/128GB,4,106920,427680,AUTUMN5,406296.0,60944.399999999994,2023-11-18 00:00:00,Pending,Pending,Credit Card,WeChat Pay,14566299079,Tian Jin Shi Hai Yan Shi Da Xing Hu Lu K Zuo  201905
RYS2LBGLE184804237188,Chen Bo,Vivo/X60/Red/64GB,8,65368,522944,AUTUMN5,496796.8,74519.51999999999,2023-11-18 00:00:00,Pending,Delivered,PayPal,Visa,13934381121,Tai Wan Sheng Yan Xian Wei Dou Geng Lu N Zuo  641185
M1I0OOZWS184804237353,Zhou Yu Lan,Vivo/X60/Red/8GB,3,50080,150240,FESTIVE30,105168.0,15775.199999999999,2023-11-18 00:00:00,Pending,Delivered,Bank Transfer,MasterCard,15608736671,Jiang Xi Sheng Cheng Du Xian Ping Shan Wu Zhou Lu G Zuo  675548
9A94ABY28184804237518,Peng Bo,Vivo/X60/Purple/64GB,10,119352,1193520,SPRING20,954816.0,143222.4,2023-11-18 00:00:00,Failed,Pending,Bank Transfer,PayPal,15743274703,He Nan Sheng Fo Shan Shi Ji Zhou Ao Men Lu G Zuo  824063
3WCV4JYVH184804237680,Li Xiu Yun,Xiaomi/Mi 11/Red/8GB,1,118109,118109,SPRING20,94487.20000000001,14173.080000000002,2023-11-18 00:00:00,Paid,Pending,Credit Card,Visa,15914287262,Hu Bei Sheng He Fei Shi Zi Chuan Liang Lu Q Zuo  736254
MH8BK53EJ184804237857,Peng Ying,Galaxy/S21/Red/32GB,5,137575,687875,FESTIVE30,481512.49999999994,72226.87499999999,2023-11-18 00:00:00,Pending,In Transit,Bank Transfer,MasterCard,15171385920,Hu Nan Sheng Shen Zhen Shi Bai Yun Song Jie E Zuo  983771
GS89JC3A2184804238028,Ren Na,OnePlus/9/Blue/32GB,2,126612,253224,NEWYEAR25,189918.0,28487.7,2023-11-18 00:00:00,Failed,Shipped,Debit Card,Visa,13235700981,Tai Wan Sheng Rong Shi Xiang An Liang Lu F Zuo  143838
DM5WW6I36184804238194,Li Jia,OnePlus/9/Blue/128GB,8,61503,492024,SPRING20,393619.2,59042.88,2023-11-18 00:00:00,Pending,Delivered,Credit Card,PayPal,13662181310,Hai Nan Sheng Chong Qing Xian Nan Zhang Hai Kou Jie C Zuo  918928
V4CNLNIFF184804238352,Ban Gui Xiang,Galaxy/S21/White/254GB,9,99549,895941,SPRING20,716752.8,107512.92,2023-11-18 00:00:00,Paid,Shipped,Debit Card,Alipay,15212898515,Xin Jiang Wei Wu Er Zi Zhi Qu Jun Xian You Hao Huang Jie J Zuo  156006
FIFDW0IVE184804238543,Li Lei,iPhone/13 Pro/White/64GB,6,124530,747180,AUTUMN5,709821.0,106473.15,2023-11-18 00:00:00,Failed,In Transit,PayPal,Visa,18653703383,Hai Nan Sheng Shen Yang Xian He Chuan Hai Men Lu T Zuo  547632
TB9TDNDMQ184804238702,Wang Lan Ying,Oppo/Reno5/Red/64GB,3,107058,321174,AUTUMN5,305115.3,45767.295,2023-11-18 00:00:00,Paid,In Transit,Bank Transfer,Visa,15307930642,Hu Bei Sheng Feng Lan Shi Chong Wen Shen Yang Jie V Zuo  273392
4CIAV5QKG184804238868,Qian Cheng,Xiaomi/Mi 11/Red/64GB,7,116483,815381,NEWYEAR25,611535.75,91730.3625,2023-11-18 00:00:00,Paid,Delivered,Debit Card,Alipay,15308037392,He Bei Sheng Kun Ming Xian Liang Ping Wang Jie A Zuo  769554
IPB9NU7XN184804239042,Chen Li Li,Vivo/X60/Red/8GB,9,101557,914013,AUTUMN5,868312.35,130246.8525,2023-11-18 00:00:00,Paid,Delivered,PayPal,Alipay,15538238131,Yun Nan Sheng Shen Yang Shi Min Xing Qian Jiang Jie M Zuo  917441
FK0EF4NJZ184804239206,Zhou Xiu Mei,Huawei/P40/Blue/32GB,10,100269,1002690,SPRING20,802152.0,120322.79999999999,2023-11-18 00:00:00,Pending,Delivered,Credit Card,Alipay,15363145389,Ji Lin Sheng Hong Xia Shi Xiang An Fu Xin Lu X Zuo  704643
KSY3F5FMN184804239372,Peng Shuai,Vivo/X60/Black/64GB,6,107057,642342,WINTER10,578107.8,86716.17,2023-11-18 00:00:00,Pending,Pending,Bank Transfer,WeChat Pay,14766264323,Xi Zang Zi Zhi Qu Xiu Fang Shi Hai Gang Li Jie I Zuo  152724
Z1E2N4RZV184804239553,Meng Hui,Xiaomi/Mi 11/Black/8GB,7,137822,964754,SPRING20,771803.2000000001,115770.48000000001,2023-11-18 00:00:00,Pending,Delivered,PayPal,American Express,14768139435,Hu Bei Sheng Fu Zhou Xian Feng Dou Nan Jing Lu T Zuo  575005
1OPLLE3HD184804239713,Sun Jian Ping,Oppo/Reno5/Red/1TB,9,124443,1119987,FESTIVE30,783990.8999999999,117598.63499999998,2023-11-18 00:00:00,Failed,In Transit,Bank Transfer,Alipay,18981257581,Gui Zhou Sheng Lan Ying Shi Feng Dou Mao Jie G Zuo  187031
SNNLDJG56184804239889,Ceng Jie,Oppo/Reno5/Red/8GB,3,82882,248646,FESTIVE30,174052.19999999998,26107.829999999998,2023-11-18 00:00:00,Pending,In Transit,Debit Card,MasterCard,13972575354,Zhe Jiang Sheng Chang Xian Xiao Nan Chao Zhou Lu R Zuo  752292
49W4S2N8H184804240046,Xu Xu,Galaxy/S21/Purple/32GB,2,91384,182768,WINTER10,164491.2,24673.68,2023-11-18 00:00:00,Pending,Pending,PayPal,MasterCard,14799693914,Si Chuan Sheng Ting Shi Qing Cheng Chen Lu K Zuo  373760
11BAVHZ13184804240213,Feng Hai Yan,iPhone/13/Red/254GB,5,113821,569105,SPRING20,455284.0,68292.59999999999,2023-11-18 00:00:00,Failed,Shipped,Debit Card,Visa,13972129846,Xi Zang Zi Zhi Qu Dan Xian Bin Cheng Dong Lu E Zuo  148210
QI9B4DE20184804240396,Shao Fei,Galaxy/S21/Blue/32GB,9,112786,1015074,FESTIVE30,710551.7999999999,106582.76999999999,2023-11-18 00:00:00,Paid,Shipped,Debit Card,WeChat Pay,13909337543,Jiang Su Sheng Yi Dou Xian Hua Xi Chao Zhou Lu J Zuo  710686
XYA923IP5184804240555,Zhang Xiu Lan,OnePlus/9/White/254GB,6,53367,320202,SUMMER15,272171.7,40825.755,2023-11-18 00:00:00,Failed,Shipped,PayPal,American Express,13102222417,Ao Men Te Bie Xing Zheng Qu Fu Xin Shi Men Tou Gou Han Dan Jie Y Zuo  286214
BJ8SNQMC8184804240747,Xu Li Li,Oppo/Reno5/Purple/128GB,1,112833,112833,AUTUMN5,107191.34999999999,16078.702499999998,2023-11-18 00:00:00,Paid,In Transit,Credit Card,MasterCard,18588184868,Bei Jing Shi Nan Chang Xian Qing He Tai Yuan Jie Z Zuo  412684
H6L5YMZ43184804240912,You Xiu Lan,Vivo/X60/White/254GB,10,54996,549960,WINTER10,494964.0,74244.59999999999,2023-11-18 00:00:00,Failed,In Transit,Bank Transfer,Alipay,15284148370,An Hui Sheng Guan Ling Shi Fang Shan Hu Lu U Zuo  567507
7Z9UO2947184804241087,Zhang Hong Mei,iPhone/13 Pro/Purple/1TB,4,92637,370548,NEWYEAR25,277911.0,41686.65,2023-11-18 00:00:00,Paid,Delivered,Debit Card,WeChat Pay,18981636052,Tai Wan Sheng Ming Shi Bi Shan You Jie R Zuo  367296
EDN0VN3YZ184804241255,Zheng Ying,iPhone/13/Blue/128GB,3,88534,265602,SPRING20,212481.6,31872.239999999998,2023-11-18 00:00:00,Pending,Pending,PayPal,Alipay,13661125506,Hu Nan Sheng Qian Xian Men Tou Gou Yong An Lu Y Zuo  691788
BFRQ98LWZ184804241415,Chen Xin,Huawei/P40/White/1TB,10,87369,873690,WINTER10,786321.0,117948.15,2023-11-18 00:00:00,Failed,In Transit,Credit Card,PayPal,15894714339,Chong Qing Shi Lu An Shi Ping Shan Shang Hai Lu Z Zuo  256987
TLO7U31T5184804241578,Bao Rong,iPhone/13/Red/254GB,10,98123,981230,SPRING20,784984.0,117747.59999999999,2023-11-18 00:00:00,Paid,Shipped,Bank Transfer,American Express,13192995285,Fu Jian Sheng Gui Fang Xian Xi Shan Chen Lu J Zuo  949650
V2TQ0K0GJ184804241746,Zhou Ying,Xiaomi/Mi 11/Black/254GB,10,92688,926880,NEWYEAR25,695160.0,104274.0,2023-11-18 00:00:00,Paid,Pending,Bank Transfer,American Express,15812416472,Xin Jiang Wei Wu Er Zi Zhi Qu Fo Shan Shi Sha Wan Zhou Lu I Zuo  487491
4ZTUZW88H184804241933,Li Xiu Fang,iPhone/13/White/32GB,10,96656,966560,WINTER10,869904.0,130485.59999999999,2023-11-18 00:00:00,Failed,Delivered,Debit Card,MasterCard,13707726087,Ning Xia Hui Zu Zi Zhi Qu Juan Shi Shang Jie Chang Chun Jie B Zuo  368026
FDH3A6UPG184804242115,Suo Xiu Ying,Oppo/Reno5/White/64GB,10,79646,796460,SPRING20,637168.0,95575.2,2023-11-18 00:00:00,Failed,In Transit,Bank Transfer,Visa,15979368799,Gan Su Sheng Yan Xian Xi Xia Jiang Lu Q Zuo  915006
55GC8U33L184804242288,Ge Ming,iPhone/13 Pro/Black/32GB,3,149087,447261,SUMMER15,380171.85,57025.7775,2023-11-18 00:00:00,Pending,In Transit,Bank Transfer,Alipay,14766100715,Shan Xi Sheng Xing Cheng Shi Xun Yang Yang Lu O Zuo  271616
W03SM22VU184804242465,Li Qiang,iPhone/13/Blue/32GB,3,80996,242988,WINTER10,218689.2,32803.38,2023-11-18 00:00:00,Pending,Pending,Debit Card,WeChat Pay,18784474697,Qing Hai Sheng Guan Ling Xian Hua Long Xiao Jie P Zuo  769379
Y7JRVAUS7184804242638,Zhu Yu,Oppo/Reno5/Black/32GB,2,101999,203998,SUMMER15,173398.3,26009.745,2023-11-18 00:00:00,Paid,Delivered,PayPal,PayPal,13151733774,Bei Jing Shi Fu Xin Shi Yong Chuan Shang Hai Jie N Zuo  575276
4LYICWHZR184804242801,Ke Shuai,Xiaomi/Mi 11/Red/8GB,7,67791,474537,AUTUMN5,450810.14999999997,67621.52249999999,2023-11-18 00:00:00,Paid,In Transit,Credit Card,Alipay,13578107883,Tian Jin Shi Feng Ying Xian You Hao Xiang Gang Lu S Zuo  352531
WZAWDAA2A184804242963,Wang Fei,Oppo/Reno5/Blue/1TB,4,133012,532048,NEWYEAR25,399036.0,59855.399999999994,2023-11-18 00:00:00,Failed,In Transit,Credit Card,Alipay,15331825321,Ji Lin Sheng Zhang Jia Gang Shi Shen Bei Xin Li Jie P Zuo  123721
9I9LIUJ3P184804243147,Wang Xia,iPhone/13/Red/32GB,8,118371,946968,AUTUMN5,899619.6,134942.94,2023-11-18 00:00:00,Paid,Pending,PayPal,American Express,15928690926,Qing Hai Sheng Yu Xian Ji Zhou Xing An Meng Lu A Zuo  423585
DHGFU2AT7184804243308,Su Shu Ying,Huawei/P40/Blue/128GB,3,149379,448137,SUMMER15,380916.45,57137.4675,2023-11-18 00:00:00,Pending,In Transit,PayPal,American Express,18956177964,Liao Ning Sheng Xiao Hong Xian Shen He Mou Jie N Zuo  545268
KN1EOKKOO184804243485,Zhao Ying,iPhone/13 Pro/Black/32GB,6,84162,504972,FESTIVE30,353480.39999999997,53022.05999999999,2023-11-18 00:00:00,Paid,Shipped,Credit Card,PayPal,15026176193,Hu Bei Sheng Hui Xian Huai Rou Ma Jie N Zuo  729742
FXVVYVUJI184804243652,Wang Yu,iPhone/13/Red/128GB,3,54679,164037,NEWYEAR25,123027.75,18454.1625,2023-11-18 00:00:00,Failed,Pending,Debit Card,MasterCard,18591159000,Xin Jiang Wei Wu Er Zi Zhi Qu Qian Xian Liang Ping Xu Jie U Zuo  959922
UG118Y2QW184804243833,Jiang Chao,OnePlus/9/Purple/254GB,9,144344,1299096,FESTIVE30,909367.2,136405.08,2023-11-18 00:00:00,Pending,Pending,Credit Card,American Express,14576084675,Shan Xi Sheng Cheng Du Xian Shen He Duan Jie V Zuo  165302
9T7RITF16184804244005,Wang Dan,Oppo/Reno5/White/64GB,5,75993,379965,WINTER10,341968.5,51295.275,2023-11-18 00:00:00,Failed,In Transit,Credit Card,MasterCard,15725506898,Yun Nan Sheng Cheng Du Shi Xing Shan Zhang Jie E Zuo  418208
IRMNHB24H184804244263,Lu Yu Zhen,Huawei/P40/Red/64GB,4,93353,373412,SUMMER15,317400.2,47610.03,2023-11-18 00:00:00,Failed,Delivered,PayPal,PayPal,13759068808,He Nan Sheng Hu He Hao Te Shi Feng Dou Sun Jie J Zuo  719933
L8LLCRJLC184804244446,Hou Chang,iPhone/13/Black/32GB,2,99611,199222,SUMMER15,169338.69999999998,25400.804999999997,2023-11-18 00:00:00,Paid,Shipped,Bank Transfer,Visa,15754338010,Jiang Su Sheng La Sa Shi Feng Dou Shen Yang Lu M Zuo  413682
QHF72RI1Q184804244606,Cao Xiu Yun,Vivo/X60/White/64GB,6,60958,365748,WINTER10,329173.2,49375.98,2023-11-18 00:00:00,Pending,Delivered,Debit Card,PayPal,13830314521,Zhe Jiang Sheng Liu Zhou Shi Xi Feng Tian Jin Lu U Zuo  732945
XW8MXEM4D184804244770,Dai Chen,Oppo/Reno5/Purple/64GB,10,60905,609050,SPRING20,487240.0,73086.0,2023-11-18 00:00:00,Pending,Delivered,PayPal,MasterCard,15335668629,Hu Nan Sheng Xin Shi Huang Pu Wang Jie B Zuo  465775
9CO95WU6O184804244934,Zhu Yan,Vivo/X60/White/32GB,3,96524,289572,SPRING20,231657.6,34748.64,2023-11-18 00:00:00,Pending,Shipped,Debit Card,American Express,14534719547,Ao Men Te Bie Xing Zheng Qu Fei Shi Gao Ming Guang Zhou Lu K Zuo  945894
73MJZ7SWL184804245108,Zhang Zhi Qiang,iPhone/13/Purple/254GB,3,73503,220509,AUTUMN5,209483.55,31422.532499999998,2023-11-18 00:00:00,Pending,In Transit,Credit Card,Visa,13523423779,Hei Long Jiang Sheng Ting Ting Shi He Chuan Wang Lu U Zuo  578495
Q5SKYETU5184804245289,Chen Hong Xia,Galaxy/S21/Blue/1TB,4,69738,278952,WINTER10,251056.80000000002,37658.520000000004,2023-11-18 00:00:00,Paid,Delivered,PayPal,Visa,18866173031,Zhe Jiang Sheng Lu An Shi Hai Gang Lei Jie D Zuo  610474
73HFCX3GJ184804245464,Xie Rong,Vivo/X60/Blue/1TB,4,107934,431736,WINTER10,388562.4,58284.36,2023-11-18 00:00:00,Paid,In Transit,PayPal,MasterCard,14576138258,Yun Nan Sheng Jing Men Shi Shang Jie Bei Zhen Lu B Zuo  462267
DAGTDFRZY184804245622,Lu Fang,Xiaomi/Mi 11/Purple/254GB,10,108004,1080040,SUMMER15,918034.0,137705.1,2023-11-18 00:00:00,Failed,In Transit,Debit Card,Visa,15024805360,Zhe Jiang Sheng Xiu Ying Xian Xiao Shan Shan Wei Jie Z Zuo  209392
SRCEGI0ZA184804245780,Shi Feng Ying,Xiaomi/Mi 11/Purple/8GB,1,97689,97689,SPRING20,78151.2,11722.679999999998,2023-11-18 00:00:00,Paid,Delivered,Credit Card,American Express,13266410545,Hu Bei Sheng Ying Xian Shang Jie Lan Zhou Lu L Zuo  642612
XYSJQ980I184804245940,Wang Li Li,iPhone/13/White/128GB,6,102528,615168,AUTUMN5,584409.6,87661.43999999999,2023-11-18 00:00:00,Pending,In Transit,Debit Card,MasterCard,15997467226,Si Chuan Sheng Jun Xian Hai Gang Zhao Jie W Zuo  241555
T1L0UFJHN184804246110,Chen Chao,iPhone/13 Pro/White/254GB,2,71005,142010,SPRING20,113608.0,17041.2,2023-11-18 00:00:00,Paid,In Transit,PayPal,Visa,14546894873,Gan Su Sheng Chao Hu Shi Huai Rou Fu Zhou Lu Q Zuo  241278
V33EE8P6I184804246271,Chen Xin,iPhone/13/White/32GB,3,98123,294369,SPRING20,235495.2,35324.28,2023-11-18 00:00:00,Failed,Pending,Credit Card,American Express,14507128478,An Hui Sheng Hua Xian Liang Ping Fu Xin Jie U Zuo  604152
TLFFLGUE6184804246423,Lu Lei,Galaxy/S21/Black/8GB,3,89321,267963,SUMMER15,227768.55,34165.282499999994,2023-11-18 00:00:00,Failed,Pending,PayPal,WeChat Pay,18898678641,Shan Xi Sheng He Fei Xian Hai Ling Ye Lu N Zuo  912583
8ZQ0XA1R4184804246596,Zhuang Xiu Rong,Vivo/X60/White/1TB,8,63863,510904,FESTIVE30,357632.8,53644.92,2023-11-18 00:00:00,Failed,Delivered,Credit Card,American Express,14586586423,Hai Nan Sheng Qian Jiang Shi Huang Pu Lin Lu W Zuo  552209
14EK3DMOT184804246771,Zhang Gui Ying,Huawei/P40/Red/64GB,9,65685,591165,SUMMER15,502490.25,75373.53749999999,2023-11-18 00:00:00,Pending,Pending,Bank Transfer,PayPal,15158305642,Xin Jiang Wei Wu Er Zi Zhi Qu Cheng Shi An Ci Tian Jin Lu F Zuo  117187
BRVSTBNCH184804246949,Chen Shuai,iPhone/13/Blue/32GB,9,149517,1345653,WINTER10,1211087.7,181663.155,2023-11-18 00:00:00,Failed,Pending,Bank Transfer,PayPal,13014233908,Ji Lin Sheng Bei Jing Shi Hai Gang Ha Er Bin Jie W Zuo  651087
