Order ID,Customer Name,Mobile Model,Quantity,Price per Unit,Total Price,Promotion Code,Order Amount,GST,Order Date,Payment Status,Shipping Status,Payment Method,Payment Provider,Mobile,Delivery Address
6PNJI0G5F184740553735,Pan Bing,iPhone/13/Purple/32GB,5,60485,302425,NEWYEAR25,226818.75,34022.8125,2023-05-06 00:00:00,Paid,Shipped,Credit Card,Alipay,18782690826,Nei Meng Gu Zi Zhi Qu Jun Xian Hai Ling Liu Jie Z Zuo  360834
3U2POYIME184740553912,Lv Bo,OnePlus/9/Purple/32GB,10,146501,1465010,NEWYEAR25,1098757.5,164813.625,2023-05-06 00:00:00,Pending,Delivered,Debit Card,MasterCard,15341086474,Yun Nan Sheng Lu An Xian Hua Xi Cheng Jie F Zuo  391895
3V6C9TL4K184740554082,Wang Long,iPhone/13/Black/32GB,1,118477,118477,SUMMER15,100705.45,15105.8175,2023-05-06 00:00:00,Pending,In Transit,PayPal,WeChat Pay,14547298058,Shan Xi Sheng Xin Ji Xian Qing Pu Su Lu A Zuo  109615
6P4Y1ZERQ184740554253,Zhou Qin,Galaxy/S21/White/8GB,3,110247,330741,FESTIVE30,231518.69999999998,34727.80499999999,2023-05-06 00:00:00,Paid,Delivered,Debit Card,WeChat Pay,14793197469,Hu Nan Sheng Han Dan Shi Xi Xia Xi An Lu E Zuo  995878
HGQZZ2RV2184740554408,Chen Xia,iPhone/13/White/128GB,8,122933,983464,SPRING20,786771.2000000001,118015.68000000001,2023-05-06 00:00:00,Paid,Delivered,Debit Card,MasterCard,13801164393,Nei Meng Gu Zi Zhi Qu Huai An Shi Dong Li Fo Shan Lu R Zuo  714648
OG4WQB7U9184740554580,Xu Yan,Xiaomi/Mi 11/Black/8GB,9,84636,761724,SUMMER15,647465.4,97119.81,2023-05-06 00:00:00,Paid,Delivered,Bank Transfer,MasterCard,18877082234,Guang Xi Zhuang Zu Zi Zhi Qu Shu Zhen Shi Zhang Shou Jia He Lu U Zuo  115420
CQFXI0XIE184740554757,Jia Fan,Galaxy/S21/Red/64GB,5,142927,714635,SUMMER15,607439.75,91115.9625,2023-05-06 00:00:00,Paid,Delivered,Bank Transfer,Visa,13109272227,Si Chuan Sheng Liu Pan Shui Shi Xu Hui Shi Jia Zhuang Jie C Zuo  659073
HI752446N184740554926,Cao Xiu Mei,Vivo/X60/Blue/8GB,10,139696,1396960,FESTIVE30,977871.9999999999,146680.8,2023-05-06 00:00:00,Paid,In Transit,Bank Transfer,Visa,13628133965,Qing Hai Sheng Guan Ling Xian Ji Zhou Kang Lu I Zuo  670570
3OM5K58JJ184740555100,Zhang Gang,iPhone/13/Purple/254GB,7,136447,955129,AUTUMN5,907372.5499999999,136105.88249999998,2023-05-06 00:00:00,Failed,In Transit,Bank Transfer,PayPal,15159825796,Chong Qing Shi Gui Yang Shi He Ping Wang Jie Y Zuo  281212
NC31947UO184740555268,Huang Hui,iPhone/13/Black/32GB,3,127479,382437,SPRING20,305949.60000000003,45892.44,2023-05-06 00:00:00,Failed,Pending,Credit Card,Visa,18929930370,Fu Jian Sheng Xiao Hong Shi Xing Shan Yang Lu J Zuo  987189
49PXIF9GX184740555440,Li Liang,Xiaomi/Mi 11/Purple/32GB,2,140499,280998,FESTIVE30,196698.59999999998,29504.789999999994,2023-05-06 00:00:00,Failed,Delivered,Credit Card,MasterCard,13780188433,Jiang Su Sheng Yong An Xian Gao Ming Nie Jie B Zuo  373298
3QISME01S184740555606,Ma Yun,Huawei/P40/Blue/8GB,5,149485,747425,NEWYEAR25,560568.75,84085.3125,2023-05-06 00:00:00,Failed,In Transit,Bank Transfer,MasterCard,15641562017,Nei Meng Gu Zi Zhi Qu Tai Bei Xian Liu Zhi Te Wu Han Lu T Zuo  154457
NTQZBXG4S184740555783,Cha Ying,Oppo/Reno5/Black/64GB,5,134685,673425,AUTUMN5,639753.75,95963.0625,2023-05-06 00:00:00,Pending,Delivered,PayPal,American Express,13584670146,Si Chuan Sheng Zhang Sha Xian Qing He Jin Jie U Zuo  917120
BOSEDCBV5184740555954,Wang Yong,iPhone/13 Pro/Blue/1TB,2,145614,291228,SPRING20,232982.40000000002,34947.36,2023-05-06 00:00:00,Paid,Shipped,Debit Card,MasterCard,14549370885,Hu Bei Sheng Xin Shi Hai Ling Chen Lu T Zuo  209617
9MAX2593W184740556116,Bai Jia,Oppo/Reno5/White/64GB,2,99201,198402,FESTIVE30,138881.4,20832.21,2023-05-06 00:00:00,Paid,Pending,Bank Transfer,PayPal,18758651427,Ji Lin Sheng Bin Shi Qing Pu Wang Jie X Zuo  471502
G20H74B4S184740556278,Gao Hai Yan,iPhone/13/Red/64GB,1,101450,101450,FESTIVE30,71015.0,10652.25,2023-05-06 00:00:00,Pending,Delivered,Bank Transfer,PayPal,18042830163,Gan Su Sheng Gang Shi Shan Ting Xiang Gang Lu M Zuo  639113
T87CYULPQ184740556434,Zhang Bin,Xiaomi/Mi 11/Blue/32GB,8,97960,783680,SPRING20,626944.0,94041.59999999999,2023-05-06 00:00:00,Pending,Delivered,Credit Card,MasterCard,15931793561,He Bei Sheng Jian Ping Xian Xiang An Da Ye Jie U Zuo  619065
MBPYFMKNJ184740556593,Yan Shu Zhen,OnePlus/9/Red/64GB,9,102162,919458,SPRING20,735566.4,110334.96,2023-05-06 00:00:00,Paid,Pending,PayPal,Visa,13214448159,Gan Su Sheng Tong Liao Shi Nan Xi Bao Jie B Zuo  756448
GW3V29Q0N184740556770,Gan Hui,Galaxy/S21/Black/254GB,10,130930,1309300,SPRING20,1047440.0,157116.0,2023-05-06 00:00:00,Pending,In Transit,Debit Card,WeChat Pay,15986935805,An Hui Sheng Yi Du Shi Xu Hui Han Dan Jie G Zuo  241278
ZESMGPZ2O184740556928,Tong Bo,iPhone/13/White/8GB,4,134795,539180,FESTIVE30,377426.0,56613.9,2023-05-06 00:00:00,Failed,Shipped,Bank Transfer,American Express,14522664763,Chong Qing Shi Hui Xian Nan Hu Wang Lu A Zuo  631922
HRNWG3M2C184740557093,Chen Jian Guo,Huawei/P40/Black/128GB,5,90336,451680,WINTER10,406512.0,60976.799999999996,2023-05-06 00:00:00,Paid,In Transit,Debit Card,MasterCard,13071903800,Tian Jin Shi Zhi Qiang Shi Xu Hui Chen Jie L Zuo  231508
8Z8RB5U11184740557269,Li Yan,Vivo/X60/Red/1TB,1,65152,65152,NEWYEAR25,48864.0,7329.599999999999,2023-05-06 00:00:00,Paid,Shipped,Bank Transfer,Visa,15525005263,Ao Men Te Bie Xing Zheng Qu Ma An Shan Shi Ping Shan Li Lu P Zuo  105042
47AJBHTPZ184740557462,Tang Jian,Vivo/X60/White/128GB,5,55608,278040,AUTUMN5,264138.0,39620.7,2023-05-06 00:00:00,Failed,Pending,Bank Transfer,WeChat Pay,15015284716,Shan Xi Sheng Shu Hua Xian Xing Shan Xu Lu E Zuo  610191
XY98F5UX4184740557640,Liu Gang,Vivo/X60/Black/32GB,6,126780,760680,AUTUMN5,722646.0,108396.9,2023-05-06 00:00:00,Paid,Shipped,Credit Card,WeChat Pay,18955811763,Shang Hai Shi Mei Xian Huang Pu Wang Jie C Zuo  601344
AANZ20GL9184740557806,Wu Shu Lan,iPhone/13/Red/254GB,3,79351,238053,SPRING20,190442.40000000002,28566.360000000004,2023-05-06 00:00:00,Paid,Pending,Debit Card,MasterCard,15201204874,An Hui Sheng Xiu Fang Shi Huang Pu La Sa Jie N Zuo  902332
VH4FUOEVX184740557972,Wang Jun,Galaxy/S21/Blue/8GB,1,128180,128180,SPRING20,102544.0,15381.599999999999,2023-05-06 00:00:00,Pending,Pending,Credit Card,Visa,13024116559,Ji Lin Sheng Hai Yan Xian Xi Xia He Fei Jie G Zuo  607384
VJDG5SQJ7184740558133,Wu Li Li,Huawei/P40/Black/1TB,6,85307,511842,NEWYEAR25,383881.5,57582.225,2023-05-06 00:00:00,Paid,Shipped,PayPal,MasterCard,15001400661,He Nan Sheng Yin Chuan Shi Xi Xia Wang Lu F Zuo  926271
8JMY5GQOV184740558305,Zhong Wen,Vivo/X60/Purple/254GB,7,116945,818615,FESTIVE30,573030.5,85954.575,2023-05-06 00:00:00,Failed,In Transit,Bank Transfer,PayPal,13880568434,Ning Xia Hui Zu Zi Zhi Qu Juan Shi Huang Pu Wu Han Jie O Zuo  481422
WS08JMMF8184740558477,Wang Feng,Vivo/X60/Black/1TB,6,143546,861276,NEWYEAR25,645957.0,96893.55,2023-05-06 00:00:00,Pending,Shipped,Credit Card,MasterCard,13196692607,Qing Hai Sheng Li Shi Fang Shan Che Lu W Zuo  838659
TBFLWDBK7184740558638,Yang Rui,iPhone/13/Purple/8GB,9,53585,482265,SPRING20,385812.0,57871.799999999996,2023-05-06 00:00:00,Pending,Pending,Debit Card,PayPal,15685551564,Xiang Gang Te Bie Xing Zheng Qu Ao Men Shi Qing Pu Zhang Jie I Zuo  450311
MRZBARQVK184740558827,Wang Yan,Huawei/P40/White/64GB,4,59175,236700,FESTIVE30,165690.0,24853.5,2023-05-06 00:00:00,Pending,Pending,Credit Card,Alipay,13911329234,Fu Jian Sheng Xia Shi Qing Cheng Xi An Lu I Zuo  378472
0JW65VX9W184740558978,Zhu Jian Guo,Galaxy/S21/Black/8GB,6,92140,552840,AUTUMN5,525198.0,78779.7,2023-05-06 00:00:00,Pending,Pending,PayPal,MasterCard,13220782362,Gui Zhou Sheng La Sa Shi Sha Wan Jing Men Lu T Zuo  565981
D8O2962U0184740559144,Hu Feng Lan,OnePlus/9/Black/64GB,1,134548,134548,AUTUMN5,127820.59999999999,19173.089999999997,2023-05-06 00:00:00,Failed,In Transit,PayPal,Visa,14719241786,Hu Nan Sheng Qian Shi Shang Jie Sun Jie X Zuo  585354
C0T6HZDRH184740559313,He Xiang,iPhone/13/Purple/1TB,9,104551,940959,SUMMER15,799815.15,119972.27249999999,2023-05-06 00:00:00,Paid,Pending,PayPal,PayPal,15948131543,Bei Jing Shi Gui Zhi Shi Mu Ye Fo Shan Jie Q Zuo  214046
VGW4EAFWH184740559471,Liu Yu Lan,iPhone/13 Pro/White/128GB,4,98779,395116,SUMMER15,335848.6,50377.28999999999,2023-05-06 00:00:00,Pending,Delivered,Bank Transfer,PayPal,13746054076,Hei Long Jiang Sheng Fei Xian Nan Hu Liang Lu Y Zuo  963099
TJWOKQLMN184740559644,Zhang Lin,Huawei/P40/Red/1TB,10,147765,1477650,AUTUMN5,1403767.5,210565.125,2023-05-06 00:00:00,Paid,Pending,Credit Card,American Express,15965130770,Guang Dong Sheng Tai Yuan Xian Xiao Nan Dong Guan Jie B Zuo  154849
9COY69SAL184740559803,Zhao Li Hua,iPhone/13/White/1TB,4,73814,295256,NEWYEAR25,221442.0,33216.299999999996,2023-05-06 00:00:00,Pending,Shipped,Debit Card,American Express,13419879321,Bei Jing Shi Rui Shi You Hao Liu Jie U Zuo  145274
ZHPIX7B1T184740559971,Rong Ting Ting,iPhone/13/White/1TB,10,83856,838560,SUMMER15,712776.0,106916.4,2023-05-06 00:00:00,Pending,In Transit,Debit Card,MasterCard,13486609503,He Nan Sheng Shan Wei Shi Pu Tuo Qi Qi Ha Er Jie L Zuo  372182
ZIDE0PMC7184740560146,Ren Chang,Galaxy/S21/White/8GB,9,101268,911412,SPRING20,729129.6000000001,109369.44000000002,2023-05-06 00:00:00,Failed,Pending,Bank Transfer,WeChat Pay,18067270319,Hei Long Jiang Sheng Yu Xian Cheng Bei Yin Chuan Jie X Zuo  396963
TS2UJX2RS184740560302,Wang Bing,Xiaomi/Mi 11/Red/254GB,3,90459,271377,FESTIVE30,189963.9,28494.585,2023-05-06 00:00:00,Failed,Pending,PayPal,Alipay,13536347985,Gan Su Sheng Jing Xian Zhao Yang Jia Jie H Zuo  158412
CLC8B419T184740560471,Yan Yong,Xiaomi/Mi 11/White/64GB,3,78325,234975,WINTER10,211477.5,31721.625,2023-05-06 00:00:00,Failed,Shipped,PayPal,MasterCard,13818130847,Gui Zhou Sheng Mei Shi Chong Wen Fu Zhou Lu V Zuo  851586
ZA394LNS6184740560624,Li Jian Jun,Oppo/Reno5/White/32GB,3,70587,211761,WINTER10,190584.9,28587.734999999997,2023-05-06 00:00:00,Failed,Delivered,Debit Card,Visa,15050751345,Yun Nan Sheng Wu Lu Mu Qi Xian Bi Shan Zheng Lu K Zuo  259715
K8DXXVW8E184740560809,Chen Xiu Rong,OnePlus/9/Purple/1TB,5,57234,286170,SUMMER15,243244.5,36486.674999999996,2023-05-06 00:00:00,Pending,In Transit,Credit Card,PayPal,18532530784,Xiang Gang Te Bie Xing Zheng Qu Zheng Zhou Xian Zi Chuan Ha Er Bin Lu P Zuo  460722
LP8NNVT0N184740561002,Li Jian Guo,Vivo/X60/Purple/254GB,4,97560,390240,NEWYEAR25,292680.0,43902.0,2023-05-06 00:00:00,Paid,Delivered,Debit Card,American Express,14764394656,Ning Xia Hui Zu Zi Zhi Qu Jun Xian Min Xing Hang Zhou Jie A Zuo  886499
H4DGX1DCB184740561193,Kou Xiao Hong,iPhone/13 Pro/Red/254GB,8,55356,442848,AUTUMN5,420705.6,63105.84,2023-05-06 00:00:00,Paid,Pending,Credit Card,Alipay,14548584574,Shan Xi Sheng Kai Shi Dong Cheng Zhang Jie F Zuo  556053
9GUYE08X9184740561367,Shi Hai Yan,iPhone/13/Black/64GB,4,129353,517412,SPRING20,413929.60000000003,62089.44,2023-05-06 00:00:00,Paid,Delivered,Bank Transfer,PayPal,13815760388,He Bei Sheng Shen Zhen Xian Xiao Nan Liu Lu L Zuo  427111
ZLQ1R295L184740561544,Xiang Qin,Xiaomi/Mi 11/White/128GB,4,87842,351368,WINTER10,316231.2,47434.68,2023-05-06 00:00:00,Failed,Delivered,Bank Transfer,Alipay,18063059933,Guang Dong Sheng Fu Zhou Shi Hua Xi Yi Dou Jie H Zuo  554133
010HIKA3P184740561713,Peng Ping,Huawei/P40/White/254GB,6,90053,540318,SUMMER15,459270.3,68890.545,2023-05-06 00:00:00,Paid,Delivered,Bank Transfer,MasterCard,14500836019,Gan Su Sheng Fo Shan Xian Shan Ting Wu Zhou Jie F Zuo  922712
PFSN4ZAC1184740561872,Chen Xue Mei,iPhone/13 Pro/White/8GB,6,107760,646560,SUMMER15,549576.0,82436.4,2023-05-06 00:00:00,Pending,Shipped,Debit Card,American Express,13042509962,Shan Dong Sheng Yan Xian Gao Gang Wang Jie W Zuo  102685
1KRER322V184740562048,Shi Ling,Galaxy/S21/Blue/254GB,9,71680,645120,WINTER10,580608.0,87091.2,2023-05-06 00:00:00,Pending,In Transit,Bank Transfer,PayPal,14744215290,Shan Dong Sheng Xin Shi Huai Rou Wei Lu V Zuo  341590
BF8FN6KZ2184740562212,Zhong Hong Mei,iPhone/13/Red/8GB,1,100606,100606,WINTER10,90545.40000000001,13581.810000000001,2023-05-06 00:00:00,Failed,Shipped,PayPal,MasterCard,14778882306,Fu Jian Sheng Feng Shi Xi Shan Xin Lu N Zuo  592302
92QT6AL3A184740562380,Li Wen,Galaxy/S21/Blue/128GB,5,92459,462295,FESTIVE30,323606.5,48540.975,2023-05-06 00:00:00,Paid,In Transit,Credit Card,PayPal,13794552317,Chong Qing Shi Xing An Meng Shi Xin Cheng Chen Jie L Zuo  238204
94AX7CKUA184740562565,Wang Na,OnePlus/9/Black/128GB,1,130784,130784,AUTUMN5,124244.79999999999,18636.719999999998,2023-05-06 00:00:00,Failed,Pending,Debit Card,PayPal,13695248459,Jiang Su Sheng Shen Yang Xian Shang Jie Ma Lu H Zuo  824651
QFV178N7Z184740562736,Wang Gui Lan,Oppo/Reno5/Black/128GB,2,95769,191538,WINTER10,172384.2,25857.63,2023-05-06 00:00:00,Failed,Delivered,Debit Card,PayPal,13634419505,He Bei Sheng Jin Feng Xian Gao Gang Shen Zhen Lu X Zuo  304037
SCBQ5VPV1184740562900,Gao Chen,Vivo/X60/Black/8GB,8,136624,1092992,SPRING20,874393.6000000001,131159.04,2023-05-06 00:00:00,Pending,Pending,Debit Card,WeChat Pay,15985959689,Ji Lin Sheng Tai Yuan Xian Cheng Bei Zhu Lu B Zuo  650091
YLLW6S0KZ184740563068,Meng Juan,iPhone/13 Pro/Purple/128GB,10,142572,1425720,WINTER10,1283148.0,192472.19999999998,2023-05-06 00:00:00,Failed,Delivered,Debit Card,Visa,18529669017,Fu Jian Sheng Shen Yang Xian Feng Dou Chen Lu Q Zuo  563076
WUGIIVMLF184740563236,Li Shu Ying,Xiaomi/Mi 11/Black/1TB,1,94067,94067,SUMMER15,79956.95,11993.5425,2023-05-06 00:00:00,Paid,In Transit,PayPal,Alipay,18796530186,Ning Xia Hui Zu Zi Zhi Qu Shu Zhen Xian Xiao Shan Shen Zhen Jie F Zuo  506598
I0XIY17K5184740563418,Hu Fei,OnePlus/9/Purple/32GB,6,105173,631038,FESTIVE30,441726.6,66258.98999999999,2023-05-06 00:00:00,Pending,Delivered,Debit Card,WeChat Pay,14553490189,Hu Nan Sheng Hui Xian Shuang Luan Gong Lu A Zuo  298693
WUO7ZMXKY184740563584,Xie Qian,OnePlus/9/Black/128GB,10,53222,532220,AUTUMN5,505609.0,75841.34999999999,2023-05-06 00:00:00,Paid,Shipped,Credit Card,MasterCard,15233029529,Tai Wan Sheng Qian Jiang Xian Xi Xia Lan Zhou Lu T Zuo  512953
1MECMPUP4184740563740,Wang Yang,Galaxy/S21/Red/128GB,1,138776,138776,WINTER10,124898.40000000001,18734.760000000002,2023-05-06 00:00:00,Failed,In Transit,Bank Transfer,Visa,18849040819,Gui Zhou Sheng Yu Xian Men Tou Gou Chen Lu R Zuo  757601
FJY7S856M184740563913,Wu Lei,Vivo/X60/Black/32GB,1,137327,137327,NEWYEAR25,102995.25,15449.287499999999,2023-05-06 00:00:00,Failed,Shipped,Credit Card,PayPal,13781027689,Shan Dong Sheng Ao Men Xian Shan Ting Zhang Lu U Zuo  951463
VEURA1VLT184740564077,Zhao Jun,Galaxy/S21/White/254GB,7,146782,1027474,SPRING20,821979.2000000001,123296.88,2023-05-06 00:00:00,Failed,Shipped,PayPal,Alipay,13812925733,Tai Wan Sheng Yu Xian He Ping Tong Liao Lu Q Zuo  826819
LU54L944Y184740564229,Xu Hao,Huawei/P40/Purple/128GB,5,108312,541560,NEWYEAR25,406170.0,60925.5,2023-05-06 00:00:00,Paid,Pending,PayPal,Alipay,14586705111,Zhe Jiang Sheng Xing An Meng Shi You Hao Li Jie R Zuo  577138
4990PKINE184740564403,Han Jian Jun,Vivo/X60/White/64GB,7,88035,616245,WINTER10,554620.5,83193.075,2023-05-06 00:00:00,Paid,Pending,Debit Card,American Express,13117730327,Gan Su Sheng Bin Xian Ji Qu Zhong Lu W Zuo  875763
ZJRWWWD7Z184740564572,Zhou Hui,Galaxy/S21/Purple/64GB,3,100818,302454,SUMMER15,257085.9,38562.884999999995,2023-05-06 00:00:00,Failed,In Transit,Debit Card,Alipay,15998225782,Hai Nan Sheng Gui Ying Shi Bai Yun Bai Jie P Zuo  914538
MBNF1X0YI184740564739,Chen Li Hua,OnePlus/9/Red/32GB,5,128001,640005,NEWYEAR25,480003.75,72000.5625,2023-05-06 00:00:00,Pending,Pending,PayPal,American Express,18665755661,Xin Jiang Wei Wu Er Zi Zhi Qu Wu Lu Mu Qi Shi Xiao Shan Li Lu R Zuo  582604
CXL7TJSUQ184740564941,Cao Xiao Hong,Galaxy/S21/Red/32GB,9,139070,1251630,SPRING20,1001304.0,150195.6,2023-05-06 00:00:00,Failed,In Transit,Credit Card,MasterCard,18632861610,He Nan Sheng Yan Shi Hua Xi Tian Jin Jie O Zuo  231639
MBYHM677J184740565101,Pan Li,iPhone/13/Blue/32GB,1,60880,60880,SPRING20,48704.0,7305.599999999999,2023-05-06 00:00:00,Failed,Pending,Credit Card,American Express,18905946476,Tai Wan Sheng Hui Zhou Xian Xiu Ying Liao Lu J Zuo  551229
JA5M3CHEU184740565274,Han Yu Mei,Huawei/P40/Purple/32GB,5,55264,276320,SUMMER15,234872.0,35230.799999999996,2023-05-06 00:00:00,Pending,Shipped,PayPal,American Express,18872091714,Hei Long Jiang Sheng Fu Xin Shi Zhang Shou Nan Jing Jie I Zuo  225672
YQTVHRR2E184740565445,Fan Wei,Oppo/Reno5/Black/1TB,2,55708,111416,NEWYEAR25,83562.0,12534.3,2023-05-06 00:00:00,Pending,Pending,Credit Card,American Express,13967509680,Jiang Xi Sheng Ting Ting Xian Nan Hu Liu Pan Shui Lu F Zuo  892565
YOIVWF02X184740565616,Liu Chen,Huawei/P40/Blue/8GB,10,60132,601320,FESTIVE30,420924.0,63138.6,2023-05-06 00:00:00,Failed,In Transit,Bank Transfer,Visa,13624434361,Si Chuan Sheng Chang Shi Xiao Shan Lu An Jie T Zuo  351721
O70CR5QQD184740565771,Wang Yu Ying,Oppo/Reno5/Black/1TB,1,96997,96997,NEWYEAR25,72747.75,10912.1625,2023-05-06 00:00:00,Pending,Pending,Debit Card,WeChat Pay,18256724018,Hu Bei Sheng Ha Er Bin Xian Bai Yun Wu Lu Mu Qi Jie B Zuo  198130
XNIXSY4YI184740565948,Zhang Yang,Huawei/P40/Red/32GB,6,98372,590232,NEWYEAR25,442674.0,66401.09999999999,2023-05-06 00:00:00,Pending,Shipped,PayPal,Visa,18630288975,Hu Bei Sheng Fo Shan Shi Xin Cheng Duan Jie N Zuo  266396
RE0OGGY90184740566119,Niu Yang,Oppo/Reno5/Blue/1TB,3,109229,327687,SUMMER15,278533.95,41780.0925,2023-05-06 00:00:00,Failed,Pending,PayPal,American Express,13875255574,Gan Su Sheng Xiu Mei Xian Nan Xi Qian Jie K Zuo  233077
Q3CKXG23Z184740566330,Fan Gui Zhen,iPhone/13/Blue/32GB,1,59132,59132,FESTIVE30,41392.399999999994,6208.859999999999,2023-05-06 00:00:00,Pending,Pending,PayPal,Alipay,13073246146,Shan Xi Sheng Shen Zhen Shi Bai Yun Hu Lu L Zuo  935360
YZ27DOHDY184740566521,Zhang Jian Hua,iPhone/13 Pro/Red/64GB,10,58205,582050,SUMMER15,494742.5,74211.375,2023-05-06 00:00:00,Paid,Delivered,PayPal,MasterCard,15713789777,Gui Zhou Sheng Tian Jin Shi Xi Feng Dong Guan Jie M Zuo  621681
5ZNQO5PFM184740566695,Xie Li Juan,iPhone/13 Pro/Blue/64GB,9,87623,788607,FESTIVE30,552024.8999999999,82803.73499999999,2023-05-06 00:00:00,Paid,In Transit,PayPal,American Express,18211184613,An Hui Sheng Feng Lan Shi Sha Wan Chen Jie X Zuo  527693
2Y1N49DKA184740566876,Ceng Xu,OnePlus/9/Black/128GB,6,78167,469002,WINTER10,422101.8,63315.27,2023-05-06 00:00:00,Paid,Shipped,Bank Transfer,American Express,14593176126,Hai Nan Sheng Xing An Meng Shi Chong Wen La Sa Lu V Zuo  260302
H8WDNDIC1184740567044,Zhang Jian Hua,iPhone/13/White/8GB,8,88025,704200,FESTIVE30,492939.99999999994,73940.99999999999,2023-05-06 00:00:00,Paid,Delivered,Bank Transfer,PayPal,13688798491,Hai Nan Sheng Jie Xian Dong Cheng Ma An Shan Jie H Zuo  830189
FT71ZGGYS184740567214,Wang Hui,Oppo/Reno5/Black/254GB,10,101331,1013310,SUMMER15,861313.5,129197.025,2023-05-06 00:00:00,Pending,Pending,Debit Card,Visa,18099694040,Shan Xi Sheng Yang Shi Bai Yun Cai Lu Q Zuo  761530
9LKGWB6E9184740567382,Wei Chun Mei,iPhone/13 Pro/Blue/8GB,1,109841,109841,WINTER10,98856.90000000001,14828.535,2023-05-06 00:00:00,Paid,Shipped,Credit Card,Alipay,15046633990,He Nan Sheng Zhi Qiang Shi Da Xing Li Jie W Zuo  150595
7WGJFBN89184740567564,Du Jing,Galaxy/S21/Black/254GB,4,78200,312800,WINTER10,281520.0,42228.0,2023-05-06 00:00:00,Pending,Shipped,Debit Card,MasterCard,18143206506,He Nan Sheng Nan Ning Xian Long Tan Tai Bei Jie A Zuo  366312
AZC4DCRYI184740567725,Zhang Chao,iPhone/13/Black/64GB,6,77314,463884,SPRING20,371107.2,55666.08,2023-05-06 00:00:00,Pending,Delivered,Bank Transfer,WeChat Pay,15257029965,Guang Xi Zhuang Zu Zi Zhi Qu Jian Ping Shi Hai Ling Chao Zhou Lu H Zuo  144390
WAHXMOK9X184740567910,Tian Chen,Oppo/Reno5/Black/254GB,7,92481,647367,AUTUMN5,614998.65,92249.7975,2023-05-06 00:00:00,Pending,Pending,PayPal,American Express,14733950419,Shan Xi Sheng Hui Zhou Xian Qing Cheng Wang Lu P Zuo  220819
GO3UYT0DO184740568085,Zhang Xiao Hong,iPhone/13/Blue/8GB,5,56800,284000,SUMMER15,241400.0,36210.0,2023-05-06 00:00:00,Failed,Shipped,Credit Card,Alipay,14587718108,Hei Long Jiang Sheng Ying Shi Qing Pu Nan Jing Lu Q Zuo  977883
JCGUFG17E184740568251,Liu Shu Zhen,Oppo/Reno5/Blue/1TB,2,127913,255826,FESTIVE30,179078.19999999998,26861.729999999996,2023-05-06 00:00:00,Pending,Delivered,Bank Transfer,American Express,15851034923,Ao Men Te Bie Xing Zheng Qu Feng Ying Shi Nan Zhang Yi Dou Jie K Zuo  506558
AZVDOOUEN184740568439,Xu Li,iPhone/13/White/32GB,7,93951,657657,WINTER10,591891.3,88783.695,2023-05-06 00:00:00,Paid,Delivered,Bank Transfer,WeChat Pay,13904571725,Guang Dong Sheng Gui Lan Shi Bin Cheng He Lu N Zuo  929072
K9GLFVHV5184740568611,Huang Dong,Vivo/X60/Blue/1TB,7,140250,981750,SPRING20,785400.0,117810.0,2023-05-06 00:00:00,Paid,Shipped,Debit Card,American Express,13795971317,Tian Jin Shi Chao Hu Xian Xi Shan Ha Er Bin Jie J Zuo  904254
QDURN1N1L184740568775,Yang Jie,Oppo/Reno5/White/128GB,10,58539,585390,SPRING20,468312.0,70246.8,2023-05-06 00:00:00,Pending,Pending,PayPal,Alipay,13170274415,Ji Lin Sheng Zhang Chun Xian Xiang An Liang Lu G Zuo  818421
3J6Q37TN3184740568950,Xia Bo,Vivo/X60/Black/1TB,7,133768,936376,NEWYEAR25,702282.0,105342.3,2023-05-06 00:00:00,Failed,Shipped,Bank Transfer,American Express,13426729384,Tai Wan Sheng Ao Men Xian Gao Ming Ning De Lu F Zuo  357948
9XVBS95EU184740569111,Zhang Juan,iPhone/13 Pro/Black/254GB,4,138524,554096,AUTUMN5,526391.2,78958.68,2023-05-06 00:00:00,Paid,Delivered,Debit Card,American Express,15306027461,He Bei Sheng Wu Lu Mu Qi Shi Sha Shi Shang Hai Lu F Zuo  627529
0XSK455ZT184740569282,Li Xin,OnePlus/9/Blue/254GB,5,53043,265215,NEWYEAR25,198911.25,29836.6875,2023-05-06 00:00:00,Failed,Shipped,Debit Card,WeChat Pay,18071162134,Hei Long Jiang Sheng Chang Xian Pu Tuo Liao Yang Jie P Zuo  738622
VX12TPMOT184740569448,Chen Mei,OnePlus/9/White/1TB,9,78441,705969,NEWYEAR25,529476.75,79421.5125,2023-05-06 00:00:00,Pending,In Transit,PayPal,PayPal,13487131572,Ji Lin Sheng Xiu Lan Shi Xi Shan Bian Lu K Zuo  194331
E78HXIUFX184740569621,Zhong Jia,Vivo/X60/White/1TB,1,135361,135361,NEWYEAR25,101520.75,15228.1125,2023-05-06 00:00:00,Failed,Delivered,Debit Card,WeChat Pay,13324079780,Liao Ning Sheng Shu Hua Shi Qing Cheng Zhang Jie I Zuo  695267
9ALSAJERR184740569791,Xu Yu,iPhone/13/Red/1TB,2,111706,223412,NEWYEAR25,167559.0,25133.85,2023-05-06 00:00:00,Pending,Delivered,Debit Card,WeChat Pay,15107171223,Ning Xia Hui Zu Zi Zhi Qu Jing Shi Nan Xi Tao Jie Z Zuo  672721
09LL0566X184740569979,Chen Ting Ting,Oppo/Reno5/Blue/64GB,2,83904,167808,FESTIVE30,117465.59999999999,17619.839999999997,2023-05-06 00:00:00,Paid,Delivered,Debit Card,PayPal,13855106116,Si Chuan Sheng Tong Liao Shi Sha Wan Kun Ming Jie J Zuo  431288
SQHWH2IW7184740570146,Liu Lan Ying,Galaxy/S21/Blue/254GB,7,134188,939316,WINTER10,845384.4,126807.66,2023-05-06 00:00:00,Pending,Delivered,Credit Card,Visa,13370909163,Gui Zhou Sheng Tian Jin Xian Shang Jie La Sa Jie W Zuo  438040
WV812XFIO184740570312,Li Na,Vivo/X60/White/32GB,7,103453,724171,NEWYEAR25,543128.25,81469.2375,2023-05-06 00:00:00,Failed,Delivered,Bank Transfer,PayPal,14534091002,Shan Dong Sheng Cheng Du Xian Min Xing Wu Lu H Zuo  218763
GYMXN1AOS184740570489,Xie Yu Mei,OnePlus/9/Purple/64GB,7,69345,485415,AUTUMN5,461144.25,69171.6375,2023-05-06 00:00:00,Pending,Delivered,Credit Card,MasterCard,15656428110,Guang Xi Zhuang Zu Zi Zhi Qu Bei Jing Shi Chang Shou Chen Lu T Zuo  509833
MOHF5IUZQ184740570683,Dan Kun,Galaxy/S21/White/8GB,5,72635,363175,FESTIVE30,254222.49999999997,38133.37499999999,2023-05-06 00:00:00,Paid,Pending,Bank Transfer,Visa,14766280149,Hu Nan Sheng Shang Hai Shi Nan Xi Tong Liao Lu M Zuo  804508
925V16DUL184740570847,Chen Jian Ping,iPhone/13/Red/128GB,10,120337,1203370,SUMMER15,1022864.5,153429.675,2023-05-06 00:00:00,Failed,Shipped,Bank Transfer,MasterCard,15688589062,Nei Meng Gu Zi Zhi Qu Shang Hai Xian Jiang Bei Xu Jie C Zuo  205500
M8QE8QIWA184740571041,Su Nan,OnePlus/9/White/254GB,1,112641,112641,AUTUMN5,107008.95,16051.342499999999,2023-05-06 00:00:00,Pending,In Transit,Bank Transfer,MasterCard,15375476096,Si Chuan Sheng Hong Xia Shi Gao Ping Liu Lu K Zuo  323453
66WT20RBD184740571213,Xu Jun,Galaxy/S21/Purple/254GB,9,59868,538812,AUTUMN5,511871.39999999997,76780.70999999999,2023-05-06 00:00:00,Paid,Shipped,Bank Transfer,Visa,15344273741,Xin Jiang Wei Wu Er Zi Zhi Qu Fei Shi Shen Bei Xin Guan Jie B Zuo  255557
HTCBN2BLT184740571415,Zou Hong,Galaxy/S21/Red/32GB,4,88113,352452,WINTER10,317206.8,47581.02,2023-05-06 00:00:00,Failed,Shipped,Credit Card,MasterCard,15767093325,Yun Nan Sheng Ha Er Bin Xian Ji Qu Ji Nan Jie F Zuo  586544
OF05UG6DM184740571577,He Li Juan,Vivo/X60/Purple/64GB,6,85908,515448,SPRING20,412358.4,61853.76,2023-05-06 00:00:00,Paid,Pending,Bank Transfer,PayPal,18783459692,Hu Bei Sheng Xiang Gang Xian Hua Xi Hai Men Jie B Zuo  600402
BLHYY8MGB184740571746,Wu Chen,iPhone/13 Pro/Black/64GB,1,118400,118400,WINTER10,106560.0,15984.0,2023-05-06 00:00:00,Paid,Delivered,Debit Card,American Express,18706634546,Qing Hai Sheng Gui Lan Xian Shan Ting Nong Jie F Zuo  866988
VGNRVFKNB184740571917,Jiang Qian,Oppo/Reno5/Purple/32GB,6,81385,488310,AUTUMN5,463894.5,69584.175,2023-05-06 00:00:00,Paid,Shipped,Debit Card,WeChat Pay,13536497151,Hu Bei Sheng Guang Zhou Xian Nan Zhang He Shan Jie Z Zuo  858637
P7FWLIQCB184740572075,Yang Jia,Galaxy/S21/Red/254GB,1,101846,101846,FESTIVE30,71292.2,10693.83,2023-05-06 00:00:00,Paid,Delivered,Bank Transfer,Visa,15994214860,Shan Xi Sheng Han Dan Xian Zhang Shou Weng Lu K Zuo  920680
G19YL3K18184740572250,Zhang Yan,iPhone/13 Pro/Purple/128GB,3,60905,182715,SUMMER15,155307.75,23296.1625,2023-05-06 00:00:00,Failed,In Transit,Bank Transfer,Alipay,13989695899,Jiang Su Sheng Lei Shi Cheng Bei Liu Jie T Zuo  654427
K8UUOI9MY184740572414,Liu Jia,Oppo/Reno5/Red/8GB,4,121523,486092,FESTIVE30,340264.39999999997,51039.659999999996,2023-05-06 00:00:00,Pending,Pending,Credit Card,WeChat Pay,14769281543,He Bei Sheng Da Ye Shi Ji Qu Chen Lu F Zuo  384755
