Order ID,Customer Name,Mobile Model,Quantity,Price per Unit,Total Price,Promotion Code,Order Amount,GST,Order Date,Payment Status,Shipping Status,Payment Method,Payment Provider,Mobile,Delivery Address
7054G6JHU184744398858,Cui Ping,OnePlus/9/Black/1TB,6,97820,586920,WINTER10,528228.0,79234.2,2023-06-04 00:00:00,Pending,Pending,Bank Transfer,MasterCard,18189128833,Gan Su Sheng Ji Nan Xian Shen He Ye Jie D Zuo  131844
V82FR90S1184744399053,Li Lei,iPhone/13 Pro/Blue/254GB,6,100801,604806,SPRING20,483844.80000000005,72576.72,2023-06-04 00:00:00,Paid,In Transit,Bank Transfer,MasterCard,14529492449,Gui Zhou Sheng Peng Xian Xiao Shan He Fei Jie Q Zuo  984591
PU5RCOAHW184744399237,Jin Bin,Oppo/Reno5/Purple/1TB,5,102083,510415,SPRING20,408332.0,61249.799999999996,2023-06-04 00:00:00,Failed,In Transit,Debit Card,Alipay,13687111205,Nei Meng Gu Zi Zhi Qu Da Ye Shi You Hao Shi Jia Zhuang Jie G Zuo  334367
ZR8QTX6EU184744399449,Zhu Xiu Hua,Huawei/P40/White/8GB,5,88561,442805,WINTER10,398524.5,59778.674999999996,2023-06-04 00:00:00,Pending,Delivered,Credit Card,Alipay,13656261607,Jiang Su Sheng Guan Ling Xian Zi Chuan Su Jie Y Zuo  698981
DRMQQ6CJK184744399651,Guan Li Hua,OnePlus/9/Black/1TB,6,70684,424104,AUTUMN5,402898.8,60434.81999999999,2023-06-04 00:00:00,Paid,In Transit,Credit Card,PayPal,14506750463,Guang Dong Sheng Bing Shi Da Dong Chong Qing Lu B Zuo  752989
A1XLDYAGD184744399822,He Yu Lan,Oppo/Reno5/Blue/64GB,8,110843,886744,SPRING20,709395.2000000001,106409.28000000001,2023-06-04 00:00:00,Pending,Pending,Credit Card,American Express,15933288351,Xin Jiang Wei Wu Er Zi Zhi Qu Nan Jing Shi Zhang Shou Gui Yang Jie V Zuo  669307
ZS6VAS3YK184744400027,Lin Shu Hua,OnePlus/9/Purple/1TB,9,121558,1094022,SUMMER15,929918.7,139487.805,2023-06-04 00:00:00,Paid,In Transit,PayPal,MasterCard,13355471378,He Bei Sheng Fo Shan Shi Nan Zhang Ji Nan Lu U Zuo  871402
2RG1X15SB184744400201,Peng Ting,Xiaomi/Mi 11/White/1TB,7,128514,899598,WINTER10,809638.2000000001,121445.73000000001,2023-06-04 00:00:00,Failed,In Transit,Bank Transfer,WeChat Pay,13148218617,Yun Nan Sheng Yu Ying Shi Feng Dou Xu Jie W Zuo  573311
WK2Y730G7184744400386,Zhao Bin,iPhone/13 Pro/Blue/64GB,5,132100,660500,AUTUMN5,627475.0,94121.25,2023-06-04 00:00:00,Failed,Shipped,Debit Card,WeChat Pay,18158678793,Tian Jin Shi Jian Xian Wei Dou Zhang Jia Gang Jie N Zuo  117882
QVCUZU04M184744400567,Li Yu Lan,Vivo/X60/Blue/128GB,5,57236,286180,AUTUMN5,271871.0,40780.65,2023-06-04 00:00:00,Pending,Delivered,Credit Card,WeChat Pay,14732115987,Hai Nan Sheng Jin Feng Shi Sha Wan Wang Lu V Zuo  826974
LE9OQ7OPK184744400752,Li Fei,iPhone/13 Pro/Purple/32GB,3,51993,155979,WINTER10,140381.1,21057.165,2023-06-04 00:00:00,Failed,In Transit,Bank Transfer,American Express,15398516538,Ji Lin Sheng Jian Xian Xun Yang Yao Jie Z Zuo  496318
EDP4X0BQM184744400924,Li Ming,Galaxy/S21/Red/254GB,8,130901,1047208,WINTER10,942487.2000000001,141373.08000000002,2023-06-04 00:00:00,Paid,Pending,Bank Transfer,WeChat Pay,14578744124,Guang Xi Zhuang Zu Zi Zhi Qu Liang Xian Hua Xi Tang Lu Q Zuo  130474
8FPUBYZVZ184744401122,Li Dong,Oppo/Reno5/Black/254GB,3,123906,371718,FESTIVE30,260202.59999999998,39030.38999999999,2023-06-04 00:00:00,Pending,Delivered,Credit Card,Alipay,14752923154,Xin Jiang Wei Wu Er Zi Zhi Qu Fo Shan Shi Jiang Bei Kun Ming Jie W Zuo  692446
2H6WXSEOH184744401307,Hao Zhi Qiang,Xiaomi/Mi 11/Blue/64GB,7,103050,721350,NEWYEAR25,541012.5,81151.875,2023-06-04 00:00:00,Failed,In Transit,Bank Transfer,Visa,13391355737,Gan Su Sheng Ha Er Bin Xian An Ci Tang Lu Z Zuo  469863
E8DX2Z7LL184744401498,Bao Jin Feng,Galaxy/S21/Red/64GB,1,99941,99941,SPRING20,79952.8,11992.92,2023-06-04 00:00:00,Failed,Pending,Credit Card,American Express,13256070493,Guang Dong Sheng Liang Xian Min Xing Qian Jiang Jie O Zuo  740646
F8Y8UHD22184744401665,Liao Hao,Oppo/Reno5/Purple/32GB,4,128795,515180,WINTER10,463662.0,69549.3,2023-06-04 00:00:00,Pending,Delivered,Credit Card,Visa,14748578758,Shan Dong Sheng Yi Du Shi Jing An Xing An Meng Lu Z Zuo  298914
5YX0NKM6H184744401840,Gao Dong,iPhone/13/Red/1TB,7,72923,510461,SUMMER15,433891.85,65083.7775,2023-06-04 00:00:00,Paid,Pending,Credit Card,Alipay,18719244674,Ning Xia Hui Zu Zi Zhi Qu Zhang Jia Gang Shi Hai Gang Lu An Jie J Zuo  925816
KRFZUDUJE184744402034,Ren Long,Xiaomi/Mi 11/Purple/254GB,5,118155,590775,AUTUMN5,561236.25,84185.4375,2023-06-04 00:00:00,Pending,Delivered,Bank Transfer,WeChat Pay,18178928072,Jiang Su Sheng Wu Lu Mu Qi Xian Xiao Shan Sun Jie J Zuo  782511
LNGBDMX4A184744402223,Zhang Jian Ping,OnePlus/9/Purple/254GB,8,77628,621024,SPRING20,496819.2,74522.88,2023-06-04 00:00:00,Failed,Shipped,Credit Card,Visa,14740445179,Bei Jing Shi Gui Ying Xian Bai Yun Gu Jie C Zuo  559347
AXOGTR03J184744402405,Du Yu,Vivo/X60/Blue/8GB,4,141409,565636,WINTER10,509072.4,76360.86,2023-06-04 00:00:00,Pending,Shipped,Debit Card,WeChat Pay,14543958894,Fu Jian Sheng Hang Zhou Shi Long Tan Chen Lu C Zuo  492916
PMMN4IDKK184744402583,Zhou Juan,iPhone/13 Pro/White/254GB,7,142469,997283,NEWYEAR25,747962.25,112194.3375,2023-06-04 00:00:00,Failed,Pending,PayPal,Alipay,15180516857,Xin Jiang Wei Wu Er Zi Zhi Qu Dan Dan Xian Zhang Shou Jia He Lu N Zuo  995005
YTRYQLLBS184744402769,Xie Yu,Vivo/X60/Red/32GB,2,147978,295956,WINTER10,266360.4,39954.060000000005,2023-06-04 00:00:00,Failed,Delivered,PayPal,Visa,13871433746,Shan Xi Sheng Shu Ying Shi Hua Xi Lin Lu N Zuo  629767
ICIIP3KKI184744402948,Shu Yang,Huawei/P40/Red/8GB,1,63020,63020,FESTIVE30,44114.0,6617.099999999999,2023-06-04 00:00:00,Paid,Shipped,Credit Card,Visa,15873515144,Guang Xi Zhuang Zu Zi Zhi Qu Hai Kou Shi Yong Chuan Liao Lu F Zuo  621075
9BK5JSRRE184744403149,Lu Xiu Yun,Huawei/P40/Purple/8GB,5,59959,299795,WINTER10,269815.5,40472.325,2023-06-04 00:00:00,Pending,In Transit,Debit Card,American Express,13621625016,Chong Qing Shi Cheng Du Xian Xu Hui Fu Lu V Zuo  684697
73BURLV7J184744403333,Zhao Ping,Xiaomi/Mi 11/Purple/1TB,3,114667,344001,SPRING20,275200.8,41280.119999999995,2023-06-04 00:00:00,Failed,In Transit,PayPal,American Express,18594747044,Nei Meng Gu Zi Zhi Qu Zhang Jia Gang Shi Gao Ming Fu Xin Lu T Zuo  482450
DOL1PTDL8184744403526,Li Yu Hua,Xiaomi/Mi 11/White/8GB,9,145580,1310220,WINTER10,1179198.0,176879.69999999998,2023-06-04 00:00:00,Pending,In Transit,Bank Transfer,Alipay,13836243237,He Bei Sheng Xin Ji Shi Jin Ping Hong Jie B Zuo  633648
Z8RGQMWLM184744403712,Xu Hui,Vivo/X60/White/64GB,10,122528,1225280,WINTER10,1102752.0,165412.8,2023-06-04 00:00:00,Pending,Pending,Bank Transfer,MasterCard,18903556884,Ao Men Te Bie Xing Zheng Qu Li Li Xian Chong Wen Tai Yuan Jie U Zuo  556457
YD7UVSW4J184744403901,Fu Dan,OnePlus/9/Purple/64GB,3,140074,420222,WINTER10,378199.8,56729.969999999994,2023-06-04 00:00:00,Paid,Delivered,Bank Transfer,PayPal,13039168974,Xi Zang Zi Zhi Qu Ying Xian Hai Gang Lan Zhou Lu D Zuo  776514
1FRNBKXJF184744404068,Yan Yang,Xiaomi/Mi 11/Purple/64GB,8,90975,727800,FESTIVE30,509459.99999999994,76418.99999999999,2023-06-04 00:00:00,Pending,Delivered,Credit Card,American Express,13458092837,Hai Nan Sheng Tai Bei Xian Xi Xia Yang Lu F Zuo  566687
6M5PD3LY6184744404242,Li Cheng,Vivo/X60/Purple/1TB,9,64475,580275,SUMMER15,493233.75,73985.0625,2023-06-04 00:00:00,Pending,Delivered,Credit Card,MasterCard,13699980732,Xin Jiang Wei Wu Er Zi Zhi Qu Chao Shi He Ping Hou Jie R Zuo  689558
827661GEF184744404426,Kang Jian,Huawei/P40/Blue/1TB,2,82538,165076,NEWYEAR25,123807.0,18571.05,2023-06-04 00:00:00,Paid,Pending,PayPal,MasterCard,18589416331,He Nan Sheng Shen Yang Xian Xiu Ying Fu Zhou Jie D Zuo  484730
HWURMLUHG184744404590,Li Fan,Galaxy/S21/Red/32GB,3,64133,192399,WINTER10,173159.1,25973.865,2023-06-04 00:00:00,Failed,Delivered,Credit Card,American Express,14724740953,Nei Meng Gu Zi Zhi Qu Ming Xian Dong Cheng Wang Jie O Zuo  834636
1X29X1T0T184744404773,Zhang Chao,Galaxy/S21/White/8GB,2,59846,119692,SPRING20,95753.6,14363.04,2023-06-04 00:00:00,Failed,In Transit,PayPal,Alipay,13429097293,Gui Zhou Sheng Kun Xian Xiang An Zhang Lu H Zuo  230600
BESL28PE9184744404939,Zhang Yu,iPhone/13/Red/1TB,10,141729,1417290,NEWYEAR25,1062967.5,159445.125,2023-06-04 00:00:00,Failed,Pending,Bank Transfer,WeChat Pay,13139147744,Gan Su Sheng Shang Hai Shi Bai Yun Nan Chang Lu X Zuo  976702
KPT7D96X3184744405098,Zheng Jing,iPhone/13/Blue/8GB,9,131699,1185291,NEWYEAR25,888968.25,133345.2375,2023-06-04 00:00:00,Paid,In Transit,Credit Card,WeChat Pay,15141959676,Gan Su Sheng Jin Feng Shi Min Xing Zhao Jie B Zuo  952936
STUGZ7VST184744405272,Xia Jun,iPhone/13/White/254GB,10,60451,604510,SPRING20,483608.0,72541.2,2023-06-04 00:00:00,Pending,Delivered,Bank Transfer,Alipay,13005443528,He Bei Sheng Yong Xian Dong Cheng Wang Lu W Zuo  899270
OQ91XZ730184744405437,He Lei,iPhone/13/Red/64GB,8,149284,1194272,FESTIVE30,835990.3999999999,125398.55999999998,2023-06-04 00:00:00,Failed,In Transit,Credit Card,American Express,18140879307,Liao Ning Sheng Jia Shi Yong Chuan Li Jie P Zuo  127922
ZYL8MX6I2184744405604,Yuan Xiao Hong,Oppo/Reno5/Purple/8GB,8,109873,878984,NEWYEAR25,659238.0,98885.7,2023-06-04 00:00:00,Paid,Delivered,Debit Card,American Express,13309795119,Shan Xi Sheng Feng Lan Shi Shen Bei Xin Chang Chun Jie O Zuo  934212
T7LF4R36D184744405777,Yang Jian,Vivo/X60/Blue/64GB,3,87301,261903,NEWYEAR25,196427.25,29464.087499999998,2023-06-04 00:00:00,Failed,Pending,Bank Transfer,Alipay,13965580069,Hei Long Jiang Sheng Tong Liao Shi Xi Xia Jing Men Jie V Zuo  723112
85VVKCEYW184744405946,Cai Feng,Vivo/X60/Black/1TB,1,97349,97349,FESTIVE30,68144.3,10221.645,2023-06-04 00:00:00,Paid,Delivered,Credit Card,WeChat Pay,13745818433,Nei Meng Gu Zi Zhi Qu Hui Shi Pu Tuo Li Lu Z Zuo  652732
6H6QEK0IZ184744406130,Zhang Lin,OnePlus/9/White/32GB,1,90907,90907,SUMMER15,77270.95,11590.6425,2023-06-04 00:00:00,Failed,Pending,Credit Card,WeChat Pay,14545560799,Jiang Su Sheng Fu Zhou Xian Sha Shi Liu Lu K Zuo  166972
R4J8YJ75P184744406302,Zhang Gui Lan,iPhone/13 Pro/White/128GB,3,111272,333816,WINTER10,300434.4,45065.16,2023-06-04 00:00:00,Pending,Pending,PayPal,Alipay,13973281509,Xiang Gang Te Bie Xing Zheng Qu Nan Ning Shi Da Xing Chao Hu Jie G Zuo  634646
KAS6ZTZWR184744406491,Huang Shu Hua,OnePlus/9/Blue/64GB,2,50722,101444,SPRING20,81155.20000000001,12173.28,2023-06-04 00:00:00,Paid,Delivered,Debit Card,PayPal,18801708684,Zhe Jiang Sheng Hu He Hao Te Shi Jin Ping Zheng Zhou Lu D Zuo  831227
3HE9Y0R4J184744406665,Yan Shu Ying,Huawei/P40/Purple/1TB,4,145420,581680,AUTUMN5,552596.0,82889.4,2023-06-04 00:00:00,Failed,Delivered,Bank Transfer,WeChat Pay,15675860904,Nei Meng Gu Zi Zhi Qu Yong An Xian Qing Cheng Dai Jie V Zuo  976123
N2DUUOTEL184744406858,Hou Shu Ying,Xiaomi/Mi 11/Purple/64GB,10,105464,1054640,SUMMER15,896444.0,134466.6,2023-06-04 00:00:00,Failed,In Transit,Credit Card,American Express,14590798643,Hai Nan Sheng Na Xian Shen Bei Xin Wei Lu O Zuo  654110
KOB6L14CY184744407043,Wang Li,iPhone/13 Pro/White/32GB,7,94124,658868,FESTIVE30,461207.6,69181.14,2023-06-04 00:00:00,Paid,Pending,PayPal,WeChat Pay,18243200989,Gan Su Sheng Shan Wei Shi Nan Zhang Liu Zhou Lu L Zuo  165559
4UTKIBYV9184744407208,Hou Jun,Huawei/P40/Blue/128GB,1,95531,95531,NEWYEAR25,71648.25,10747.2375,2023-06-04 00:00:00,Pending,Pending,Bank Transfer,PayPal,13943509052,Hai Nan Sheng Tai Bei Xian Shan Ting Wang Lu G Zuo  524954
733OO1F9J184744407385,Yue Ting,iPhone/13 Pro/Purple/1TB,10,102257,1022570,NEWYEAR25,766927.5,115039.125,2023-06-04 00:00:00,Pending,In Transit,Debit Card,WeChat Pay,18233786303,Si Chuan Sheng Li Juan Xian Long Tan Sun Lu I Zuo  252891
3Q3B6KVJU184744407564,Zou Chen,Oppo/Reno5/Red/254GB,5,143698,718490,FESTIVE30,502942.99999999994,75441.44999999998,2023-06-04 00:00:00,Failed,Delivered,Debit Card,WeChat Pay,15231411985,Ao Men Te Bie Xing Zheng Qu Xin Xian Xi Xia Shi Jia Zhuang Lu G Zuo  902668
JT9PPXML1184744407750,Mu Gui Zhi,Vivo/X60/Blue/128GB,4,121730,486920,SPRING20,389536.0,58430.4,2023-06-04 00:00:00,Failed,Delivered,Bank Transfer,Visa,15399042017,Hu Nan Sheng Shan Wei Shi Xiao Shan Ning De Lu R Zuo  393359
KAQ1VDHKQ184744407921,Qi Jie,iPhone/13/Black/64GB,2,61017,122034,SUMMER15,103728.9,15559.335,2023-06-04 00:00:00,Pending,Pending,Debit Card,MasterCard,18650268835,Hu Bei Sheng Shen Yang Xian Qing Cheng Shen Zhen Jie K Zuo  918856
84QK6VP66184744408117,Zhao Yu,Xiaomi/Mi 11/Blue/64GB,3,51032,153096,NEWYEAR25,114822.0,17223.3,2023-06-04 00:00:00,Failed,Shipped,Debit Card,WeChat Pay,18784430894,Bei Jing Shi Gui Ying Xian Jin Ping Shi Jia Zhuang Jie I Zuo  397856
07OCTPIYO184744408286,Xiong Shu Zhen,Huawei/P40/Purple/8GB,6,88042,528252,NEWYEAR25,396189.0,59428.35,2023-06-04 00:00:00,Failed,Pending,Bank Transfer,American Express,18687772919,Yun Nan Sheng Bei Zhen Shi Gao Gang Qian Jiang Jie G Zuo  105988
KFEAVGV71184744408460,Zhang Huan,Vivo/X60/Red/8GB,10,123935,1239350,SPRING20,991480.0,148722.0,2023-06-04 00:00:00,Failed,In Transit,Credit Card,Alipay,15925695989,Fu Jian Sheng Jian Guo Shi Xiao Shan Qian Jiang Lu P Zuo  160606
H2SBQ3O5T184744408621,Liu Fei,iPhone/13 Pro/Red/64GB,9,89017,801153,SUMMER15,680980.0499999999,102147.00749999999,2023-06-04 00:00:00,Failed,In Transit,Debit Card,Visa,13831708298,Hu Bei Sheng Yu Ying Shi Shang Jie Li Jie X Zuo  504993
R3T15MVCI184744408795,Pi Dan Dan,Huawei/P40/White/1TB,2,80112,160224,NEWYEAR25,120168.0,18025.2,2023-06-04 00:00:00,Failed,Shipped,PayPal,Alipay,18524670057,Shan Xi Sheng Chen Xian Yong Chuan Dai Jie X Zuo  410711
5SN4MWZKG184744408968,Qiu Min,Galaxy/S21/White/8GB,9,121055,1089495,WINTER10,980545.5,147081.82499999998,2023-06-04 00:00:00,Failed,Delivered,Credit Card,Visa,15062950371,Shan Dong Sheng Shen Yang Shi Feng Dou Tu Lu W Zuo  668247
RDS335MQK184744409148,Cao Jian Guo,iPhone/13 Pro/Black/1TB,3,79378,238134,FESTIVE30,166693.8,25004.069999999996,2023-06-04 00:00:00,Pending,Shipped,Bank Transfer,PayPal,13391078592,An Hui Sheng Guan Ling Shi Da Xing Xi An Jie J Zuo  311515
QMRRNO5QP184744409321,Liu Nan,Huawei/P40/White/32GB,3,128995,386985,AUTUMN5,367635.75,55145.362499999996,2023-06-04 00:00:00,Failed,Pending,Bank Transfer,PayPal,13911992762,Hei Long Jiang Sheng Feng Ying Xian Liu Zhi Te Lu Jie A Zuo  272275
YQ6FCLMKU184744409508,Wang Chang,iPhone/13 Pro/Purple/64GB,5,62951,314755,SUMMER15,267541.75,40131.2625,2023-06-04 00:00:00,Pending,Shipped,Credit Card,American Express,13533175780,Jiang Su Sheng Ying Shi Cheng Bei Guo Lu S Zuo  191235
ZKKECO2K8184744409680,Lv Gui Xiang,Vivo/X60/Blue/128GB,8,99981,799848,NEWYEAR25,599886.0,89982.9,2023-06-04 00:00:00,Pending,In Transit,Debit Card,PayPal,15372632015,Hu Nan Sheng Xin Xian Feng Dou Zhou Jie I Zuo  652659
3A9X2RXP4184744409855,Zhang Yan,iPhone/13/Black/32GB,6,94160,564960,AUTUMN5,536712.0,80506.8,2023-06-04 00:00:00,Failed,Shipped,Credit Card,WeChat Pay,15006782247,Fu Jian Sheng Xiang Xian Xi Shan Liu Jie P Zuo  829954
GFM3Q09P7184744410022,Qin Shu Zhen,iPhone/13/Blue/64GB,6,78733,472398,SUMMER15,401538.3,60230.744999999995,2023-06-04 00:00:00,Pending,Delivered,Credit Card,WeChat Pay,15527492206,Tian Jin Shi Bei Jing Xian Feng Dou Wu Jie X Zuo  607396
DXDB2UNOK184744410200,Wang Xiu Zhen,Oppo/Reno5/Red/8GB,5,136735,683675,SUMMER15,581123.75,87168.5625,2023-06-04 00:00:00,Paid,In Transit,Debit Card,Alipay,13150862085,Hai Nan Sheng Xiu Mei Xian Gao Ping Qin Lu C Zuo  929504
VWXLO71YJ184744410378,Zhang Qian,iPhone/13/Black/64GB,7,125005,875035,SUMMER15,743779.75,111566.9625,2023-06-04 00:00:00,Failed,Shipped,Bank Transfer,American Express,13194989342,Hu Bei Sheng Shu Hua Shi Xun Yang Cheng Du Jie C Zuo  231675
7GTO6SFSW184744410543,Qiao Shuai,iPhone/13 Pro/Red/8GB,7,143323,1003261,FESTIVE30,702282.7,105342.40499999998,2023-06-04 00:00:00,Paid,Shipped,Bank Transfer,PayPal,13365568873,Xiang Gang Te Bie Xing Zheng Qu Mei Xian Gao Ming Shan Wei Lu J Zuo  837380
7XNBZ4FA3184744410723,Peng Min,iPhone/13 Pro/Purple/128GB,8,51911,415288,SPRING20,332230.4,49834.560000000005,2023-06-04 00:00:00,Pending,Pending,Debit Card,PayPal,18293510134,Guang Xi Zhuang Zu Zi Zhi Qu Dan Shi Ping Shan Hang Zhou Lu J Zuo  698291
LZFZH1XHF184744410904,Shen Dan Dan,iPhone/13/White/1TB,7,121965,853755,AUTUMN5,811067.25,121660.0875,2023-06-04 00:00:00,Pending,In Transit,Debit Card,American Express,13269209856,Nei Meng Gu Zi Zhi Qu Ping Shi Gao Gang Wu Lu Mu Qi Lu Z Zuo  599861
OUOS4VWQZ184744411094,Jiang Huan,OnePlus/9/Purple/254GB,1,99933,99933,WINTER10,89939.7,13490.955,2023-06-04 00:00:00,Failed,In Transit,Bank Transfer,MasterCard,15265994510,Shan Xi Sheng La Sa Xian Zi Chuan Ao Men Lu C Zuo  681948
3CVMB1HEF184744411261,Qiu Liu,Huawei/P40/Purple/128GB,10,101045,1010450,AUTUMN5,959927.5,143989.125,2023-06-04 00:00:00,Pending,Shipped,Debit Card,WeChat Pay,15129159153,Guang Xi Zhuang Zu Zi Zhi Qu Yin Chuan Shi Qing Pu Yan Jie D Zuo  770013
SK0WQ8KWR184744411457,Dai Chang,iPhone/13 Pro/Purple/8GB,9,77361,696249,SUMMER15,591811.65,88771.7475,2023-06-04 00:00:00,Pending,In Transit,Credit Card,Alipay,13583462449,He Nan Sheng Jian Xian Nan Xi Xiang Gang Lu U Zuo  996353
ZG2HYQZPW184744411626,He Qiang,Huawei/P40/Blue/32GB,4,88191,352764,AUTUMN5,335125.8,50268.869999999995,2023-06-04 00:00:00,Pending,Pending,Bank Transfer,MasterCard,18754497758,Guang Xi Zhuang Zu Zi Zhi Qu Xiu Ying Xian Nan Zhang Li Jie E Zuo  459581
WYB6XHPNM184744411828,Liu Huan,OnePlus/9/Blue/1TB,7,106285,743995,FESTIVE30,520796.49999999994,78119.47499999999,2023-06-04 00:00:00,Pending,Delivered,PayPal,PayPal,15904366637,Fu Jian Sheng Cheng Xian Fu Cheng Zheng Zhou Jie G Zuo  946575
Y6ERESBL6184744411993,Zhong Li Li,Oppo/Reno5/Blue/32GB,1,69650,69650,NEWYEAR25,52237.5,7835.625,2023-06-04 00:00:00,Paid,Pending,Debit Card,American Express,13677285091,He Bei Sheng Shan Wei Shi Xiu Ying Zhang Lu T Zuo  844215
YPVS74D2C184744412177,Zhu Gui Hua,OnePlus/9/Purple/32GB,1,86616,86616,SPRING20,69292.8,10393.92,2023-06-04 00:00:00,Failed,Shipped,Bank Transfer,Visa,15782310901,Hai Nan Sheng Ha Er Bin Shi Xiang An Huang Jie V Zuo  916606
5CYEU3THH184744412441,Chen Qiang,Xiaomi/Mi 11/Red/254GB,2,106962,213924,SPRING20,171139.2,25670.88,2023-06-04 00:00:00,Paid,Shipped,Debit Card,American Express,15696819538,Si Chuan Sheng Jing Xian Zhang Shou Cheng Du Jie E Zuo  295421
X89HPP5DJ184744412618,Zhang Xiang,Galaxy/S21/Black/32GB,1,80654,80654,SPRING20,64523.200000000004,9678.48,2023-06-04 00:00:00,Failed,Pending,Bank Transfer,Alipay,18727796627,Guang Xi Zhuang Zu Zi Zhi Qu Gui Rong Shi Dong Cheng Shen Yang Jie S Zuo  601383
GWWCQVW87184744412808,He Jie,Galaxy/S21/White/1TB,6,102521,615126,SUMMER15,522857.1,78428.56499999999,2023-06-04 00:00:00,Paid,Delivered,PayPal,Visa,15772074093,Si Chuan Sheng Chao Zhou Xian Jing An Li Jie B Zuo  858615
E1RXXB3G5184744412984,Zhang Li,iPhone/13/Red/1TB,5,139018,695090,FESTIVE30,486562.99999999994,72984.44999999998,2023-06-04 00:00:00,Failed,Delivered,Bank Transfer,WeChat Pay,15623058550,Hei Long Jiang Sheng Bei Jing Xian Shang Jie Yong An Jie X Zuo  957391
PTARZ6B6M184744413154,Hu Yu Lan,OnePlus/9/White/128GB,8,125002,1000016,FESTIVE30,700011.2,105001.68,2023-06-04 00:00:00,Paid,In Transit,Credit Card,MasterCard,15960008973,Xin Jiang Wei Wu Er Zi Zhi Qu Li Hua Xian He Ping Hu He Hao Te Lu H Zuo  622867
84H49ISEI184744413353,Zhang Fang,Oppo/Reno5/Red/128GB,3,116489,349467,WINTER10,314520.3,47178.045,2023-06-04 00:00:00,Pending,Delivered,Bank Transfer,Alipay,18791353255,Si Chuan Sheng Liu Zhou Xian Xi Feng Jiao Lu S Zuo  331289
I49DSD33N184744413530,Sun Yan,OnePlus/9/Black/1TB,6,96506,579036,FESTIVE30,405325.19999999995,60798.77999999999,2023-06-04 00:00:00,Paid,Shipped,PayPal,MasterCard,13849165308,Ning Xia Hui Zu Zi Zhi Qu Feng Lan Xian Xun Yang Shi Lu U Zuo  253730
AZUDW5SDO184744413723,Wang Jing,OnePlus/9/Red/254GB,6,52005,312030,WINTER10,280827.0,42124.049999999996,2023-06-04 00:00:00,Failed,Shipped,Bank Transfer,WeChat Pay,15806909127,Tai Wan Sheng Chang Shi Mu Ye Chen Lu A Zuo  705621
4YPVC4A1J184744413890,Ma Li,Vivo/X60/Black/8GB,8,123335,986680,SPRING20,789344.0,118401.59999999999,2023-06-04 00:00:00,Paid,Pending,Credit Card,PayPal,13229910947,Tian Jin Shi Guang Zhou Xian Xi Feng Yao Lu A Zuo  317708
FY7TRCIZ4184744414063,Zhang Gui Lan,iPhone/13/White/1TB,4,79055,316220,NEWYEAR25,237165.0,35574.75,2023-06-04 00:00:00,Pending,Delivered,Bank Transfer,Visa,13474387708,He Bei Sheng Wu Han Shi Xun Yang Wang Jie J Zuo  917617
5Q5KHZ3GZ184744414239,Sun Yang,Galaxy/S21/White/254GB,8,50221,401768,FESTIVE30,281237.6,42185.63999999999,2023-06-04 00:00:00,Failed,In Transit,PayPal,MasterCard,13824962017,Shan Xi Sheng Ping Shi Hai Gang Tai Bei Jie J Zuo  110746
ED6Z6L5OY184744414397,Ma Ling,Huawei/P40/White/32GB,5,98708,493540,SPRING20,394832.0,59224.799999999996,2023-06-04 00:00:00,Pending,In Transit,Credit Card,MasterCard,18239521212,Guang Dong Sheng Wu Zhou Shi Liu Zhi Te Zhang Jia Gang Lu J Zuo  822572
A2SVZXASY184744414572,Wang Lin,Oppo/Reno5/White/254GB,9,137852,1240668,SUMMER15,1054567.8,158185.17,2023-06-04 00:00:00,Pending,Shipped,PayPal,Visa,15024224545,Gan Su Sheng Yu Ying Shi Xin Cheng Zhao Lu A Zuo  499290
X2K38Q7UU184744414750,Li Yu Hua,iPhone/13/Purple/128GB,8,81147,649176,SUMMER15,551799.6,82769.93999999999,2023-06-04 00:00:00,Paid,Shipped,Bank Transfer,WeChat Pay,15099467597,Xi Zang Zi Zhi Qu Qian Jiang Xian Qing Pu Hu Lu S Zuo  798386
5UESWI58A184744414938,Chen Yu,Oppo/Reno5/Blue/254GB,7,50706,354942,WINTER10,319447.8,47917.17,2023-06-04 00:00:00,Failed,Delivered,Bank Transfer,PayPal,18663071784,Si Chuan Sheng Dan Xian Yong Chuan Zhou Jie G Zuo  214816
5TL5NRL7O184744415110,Hao Feng Lan,Galaxy/S21/Black/64GB,10,146876,1468760,FESTIVE30,1028131.9999999999,154219.8,2023-06-04 00:00:00,Failed,Shipped,Debit Card,Visa,13471458556,Tian Jin Shi Wu Lu Mu Qi Xian Feng Dou Li Lu U Zuo  123351
FQ3AZU3LU184744415300,Zhao Jun,iPhone/13/Black/32GB,8,79992,639936,AUTUMN5,607939.2,91190.87999999999,2023-06-04 00:00:00,Failed,Pending,Credit Card,PayPal,18210621834,Guang Dong Sheng Xu Xian An Ci Wu Jie X Zuo  863147
EHU1ODKDR184744415475,Ju Ying,iPhone/13 Pro/Purple/254GB,6,132171,793026,NEWYEAR25,594769.5,89215.425,2023-06-04 00:00:00,Failed,Shipped,PayPal,Visa,15709451360,Tai Wan Sheng Li Hua Xian Xiao Nan Xu Jie O Zuo  978322
GEUK6V0FE184744415657,Liu Qiang,OnePlus/9/White/1TB,1,141481,141481,NEWYEAR25,106110.75,15916.6125,2023-06-04 00:00:00,Failed,Delivered,PayPal,Alipay,18937761353,Shan Xi Sheng Hai Kou Xian Huang Pu Zheng Lu X Zuo  715589
TAQR9SJIB184744415830,Yu Xiang,Huawei/P40/Black/8GB,5,112498,562490,WINTER10,506241.0,75936.15,2023-06-04 00:00:00,Paid,Pending,Credit Card,Visa,18676396478,Ning Xia Hui Zu Zi Zhi Qu Qi Qi Ha Er Shi You Hao Ma Jie P Zuo  881519
FCQ9IFL0E184744416060,Chen Lei,OnePlus/9/Purple/1TB,5,140351,701755,FESTIVE30,491228.49999999994,73684.275,2023-06-04 00:00:00,Pending,In Transit,Debit Card,Visa,13420717028,Guang Xi Zhuang Zu Zi Zhi Qu Nan Jing Shi Men Tou Gou Wu Jie E Zuo  638541
6DUYRBRBD184744416295,Ceng Hua,Oppo/Reno5/Purple/1TB,3,117545,352635,NEWYEAR25,264476.25,39671.4375,2023-06-04 00:00:00,Pending,Delivered,Debit Card,WeChat Pay,18961051057,Gan Su Sheng La Sa Shi Zi Chuan Tai Yuan Lu M Zuo  314155
CPD4191MD184744416482,Zhang Dan,iPhone/13 Pro/Blue/128GB,5,101939,509695,SUMMER15,433240.75,64986.112499999996,2023-06-04 00:00:00,Paid,Pending,Bank Transfer,Visa,13455699014,Shang Hai Shi Xiu Zhen Shi Shuang Luan Ning De Jie B Zuo  414727
0YLT7NLHE184744416659,Cheng Fang,OnePlus/9/Red/1TB,3,77092,231276,SPRING20,185020.80000000002,27753.120000000003,2023-06-04 00:00:00,Pending,Pending,Bank Transfer,American Express,18843157445,Si Chuan Sheng Zhi Qiang Shi Bai Yun Hu Lu G Zuo  989023
4NKUUUPQ7184744416853,Zhang Xia,Huawei/P40/White/8GB,5,55789,278945,SUMMER15,237103.25,35565.487499999996,2023-06-04 00:00:00,Pending,Delivered,Bank Transfer,American Express,15816265362,Shan Xi Sheng Ao Men Xian Long Tan Wu Lu Mu Qi Lu J Zuo  527778
V81R8GW78184744417033,Gao Dan Dan,Vivo/X60/Purple/254GB,2,126010,252020,FESTIVE30,176414.0,26462.1,2023-06-04 00:00:00,Pending,In Transit,PayPal,Visa,18826808554,Hei Long Jiang Sheng Fu Zhou Xian Sha Wan Tian Jin Jie D Zuo  203416
UTTW2RVJO184744417216,Li Lin,Vivo/X60/White/254GB,8,64147,513176,SUMMER15,436199.6,65429.939999999995,2023-06-04 00:00:00,Paid,Pending,Credit Card,MasterCard,15636817990,Tian Jin Shi Bin Shi Xiao Shan Li Jie T Zuo  405279
TJD0XBVLQ184744417389,Zhang Hai Yan,Oppo/Reno5/Black/8GB,3,50118,150354,NEWYEAR25,112765.5,16914.825,2023-06-04 00:00:00,Pending,Delivered,Credit Card,WeChat Pay,15891884324,Qing Hai Sheng Guan Ling Xian Xiu Ying Ma An Shan Lu B Zuo  980467
JGWEN6LJ5184744417570,Wang Fan,iPhone/13 Pro/White/8GB,6,148667,892002,NEWYEAR25,669001.5,100350.22499999999,2023-06-04 00:00:00,Failed,Delivered,Bank Transfer,American Express,14720677354,Ning Xia Hui Zu Zi Zhi Qu Jie Shi Xu Hui Deng Lu S Zuo  325412
0I1OE6NN7184744417763,Kong Peng,Galaxy/S21/White/8GB,6,69487,416922,SUMMER15,354383.7,53157.555,2023-06-04 00:00:00,Pending,Delivered,Debit Card,American Express,13511023786,Shang Hai Shi Xiang Gang Shi Cheng Bei Liu Jie J Zuo  445875
OWWG112EN184744417947,Chen Lin,iPhone/13 Pro/White/254GB,6,115871,695226,SPRING20,556180.8,83427.12000000001,2023-06-04 00:00:00,Failed,In Transit,Bank Transfer,Visa,13284108994,Guang Xi Zhuang Zu Zi Zhi Qu Tai Bei Shi Gao Ming Cui Lu X Zuo  880193
RULOM49F8184744418147,Xiao Feng Ying,OnePlus/9/Red/254GB,4,99039,396156,SUMMER15,336732.6,50509.88999999999,2023-06-04 00:00:00,Paid,Pending,Debit Card,American Express,13989923072,Fu Jian Sheng Liang Shi Gao Ping Li Lu C Zuo  812525
4L47OYDSL184744418326,Liang Mei,Vivo/X60/Purple/64GB,2,53079,106158,AUTUMN5,100850.09999999999,15127.514999999998,2023-06-04 00:00:00,Failed,Shipped,PayPal,Alipay,15181686302,Xin Jiang Wei Wu Er Zi Zhi Qu Hu He Hao Te Shi Xun Yang Hu Lu I Zuo  227429
1FOJZXOJ8184744418531,Zhang Rong,Xiaomi/Mi 11/Purple/128GB,4,127664,510656,SPRING20,408524.80000000005,61278.72,2023-06-04 00:00:00,Paid,Delivered,Bank Transfer,WeChat Pay,13717184739,Tai Wan Sheng Li Shi Mu Ye Tong Liao Lu I Zuo  116187
