Order ID,Customer Name,Mobile Model,Quantity,Price per Unit,Total Price,Promotion Code,Order Amount,GST,Order Date,Payment Status,Shipping Status,Payment Method,Payment Provider,Mobile,Delivery Address
CTMXGOKOV184815400950,Li Fang,OnePlus/9/Black/254GB,10,107620,1076200,AUTUMN5,1022390.0,153358.5,2024-02-20 00:00:00,Paid,In Transit,Debit Card,American Express,13640571902,Fu Jian Sheng Ping Shi Bai Yun Bei Zhen Lu F Zuo  370506
6VX1J9MAO184815401107,Hao Li,iPhone/13/Purple/8GB,1,86842,86842,AUTUMN5,82499.9,12374.984999999999,2024-02-20 00:00:00,Failed,Shipped,Credit Card,Alipay,18164339253,Hu Bei Sheng Li Xian Yong Chuan La Sa Jie K Zuo  632746
BMU6ZCKYJ184815401259,Zhang Chen,Huawei/P40/Blue/8GB,6,120633,723798,NEWYEAR25,542848.5,81427.275,2024-02-20 00:00:00,Pending,Pending,Bank Transfer,PayPal,13691251285,Hai Nan Sheng Han Dan Xian He Ping Hai Men Lu S Zuo  167393
RAHXNQ13C184815401418,Chen Feng Lan,Huawei/P40/White/64GB,8,73404,587232,SPRING20,469785.60000000003,70467.84,2024-02-20 00:00:00,Pending,Shipped,Debit Card,PayPal,15191363386,Shang Hai Shi Bing Shi You Hao Huang Lu E Zuo  324624
09WR3OV1L184815401586,Ou Xiu Lan,Vivo/X60/Purple/128GB,1,78728,78728,AUTUMN5,74791.59999999999,11218.739999999998,2024-02-20 00:00:00,Failed,Pending,Credit Card,WeChat Pay,13911382245,Shang Hai Shi Min Xian Jiang Bei Bei Zhen Jie Y Zuo  583263
A93UYKEQ8184815401745,Yin Feng Ying,Galaxy/S21/Blue/1TB,7,114392,800744,SPRING20,640595.2000000001,96089.28000000001,2024-02-20 00:00:00,Pending,Pending,Bank Transfer,American Express,13438589264,Nei Meng Gu Zi Zhi Qu Jian Jun Xian He Chuan Wang Jie U Zuo  158737
32UM6935Y184815401933,Yang Ting,iPhone/13/Blue/32GB,1,65500,65500,SUMMER15,55675.0,8351.25,2024-02-20 00:00:00,Failed,In Transit,Bank Transfer,MasterCard,13633294300,Guang Xi Zhuang Zu Zi Zhi Qu Hao Shi Sha Wan Zheng Jie Y Zuo  980889
T20L7FSBN184815402116,Yang Qiang,Vivo/X60/Red/64GB,1,50685,50685,WINTER10,45616.5,6842.474999999999,2024-02-20 00:00:00,Paid,Pending,Credit Card,Visa,18670096642,Hei Long Jiang Sheng Gui Rong Shi Xi Shan He Lu B Zuo  566317
5GJ45FHEX184815402289,Li Gui Rong,Huawei/P40/Black/1TB,10,85547,855470,FESTIVE30,598829.0,89824.34999999999,2024-02-20 00:00:00,Pending,Pending,Bank Transfer,WeChat Pay,15096825852,Hu Nan Sheng Yong An Shi Qing Pu Nan Chang Jie Z Zuo  867033
H7R22E6GW184815402452,Ma Hao,Galaxy/S21/White/1TB,6,92755,556530,WINTER10,500877.0,75131.55,2024-02-20 00:00:00,Pending,Shipped,Debit Card,MasterCard,13220299109,Xiang Gang Te Bie Xing Zheng Qu He Shan Xian Zhao Yang Liao Yang Lu T Zuo  701312
IDYTA4SBQ184815402635,Song Xiu Lan,Galaxy/S21/Purple/8GB,9,77329,695961,SUMMER15,591566.85,88735.0275,2024-02-20 00:00:00,Pending,Shipped,Bank Transfer,Visa,14760515205,Shan Xi Sheng Han Dan Xian Cheng Bei Xin Ji Lu N Zuo  964733
2INN9RUB8184815402797,Chen Chang,Xiaomi/Mi 11/Blue/254GB,6,103291,619746,NEWYEAR25,464809.5,69721.425,2024-02-20 00:00:00,Pending,Shipped,Debit Card,Alipay,14560658213,Guang Dong Sheng Hong Xia Shi Zi Chuan Luo Jie E Zuo  878289
0R02FZZ3S184815402966,Mou Chao,Xiaomi/Mi 11/Red/254GB,8,126863,1014904,WINTER10,913413.6,137012.03999999998,2024-02-20 00:00:00,Paid,In Transit,Bank Transfer,Alipay,14709932029,He Bei Sheng Feng Shi Gao Ming Guan Ling Jie M Zuo  481013
EE92C3TH9184815403119,Wang Hao,Oppo/Reno5/Black/254GB,3,142278,426834,FESTIVE30,298783.8,44817.57,2024-02-20 00:00:00,Paid,Shipped,Bank Transfer,Alipay,13523039468,Shang Hai Shi He Shan Xian You Hao Ou Jie S Zuo  100884
TQMUKPH8R184815403287,Hu Feng Ying,Xiaomi/Mi 11/Purple/1TB,1,127540,127540,SPRING20,102032.0,15304.8,2024-02-20 00:00:00,Pending,In Transit,Credit Card,WeChat Pay,18644333551,Hei Long Jiang Sheng Yi Dou Xian Xiang An Nan Chang Jie D Zuo  676523
BX67X853G184815403452,Tang Yu Lan,iPhone/13/Purple/254GB,2,96958,193916,FESTIVE30,135741.19999999998,20361.179999999997,2024-02-20 00:00:00,Failed,In Transit,PayPal,MasterCard,15274173001,Qing Hai Sheng Yu Xian An Ci Xin Ji Jie Z Zuo  994734
6Y0CNYGR7184815403607,Wang Xiu Ying,Oppo/Reno5/Purple/128GB,5,131728,658640,AUTUMN5,625708.0,93856.2,2024-02-20 00:00:00,Paid,Shipped,Bank Transfer,MasterCard,13121505737,Jiang Su Sheng Ting Xian Cheng Bei He Fei Jie Q Zuo  875053
CU3ELAESB184815403763,Mo Jun,Oppo/Reno5/Blue/64GB,1,56966,56966,NEWYEAR25,42724.5,6408.675,2024-02-20 00:00:00,Paid,Delivered,Debit Card,Alipay,15658423439,Shan Dong Sheng Liao Yang Shi Qing He Xi Ning Lu W Zuo  873395
FWAAL75FY184815403923,Wen Hong Xia,Huawei/P40/Red/8GB,9,52053,468477,SPRING20,374781.60000000003,56217.240000000005,2024-02-20 00:00:00,Paid,Pending,PayPal,Alipay,15604046659,Hu Bei Sheng Gui Ying Shi Nan Hu Wu Lu Q Zuo  168751
HMOLEOA7M184815404100,Wu Dan,iPhone/13 Pro/Blue/32GB,7,139632,977424,WINTER10,879681.6,131952.24,2024-02-20 00:00:00,Pending,Pending,Bank Transfer,MasterCard,13169785852,Tian Jin Shi Hua Xian Xi Xia Guang Zhou Lu D Zuo  346293
E6EJVLLD9184815404253,Ma Jie,Vivo/X60/Black/254GB,5,90095,450475,SPRING20,360380.0,54057.0,2024-02-20 00:00:00,Paid,Shipped,Bank Transfer,PayPal,18196829019,Shang Hai Shi Yong An Shi Nan Xi La Sa Lu P Zuo  558446
CHTAZAXWS184815404410,Yan Jia,Vivo/X60/Purple/128GB,9,63585,572265,NEWYEAR25,429198.75,64379.8125,2024-02-20 00:00:00,Failed,Shipped,Credit Card,PayPal,15666818176,Shan Xi Sheng Gui Zhi Shi Long Tan Da Ye Lu Y Zuo  437311
LG2R62ZS9184815404567,Lu Shu Zhen,Huawei/P40/Black/64GB,9,81429,732861,NEWYEAR25,549645.75,82446.8625,2024-02-20 00:00:00,Failed,Delivered,Debit Card,Alipay,15137403479,Shan Dong Sheng Zhi Qiang Xian Xu Hui Zhang Lu R Zuo  312804
9FO8DGLXH184815404741,Zheng Lu,iPhone/13 Pro/Black/8GB,5,65753,328765,WINTER10,295888.5,44383.275,2024-02-20 00:00:00,Paid,In Transit,Debit Card,American Express,18055009104,Xiang Gang Te Bie Xing Zheng Qu Xi Ning Xian Qing Cheng Ning De Lu V Zuo  471585
5CK0HUOYL184815404919,Ye Gui Fang,OnePlus/9/White/1TB,7,107152,750064,AUTUMN5,712560.7999999999,106884.11999999998,2024-02-20 00:00:00,Failed,In Transit,Debit Card,Alipay,18968369870,Hei Long Jiang Sheng Tian Jin Xian Liang Ping La Sa Lu E Zuo  376966
NV6GNNBAR184815405089,Ao Hong Xia,OnePlus/9/Blue/32GB,2,57608,115216,NEWYEAR25,86412.0,12961.8,2024-02-20 00:00:00,Pending,In Transit,Credit Card,MasterCard,15602164669,Chong Qing Shi Hua Shi You Hao Liao Yang Lu T Zuo  248550
IFII4I3MN184815405248,Huang Juan,Galaxy/S21/Purple/1TB,3,147178,441534,AUTUMN5,419457.3,62918.594999999994,2024-02-20 00:00:00,Failed,Delivered,PayPal,PayPal,15601065880,Ao Men Te Bie Xing Zheng Qu Yu Xian Shan Ting Gong Lu S Zuo  885097
5NVTFSEMA184815405433,Yang Peng,Oppo/Reno5/Purple/32GB,6,103455,620730,SUMMER15,527620.5,79143.075,2024-02-20 00:00:00,Paid,Shipped,PayPal,Alipay,15863548732,Zhe Jiang Sheng Tian Jin Shi Zhang Shou Hang Zhou Jie F Zuo  891252
NII85CTGK184815405590,Li Feng Lan,iPhone/13/Purple/32GB,4,71092,284368,SPRING20,227494.40000000002,34124.16,2024-02-20 00:00:00,Pending,Pending,Debit Card,PayPal,13951140181,Jiang Su Sheng Cheng Du Shi Xing Shan Fang Lu Q Zuo  107128
KKD2GAJ1H184815405762,Lan Fei,Huawei/P40/Purple/254GB,8,114966,919728,FESTIVE30,643809.6,96571.43999999999,2024-02-20 00:00:00,Paid,Shipped,Bank Transfer,PayPal,15196903065,Xi Zang Zi Zhi Qu Tao Shi Hua Xi He Shan Jie F Zuo  799810
9HQS4Y1OK184815405923,Wang Gui Zhen,Xiaomi/Mi 11/Red/128GB,3,53807,161421,FESTIVE30,112994.7,16949.204999999998,2024-02-20 00:00:00,Paid,In Transit,PayPal,American Express,18641953629,Xi Zang Zi Zhi Qu Lan Zhou Shi Ji Zhou Hu He Hao Te Jie K Zuo  808378
0GK274ERG184815406105,Sun Lei,Galaxy/S21/Red/64GB,5,72707,363535,AUTUMN5,345358.25,51803.737499999996,2024-02-20 00:00:00,Pending,Shipped,Bank Transfer,PayPal,18219409050,Hu Bei Sheng Gui Fang Shi Zhang Shou Xu Lu A Zuo  810198
BGGUVJVYD184815406274,Wang Yu Hua,Xiaomi/Mi 11/White/64GB,10,61663,616630,SUMMER15,524135.5,78620.325,2024-02-20 00:00:00,Paid,Shipped,Credit Card,MasterCard,15617360116,Jiang Xi Sheng Wu Lu Mu Qi Shi Hua Xi Fu Zhou Lu Q Zuo  169382
MHOMH90ND184815406449,Yang Feng Lan,iPhone/13/White/128GB,9,73160,658440,FESTIVE30,460907.99999999994,69136.19999999998,2024-02-20 00:00:00,Paid,Shipped,Debit Card,WeChat Pay,13063690535,Liao Ning Sheng Chao Hu Shi Xin Cheng Tian Jin Jie L Zuo  404302
2O4CYCETS184815406611,Yang Yang,Vivo/X60/Purple/32GB,7,55660,389620,AUTUMN5,370139.0,55520.85,2024-02-20 00:00:00,Pending,Shipped,Debit Card,PayPal,18964714352,Tian Jin Shi Xing Cheng Xian Yong Chuan Zhuang Lu C Zuo  834964
1XKXMOGO8184815406781,Jiang Ying,Vivo/X60/White/8GB,7,74000,518000,SPRING20,414400.0,62160.0,2024-02-20 00:00:00,Failed,Shipped,Bank Transfer,Visa,13766847995,Xi Zang Zi Zhi Qu Fang Xian Sha Wan Wang Jie L Zuo  762233
M4HLD40SK184815406957,Wang Jing,Oppo/Reno5/Blue/1TB,1,133198,133198,SUMMER15,113218.3,16982.745,2024-02-20 00:00:00,Paid,Delivered,PayPal,Alipay,18038789626,Tai Wan Sheng Jia He Shi Xin Cheng Hang Zhou Jie X Zuo  215488
SHHL0CN81184815407116,Xiao Lan Ying,Xiaomi/Mi 11/Purple/254GB,7,137964,965748,NEWYEAR25,724311.0,108646.65,2024-02-20 00:00:00,Failed,Pending,PayPal,MasterCard,15621418819,Xiang Gang Te Bie Xing Zheng Qu Xiu Mei Shi Men Tou Gou Ma Lu X Zuo  771137
79U81ZUU7184815407321,Li Ling,Xiaomi/Mi 11/Black/8GB,5,108148,540740,SPRING20,432592.0,64888.799999999996,2024-02-20 00:00:00,Pending,In Transit,Bank Transfer,Alipay,14581426246,Jiang Xi Sheng Tian Jin Shi Xing Shan Xu Lu P Zuo  168814
LOUOK7UQ6184815407491,Luo Xia,iPhone/13 Pro/Black/32GB,4,147817,591268,AUTUMN5,561704.6,84255.68999999999,2024-02-20 00:00:00,Failed,Pending,Credit Card,American Express,13442019729,Tai Wan Sheng Shu Ying Xian Pu Tuo Ye Lu L Zuo  643481
XCEUKWS3B184815407664,Lin Gui Ying,Vivo/X60/Blue/128GB,6,138802,832812,AUTUMN5,791171.3999999999,118675.70999999998,2024-02-20 00:00:00,Pending,Delivered,Credit Card,MasterCard,13926680126,Fu Jian Sheng Nan Shi Jing An Ma An Shan Jie C Zuo  585642
W30TYKCDG184815407832,Xu Li,iPhone/13/Blue/32GB,10,99811,998110,WINTER10,898299.0,134744.85,2024-02-20 00:00:00,Failed,Shipped,PayPal,PayPal,13029478893,Fu Jian Sheng Wu Lu Mu Qi Xian Da Dong Hu He Hao Te Jie S Zuo  681083
X2RMFCD4S184815408008,Zheng Feng Ying,Xiaomi/Mi 11/Blue/1TB,4,100344,401376,FESTIVE30,280963.19999999995,42144.47999999999,2024-02-20 00:00:00,Failed,In Transit,Bank Transfer,American Express,18746548046,Xiang Gang Te Bie Xing Zheng Qu Jing Men Shi Shang Jie Hu He Hao Te Lu B Zuo  736168
RLGBW4KNX184815408204,Wang Fei,iPhone/13 Pro/Red/1TB,3,107040,321120,SPRING20,256896.0,38534.4,2024-02-20 00:00:00,Failed,Delivered,Debit Card,Alipay,13084688457,Liao Ning Sheng He Fei Xian Bai Yun La Sa Jie W Zuo  400990
F403CZR99184815408368,Yang Yu Ying,iPhone/13 Pro/Red/8GB,10,141417,1414170,SPRING20,1131336.0,169700.4,2024-02-20 00:00:00,Failed,Shipped,Bank Transfer,American Express,18573963740,Chong Qing Shi Shan Wei Shi Xin Cheng Xin Ji Jie N Zuo  225834
C8PIHITQT184815408534,Lei Ying,iPhone/13/Black/1TB,1,62537,62537,NEWYEAR25,46902.75,7035.412499999999,2024-02-20 00:00:00,Failed,Shipped,Debit Card,WeChat Pay,13057718498,Jiang Su Sheng Ao Men Xian Bin Cheng Yang Jie X Zuo  155778
1N2K0HJPS184815408706,Li Lu,OnePlus/9/Blue/128GB,2,128148,256296,AUTUMN5,243481.19999999998,36522.17999999999,2024-02-20 00:00:00,Pending,Shipped,PayPal,American Express,13405136970,Ji Lin Sheng Yu Xian Dong Cheng Huang Lu E Zuo  623345
UWTYF59XC184815408874,Zhang Xiu Zhen,Vivo/X60/Black/254GB,7,111627,781389,AUTUMN5,742319.5499999999,111347.93249999998,2024-02-20 00:00:00,Failed,Pending,Debit Card,WeChat Pay,18019763650,Gui Zhou Sheng Ying Xian Cheng Bei Zhao Lu D Zuo  164594
JDQIWTNNF184815409054,Xu Xin,Galaxy/S21/Blue/64GB,8,146391,1171128,SPRING20,936902.4,140535.36,2024-02-20 00:00:00,Failed,Pending,Debit Card,WeChat Pay,18278919586,Shan Xi Sheng Ji Nan Xian Xing Shan Meng Jie Z Zuo  355065
YIA1FG2Y6184815409227,Zhu Lin,Vivo/X60/Blue/8GB,9,143837,1294533,AUTUMN5,1229806.3499999999,184470.95249999998,2024-02-20 00:00:00,Pending,Shipped,PayPal,American Express,14588646736,Shan Xi Sheng Lin Shi Cheng Dong Bei Zhen Lu F Zuo  707188
GOOMTXBWF184815409383,Ji Lin,Vivo/X60/Red/1TB,3,65649,196947,SUMMER15,167404.94999999998,25110.742499999997,2024-02-20 00:00:00,Pending,Shipped,PayPal,PayPal,15252683933,Shan Xi Sheng Gui Rong Xian Liang Ping Wang Lu K Zuo  174824
6IQQ1LD7X184815409553,Ceng Xiang,iPhone/13 Pro/White/128GB,5,94754,473770,SUMMER15,402704.5,60405.674999999996,2024-02-20 00:00:00,Failed,Shipped,PayPal,MasterCard,15263880930,Gui Zhou Sheng Shen Yang Shi Qing Pu Lu An Jie H Zuo  969189
I3N97Q0X2184815409709,Wang Yun,Vivo/X60/White/128GB,4,117869,471476,AUTUMN5,447902.19999999995,67185.32999999999,2024-02-20 00:00:00,Pending,Pending,PayPal,American Express,13004183660,Bei Jing Shi Nan Chang Shi Fu Cheng Zhong Lu O Zuo  903419
WS0K7U90T184815409879,Zhang Jing,OnePlus/9/White/64GB,3,104747,314241,AUTUMN5,298528.95,44779.3425,2024-02-20 00:00:00,Pending,Shipped,PayPal,American Express,13312843981,Shan Xi Sheng Cheng Du Shi He Chuan Zhang Lu R Zuo  344282
G1BGASIL1184815410056,Lu Jia,Huawei/P40/Purple/1TB,5,141779,708895,SPRING20,567116.0,85067.4,2024-02-20 00:00:00,Failed,Pending,Debit Card,American Express,18827923934,Yun Nan Sheng Mei Xian Xiu Ying Wang Jie U Zuo  905797
J0DUWJQ0P184815410223,Guo Yu,iPhone/13/Purple/1TB,3,78487,235461,WINTER10,211914.9,31787.234999999997,2024-02-20 00:00:00,Paid,Delivered,Bank Transfer,Alipay,13008896283,Qing Hai Sheng Han Dan Shi An Ci Zhong Lu Z Zuo  313242
W7W58Y8D8184815410388,Zhang Yu,Huawei/P40/Red/254GB,4,101644,406576,NEWYEAR25,304932.0,45739.799999999996,2024-02-20 00:00:00,Paid,Shipped,Credit Card,WeChat Pay,15219334806,Hu Nan Sheng Yu Mei Shi Shen He Wang Lu R Zuo  710252
1YOSPJPXP184815410566,Nie Zhi Qiang,iPhone/13 Pro/Purple/254GB,9,81991,737919,SUMMER15,627231.15,94084.6725,2024-02-20 00:00:00,Failed,Delivered,Debit Card,American Express,13572628490,Qing Hai Sheng Xiao Hong Shi Xi Xia Xi An Lu C Zuo  609008
0Q2PNRVJ2184815410727,Zhao Fang,Vivo/X60/Red/32GB,2,101728,203456,SUMMER15,172937.6,25940.64,2024-02-20 00:00:00,Pending,Pending,PayPal,PayPal,13266598780,Hu Bei Sheng Shen Yang Xian Qing He Huai An Lu U Zuo  924039
P3WWKH37F184815410886,Yin Xiu Ying,Oppo/Reno5/Red/1TB,6,112522,675132,FESTIVE30,472592.39999999997,70888.85999999999,2024-02-20 00:00:00,Pending,In Transit,Credit Card,American Express,13850973561,Hu Nan Sheng Tai Bei Xian Ping Shan He Jie O Zuo  955406
SJN81REVG184815411064,He Ting,Huawei/P40/White/128GB,8,71763,574104,WINTER10,516693.60000000003,77504.04000000001,2024-02-20 00:00:00,Pending,Shipped,Debit Card,WeChat Pay,18104974526,Tian Jin Shi Jian Shi Xing Shan Chen Lu M Zuo  475451
27RDTKO3C184815411231,Shi Hui,Huawei/P40/Blue/8GB,3,69870,209610,NEWYEAR25,157207.5,23581.125,2024-02-20 00:00:00,Pending,Pending,Bank Transfer,PayPal,13494144577,He Bei Sheng Li Xian Liang Ping Lu An Jie M Zuo  776795
8G0NDLGM4184815411388,Ma Ping,iPhone/13 Pro/Purple/254GB,6,77026,462156,WINTER10,415940.4,62391.06,2024-02-20 00:00:00,Failed,Pending,Credit Card,PayPal,18024792483,Tian Jin Shi He Fei Shi Mu Ye Jing Lu Z Zuo  339767
ENMPPPKAM184815411566,Wang Li,OnePlus/9/White/128GB,2,137507,275014,NEWYEAR25,206260.5,30939.074999999997,2024-02-20 00:00:00,Failed,Shipped,Debit Card,PayPal,18083499884,Si Chuan Sheng Liu Xian Xun Yang Huang Jie S Zuo  188198
GENG2QOTA184815411735,Su Na,Oppo/Reno5/White/1TB,10,71062,710620,WINTER10,639558.0,95933.7,2024-02-20 00:00:00,Paid,Shipped,Bank Transfer,PayPal,18149707512,Shan Xi Sheng Jian Hua Xian Qing Cheng Ding Lu I Zuo  356253
AN6FQK1DP184815411906,Zheng Shu Ying,Xiaomi/Mi 11/Purple/1TB,10,85225,852250,FESTIVE30,596575.0,89486.25,2024-02-20 00:00:00,Pending,Shipped,Credit Card,MasterCard,13481814196,Si Chuan Sheng Jian Hua Xian Xi Shan Wu Han Jie C Zuo  670847
F6G8Q882T184815412066,Xu Bo,iPhone/13/Blue/8GB,3,102419,307257,FESTIVE30,215079.9,32261.984999999997,2024-02-20 00:00:00,Paid,Shipped,Credit Card,Visa,15513479966,Jiang Su Sheng Fu Xin Xian Dong Cheng Hui Zhou Jie B Zuo  872730
4EDMDGAQJ184815412222,Zhou Yu Lan,Galaxy/S21/White/128GB,3,120876,362628,WINTER10,326365.2,48954.78,2024-02-20 00:00:00,Pending,Shipped,Bank Transfer,Alipay,18637520411,Xiang Gang Te Bie Xing Zheng Qu Feng Lan Xian Shen He Deng Jie K Zuo  684411
QFSI1V24M184815412419,Cao Xiu Ying,iPhone/13/Red/1TB,3,96361,289083,NEWYEAR25,216812.25,32521.837499999998,2024-02-20 00:00:00,Pending,Pending,PayPal,WeChat Pay,13954627976,Shang Hai Shi Ying Shi Ji Qu Yang Jie A Zuo  340521
2OE459TPW184815412592,Yan Jing,Huawei/P40/Blue/128GB,4,99585,398340,FESTIVE30,278838.0,41825.7,2024-02-20 00:00:00,Failed,Shipped,Bank Transfer,Visa,18200267586,Bei Jing Shi Hui Shi Da Xing Xu Lu T Zuo  474429
VF7LVQ4YM184815412762,Luo Gui Ying,Xiaomi/Mi 11/Purple/8GB,2,145502,291004,AUTUMN5,276453.8,41468.07,2024-02-20 00:00:00,Failed,Delivered,Credit Card,MasterCard,13850728721,Si Chuan Sheng Ha Er Bin Shi Sha Wan Lei Lu H Zuo  660134
GZ5BVBOUA184815412941,Wang Hui,Huawei/P40/Blue/254GB,8,131826,1054608,NEWYEAR25,790956.0,118643.4,2024-02-20 00:00:00,Paid,Pending,Bank Transfer,American Express,13110524595,Jiang Xi Sheng Tai Yuan Shi Qing He Shen Zhen Jie L Zuo  554648
JJFT4IYAG184815413101,Chen Bin,Huawei/P40/White/1TB,7,114966,804762,SUMMER15,684047.7,102607.15499999998,2024-02-20 00:00:00,Failed,In Transit,PayPal,American Express,18715251495,Gan Su Sheng Shen Yang Shi Cheng Dong Shen Lu I Zuo  763749
M55QVH9LE184815413268,Chen Gui Hua,iPhone/13 Pro/Black/1TB,2,75054,150108,SUMMER15,127591.8,19138.77,2024-02-20 00:00:00,Failed,Delivered,Bank Transfer,Visa,18115742296,Shang Hai Shi Nan Chang Shi Mu Ye Rao Lu B Zuo  202687
A2NG7STI7184815413444,Lei Li Hua,Oppo/Reno5/Red/254GB,5,116409,582045,AUTUMN5,552942.75,82941.41249999999,2024-02-20 00:00:00,Failed,Delivered,Bank Transfer,Visa,13425697048,Hu Nan Sheng Jie Xian Xu Hui Tong Liao Jie Q Zuo  485529
ANG3XHLNB184815413601,Zhang Dan Dan,Galaxy/S21/Black/128GB,9,122913,1106217,WINTER10,995595.3,149339.295,2024-02-20 00:00:00,Failed,Pending,PayPal,WeChat Pay,15830234032,Liao Ning Sheng Kun Ming Shi He Ping Chong Qing Lu H Zuo  241983
IUCNAWAOE184815413767,Tang Ling,Vivo/X60/Blue/8GB,3,143537,430611,WINTER10,387549.9,58132.485,2024-02-20 00:00:00,Failed,In Transit,Credit Card,WeChat Pay,15972007722,Shan Xi Sheng He Shan Xian Qing Cheng Wu Han Lu O Zuo  761411
2MIDZISZA184815413925,Peng Xue,Huawei/P40/Blue/8GB,10,61714,617140,WINTER10,555426.0,83313.9,2024-02-20 00:00:00,Pending,Delivered,Bank Transfer,MasterCard,13604343611,Gan Su Sheng Jian Hua Xian Sha Wan Wang Jie X Zuo  869471
64OYM5OGS184815414093,Wang Yong,Xiaomi/Mi 11/Purple/8GB,3,91177,273531,FESTIVE30,191471.69999999998,28720.754999999997,2024-02-20 00:00:00,Failed,In Transit,Debit Card,PayPal,15391620802,Shan Xi Sheng Mei Shi Huai Rou Hang Zhou Lu M Zuo  314531
ZKVQ1X51B184815414244,Cao Xiu Zhen,Xiaomi/Mi 11/Blue/254GB,3,101834,305502,FESTIVE30,213851.4,32077.71,2024-02-20 00:00:00,Failed,In Transit,Bank Transfer,PayPal,15905916585,Jiang Su Sheng Hai Kou Shi Jing An Cai Jie N Zuo  872971
D8TFA2CR6184815414416,Dong Juan,Huawei/P40/White/64GB,3,85278,255834,NEWYEAR25,191875.5,28781.325,2024-02-20 00:00:00,Paid,Shipped,Bank Transfer,American Express,18172928391,Tai Wan Sheng Chang Shi Gao Ming Hua Jie K Zuo  329321
4YGA0A0GD184815414578,Tang Long,Vivo/X60/Black/128GB,10,119614,1196140,WINTER10,1076526.0,161478.9,2024-02-20 00:00:00,Paid,Delivered,PayPal,Visa,13184877608,Zhe Jiang Sheng Shu Zhen Xian Zhao Yang Fan Lu R Zuo  479939
WT4P15YBK184815414748,Feng Ying,Galaxy/S21/Blue/8GB,2,92084,184168,WINTER10,165751.2,24862.68,2024-02-20 00:00:00,Paid,Pending,PayPal,American Express,13962480130,Shang Hai Shi Wu Zhou Shi Shen Bei Xin Gui Yang Lu Q Zuo  704922
T3S3GJO9L184815414916,Liu Hua,Oppo/Reno5/Blue/128GB,2,54643,109286,NEWYEAR25,81964.5,12294.675,2024-02-20 00:00:00,Paid,Pending,Credit Card,WeChat Pay,18122203073,Shang Hai Shi Chong Qing Xian Qing Cheng Zhang Jie T Zuo  736670
8EUXXLFLH184815415087,Shen Fei,iPhone/13/Red/1TB,4,61357,245428,AUTUMN5,233156.59999999998,34973.49,2024-02-20 00:00:00,Failed,Pending,PayPal,American Express,18641522048,Fu Jian Sheng Chong Qing Shi Ji Qu Hu He Hao Te Lu A Zuo  129682
0VDQY9KHX184815415258,Xu Jia,iPhone/13 Pro/Red/64GB,10,142946,1429460,NEWYEAR25,1072095.0,160814.25,2024-02-20 00:00:00,Pending,In Transit,Bank Transfer,Alipay,14557224535,He Nan Sheng Ji Nan Xian Xing Shan Qi Qi Ha Er Jie O Zuo  710355
TZMNOH92Z184815415432,Xu Jing,Oppo/Reno5/Blue/8GB,1,118416,118416,FESTIVE30,82891.2,12433.679999999998,2024-02-20 00:00:00,Pending,Delivered,Debit Card,WeChat Pay,13409011360,Ji Lin Sheng Fan Shi An Ci Bao Jie F Zuo  129239
JMYJJ4TJ3184815415601,Huang Xue,Oppo/Reno5/Black/8GB,3,142747,428241,FESTIVE30,299768.69999999995,44965.30499999999,2024-02-20 00:00:00,Paid,In Transit,Credit Card,Visa,13025599507,Shan Xi Sheng Lan Zhou Xian Xi Shan Tai Bei Lu X Zuo  861512
4FLFU8X5T184815415760,Li Gui Ying,Huawei/P40/Blue/128GB,4,57852,231408,AUTUMN5,219837.59999999998,32975.63999999999,2024-02-20 00:00:00,Pending,Shipped,Debit Card,American Express,18923467538,Hu Nan Sheng Kun Ming Shi Xiang An Xu Jie V Zuo  354926
GU2WKB6N1184815415973,Luo Jian Hua,Oppo/Reno5/White/32GB,2,106373,212746,AUTUMN5,202108.69999999998,30316.304999999997,2024-02-20 00:00:00,Failed,Delivered,Bank Transfer,MasterCard,15711357501,Hai Nan Sheng Ning De Xian Bin Cheng Bei Zhen Lu T Zuo  217977
AXIYVTZRH184815416168,Lin Xue Mei,iPhone/13 Pro/Red/8GB,3,148780,446340,WINTER10,401706.0,60255.899999999994,2024-02-20 00:00:00,Paid,In Transit,PayPal,PayPal,15773471119,An Hui Sheng Yu Shi Gao Gang Ding Lu Z Zuo  142296
L7ZY28AHC184815416355,Jiang Shuai,Xiaomi/Mi 11/White/64GB,5,76940,384700,WINTER10,346230.0,51934.5,2024-02-20 00:00:00,Paid,Delivered,Credit Card,WeChat Pay,15186313865,Jiang Su Sheng Ping Shi Xun Yang Cheng Du Lu T Zuo  572188
1FFC5PRIQ184815416518,Jian Lei,iPhone/13 Pro/Black/254GB,6,106638,639828,AUTUMN5,607836.6,91175.48999999999,2024-02-20 00:00:00,Pending,Delivered,Credit Card,Visa,18962784932,Zhe Jiang Sheng Long Xian Huai Rou Mi Lu V Zuo  265153
AA3QRFTWY184815416689,Cheng Yan,OnePlus/9/White/1TB,10,80598,805980,AUTUMN5,765681.0,114852.15,2024-02-20 00:00:00,Pending,In Transit,Bank Transfer,PayPal,13515384562,Guang Xi Zhuang Zu Zi Zhi Qu Xiang Gang Shi Bai Yun Tai Yuan Jie A Zuo  819613
92K4IOUBA184815416875,Guo Gui Zhen,Xiaomi/Mi 11/Red/8GB,2,90100,180200,SUMMER15,153170.0,22975.5,2024-02-20 00:00:00,Pending,Shipped,Bank Transfer,Alipay,18157268647,He Nan Sheng Xing An Meng Xian Ji Qu Da Ye Lu V Zuo  120468
M23Y4CKDV184815417053,Shi Gui Zhen,Galaxy/S21/Black/64GB,9,126032,1134288,NEWYEAR25,850716.0,127607.4,2024-02-20 00:00:00,Pending,Pending,PayPal,Visa,15242097780,Hu Bei Sheng Gui Hua Xian Feng Dou Guo Lu I Zuo  162278
VCIG8LR2I184815417238,Huang Gui Xiang,Galaxy/S21/Black/8GB,4,86215,344860,FESTIVE30,241401.99999999997,36210.299999999996,2024-02-20 00:00:00,Paid,Delivered,Debit Card,WeChat Pay,15125249774,Jiang Su Sheng Gui Zhen Shi Xi Xia Hui Zhou Jie C Zuo  514527
TNNT85WI6184815417406,Bao Lei,Vivo/X60/Red/64GB,1,116917,116917,SUMMER15,99379.45,14906.9175,2024-02-20 00:00:00,Failed,Delivered,Debit Card,American Express,15186933932,Guang Dong Sheng Yan Xian Dong Li Zhu Jie Y Zuo  352329
KOE879QLO184815417575,Meng Bin,OnePlus/9/Purple/1TB,5,127261,636305,SPRING20,509044.0,76356.59999999999,2024-02-20 00:00:00,Paid,Shipped,PayPal,PayPal,18193754588,Jiang Xi Sheng Bei Zhen Shi Cheng Bei Ceng Jie Q Zuo  169350
ZK5FXC39X184815417753,Xu Long,OnePlus/9/Purple/128GB,6,101625,609750,AUTUMN5,579262.5,86889.375,2024-02-20 00:00:00,Paid,Delivered,Credit Card,Visa,15334924327,Jiang Xi Sheng Xi An Xian Xing Shan Li Lu N Zuo  624255
LT7N0VO5X184815417923,Dou Yan,Galaxy/S21/White/32GB,6,103930,623580,SUMMER15,530043.0,79506.45,2024-02-20 00:00:00,Pending,In Transit,Credit Card,American Express,18627879301,Liao Ning Sheng Xi Ning Xian Gao Gang Wu Lu Mu Qi Lu W Zuo  721212
QRTBGX1X4184815418095,Zhong Ying,Huawei/P40/White/64GB,3,131223,393669,SUMMER15,334618.64999999997,50192.79749999999,2024-02-20 00:00:00,Failed,Shipped,Debit Card,Visa,14700395255,Hu Nan Sheng Fu Zhou Shi Xiu Ying Ding Lu K Zuo  526167
NMNGD8YZW184815418269,An Bo,iPhone/13/Red/1TB,3,87784,263352,AUTUMN5,250184.4,37527.659999999996,2024-02-20 00:00:00,Failed,Pending,PayPal,WeChat Pay,13084462308,Tian Jin Shi Hai Yan Xian Ji Qu Qi Qi Ha Er Lu A Zuo  607357
IH7MW66VP184815418443,Chen Dan Dan,Vivo/X60/Purple/254GB,8,79935,639480,WINTER10,575532.0,86329.8,2024-02-20 00:00:00,Paid,Shipped,Bank Transfer,WeChat Pay,18064706281,Gan Su Sheng Chong Qing Xian Zhang Shou Liu Lu R Zuo  895140
BV99L6RZW184815418625,Lin Yu,Oppo/Reno5/Black/128GB,6,129017,774102,WINTER10,696691.8,104503.77,2024-02-20 00:00:00,Failed,In Transit,PayPal,MasterCard,18595351186,Xi Zang Zi Zhi Qu Fo Shan Shi Xu Hui Wang Jie G Zuo  230889
3OJCAL3CL184815418808,Cao Chao,Oppo/Reno5/Black/128GB,2,83915,167830,SPRING20,134264.0,20139.6,2024-02-20 00:00:00,Failed,Delivered,Bank Transfer,WeChat Pay,15371570154,Guang Xi Zhuang Zu Zi Zhi Qu Chang Xian Liu Zhi Te Zheng Zhou Lu Z Zuo  349785
U58BCLG62184815418993,Xiong Nan,Oppo/Reno5/Red/8GB,2,125543,251086,AUTUMN5,238531.69999999998,35779.755,2024-02-20 00:00:00,Pending,In Transit,PayPal,Visa,15547110223,He Bei Sheng Lu Shi Shen He Wang Lu D Zuo  301777
V58VJUKG4184815419164,Wang Xiao Hong,Vivo/X60/White/128GB,9,51903,467127,WINTER10,420414.3,63062.145,2024-02-20 00:00:00,Paid,Shipped,Credit Card,American Express,18235028084,Hei Long Jiang Sheng Tong Liao Shi Ji Qu Xing An Meng Jie C Zuo  212747
XWZE7IAD0184815419343,Chen Hua,iPhone/13/Black/8GB,4,107695,430780,NEWYEAR25,323085.0,48462.75,2024-02-20 00:00:00,Paid,Pending,Bank Transfer,WeChat Pay,13095948592,Hu Bei Sheng La Sa Xian Xi Feng Jing Men Lu H Zuo  995485
Z0BRCM69G184815419505,Duan Li Li,Xiaomi/Mi 11/White/8GB,2,62361,124722,SUMMER15,106013.7,15902.054999999998,2024-02-20 00:00:00,Pending,Delivered,PayPal,WeChat Pay,13246931083,Fu Jian Sheng Xiang Shi Xiao Shan Fan Jie E Zuo  660262
