Order ID,Customer Name,Mobile Model,Quantity,Price per Unit,Total Price,Promotion Code,Order Amount,GST,Order Date,Payment Status,Shipping Status,Payment Method,Payment Provider,Mobile,Delivery Address
T8ACZKV2Y184749262312,Liao Jun,OnePlus/9/White/1TB,5,56608,283040,WINTER10,254736.0,38210.4,2023-07-13 00:00:00,Failed,In Transit,Debit Card,PayPal,13253503048,Tai Wan Sheng Qian Jiang Shi Yong Chuan Huai An Lu G Zuo  645678
8XOK99ZMG184749262472,Tian Bo,Huawei/P40/Black/128GB,3,136482,409446,SPRING20,327556.80000000005,49133.520000000004,2023-07-13 00:00:00,Pending,Shipped,Debit Card,PayPal,18915223521,He Nan Sheng Li Xian Hua Long Wu Han Jie E Zuo  697547
6OUC4T5ZB184749262625,Chen Xiu Lan,OnePlus/9/Black/1TB,3,75428,226284,WINTER10,203655.6,30548.34,2023-07-13 00:00:00,Pending,In Transit,Debit Card,PayPal,13789106883,Tian Jin Shi Shen Yang Shi Min Xing Liu Jie K Zuo  541559
9OBYYG9GI184749262797,Liang Hua,Vivo/X60/White/32GB,1,107472,107472,NEWYEAR25,80604.0,12090.6,2023-07-13 00:00:00,Failed,Shipped,Credit Card,American Express,15344102143,Gui Zhou Sheng Xin Ji Xian Jiang Bei Jing Men Lu E Zuo  321361
J380PC4IB184749262955,Yang Yang,OnePlus/9/Purple/128GB,4,125335,501340,FESTIVE30,350938.0,52640.7,2023-07-13 00:00:00,Failed,Delivered,Debit Card,Visa,18560626639,Fu Jian Sheng Kun Ming Shi Xing Shan Tian Jin Lu X Zuo  340627
65SP44GP6184749263110,Chen Shu Lan,Oppo/Reno5/Blue/8GB,7,149195,1044365,FESTIVE30,731055.5,109658.325,2023-07-13 00:00:00,Failed,Delivered,Credit Card,MasterCard,14523241450,Qing Hai Sheng Li Xian Zhang Shou Han Jie A Zuo  188899
BU0M4IH2V184749263278,Li Xiu Rong,OnePlus/9/Purple/128GB,8,112068,896544,SUMMER15,762062.4,114309.36,2023-07-13 00:00:00,Paid,In Transit,Credit Card,American Express,15869469148,Xin Jiang Wei Wu Er Zi Zhi Qu Xiu Mei Xian Pu Tuo Liu Zhou Jie P Zuo  407037
DJMC2HKK8184749263460,Xu Ming,Xiaomi/Mi 11/Blue/254GB,1,72486,72486,FESTIVE30,50740.2,7611.029999999999,2023-07-13 00:00:00,Paid,Pending,Bank Transfer,MasterCard,15867266062,Yun Nan Sheng Peng Xian Bi Shan Fang Lu T Zuo  605215
OFNE9Y0YK184749263624,Chen Wei,iPhone/13 Pro/Red/254GB,8,66692,533536,SUMMER15,453505.6,68025.84,2023-07-13 00:00:00,Paid,Shipped,PayPal,MasterCard,18014025931,Shan Xi Sheng Hui Shi Nan Xi Zhang Lu Z Zuo  797985
NBA1FPA45184749263785,Jia Ying,OnePlus/9/White/1TB,5,121843,609215,NEWYEAR25,456911.25,68536.6875,2023-07-13 00:00:00,Pending,Shipped,Credit Card,Visa,14537459816,Qing Hai Sheng Qin Shi Gao Ming Dong Guan Jie N Zuo  473732
5UBJ3X6EJ184749263937,Lu Lei,iPhone/13/Purple/254GB,2,142538,285076,SPRING20,228060.80000000002,34209.12,2023-07-13 00:00:00,Paid,Pending,Debit Card,Visa,18282885494,Gan Su Sheng Fei Xian Liu Zhi Te Kun Ming Jie H Zuo  400881
1UAHZ4KAS184749264095,Wang Yan,Galaxy/S21/Purple/64GB,1,95336,95336,WINTER10,85802.40000000001,12870.36,2023-07-13 00:00:00,Paid,In Transit,Debit Card,Visa,13847723489,Qing Hai Sheng Li Juan Xian Min Xing Chang Chun Lu V Zuo  637374
TMXHLMZG0184749264250,Yao Xiu Rong,Huawei/P40/Red/254GB,4,116272,465088,AUTUMN5,441833.6,66275.04,2023-07-13 00:00:00,Pending,In Transit,Debit Card,Visa,13901142403,Shan Xi Sheng Yu Ying Shi Cheng Dong Miao Lu M Zuo  201691
QU8VZPJD5184749264424,Song Dan Dan,iPhone/13 Pro/White/64GB,6,135675,814050,AUTUMN5,773347.5,116002.125,2023-07-13 00:00:00,Pending,In Transit,Credit Card,MasterCard,13666913077,Hu Bei Sheng Xiao Hong Shi Feng Dou He Lu I Zuo  998766
3QCBII70T184749264600,Na Dan,Xiaomi/Mi 11/White/64GB,5,138437,692185,NEWYEAR25,519138.75,77870.8125,2023-07-13 00:00:00,Failed,Shipped,PayPal,WeChat Pay,18795973027,Xin Jiang Wei Wu Er Zi Zhi Qu Wu Han Xian Yong Chuan Jia He Jie Z Zuo  225050
PQQODN9R6184749264781,He Gui Ying,Oppo/Reno5/Black/64GB,9,121908,1097172,AUTUMN5,1042313.3999999999,156347.00999999998,2023-07-13 00:00:00,Pending,Delivered,PayPal,WeChat Pay,13162824034,Liao Ning Sheng Nan Shi Zhao Yang Zhang Jia Gang Jie J Zuo  583564
4XU351V18184749264947,Ceng Ting Ting,iPhone/13/Black/254GB,9,89189,802701,AUTUMN5,762565.95,114384.89249999999,2023-07-13 00:00:00,Paid,Delivered,Debit Card,WeChat Pay,15865267537,Ji Lin Sheng Xing An Meng Shi Qing Cheng Li Jie V Zuo  371491
XKISX8ABA184749265127,Ceng Jun,iPhone/13/Blue/254GB,7,133597,935179,SUMMER15,794902.15,119235.3225,2023-07-13 00:00:00,Failed,Shipped,Bank Transfer,PayPal,15709838795,Jiang Xi Sheng Xing An Meng Shi Shen Bei Xin Hu Lu Z Zuo  721904
W7A8PLYUY184749265312,Zhang Yang,iPhone/13 Pro/Black/64GB,2,84131,168262,SUMMER15,143022.69999999998,21453.404999999995,2023-07-13 00:00:00,Failed,Delivered,PayPal,WeChat Pay,14737564040,He Bei Sheng Hong Mei Shi Mu Ye Yin Chuan Lu K Zuo  392607
UYDV71BD4184749265475,Huang Yan,iPhone/13 Pro/White/32GB,10,50094,500940,FESTIVE30,350658.0,52598.7,2023-07-13 00:00:00,Failed,Delivered,PayPal,MasterCard,13399346802,Hu Nan Sheng Gui Zhi Shi Wei Dou Qiu Jie G Zuo  263034
9OS5C1TNV184749265650,Chen Xiu Rong,Xiaomi/Mi 11/Blue/128GB,10,113368,1133680,WINTER10,1020312.0,153046.8,2023-07-13 00:00:00,Failed,Shipped,Debit Card,Alipay,18621228207,Jiang Su Sheng Gui Zhi Shi You Hao Yan Jie U Zuo  477127
6GQSCAML1184749265829,Guo Li,OnePlus/9/Purple/32GB,3,138139,414417,SUMMER15,352254.45,52838.1675,2023-07-13 00:00:00,Failed,In Transit,Debit Card,WeChat Pay,15511351456,Nei Meng Gu Zi Zhi Qu Feng Lan Xian Xi Xia Kun Ming Lu Y Zuo  290376
69O14BO7R184749266005,Tan Xiu Lan,Huawei/P40/White/8GB,1,146104,146104,SPRING20,116883.20000000001,17532.48,2023-07-13 00:00:00,Failed,In Transit,PayPal,WeChat Pay,13152781058,Hu Bei Sheng Zhang Sha Shi Yong Chuan Liu Jie Q Zuo  996322
WSWM0A142184749266228,Li Xiu Fang,Huawei/P40/Purple/32GB,1,82474,82474,SPRING20,65979.2,9896.88,2023-07-13 00:00:00,Failed,In Transit,Credit Card,WeChat Pay,18607114060,Guang Dong Sheng Dan Dan Shi Zi Chuan Tai Yuan Jie Y Zuo  574626
S7SU3MYRG184749266416,Zhang Chao,iPhone/13 Pro/Red/64GB,7,83457,584199,AUTUMN5,554989.0499999999,83248.35749999998,2023-07-13 00:00:00,Paid,Delivered,PayPal,Alipay,13836814120,Shan Xi Sheng Cheng Du Xian Xiu Ying Zhang Lu S Zuo  512598
Q82OC444D184749266600,Zhu Gui Rong,OnePlus/9/White/128GB,7,139738,978166,WINTER10,880349.4,132052.41,2023-07-13 00:00:00,Paid,Delivered,Bank Transfer,PayPal,18695729150,Zhe Jiang Sheng Fu Zhou Shi Qing He Shen Yang Jie C Zuo  611875
GH4LQRONU184749266770,Zhang Peng,OnePlus/9/White/8GB,2,148015,296030,WINTER10,266427.0,39964.049999999996,2023-07-13 00:00:00,Failed,Shipped,Credit Card,MasterCard,14716448320,He Nan Sheng Ma An Shan Shi Xi Feng Xi An Lu E Zuo  960839
YTC6KBPOF184749266941,Yang Zhi Qiang,OnePlus/9/White/8GB,9,117814,1060326,SPRING20,848260.8,127239.12,2023-07-13 00:00:00,Failed,Delivered,Credit Card,Alipay,13107491751,Jiang Su Sheng Shan Wei Xian Zhang Shou Lei Jie P Zuo  748402
FJ5ZZCCTC184749267122,Zhuang Xiu Fang,Xiaomi/Mi 11/Red/1TB,5,122013,610065,SUMMER15,518555.25,77783.28749999999,2023-07-13 00:00:00,Paid,Shipped,Bank Transfer,Visa,13070801020,Shan Xi Sheng Zheng Zhou Xian Nan Zhang Lu An Jie E Zuo  594736
4TH2KGSE8184749267299,Mei Xu,iPhone/13 Pro/Red/8GB,6,142717,856302,SPRING20,685041.6000000001,102756.24,2023-07-13 00:00:00,Pending,Delivered,PayPal,Visa,15126741809,Jiang Su Sheng Dong Guan Shi Qing He Bei Zhen Jie J Zuo  833080
QYIDXJQ86184749267463,Yang Hong Mei,Vivo/X60/Red/64GB,4,71168,284672,NEWYEAR25,213504.0,32025.6,2023-07-13 00:00:00,Pending,Pending,Debit Card,American Express,14701921236,Shan Xi Sheng Chong Qing Shi Shuang Luan Cheng Du Lu I Zuo  383711
554WI0OH8184749267630,Chai Bo,Vivo/X60/Purple/254GB,6,59679,358074,WINTER10,322266.60000000003,48339.990000000005,2023-07-13 00:00:00,Paid,In Transit,Credit Card,PayPal,14553252235,He Bei Sheng Tong Liao Shi Nan Hu Xu Lu U Zuo  849322
JFKCY3DR8184749267804,Zhong Liu,Huawei/P40/Purple/1TB,5,81262,406310,WINTER10,365679.0,54851.85,2023-07-13 00:00:00,Pending,Delivered,Debit Card,American Express,13618230715,Tai Wan Sheng Gui Lan Xian Jing An Ha Er Bin Jie I Zuo  565298
RU9Z289QY184749267977,Zhuang Qin,Oppo/Reno5/White/254GB,10,96372,963720,FESTIVE30,674604.0,101190.59999999999,2023-07-13 00:00:00,Pending,Delivered,PayPal,American Express,13178130656,Xin Jiang Wei Wu Er Zi Zhi Qu Yu Mei Shi Shuang Luan Ao Men Jie G Zuo  598801
KO9RUKX8T184749268169,Huang Yu Zhen,Oppo/Reno5/Blue/128GB,6,128050,768300,WINTER10,691470.0,103720.5,2023-07-13 00:00:00,Pending,Shipped,PayPal,PayPal,15683034830,Shan Dong Sheng Ning De Shi Huai Rou Chen Lu L Zuo  368642
M2MOW1QV6184749268354,Tang Ying,Xiaomi/Mi 11/Red/8GB,8,66415,531320,SUMMER15,451622.0,67743.3,2023-07-13 00:00:00,Failed,Delivered,Debit Card,WeChat Pay,18084979532,Gui Zhou Sheng He Shan Xian Zhang Shou Long Jie Z Zuo  289719
7UV5D62LX184749268528,Li Ling,OnePlus/9/Black/128GB,2,101594,203188,SPRING20,162550.40000000002,24382.56,2023-07-13 00:00:00,Paid,Shipped,Bank Transfer,PayPal,15098743112,An Hui Sheng Yu Shi Xin Cheng Ji Lu J Zuo  623822
7UEA4SJAR184749268694,Zhang Dong,Oppo/Reno5/Red/8GB,4,84696,338784,AUTUMN5,321844.8,48276.719999999994,2023-07-13 00:00:00,Pending,Shipped,Debit Card,Visa,15154684075,Ning Xia Hui Zu Zi Zhi Qu Chao Hu Shi Liang Ping Su Lu X Zuo  202972
8E1WEPPVR184749268890,He Feng Lan,Oppo/Reno5/Purple/8GB,1,110218,110218,SPRING20,88174.40000000001,13226.160000000002,2023-07-13 00:00:00,Paid,In Transit,PayPal,WeChat Pay,14503099907,Shan Xi Sheng Tong Liao Xian Gao Gang Peng Jie M Zuo  860742
HCD8SVZSZ184749269069,Yu Xiu Rong,Huawei/P40/White/1TB,6,134411,806466,SPRING20,645172.8,96775.92,2023-07-13 00:00:00,Paid,Shipped,Credit Card,Visa,15940081998,Ji Lin Sheng Fan Xian Dong Li Gu Jie P Zuo  858128
SKEKHICW9184749269247,Xue Hong,Galaxy/S21/Blue/64GB,10,58579,585790,SUMMER15,497921.5,74688.22499999999,2023-07-13 00:00:00,Failed,In Transit,PayPal,MasterCard,18541182686,Fu Jian Sheng Na Xian Shen Bei Xin Ding Lu J Zuo  600602
7MNKZQ7D7184749269422,Zhang Xiu Zhen,Xiaomi/Mi 11/Red/8GB,3,129523,388569,WINTER10,349712.10000000003,52456.815,2023-07-13 00:00:00,Paid,Pending,Bank Transfer,WeChat Pay,15321856386,An Hui Sheng Wu Lu Mu Qi Xian Hua Xi Hu He Hao Te Jie T Zuo  868352
VM8LQ0K07184749269607,Li Chen,OnePlus/9/Blue/1TB,4,65406,261624,AUTUMN5,248542.8,37281.42,2023-07-13 00:00:00,Pending,Shipped,Bank Transfer,WeChat Pay,13700561203,Jiang Xi Sheng Liang Shi Da Xing Xi An Lu K Zuo  359106
RKIQ0E21Z184749269769,Zhang Yu Zhen,Vivo/X60/Purple/64GB,10,136447,1364470,NEWYEAR25,1023352.5,153502.875,2023-07-13 00:00:00,Paid,Shipped,Credit Card,Visa,13447287893,Ao Men Te Bie Xing Zheng Qu Bin Shi Da Dong Ning De Lu W Zuo  279593
68OUZ27BB184749269954,Nong Fang,Oppo/Reno5/Purple/1TB,9,60780,547020,AUTUMN5,519669.0,77950.34999999999,2023-07-13 00:00:00,Failed,Pending,PayPal,American Express,15502126355,He Nan Sheng He Shan Xian Gao Gang Chao Zhou Lu G Zuo  365777
HYQFVECN5184749270116,Du Ting Ting,OnePlus/9/Red/128GB,5,66489,332445,FESTIVE30,232711.49999999997,34906.72499999999,2023-07-13 00:00:00,Pending,Shipped,Debit Card,Visa,18848320116,Xi Zang Zi Zhi Qu Jing Xian Shan Ting Fu Xin Jie M Zuo  266082
V7OCS175Q184749270289,Xiao Fang,Oppo/Reno5/White/32GB,5,114707,573535,NEWYEAR25,430151.25,64522.6875,2023-07-13 00:00:00,Failed,Pending,PayPal,American Express,15573277444,An Hui Sheng Wu Lu Mu Qi Xian Xin Cheng Lu An Jie P Zuo  149330
RXEXEG5B5184749270460,Wu Hong Xia,Huawei/P40/Red/64GB,1,127851,127851,SPRING20,102280.8,15342.119999999999,2023-07-13 00:00:00,Paid,Shipped,PayPal,WeChat Pay,13194971819,Gui Zhou Sheng Ning De Shi Xiao Nan Fu Zhou Jie L Zuo  251557
T2PJ0YDAJ184749270630,Lin Bin,Huawei/P40/White/1TB,5,142355,711775,FESTIVE30,498242.49999999994,74736.37499999999,2023-07-13 00:00:00,Failed,Shipped,PayPal,American Express,13511661525,Shan Xi Sheng Gui Zhi Shi Xiao Shan Tai Yuan Jie K Zuo  971441
Q9E2I1M7D184749270791,Pei Xia,Oppo/Reno5/Red/64GB,3,133679,401037,WINTER10,360933.3,54139.994999999995,2023-07-13 00:00:00,Failed,Delivered,Credit Card,Alipay,15045961840,Chong Qing Shi Zhi Qiang Shi Dong Li Han Dan Jie I Zuo  976679
U6RUNH40X184749270954,Jiang Dan,iPhone/13 Pro/Purple/128GB,8,130666,1045328,AUTUMN5,993061.6,148959.24,2023-07-13 00:00:00,Pending,Pending,PayPal,PayPal,13412683030,He Nan Sheng Jin Feng Shi Xiang An Zhao Jie G Zuo  641698
SYAWZ9GWZ184749271129,Weng Liang,iPhone/13 Pro/Purple/32GB,6,84962,509772,SPRING20,407817.60000000003,61172.64,2023-07-13 00:00:00,Failed,Pending,Debit Card,WeChat Pay,15877510719,Shan Dong Sheng Zhang Sha Shi Bi Shan Xu Lu M Zuo  269812
YER6AWGDM184749271304,Chen Lin,iPhone/13/Blue/32GB,5,62950,314750,WINTER10,283275.0,42491.25,2023-07-13 00:00:00,Paid,Delivered,Bank Transfer,WeChat Pay,18956688314,Zhe Jiang Sheng Jing Men Xian Gao Gang Zhu Jie N Zuo  115063
T38SRDHGO184749271473,Ning Li Juan,Vivo/X60/Black/254GB,3,138731,416193,WINTER10,374573.7,56186.055,2023-07-13 00:00:00,Paid,In Transit,Bank Transfer,American Express,15574477777,Gui Zhou Sheng Bo Xian Sha Shi Tai Yuan Jie A Zuo  242919
RMCX7M3A5184749271630,Li Min,Vivo/X60/Black/32GB,10,73851,738510,SUMMER15,627733.5,94160.025,2023-07-13 00:00:00,Pending,In Transit,PayPal,MasterCard,18849729344,Guang Xi Zhuang Zu Zi Zhi Qu Jian Xian Yong Chuan Chen Lu Y Zuo  558925
0JWXNB9TT184749271816,Guo Lin,Vivo/X60/Red/64GB,1,74837,74837,NEWYEAR25,56127.75,8419.1625,2023-07-13 00:00:00,Failed,Delivered,PayPal,PayPal,13839460054,Zhe Jiang Sheng Lu An Shi Xi Shan Hai Men Jie F Zuo  392293
BT9NDXU4V184749271973,Miao Bo,Galaxy/S21/Blue/128GB,2,118204,236408,AUTUMN5,224587.59999999998,33688.13999999999,2023-07-13 00:00:00,Failed,In Transit,PayPal,Visa,13346304383,Shan Dong Sheng Da Ye Shi Huang Pu Dong Lu B Zuo  499452
2NFMLJG8O184749272147,Gao Ying,Xiaomi/Mi 11/Blue/128GB,6,51673,310038,WINTER10,279034.2,41855.13,2023-07-13 00:00:00,Paid,In Transit,Debit Card,PayPal,18510895018,Hei Long Jiang Sheng Lu Shi Zhao Yang Qiu Lu M Zuo  895867
ISMZ6G1XP184749272323,Zhou Shu Zhen,Xiaomi/Mi 11/Black/64GB,2,92215,184430,AUTUMN5,175208.5,26281.274999999998,2023-07-13 00:00:00,Paid,Delivered,Bank Transfer,Alipay,15874907985,Hei Long Jiang Sheng Lin Shi Xing Shan Lan Zhou Jie H Zuo  211872
TDMFRRMX8184749272486,Chen Rong,OnePlus/9/Black/32GB,4,135490,541960,WINTER10,487764.0,73164.59999999999,2023-07-13 00:00:00,Failed,Shipped,Debit Card,WeChat Pay,13470641145,Gui Zhou Sheng Xin Ji Xian Men Tou Gou Li Jie G Zuo  433946
2OH6KU77I184749272659,Yang Jian,Huawei/P40/Purple/8GB,3,81432,244296,SUMMER15,207651.6,31147.739999999998,2023-07-13 00:00:00,Paid,Shipped,Debit Card,Visa,13984693420,Guang Xi Zhuang Zu Zi Zhi Qu Qiang Xian Zhao Yang Ou Lu O Zuo  387302
H3OQ5XTTL184749272844,Lin Xiu Hua,iPhone/13/Purple/32GB,2,57306,114612,WINTER10,103150.8,15472.619999999999,2023-07-13 00:00:00,Failed,In Transit,Debit Card,American Express,14545714720,Xin Jiang Wei Wu Er Zi Zhi Qu Ma An Shan Shi Xu Hui Deng Jie H Zuo  979507
9WFCA4WXA184749273045,Li Dan,Oppo/Reno5/Black/254GB,3,140002,420006,WINTER10,378005.4,56700.810000000005,2023-07-13 00:00:00,Failed,In Transit,PayPal,American Express,13640237785,Xiang Gang Te Bie Xing Zheng Qu Shu Zhen Xian Xi Feng Gui Yang Jie G Zuo  184229
27RU6C6TW184749273229,Shi Liang,OnePlus/9/Red/254GB,6,69839,419034,NEWYEAR25,314275.5,47141.325,2023-07-13 00:00:00,Paid,Shipped,PayPal,WeChat Pay,15782608458,Chong Qing Shi He Shan Shi Gao Ming Dong Jie B Zuo  849479
8GYEUYWQZ184749273401,Tu Yu Mei,Xiaomi/Mi 11/Black/8GB,4,62153,248612,NEWYEAR25,186459.0,27968.85,2023-07-13 00:00:00,Paid,In Transit,Debit Card,PayPal,13033956939,Yun Nan Sheng Tai Yuan Xian Xin Cheng Tong Liao Lu W Zuo  332647
XTRWXQSQF184749273573,Li Liang,Vivo/X60/Red/8GB,7,84747,593229,SUMMER15,504244.64999999997,75636.6975,2023-07-13 00:00:00,Pending,Shipped,PayPal,PayPal,18832846666,Jiang Su Sheng Dong Mei Shi Da Dong Guo Lu U Zuo  445969
TGTBB9N00184749273743,Zhan Xiao Hong,iPhone/13/White/64GB,4,133546,534184,SUMMER15,454056.39999999997,68108.45999999999,2023-07-13 00:00:00,Paid,Shipped,PayPal,PayPal,15685575646,Shan Dong Sheng Shu Zhen Shi Min Xing Cao Jie X Zuo  672311
GI1XHMEEI184749273920,Zhou Fang,OnePlus/9/Black/8GB,4,74327,297308,SPRING20,237846.40000000002,35676.96,2023-07-13 00:00:00,Pending,Pending,PayPal,Alipay,13127409444,Jiang Xi Sheng Rong Xian Pu Tuo Ning De Lu Y Zuo  701384
69CID2TGM184749274072,Dong Lin,iPhone/13 Pro/White/1TB,4,68708,274832,NEWYEAR25,206124.0,30918.6,2023-07-13 00:00:00,Pending,In Transit,Bank Transfer,Alipay,15597833192,Guang Xi Zhuang Zu Zi Zhi Qu Ling Shi Jin Ping Hui Zhou Jie G Zuo  226553
4GXZRH7TY184749274245,Chen Chen,OnePlus/9/Black/254GB,8,63202,505616,SUMMER15,429773.6,64466.03999999999,2023-07-13 00:00:00,Paid,Shipped,Debit Card,Visa,18097854579,Bei Jing Shi Bei Jing Shi Fu Cheng Hu He Hao Te Lu H Zuo  201632
E21CI23HI184749274410,Zhang Li,Xiaomi/Mi 11/Blue/1TB,8,79317,634536,NEWYEAR25,475902.0,71385.3,2023-07-13 00:00:00,Paid,Pending,PayPal,MasterCard,15387641725,Ao Men Te Bie Xing Zheng Qu Cheng Du Shi Qing He Qi Qi Ha Er Lu N Zuo  436358
6W40M8F80184749274602,Xie Yang,Vivo/X60/Purple/254GB,9,144300,1298700,SUMMER15,1103895.0,165584.25,2023-07-13 00:00:00,Pending,Delivered,Debit Card,Alipay,15611197607,Chong Qing Shi Yin Chuan Shi An Ci Wu Lu P Zuo  690839
O04VOFCON184749274777,Zou Chun Mei,iPhone/13/Purple/64GB,3,95160,285480,AUTUMN5,271206.0,40680.9,2023-07-13 00:00:00,Paid,Pending,Debit Card,Alipay,15873373035,He Bei Sheng Xin Shi Huang Pu Zhou Lu Q Zuo  229506
GOBEPY3WN184749274948,Sun Yun,iPhone/13/Purple/64GB,9,115734,1041606,FESTIVE30,729124.2,109368.62999999999,2023-07-13 00:00:00,Paid,Pending,PayPal,Visa,14512720883,Si Chuan Sheng Lan Zhou Shi Xiao Nan Yang Jie K Zuo  603027
NUFJUD280184749275118,Xu Peng,iPhone/13/Blue/32GB,5,122366,611830,SUMMER15,520055.5,78008.325,2023-07-13 00:00:00,Paid,Delivered,PayPal,American Express,13668688514,Shan Dong Sheng Ao Men Xian Yong Chuan Liu Pan Shui Lu M Zuo  623795
A3BJK0KVB184749275288,Zhang Xiao Hong,Galaxy/S21/Blue/254GB,10,71371,713710,WINTER10,642339.0,96350.84999999999,2023-07-13 00:00:00,Failed,In Transit,Debit Card,MasterCard,18624771786,Hu Nan Sheng He Shan Xian Qing Pu Chen Lu H Zuo  667525
HUP753O07184749275475,Wang Lei,OnePlus/9/Red/64GB,5,146953,734765,SPRING20,587812.0,88171.8,2023-07-13 00:00:00,Pending,Shipped,Credit Card,PayPal,14750155155,Hu Bei Sheng Xing Cheng Shi Xun Yang Jing Men Jie C Zuo  504942
GG7BNQ211184749275633,Liu Yu Ying,Vivo/X60/Red/254GB,5,59443,297215,SUMMER15,252632.75,37894.9125,2023-07-13 00:00:00,Pending,In Transit,PayPal,WeChat Pay,13457602890,Gan Su Sheng Hu He Hao Te Xian Sha Shi Li Jie R Zuo  460212
IQYD6XMKD184749275818,Liu Ping,Xiaomi/Mi 11/Black/64GB,6,50477,302862,WINTER10,272575.8,40886.369999999995,2023-07-13 00:00:00,Pending,Pending,PayPal,Alipay,18749962076,Jiang Su Sheng Bin Xian He Chuan Guang Zhou Jie Q Zuo  938004
UR31WO0IC184749275972,Li Li Juan,Vivo/X60/Red/254GB,3,93957,281871,SUMMER15,239590.35,35938.5525,2023-07-13 00:00:00,Paid,Shipped,Debit Card,Alipay,13662800696,Hu Bei Sheng Liu Pan Shui Shi Dong Li Ceng Jie Q Zuo  372383
5F0CVH5HO184749276162,Sun Rui,Oppo/Reno5/Red/1TB,8,105106,840848,FESTIVE30,588593.6,88289.04,2023-07-13 00:00:00,Pending,Shipped,Bank Transfer,WeChat Pay,13495702073,Zhe Jiang Sheng Li Shi Men Tou Gou Lan Zhou Jie Y Zuo  435145
G8JMNGB83184749276323,Bao Yu,Vivo/X60/White/1TB,1,73811,73811,NEWYEAR25,55358.25,8303.7375,2023-07-13 00:00:00,Paid,Shipped,Credit Card,Alipay,15030781372,Ao Men Te Bie Xing Zheng Qu Yang Xian Long Tan Xi An Lu P Zuo  468791
BFMHHUN7T184749276499,Qi Xiang,Galaxy/S21/Blue/128GB,4,125592,502368,WINTER10,452131.2,67819.68,2023-07-13 00:00:00,Pending,In Transit,Debit Card,Visa,18721563582,Hu Bei Sheng Yu Lan Shi Bai Yun Luo Lu D Zuo  423572
2Y3VYFP4D184749276677,Pang Yong,Oppo/Reno5/Purple/254GB,10,143570,1435700,SPRING20,1148560.0,172284.0,2023-07-13 00:00:00,Failed,In Transit,Credit Card,American Express,13301922607,Chong Qing Shi Rui Xian Long Tan Tao Lu T Zuo  659497
8L9JU8KM8184749276842,Zhao Ting,iPhone/13 Pro/Blue/32GB,3,78190,234570,FESTIVE30,164199.0,24629.85,2023-07-13 00:00:00,Pending,Delivered,PayPal,Alipay,14545947219,Yun Nan Sheng Jing Xian Xiang An Hou Lu U Zuo  498234
7B2WJUQAJ184749277005,Wang Feng Ying,Huawei/P40/Black/254GB,1,142867,142867,SUMMER15,121436.95,18215.5425,2023-07-13 00:00:00,Paid,Pending,Bank Transfer,American Express,18203543684,Gui Zhou Sheng Wu Lu Mu Qi Xian Dong Li Huai An Lu O Zuo  615171
ASBKS42J7184749277174,Li Lu,Vivo/X60/Red/8GB,5,122615,613075,AUTUMN5,582421.25,87363.1875,2023-07-13 00:00:00,Paid,Delivered,Bank Transfer,WeChat Pay,18116078305,Bei Jing Shi Xing Cheng Shi Feng Dou Han Dan Jie V Zuo  699254
J2KFJ8CSU184749277335,Sun Yu Hua,iPhone/13 Pro/Black/64GB,8,86438,691504,SPRING20,553203.2000000001,82980.48000000001,2023-07-13 00:00:00,Paid,In Transit,Bank Transfer,Visa,13558985769,Xiang Gang Te Bie Xing Zheng Qu Chun Mei Shi Nan Zhang Bei Zhen Jie B Zuo  686946
AIZTU88U1184749277518,Chu Xiu Ying,Galaxy/S21/Blue/32GB,5,71581,357905,AUTUMN5,340009.75,51001.4625,2023-07-13 00:00:00,Paid,Pending,Bank Transfer,Alipay,13765953328,Hu Nan Sheng Hai Yan Xian Nan Zhang Shen Yang Lu F Zuo  356280
3C4LPNYQ4184749277681,Chen Yu,Xiaomi/Mi 11/Purple/32GB,4,99107,396428,SUMMER15,336963.8,50544.57,2023-07-13 00:00:00,Paid,Shipped,Debit Card,Alipay,13465850388,Shan Xi Sheng Qiang Xian Shen Bei Xin Chang Sha Lu Q Zuo  873306
990W5YQAA184749277841,Huang Xiu Hua,Huawei/P40/Red/8GB,9,94752,852768,NEWYEAR25,639576.0,95936.4,2023-07-13 00:00:00,Failed,Delivered,Credit Card,WeChat Pay,15740334062,Zhe Jiang Sheng Hai Men Shi You Hao Liang Lu H Zuo  271269
QFNSJ3CU5184749278012,Chen Juan,Xiaomi/Mi 11/White/1TB,9,132359,1191231,WINTER10,1072107.9000000001,160816.18500000003,2023-07-13 00:00:00,Failed,Shipped,Bank Transfer,MasterCard,18666038421,Ning Xia Hui Zu Zi Zhi Qu Xing An Meng Shi Xi Shan Kun Ming Lu A Zuo  282659
CI2WR5HGQ184749278194,Zhang Long,Galaxy/S21/Red/8GB,9,128877,1159893,NEWYEAR25,869919.75,130487.9625,2023-07-13 00:00:00,Paid,Pending,Debit Card,PayPal,15757193746,Shang Hai Shi Dong Xian He Chuan Shi Lu F Zuo  683461
KNRDF4EB4184749278357,Yuan Yu,Vivo/X60/Black/32GB,2,141172,282344,NEWYEAR25,211758.0,31763.699999999997,2023-07-13 00:00:00,Paid,Pending,Bank Transfer,Visa,15644100168,Si Chuan Sheng Xing An Meng Xian Ji Zhou Lu An Lu J Zuo  310636
S9A42MBTR184749278522,Yang Yu Mei,OnePlus/9/Black/128GB,6,85341,512046,SPRING20,409636.80000000005,61445.520000000004,2023-07-13 00:00:00,Paid,Delivered,PayPal,American Express,13495776169,Yun Nan Sheng Yin Chuan Shi Ping Shan Ma Jie A Zuo  629785
E6EYJR5BJ184749278698,Liu Qiang,OnePlus/9/Red/64GB,5,103791,518955,WINTER10,467059.5,70058.925,2023-07-13 00:00:00,Pending,Shipped,PayPal,PayPal,15840016327,Hei Long Jiang Sheng Wei Xian Mu Ye La Sa Jie T Zuo  990768
0MKL3FZZB184749278859,Wang Dong,Oppo/Reno5/Purple/8GB,4,83095,332380,SUMMER15,282523.0,42378.45,2023-07-13 00:00:00,Paid,Delivered,Bank Transfer,MasterCard,18940037267,Shang Hai Shi Yu Shi Ji Qu Shi Jia Zhuang Jie Z Zuo  402716
W053O7O8B184749279017,Li Yu,iPhone/13/Black/32GB,6,72594,435564,SUMMER15,370229.39999999997,55534.409999999996,2023-07-13 00:00:00,Pending,In Transit,Bank Transfer,Alipay,18938915732,Zhe Jiang Sheng Yu Xian Gao Ping Chen Jie R Zuo  274129
KACAU72AW184749279181,Zhao Xiu Ying,OnePlus/9/White/64GB,6,88054,528324,NEWYEAR25,396243.0,59436.45,2023-07-13 00:00:00,Pending,In Transit,Bank Transfer,American Express,15813502762,Xi Zang Zi Zhi Qu Xin Ji Shi Shang Jie Fu Xin Lu K Zuo  632815
T1CSTMJX6184749279355,Wang Lei,Vivo/X60/Purple/32GB,2,124706,249412,AUTUMN5,236941.4,35541.21,2023-07-13 00:00:00,Paid,Delivered,PayPal,American Express,14540359540,Qing Hai Sheng Xiu Rong Xian Sha Wan Han Dan Lu D Zuo  476574
QP3LYJKC4184749279515,Zhou Jian Hua,iPhone/13/Purple/1TB,9,117027,1053243,SPRING20,842594.4,126389.16,2023-07-13 00:00:00,Pending,Pending,PayPal,MasterCard,14569454468,Zhe Jiang Sheng Chao Zhou Xian Xing Shan Shang Hai Lu I Zuo  376419
QMCGKK4D3184749279677,Yan Gui Xiang,Vivo/X60/Red/8GB,9,128308,1154772,WINTER10,1039294.8,155894.22,2023-07-13 00:00:00,Pending,In Transit,Debit Card,MasterCard,18726824497,Shang Hai Shi Ma An Shan Shi Hua Xi Fu Zhou Jie C Zuo  841450
QMWSMGPC1184749279848,Yang Xiu Fang,OnePlus/9/White/254GB,4,125780,503120,NEWYEAR25,377340.0,56601.0,2023-07-13 00:00:00,Pending,Delivered,Debit Card,American Express,13085328311,Xiang Gang Te Bie Xing Zheng Qu Xing An Meng Xian Bi Shan Fo Shan Lu C Zuo  460865
MIAL3BO4J184749280039,Pan Bo,Galaxy/S21/Black/1TB,9,118184,1063656,NEWYEAR25,797742.0,119661.29999999999,2023-07-13 00:00:00,Paid,Shipped,PayPal,Visa,13680292068,Hu Nan Sheng Wu Han Xian Xiao Nan Dai Lu U Zuo  757034
8F9KDC95S184749280209,Huang Yu Zhen,Galaxy/S21/Blue/64GB,7,77934,545538,SPRING20,436430.4,65464.56,2023-07-13 00:00:00,Failed,In Transit,Credit Card,PayPal,18105010649,Nei Meng Gu Zi Zhi Qu Chang Sha Shi Dong Cheng Zhang Jie M Zuo  252919
U2SXHX6X4184749280399,Jie Jian,Galaxy/S21/Red/128GB,4,135666,542664,WINTER10,488397.60000000003,73259.64,2023-07-13 00:00:00,Pending,Pending,Debit Card,WeChat Pay,18039952652,Bei Jing Shi Dong Guan Xian Zhao Yang Ju Lu K Zuo  697498
OA1DE2P9U184749280569,Li Yu,Vivo/X60/White/128GB,9,50234,452106,FESTIVE30,316474.19999999995,47471.12999999999,2023-07-13 00:00:00,Pending,In Transit,Credit Card,WeChat Pay,15911114468,Hu Nan Sheng Li Juan Shi Mu Ye Lan Zhou Jie R Zuo  676522
MT95VIJVC184749280727,Shi Jun,Xiaomi/Mi 11/Red/32GB,1,52253,52253,SPRING20,41802.4,6270.36,2023-07-13 00:00:00,Paid,Delivered,Credit Card,Alipay,15349313077,Jiang Su Sheng Ning De Shi He Ping Zhao Jie S Zuo  599484
IAPU8BHBR184749280894,Wang Yu Lan,Huawei/P40/Black/64GB,6,89781,538686,SUMMER15,457883.1,68682.465,2023-07-13 00:00:00,Paid,Pending,PayPal,American Express,15981115556,An Hui Sheng Rong Shi Min Xing Liang Lu R Zuo  548744
XM9GLFXJU184749281063,Wang Li Hua,Galaxy/S21/Purple/128GB,6,121133,726798,SUMMER15,617778.2999999999,92666.74499999998,2023-07-13 00:00:00,Paid,Delivered,Bank Transfer,PayPal,13197369055,Hai Nan Sheng Feng Lan Shi Dong Cheng Chen Lu F Zuo  991341
