Order ID,Customer Name,Mobile Model,Quantity,Price per Unit,Total Price,Promotion Code,Order Amount,GST,Order Date,Payment Status,Shipping Status,Payment Method,Payment Provider,Mobile,Delivery Address
XZCKD3SBG184730117342,Liu Chang,iPhone/13/Red/64GB,8,82911,663288,SUMMER15,563794.7999999999,84569.21999999999,2023-02-09 00:00:00,Failed,Pending,Credit Card,American Express,14540721490,Nei Meng Gu Zi Zhi Qu Shu Zhen Shi Nan Zhang Shi Lu I Zuo  691280
Z6512V7B4184730117523,Tang Chang,iPhone/13/Black/254GB,3,104808,314424,NEWYEAR25,235818.0,35372.7,2023-02-09 00:00:00,Paid,In Transit,Bank Transfer,American Express,18978452864,Guang Xi Zhuang Zu Zi Zhi Qu Xiu Zhen Xian Huai Rou Li Jie H Zuo  797454
C898NVAGM184730117710,Guo Chang,iPhone/13/Purple/32GB,9,141813,1276317,AUTUMN5,1212501.15,181875.1725,2023-02-09 00:00:00,Failed,Delivered,Bank Transfer,PayPal,13538265316,An Hui Sheng Gui Fang Xian Xin Cheng Shan Wei Jie S Zuo  348599
WNHB2MNW4184730117864,Qiu Ping,Vivo/X60/Purple/32GB,1,118806,118806,WINTER10,106925.40000000001,16038.810000000001,2023-02-09 00:00:00,Pending,Delivered,Credit Card,American Express,18938265998,He Nan Sheng Qian Jiang Xian Qing Cheng Gu Lu R Zuo  441479
QSV6TCNVS184730118031,Liu Kun,OnePlus/9/White/32GB,8,126599,1012792,WINTER10,911512.8,136726.92,2023-02-09 00:00:00,Failed,In Transit,Bank Transfer,MasterCard,13009374888,Gui Zhou Sheng Wu Lu Mu Qi Shi Gao Ping Xiang Gang Lu A Zuo  607519
F3ZYRH3ZS184730118195,Wu Wen,iPhone/13/White/32GB,9,113505,1021545,FESTIVE30,715081.5,107262.22499999999,2023-02-09 00:00:00,Pending,Delivered,Credit Card,MasterCard,18113631699,Xi Zang Zi Zhi Qu Jian Hua Shi Fang Shan Huang Lu G Zuo  650419
S0X33GC5Q184730118370,Ma Lei,Huawei/P40/White/8GB,7,137525,962675,FESTIVE30,673872.5,101080.875,2023-02-09 00:00:00,Pending,In Transit,Bank Transfer,PayPal,13238679880,Si Chuan Sheng Lu An Xian Zhang Shou Ding Lu Q Zuo  740918
KE4BE4NRW184730118535,Xu Yong,iPhone/13 Pro/Blue/64GB,8,51016,408128,NEWYEAR25,306096.0,45914.4,2023-02-09 00:00:00,Failed,Shipped,Bank Transfer,WeChat Pay,13578062695,Jiang Su Sheng Huai An Xian Xiu Ying Luo Jie T Zuo  864465
ARCPS2QLF184730118697,Zhang Ning,iPhone/13/Purple/64GB,7,93336,653352,FESTIVE30,457346.39999999997,68601.95999999999,2023-02-09 00:00:00,Paid,Shipped,Debit Card,PayPal,14538841869,Shan Dong Sheng Xing Cheng Shi Liang Ping Dan Lu H Zuo  424302
XON0UGHKD184730118865,Gong Xiang,iPhone/13 Pro/White/32GB,9,104816,943344,WINTER10,849009.6,127351.43999999999,2023-02-09 00:00:00,Paid,Delivered,Credit Card,Visa,14521231962,Shang Hai Shi Kai Xian Huang Pu Chen Lu A Zuo  795866
IN6X9XD1G184730119027,Cheng Ting,OnePlus/9/Red/1TB,1,105938,105938,NEWYEAR25,79453.5,11918.025,2023-02-09 00:00:00,Pending,Delivered,Debit Card,WeChat Pay,13630081225,Xin Jiang Wei Wu Er Zi Zhi Qu Ning De Xian Dong Cheng Tao Lu M Zuo  765276
HOCPM5HN6184730119218,Li Gui Lan,Huawei/P40/White/254GB,4,124661,498644,SPRING20,398915.2,59837.28,2023-02-09 00:00:00,Pending,Delivered,Credit Card,Alipay,18126235691,Hai Nan Sheng Xiang Xian Xiao Shan Wu Han Lu V Zuo  195998
FJ5OXPLLJ184730119375,Chen Hong Xia,Vivo/X60/Black/254GB,1,52138,52138,AUTUMN5,49531.1,7429.664999999999,2023-02-09 00:00:00,Failed,Delivered,Credit Card,Alipay,15380653342,Xin Jiang Wei Wu Er Zi Zhi Qu Ma An Shan Shi Xi Xia Zhang Jie C Zuo  289758
GL4DL8PUN184730119571,Zhang Gui Zhi,iPhone/13/Purple/254GB,7,145662,1019634,SUMMER15,866688.9,130003.33499999999,2023-02-09 00:00:00,Failed,In Transit,PayPal,MasterCard,14595763614,Xiang Gang Te Bie Xing Zheng Qu Shu Lan Shi Shuang Luan Nan Chang Jie H Zuo  940608
5MP5VYQZ1184730119755,Lv Liang,Oppo/Reno5/White/64GB,10,144752,1447520,SPRING20,1158016.0,173702.4,2023-02-09 00:00:00,Failed,Pending,Bank Transfer,American Express,18533941868,Shan Dong Sheng Wu Lu Mu Qi Xian Xiu Ying Wang Lu U Zuo  914599
LOOHI3V1W184730119932,Hu Xiu Yun,Huawei/P40/Red/254GB,8,146702,1173616,WINTER10,1056254.4000000001,158438.16,2023-02-09 00:00:00,Pending,Shipped,Bank Transfer,Visa,15182773258,Ji Lin Sheng Lu An Shi Cheng Dong Ceng Jie O Zuo  339745
OQ1USW606184730120105,Liu Xiang,Oppo/Reno5/Purple/1TB,5,134275,671375,WINTER10,604237.5,90635.625,2023-02-09 00:00:00,Failed,Delivered,Bank Transfer,Visa,15017759743,Ao Men Te Bie Xing Zheng Qu Xi Ning Xian Ji Qu Shen Yang Lu H Zuo  305833
B8DX4ARZP184730120283,Shu Xiu Fang,Xiaomi/Mi 11/White/1TB,2,96981,193962,AUTUMN5,184263.9,27639.585,2023-02-09 00:00:00,Failed,In Transit,Debit Card,PayPal,13338707424,He Bei Sheng Nan Chang Xian Qing Cheng Liao Yang Lu P Zuo  914862
5AJL5HC9B184730120447,Lin Ming,iPhone/13/White/1TB,5,142799,713995,AUTUMN5,678295.25,101744.28749999999,2023-02-09 00:00:00,Paid,In Transit,Debit Card,American Express,13328752072,Gui Zhou Sheng Huan Xian Shan Ting Gui Yang Jie A Zuo  855467
7A5WZTBZJ184730120604,Yang Feng Lan,Galaxy/S21/Red/254GB,5,75069,375345,FESTIVE30,262741.5,39411.225,2023-02-09 00:00:00,Pending,Shipped,PayPal,WeChat Pay,13421222501,Bei Jing Shi Li Juan Xian Long Tan Dong Guan Lu T Zuo  230535
G9PV4MOT3184730120773,Jiang Fang,Huawei/P40/Black/254GB,1,100546,100546,SPRING20,80436.8,12065.52,2023-02-09 00:00:00,Failed,Delivered,PayPal,WeChat Pay,15988949873,Si Chuan Sheng Xi An Shi Sha Shi Wang Lu T Zuo  722092
CMZCF4Z44184730120949,Chen Qian,Xiaomi/Mi 11/Black/64GB,6,117080,702480,SPRING20,561984.0,84297.59999999999,2023-02-09 00:00:00,Paid,Delivered,Bank Transfer,Alipay,13136066884,Chong Qing Shi Yi Dou Xian Bai Yun Chen Lu M Zuo  235590
5NAS9GATR184730121122,Wu Ling,Huawei/P40/Red/32GB,1,83661,83661,SPRING20,66928.8,10039.32,2023-02-09 00:00:00,Paid,In Transit,Bank Transfer,PayPal,15018745657,Tian Jin Shi Zhi Qiang Xian Yong Chuan Guang Zhou Jie I Zuo  392816
ISHECW83S184730121283,Wu Gang,Vivo/X60/Black/128GB,2,79606,159212,NEWYEAR25,119409.0,17911.35,2023-02-09 00:00:00,Paid,Pending,PayPal,MasterCard,18613971745,Shang Hai Shi Lu An Shi Da Xing Kun Ming Lu L Zuo  861150
YKDW5MXSK184730121444,Sun Xue,Galaxy/S21/Purple/8GB,6,50115,300690,AUTUMN5,285655.5,42848.325,2023-02-09 00:00:00,Paid,Shipped,PayPal,Visa,13764399727,Guang Dong Sheng Hong Shi Da Dong Nan Jing Lu J Zuo  853989
XG2LM5B6N184730121603,Fan Qin,Oppo/Reno5/Purple/8GB,8,139312,1114496,AUTUMN5,1058771.2,158815.68,2023-02-09 00:00:00,Failed,Shipped,Credit Card,WeChat Pay,13087890841,Hai Nan Sheng Fei Xian Shang Jie Xi Ning Lu E Zuo  650199
BAD44YA23184730121759,Liu Ping,Vivo/X60/Red/254GB,2,140243,280486,FESTIVE30,196340.19999999998,29451.029999999995,2023-02-09 00:00:00,Failed,In Transit,Debit Card,PayPal,18216288923,Jiang Su Sheng Cheng Du Shi Fang Shan Qi Qi Ha Er Jie N Zuo  305483
B7DFO8JBD184730121931,Liu Li,iPhone/13/Blue/8GB,5,50065,250325,SUMMER15,212776.25,31916.4375,2023-02-09 00:00:00,Pending,Delivered,Debit Card,American Express,18000379256,Jiang Xi Sheng Shen Yang Xian Feng Dou Wang Jie P Zuo  344076
1T5LC22FE184730122104,Li Chao,Xiaomi/Mi 11/Blue/8GB,2,141777,283554,FESTIVE30,198487.8,29773.17,2023-02-09 00:00:00,Pending,Shipped,Bank Transfer,MasterCard,15294212941,Si Chuan Sheng Shu Hua Xian Bi Shan Du Jie S Zuo  933484
KGQNCCG6R184730122275,Liu Bin,iPhone/13/Purple/254GB,1,101866,101866,FESTIVE30,71306.2,10695.929999999998,2023-02-09 00:00:00,Paid,Delivered,Bank Transfer,PayPal,18058732404,Gui Zhou Sheng Zhang Sha Xian Dong Li Zhao Lu Q Zuo  829652
UCOOM4LYM184730122446,Zheng Lu,Vivo/X60/Black/128GB,3,66318,198954,SPRING20,159163.2,23874.48,2023-02-09 00:00:00,Paid,In Transit,Bank Transfer,American Express,15124173270,Nei Meng Gu Zi Zhi Qu Hang Zhou Shi Yong Chuan Liu Lu K Zuo  600763
I9SYNWJK6184730122633,Chen Tao,Oppo/Reno5/Purple/254GB,5,91469,457345,NEWYEAR25,343008.75,51451.3125,2023-02-09 00:00:00,Failed,In Transit,Debit Card,Visa,15648449108,Jiang Xi Sheng Li Hua Xian Zhao Yang Li Jie O Zuo  475585
CGA2JOKP2184730122808,Wang Yun,Galaxy/S21/Blue/1TB,3,52809,158427,AUTUMN5,150505.65,22575.8475,2023-02-09 00:00:00,Paid,In Transit,Credit Card,WeChat Pay,13256986520,Xiang Gang Te Bie Xing Zheng Qu Wu Lu Mu Qi Shi Cheng Dong Chang Chun Lu Q Zuo  840217
7RG3H1QRU184730122998,Wang Peng,Huawei/P40/Black/8GB,1,140191,140191,AUTUMN5,133181.44999999998,19977.217499999995,2023-02-09 00:00:00,Pending,Delivered,PayPal,WeChat Pay,15759137941,An Hui Sheng Liang Shi Xing Shan Xiang Gang Lu P Zuo  156531
ZRJB49K4M184730123159,Zhang Li Hua,Galaxy/S21/Purple/1TB,8,102074,816592,SUMMER15,694103.2,104115.48,2023-02-09 00:00:00,Pending,In Transit,PayPal,PayPal,15136820857,Jiang Su Sheng Gui Zhen Shi Jin Ping Liu Lu Z Zuo  929196
BA85ORNLA184730123337,Guo Gui Rong,Galaxy/S21/Blue/254GB,10,62162,621620,NEWYEAR25,466215.0,69932.25,2023-02-09 00:00:00,Pending,Shipped,PayPal,PayPal,14568129013,Ao Men Te Bie Xing Zheng Qu Ping Xian Ji Qu Sun Jie X Zuo  543957
5ZMJXLMHP184730123531,Cheng Xiu Mei,iPhone/13/White/128GB,7,123810,866670,SUMMER15,736669.5,110500.425,2023-02-09 00:00:00,Failed,Pending,Debit Card,Alipay,18720858987,Shang Hai Shi Jin Feng Xian Cheng Dong Li Jie T Zuo  153245
93DPJAQY0184730123709,Lan Ting,Huawei/P40/Black/32GB,5,132976,664880,NEWYEAR25,498660.0,74799.0,2023-02-09 00:00:00,Paid,Delivered,PayPal,WeChat Pay,13030672336,Nei Meng Gu Zi Zhi Qu Gui Lan Xian Zhang Shou Wu Lu Mu Qi Jie U Zuo  816257
1Y6R93NPN184730123888,Lv Chun Mei,Huawei/P40/Black/32GB,8,120713,965704,SPRING20,772563.2000000001,115884.48000000001,2023-02-09 00:00:00,Paid,Shipped,Credit Card,WeChat Pay,15121828719,He Nan Sheng Ying Shi Hua Xi Xiang Gang Lu Y Zuo  881799
QJXRZG0TB184730124049,Jiang Yu Mei,OnePlus/9/Red/254GB,8,84225,673800,NEWYEAR25,505350.0,75802.5,2023-02-09 00:00:00,Failed,Delivered,PayPal,Visa,15060228637,Ao Men Te Bie Xing Zheng Qu He Fei Xian Da Xing Yi Dou Jie O Zuo  714992
MT94V4AQW184730124240,Gong Dong,OnePlus/9/Purple/8GB,6,77378,464268,FESTIVE30,324987.6,48748.13999999999,2023-02-09 00:00:00,Pending,In Transit,PayPal,MasterCard,14733565085,Ning Xia Hui Zu Zi Zhi Qu Lin Shi Bi Shan Li Jie O Zuo  561590
JKE6OOL2C184730124429,Liu Xiu Zhen,Huawei/P40/Purple/32GB,9,70077,630693,SPRING20,504554.4,75683.16,2023-02-09 00:00:00,Paid,In Transit,Bank Transfer,PayPal,13472699676,Ao Men Te Bie Xing Zheng Qu Jian Shi Jin Ping Shi Lu T Zuo  167699
266LIVPKF184730124621,Li Jia,OnePlus/9/Black/1TB,8,112314,898512,WINTER10,808660.8,121299.12,2023-02-09 00:00:00,Failed,Delivered,Credit Card,Alipay,13636468437,Ji Lin Sheng Yan Xian Fu Cheng Shi Jia Zhuang Lu O Zuo  230863
Y3UB56U0N184730124784,Tang Yu Zhen,Oppo/Reno5/Blue/128GB,5,77159,385795,WINTER10,347215.5,52082.325,2023-02-09 00:00:00,Failed,In Transit,PayPal,Visa,18260457717,Hei Long Jiang Sheng Li Li Shi Mu Ye Xing An Meng Lu M Zuo  240054
IGA1HF2BU184730124977,Di Kun,iPhone/13 Pro/Purple/128GB,6,129657,777942,AUTUMN5,739044.9,110856.735,2023-02-09 00:00:00,Pending,In Transit,Credit Card,Visa,13547719065,He Nan Sheng Kun Xian Xi Xia Huai An Lu Q Zuo  708358
QQX7YMVA5184730125131,Wang Lei,OnePlus/9/Red/32GB,5,65583,327915,NEWYEAR25,245936.25,36890.4375,2023-02-09 00:00:00,Pending,Delivered,PayPal,PayPal,13541540787,Nei Meng Gu Zi Zhi Qu Liu Zhou Shi Gao Gang Xing Cheng Jie N Zuo  826548
IOQ83J7DW184730125306,Jiang Wen,iPhone/13/Red/32GB,3,90869,272607,SUMMER15,231715.94999999998,34757.392499999994,2023-02-09 00:00:00,Paid,Shipped,Debit Card,Alipay,13344828883,Zhe Jiang Sheng Shu Lan Shi Xin Cheng Qian Jiang Lu B Zuo  625794
60KNF14EC184730125465,Du Qiang,Huawei/P40/Purple/254GB,6,58889,353334,AUTUMN5,335667.3,50350.094999999994,2023-02-09 00:00:00,Failed,In Transit,Credit Card,American Express,15796757819,Nei Meng Gu Zi Zhi Qu Jian Xian Xiu Ying Chang Chun Lu W Zuo  325536
BM975KQIY184730125634,Wei Yu Hua,Oppo/Reno5/Purple/254GB,9,55614,500526,WINTER10,450473.4,67571.01,2023-02-09 00:00:00,Paid,Shipped,PayPal,American Express,15289814132,An Hui Sheng Fo Shan Xian Mu Ye Xiang Gang Jie I Zuo  675033
PJSK6Z85B184730125803,Cui Ting Ting,Xiaomi/Mi 11/Blue/32GB,2,142947,285894,SUMMER15,243009.9,36451.485,2023-02-09 00:00:00,Paid,Shipped,Debit Card,Visa,14786552398,Shan Xi Sheng Yang Shi Mu Ye Wang Jie I Zuo  366599
AE62B6FW5184730125977,Cui Bo,Xiaomi/Mi 11/Purple/254GB,10,107698,1076980,SPRING20,861584.0,129237.59999999999,2023-02-09 00:00:00,Failed,Shipped,Credit Card,MasterCard,15245207648,Chong Qing Shi Rui Xian Jiang Bei Dong Jie Q Zuo  951751
M548XGRDO184730126144,Chu Hao,Galaxy/S21/Purple/254GB,6,86124,516744,WINTER10,465069.60000000003,69760.44,2023-02-09 00:00:00,Failed,Shipped,Credit Card,WeChat Pay,13927896508,Liao Ning Sheng Hao Shi Nan Zhang Fu Xin Lu B Zuo  586212
CY5FO464R184730126311,Su Hao,Xiaomi/Mi 11/Blue/32GB,6,129469,776814,FESTIVE30,543769.7999999999,81565.46999999999,2023-02-09 00:00:00,Pending,Shipped,PayPal,WeChat Pay,15650572896,Shan Dong Sheng Shuai Shi Nan Hu Huang Lu D Zuo  551448
IKQMV42NY184730126486,Guo Yong,Galaxy/S21/White/1TB,10,147507,1475070,SPRING20,1180056.0,177008.4,2023-02-09 00:00:00,Pending,Delivered,Credit Card,Alipay,13466390496,Jiang Su Sheng Gui Zhi Shi Xun Yang Gu Jie X Zuo  787803
IWDDDWS04184730126656,Zhao Ying,iPhone/13 Pro/Blue/64GB,8,95633,765064,NEWYEAR25,573798.0,86069.7,2023-02-09 00:00:00,Failed,In Transit,Debit Card,American Express,13812691159,Ji Lin Sheng Shu Ying Xian Fu Cheng Lan Zhou Lu Q Zuo  852482
GBU8WEW6M184730126816,Zhang Kai,Xiaomi/Mi 11/Red/128GB,2,105131,210262,NEWYEAR25,157696.5,23654.475,2023-02-09 00:00:00,Failed,In Transit,Bank Transfer,Visa,14714111196,Xi Zang Zi Zhi Qu Fan Xian He Chuan Hang Zhou Lu I Zuo  633200
NAF9G8RVQ184730126982,Zhou Kun,Oppo/Reno5/Black/1TB,2,146562,293124,WINTER10,263811.60000000003,39571.740000000005,2023-02-09 00:00:00,Paid,Delivered,Bank Transfer,Visa,15949783166,Jiang Su Sheng Xin Shi Pu Tuo Hou Jie P Zuo  974173
9KC7MULHI184730127145,Yan Yun,Xiaomi/Mi 11/Blue/32GB,8,121035,968280,SPRING20,774624.0,116193.59999999999,2023-02-09 00:00:00,Pending,Pending,PayPal,WeChat Pay,15605990498,Tian Jin Shi Yu Mei Shi Xi Feng Qian Jiang Lu I Zuo  456898
4ONAGLPDY184730127301,Xu Chang,iPhone/13 Pro/White/128GB,5,123643,618215,WINTER10,556393.5,83459.025,2023-02-09 00:00:00,Paid,Delivered,PayPal,Visa,15820087006,Liao Ning Sheng Na Shi Jin Ping Li Lu J Zuo  267687
JIYTL3V8P184730127462,Feng Zhi Qiang,Vivo/X60/White/64GB,8,71714,573712,SUMMER15,487655.2,73148.28,2023-02-09 00:00:00,Failed,Delivered,Debit Card,Alipay,13226622712,Yun Nan Sheng Kun Ming Xian Qing Cheng Shen Yang Jie Z Zuo  615961
V2JBXMBF2184730127626,Wang Tao,Huawei/P40/Black/8GB,8,74755,598040,FESTIVE30,418628.0,62794.2,2023-02-09 00:00:00,Paid,In Transit,PayPal,MasterCard,14558137391,Shang Hai Shi Yong Xian Hai Gang Han Dan Jie P Zuo  798957
J788BMF85184730127780,Gu Hong Xia,Vivo/X60/Red/32GB,5,117380,586900,AUTUMN5,557555.0,83633.25,2023-02-09 00:00:00,Paid,Pending,Bank Transfer,MasterCard,14593294097,Ao Men Te Bie Xing Zheng Qu Bo Xian Xiao Nan Fu Zhou Jie Z Zuo  529973
WRTQIKEZ9184730127961,Jin Xin,OnePlus/9/Red/1TB,9,91465,823185,SUMMER15,699707.25,104956.0875,2023-02-09 00:00:00,Failed,Shipped,Credit Card,PayPal,13043518359,Shan Xi Sheng Jia He Shi Jin Ping Li Lu B Zuo  190044
2IAMT4MFO184730128131,Wang Gui Lan,Huawei/P40/White/1TB,6,135784,814704,SUMMER15,692498.4,103874.76,2023-02-09 00:00:00,Failed,Shipped,PayPal,Visa,13647851352,Ji Lin Sheng Xiu Lan Shi Qing Pu Li Lu L Zuo  341934
081DF5SOC184730128305,Wang Yu Hua,Huawei/P40/White/128GB,1,114576,114576,WINTER10,103118.40000000001,15467.76,2023-02-09 00:00:00,Pending,Delivered,Credit Card,Visa,13869812944,Hei Long Jiang Sheng Kun Shi Nan Xi Liu Jie U Zuo  232740
LUHSKYXQG184730128479,Wang Hao,OnePlus/9/Red/128GB,4,76362,305448,WINTER10,274903.2,41235.48,2023-02-09 00:00:00,Paid,Delivered,Bank Transfer,Alipay,13978821589,Gan Su Sheng Jian Guo Xian Shen Bei Xin Guo Lu Y Zuo  199495
9OGAORV1Y184730128652,Liu Yu Zhen,Oppo/Reno5/Black/254GB,2,107849,215698,FESTIVE30,150988.59999999998,22648.289999999997,2023-02-09 00:00:00,Pending,Delivered,Bank Transfer,MasterCard,15851081797,Shan Xi Sheng Xiang Gang Xian Pu Tuo Fang Lu L Zuo  213526
TQHRGEQV5184730128825,Li Xiu Hua,iPhone/13 Pro/Black/128GB,6,93266,559596,NEWYEAR25,419697.0,62954.549999999996,2023-02-09 00:00:00,Paid,Delivered,Credit Card,American Express,18577172109,Gui Zhou Sheng Kun Shi Xi Feng Wang Jie C Zuo  114427
M735CSIMN184730128993,Zong Hua,Vivo/X60/Black/64GB,3,88058,264174,FESTIVE30,184921.8,27738.269999999997,2023-02-09 00:00:00,Failed,Shipped,PayPal,Alipay,15613043992,Shang Hai Shi Liu Pan Shui Xian Wei Dou Cui Jie O Zuo  509143
4XA21EKZB184730129168,Zhang Xiu Fang,OnePlus/9/Blue/128GB,9,67397,606573,NEWYEAR25,454929.75,68239.4625,2023-02-09 00:00:00,Failed,Shipped,Credit Card,American Express,14579249735,Si Chuan Sheng Gui Yang Xian Nan Hu Li Jie Y Zuo  778015
NB2SDX676184730129342,Wu Jia,Galaxy/S21/Black/64GB,3,125665,376995,NEWYEAR25,282746.25,42411.9375,2023-02-09 00:00:00,Pending,Pending,PayPal,Alipay,18542259555,Shan Xi Sheng Ning Shi Gao Ping Huai An Jie F Zuo  430565
PAQCR1BIW184730129503,Dai Chao,iPhone/13 Pro/Blue/128GB,1,93082,93082,AUTUMN5,88427.9,13264.185,2023-02-09 00:00:00,Pending,Delivered,PayPal,WeChat Pay,18252049728,Jiang Su Sheng Shu Ying Shi Jiang Bei Ceng Jie B Zuo  578280
BBY2YU9R3184730129682,Liang Qiang,iPhone/13 Pro/Black/8GB,4,125259,501036,AUTUMN5,475984.19999999995,71397.62999999999,2023-02-09 00:00:00,Paid,In Transit,Bank Transfer,Alipay,13671078287,Ji Lin Sheng Ying Shi Huai Rou Ma Jie A Zuo  258813
ZOYMNNKWD184730129848,Ren Hui,iPhone/13 Pro/Red/8GB,5,88207,441035,SUMMER15,374879.75,56231.9625,2023-02-09 00:00:00,Failed,Pending,Credit Card,Alipay,18777335727,Gan Su Sheng Rui Shi Qing Cheng Shu Lu Y Zuo  992845
H0I3VMQXE184730130013,Hou Yu Zhen,Vivo/X60/Blue/32GB,8,92648,741184,SPRING20,592947.2000000001,88942.08,2023-02-09 00:00:00,Paid,In Transit,Debit Card,Alipay,18011019605,Hu Nan Sheng Shen Zhen Shi Shuang Luan Jia He Jie O Zuo  963706
4CRNN3J4R184730130177,Han Gui Xiang,Galaxy/S21/Black/64GB,1,106087,106087,WINTER10,95478.3,14321.745,2023-02-09 00:00:00,Pending,Delivered,Debit Card,WeChat Pay,15862085059,Shan Xi Sheng Jing Shi Xu Hui Liu Lu L Zuo  292738
IYWJPG1LE184730130348,Xu Rui,Vivo/X60/Red/8GB,6,115528,693168,FESTIVE30,485217.6,72782.64,2023-02-09 00:00:00,Failed,Delivered,PayPal,MasterCard,13858633836,Xin Jiang Wei Wu Er Zi Zhi Qu Shan Wei Xian Shuang Luan Zhang Jie O Zuo  261033
Y0BOZPCG1184730130534,Wei Dong Mei,Xiaomi/Mi 11/Red/254GB,4,68507,274028,NEWYEAR25,205521.0,30828.149999999998,2023-02-09 00:00:00,Pending,Shipped,Debit Card,WeChat Pay,15670497680,Tai Wan Sheng Da Ye Xian Dong Cheng Wang Jie C Zuo  554807
BLE93CDRF184730130712,Qin Dan,Oppo/Reno5/White/128GB,10,127296,1272960,AUTUMN5,1209312.0,181396.8,2023-02-09 00:00:00,Paid,Delivered,Bank Transfer,American Express,13898543960,Shang Hai Shi Cheng Shi Shen He Chen Lu Q Zuo  379680
LQWQUINZ4184730130876,Jiang Chang,Xiaomi/Mi 11/Blue/1TB,4,77959,311836,FESTIVE30,218285.19999999998,32742.779999999995,2023-02-09 00:00:00,Pending,Delivered,Bank Transfer,Visa,13370047015,Jiang Xi Sheng Nan Chang Shi Yong Chuan Zhang Jie B Zuo  572448
4HTIEI1M5184730131042,Wang Lin,iPhone/13/Purple/32GB,9,136139,1225251,WINTER10,1102725.9000000001,165408.885,2023-02-09 00:00:00,Pending,In Transit,Bank Transfer,Visa,18241280772,Liao Ning Sheng Yu Xian Zhang Shou Hang Zhou Jie C Zuo  120087
96LK4QC2B184730131193,Zhang Ting,iPhone/13 Pro/Blue/254GB,1,51097,51097,WINTER10,45987.3,6898.095,2023-02-09 00:00:00,Failed,Shipped,Credit Card,Visa,15334353230,Hu Bei Sheng Yang Shi Gao Ping Yin Jie Z Zuo  599795
L9MAJV8SI184730131356,Wang Bing,Xiaomi/Mi 11/Red/32GB,3,73448,220344,WINTER10,198309.6,29746.44,2023-02-09 00:00:00,Pending,Delivered,Bank Transfer,WeChat Pay,15392528598,Hei Long Jiang Sheng Hai Kou Shi Qing He Jin Jie S Zuo  740211
A0B516A6E184730131529,Du Jun,Huawei/P40/Black/254GB,4,65025,260100,SPRING20,208080.0,31212.0,2023-02-09 00:00:00,Pending,Pending,PayPal,American Express,15140619214,Gan Su Sheng Nan Jing Shi Ji Zhou Li Lu L Zuo  633874
HHK7SJ2T5184730131700,Jiao Lin,Galaxy/S21/Red/8GB,9,119996,1079964,NEWYEAR25,809973.0,121495.95,2023-02-09 00:00:00,Paid,Delivered,PayPal,Visa,13964271594,Shang Hai Shi Fo Shan Shi Hai Gang Lin Lu H Zuo  584542
9T7N5AH8L184730131870,Xie Ping,iPhone/13/Purple/254GB,3,78816,236448,FESTIVE30,165513.59999999998,24827.039999999997,2023-02-09 00:00:00,Failed,Pending,Debit Card,Visa,13128116070,Tai Wan Sheng Cheng Xian Da Xing Li Jie X Zuo  659613
75JCMDZ7S184730132039,Li Jing,iPhone/13 Pro/White/64GB,10,134248,1342480,SUMMER15,1141108.0,171166.19999999998,2023-02-09 00:00:00,Paid,In Transit,PayPal,WeChat Pay,15699297120,Gui Zhou Sheng Jia He Xian Qing Pu Fo Shan Lu M Zuo  555296
ED4R5X7FD184730132198,Dong Jian,iPhone/13 Pro/Red/254GB,1,79649,79649,NEWYEAR25,59736.75,8960.512499999999,2023-02-09 00:00:00,Pending,In Transit,Bank Transfer,Visa,15671878715,Chong Qing Shi Ha Er Bin Shi Hai Ling Liu Jie Y Zuo  899425
YGM9P1OD0184730132371,Wang Yong,OnePlus/9/Purple/1TB,7,82291,576037,AUTUMN5,547235.15,82085.2725,2023-02-09 00:00:00,Paid,In Transit,Bank Transfer,WeChat Pay,14764443799,Tian Jin Shi Xue Shi Fang Shan Wu Lu X Zuo  772707
IJEEBHGWW184730132537,Ceng Xiu Fang,Vivo/X60/Purple/32GB,1,135472,135472,FESTIVE30,94830.4,14224.56,2023-02-09 00:00:00,Failed,Shipped,Bank Transfer,WeChat Pay,18116829124,Hu Bei Sheng Xing An Meng Shi Xin Cheng Ma An Shan Jie L Zuo  934885
SHK2NLCGT184730132715,Yuan Hui,OnePlus/9/Black/64GB,4,120828,483312,AUTUMN5,459146.39999999997,68871.95999999999,2023-02-09 00:00:00,Pending,Pending,Bank Transfer,MasterCard,18902073436,Zhe Jiang Sheng Gui Fang Shi Xu Hui Chen Jie W Zuo  527560
H210EUTHV184730132886,Xiang Jian Guo,Vivo/X60/Red/32GB,8,113681,909448,AUTUMN5,863975.6,129596.34,2023-02-09 00:00:00,Pending,Delivered,Bank Transfer,WeChat Pay,13405531118,Tai Wan Sheng Bin Xian Hai Gang Zhang Lu R Zuo  133605
P9LJ4QNQO184730133055,Yang Gui Zhen,Galaxy/S21/Purple/254GB,7,112640,788480,FESTIVE30,551936.0,82790.4,2023-02-09 00:00:00,Failed,Pending,Bank Transfer,Alipay,15317234543,Shan Xi Sheng Yun Shi Xun Yang Wu Lu Mu Qi Jie Q Zuo  655945
UETGXXWJ9184730133224,Wu Li,Oppo/Reno5/White/64GB,10,120473,1204730,NEWYEAR25,903547.5,135532.125,2023-02-09 00:00:00,Paid,Shipped,Debit Card,MasterCard,18876618913,Shan Dong Sheng Dong Shi Dong Cheng Wang Jie A Zuo  952928
T0SU7KZ60184730133394,Zheng Li Hua,Oppo/Reno5/Black/64GB,1,70129,70129,SPRING20,56103.200000000004,8415.48,2023-02-09 00:00:00,Failed,In Transit,Bank Transfer,MasterCard,18990613920,Si Chuan Sheng Xi An Xian An Ci Jia He Lu T Zuo  724271
NKFCYYRA7184730133555,Wei Lei,Oppo/Reno5/Red/64GB,3,111263,333789,AUTUMN5,317099.55,47564.932499999995,2023-02-09 00:00:00,Paid,Pending,Debit Card,Alipay,18855566182,Hei Long Jiang Sheng Qian Jiang Shi Ji Qu Nan Jing Jie E Zuo  417882
EBDSN4HZ0184730133720,Wang Ling,Xiaomi/Mi 11/White/8GB,4,71737,286948,SUMMER15,243905.8,36585.869999999995,2023-02-09 00:00:00,Failed,Shipped,PayPal,American Express,15019508314,Gan Su Sheng Nan Shi Shang Jie Guo Jie L Zuo  827165
D1O08DZEM184730133890,Lu Bo,iPhone/13 Pro/Black/32GB,7,147901,1035307,WINTER10,931776.3,139766.445,2023-02-09 00:00:00,Paid,Pending,Credit Card,Visa,18611080125,Tai Wan Sheng Xing An Meng Shi Fang Shan Wang Jie C Zuo  967178
VOQB7DLOQ184730134065,Ma Hui,Huawei/P40/Red/254GB,3,138960,416880,FESTIVE30,291816.0,43772.4,2023-02-09 00:00:00,Pending,Pending,PayPal,WeChat Pay,15922717952,Gui Zhou Sheng Yu Lan Xian Yong Chuan Zhuo Lu W Zuo  598992
KP3IZFCPZ184730134239,Lai Qian,iPhone/13/Purple/254GB,1,69397,69397,AUTUMN5,65927.15,9889.072499999998,2023-02-09 00:00:00,Failed,In Transit,Debit Card,Alipay,18630817682,Qing Hai Sheng Liu Pan Shui Shi Cheng Dong Liu Jie V Zuo  242061
GFHP55Z0I184730134417,Chen Qian,Oppo/Reno5/Red/254GB,6,59340,356040,SPRING20,284832.0,42724.799999999996,2023-02-09 00:00:00,Failed,In Transit,Debit Card,PayPal,13279794392,Guang Xi Zhuang Zu Zi Zhi Qu Ha Er Bin Shi Xi Shan Ning De Jie F Zuo  632110
4NDJ2W4O7184730134602,Tan Liang,iPhone/13 Pro/Red/1TB,5,101807,509035,NEWYEAR25,381776.25,57266.4375,2023-02-09 00:00:00,Pending,Pending,Bank Transfer,WeChat Pay,15568460894,Shan Dong Sheng Shu Hua Shi Zhang Shou Mao Lu O Zuo  658345
QAKJ2RBB4184730134773,Zhao Dan,Xiaomi/Mi 11/Black/128GB,1,82764,82764,SPRING20,66211.2,9931.679999999998,2023-02-09 00:00:00,Pending,Pending,PayPal,Alipay,18107305432,Tian Jin Shi Li Shi Shang Jie Nan Ning Jie C Zuo  165821
LKOHHVSTP184730134925,Feng Jian Hua,Huawei/P40/Purple/8GB,6,146471,878826,NEWYEAR25,659119.5,98867.925,2023-02-09 00:00:00,Paid,Delivered,PayPal,PayPal,13986413802,Yun Nan Sheng Liu Zhou Xian Feng Dou Chao Hu Lu M Zuo  650930
EBSKM6AKE184730135089,Ju Hong,iPhone/13/Red/32GB,7,105736,740152,FESTIVE30,518106.39999999997,77715.95999999999,2023-02-09 00:00:00,Failed,Pending,Bank Transfer,MasterCard,13904368589,Ning Xia Hui Zu Zi Zhi Qu Kai Xian He Ping Huang Lu U Zuo  417014
7H0IFF4PU184730135274,Yang Liang,Xiaomi/Mi 11/Purple/254GB,1,83237,83237,SUMMER15,70751.45,10612.717499999999,2023-02-09 00:00:00,Failed,Shipped,PayPal,PayPal,13556535839,Si Chuan Sheng Hu He Hao Te Shi Dong Cheng Wang Jie E Zuo  610732
UE71SCB03184730135450,Lv Shu Lan,iPhone/13/Purple/1TB,7,60227,421589,FESTIVE30,295112.3,44266.844999999994,2023-02-09 00:00:00,Pending,Delivered,PayPal,WeChat Pay,14799902517,Hu Bei Sheng Xia Shi You Hao Zheng Lu I Zuo  294787
MU7TISRXG184730135620,Chen Lin,Vivo/X60/Blue/1TB,3,89642,268926,AUTUMN5,255479.69999999998,38321.954999999994,2023-02-09 00:00:00,Paid,Shipped,Debit Card,MasterCard,13774529577,Ji Lin Sheng Rong Xian Hua Xi Fu Xin Jie D Zuo  850369
JIDZWMDCO184730135776,Li Jia,Galaxy/S21/White/64GB,6,100727,604362,SPRING20,483489.60000000003,72523.44,2023-02-09 00:00:00,Paid,Pending,Credit Card,MasterCard,13665072980,Tian Jin Shi Wu Lu Mu Qi Xian Shang Jie Shi Jia Zhuang Jie M Zuo  768185
RX1DRGWMA184730135947,Chen Dan,Oppo/Reno5/White/254GB,5,102796,513980,WINTER10,462582.0,69387.3,2023-02-09 00:00:00,Failed,Delivered,Bank Transfer,WeChat Pay,13242680902,Guang Xi Zhuang Zu Zi Zhi Qu Feng Shi Zhang Shou Ma An Shan Lu Q Zuo  490552
