Order ID,Customer Name,Mobile Model,Quantity,Price per Unit,Total Price,Promotion Code,Order Amount,GST,Order Date,Payment Status,Shipping Status,Payment Method,Payment Provider,Mobile,Delivery Address
IWQE5VHNQ184824138879,You Chen,Xiaomi/Mi 11/Purple/1TB,8,123689,989512,NEWYEAR25,742134.0,111320.09999999999,2024-05-09 00:00:00,Failed,Pending,PayPal,Visa,14797194564,Guang Dong Sheng Rui Shi Nan Zhang Ding Lu S Zuo  641082
TSFX10M8X184824139049,Liang Xiu Hua,Huawei/P40/Blue/32GB,10,134301,1343010,NEWYEAR25,1007257.5,151088.625,2024-05-09 00:00:00,Failed,In Transit,PayPal,American Express,15385687889,Gan Su Sheng Feng Shi Feng Dou Li Lu T Zuo  371328
A9C377JOH184824139220,Yu Hua,Xiaomi/Mi 11/Red/32GB,6,96487,578922,WINTER10,521029.8,78154.47,2024-05-09 00:00:00,Pending,Shipped,Bank Transfer,PayPal,18195248473,Nei Meng Gu Zi Zhi Qu Fu Zhou Shi Bin Cheng Liu Zhou Jie S Zuo  755735
QRQ9OC7YH184824139395,Liu Hao,OnePlus/9/Black/8GB,2,61655,123310,NEWYEAR25,92482.5,13872.375,2024-05-09 00:00:00,Pending,Shipped,Bank Transfer,Visa,18542090744,Si Chuan Sheng Jian Xian Shen Bei Xin Li Jie S Zuo  968103
8QFHJSG0X184824139569,Chen Jie,iPhone/13 Pro/Red/1TB,1,58210,58210,AUTUMN5,55299.5,8294.925,2024-05-09 00:00:00,Paid,Shipped,Debit Card,Visa,18974537135,Fu Jian Sheng Yu Lan Shi Da Dong Wang Jie P Zuo  515239
C097KQQCB184824139740,Wan Ying,OnePlus/9/Black/64GB,2,52311,104622,NEWYEAR25,78466.5,11769.975,2024-05-09 00:00:00,Paid,In Transit,Debit Card,Alipay,14519915269,An Hui Sheng Shuai Shi Cheng Dong Cao Jie F Zuo  333263
Z8LB3HP3V184824139904,Ju Qiang,Vivo/X60/Red/128GB,1,53773,53773,SPRING20,43018.4,6452.76,2024-05-09 00:00:00,Failed,Pending,Debit Card,MasterCard,15075273031,He Nan Sheng Juan Shi Zhang Shou Zhang Jie N Zuo  605441
B0PTHLBM2184824140072,Xiang Yang,Vivo/X60/Black/254GB,5,110660,553300,SPRING20,442640.0,66396.0,2024-05-09 00:00:00,Pending,Pending,Debit Card,American Express,13922717661,Hei Long Jiang Sheng Han Dan Shi Shang Jie Tao Lu X Zuo  821884
T2EAY2V0Z184824140254,Zhang Xu,iPhone/13/Purple/8GB,4,86681,346724,AUTUMN5,329387.8,49408.17,2024-05-09 00:00:00,Pending,In Transit,Credit Card,Visa,18631730495,Chong Qing Shi Shi Jia Zhuang Xian Xun Yang Liu Jie O Zuo  181892
EVG6HH6S5184824140432,Wang Jing,iPhone/13 Pro/White/8GB,8,71357,570856,AUTUMN5,542313.2,81346.98,2024-05-09 00:00:00,Failed,Delivered,Credit Card,American Express,14786554582,Guang Xi Zhuang Zu Zi Zhi Qu Ming Xian He Chuan He Fei Lu K Zuo  649990
ESE99J63K184824140605,Qin Jie,iPhone/13 Pro/Blue/32GB,8,87528,700224,AUTUMN5,665212.7999999999,99781.91999999998,2024-05-09 00:00:00,Pending,Delivered,PayPal,Alipay,13287149882,Jiang Su Sheng Chao Zhou Shi He Ping Ha Er Bin Jie S Zuo  855369
RMZE66W0J184824140769,Zhu Tao,iPhone/13/Red/254GB,4,113316,453264,SPRING20,362611.2,54391.68,2024-05-09 00:00:00,Pending,Delivered,Debit Card,Visa,18129843966,Tai Wan Sheng Xiu Mei Shi Bi Shan Mou Jie M Zuo  484077
AGDZOUCXI184824140943,Gu Lin,iPhone/13 Pro/Purple/32GB,9,121690,1095210,FESTIVE30,766647.0,114997.05,2024-05-09 00:00:00,Paid,Shipped,Debit Card,WeChat Pay,13169531124,Hu Bei Sheng Guang Zhou Xian Zi Chuan Shang Hai Lu A Zuo  343405
59SF7CY4R184824141105,Chen Dong Mei,OnePlus/9/Black/32GB,9,86083,774747,FESTIVE30,542322.9,81348.435,2024-05-09 00:00:00,Paid,Delivered,PayPal,American Express,15072451049,Jiang Su Sheng Lei Xian He Ping Liang Lu Z Zuo  778611
9JI3U13ZW184824141276,You Dong Mei,Oppo/Reno5/Blue/8GB,1,127811,127811,NEWYEAR25,95858.25,14378.7375,2024-05-09 00:00:00,Paid,Delivered,PayPal,PayPal,18996876674,Xiang Gang Te Bie Xing Zheng Qu Bo Shi Nan Zhang Shen Yang Jie D Zuo  418862
2L9ZQL6LQ184824141458,Huang Qin,Oppo/Reno5/Purple/64GB,3,62667,188001,FESTIVE30,131600.69999999998,19740.104999999996,2024-05-09 00:00:00,Failed,Shipped,Bank Transfer,PayPal,18929736351,Hu Nan Sheng Long Shi Hai Gang Sun Jie D Zuo  961555
KV84QFLI0184824141627,Tan Jian Hua,OnePlus/9/Blue/32GB,2,121956,243912,FESTIVE30,170738.4,25610.76,2024-05-09 00:00:00,Pending,In Transit,Debit Card,American Express,15807239854,Hu Bei Sheng Qi Qi Ha Er Shi Zi Chuan Li Jie Q Zuo  995370
RCYQQ83G9184824141812,Li Shu Zhen,Galaxy/S21/Red/128GB,4,112736,450944,WINTER10,405849.60000000003,60877.44,2024-05-09 00:00:00,Failed,In Transit,Credit Card,MasterCard,18551174104,Jiang Su Sheng Jun Xian Dong Li Liu Lu R Zuo  606561
6VXX08H2J184824141983,Guo Lei,Oppo/Reno5/Black/1TB,7,136220,953540,SPRING20,762832.0,114424.8,2024-05-09 00:00:00,Pending,Delivered,PayPal,PayPal,14724433449,Liao Ning Sheng Peng Shi Gao Ming Huang Jie E Zuo  992400
Y994LWGCV184824142146,Zhen Li,Galaxy/S21/Purple/1TB,9,77232,695088,FESTIVE30,486561.6,72984.23999999999,2024-05-09 00:00:00,Failed,Delivered,PayPal,Visa,15387390087,Qing Hai Sheng Liang Xian Xiao Shan Yong An Jie V Zuo  464473
4NIGYF4Z6184824142298,Jiang Lin,Oppo/Reno5/Red/32GB,9,81814,736326,SUMMER15,625877.1,93881.56499999999,2024-05-09 00:00:00,Paid,Pending,Bank Transfer,MasterCard,18641532937,Xin Jiang Wei Wu Er Zi Zhi Qu Ping Shi Yong Chuan Li Jie V Zuo  498719
FAPXH5FJ4184824142481,Xu Li,Huawei/P40/Black/1TB,6,105143,630858,FESTIVE30,441600.6,66240.09,2024-05-09 00:00:00,Failed,Pending,Credit Card,PayPal,18609537753,Gan Su Sheng Fo Shan Shi Shen He Wang Jie M Zuo  180887
9JRILVA1U184824142653,Zhang Ting Ting,Xiaomi/Mi 11/Red/254GB,6,59050,354300,NEWYEAR25,265725.0,39858.75,2024-05-09 00:00:00,Pending,In Transit,PayPal,PayPal,13783832091,Xi Zang Zi Zhi Qu Li Li Shi Hua Long Xing An Meng Jie P Zuo  195872
1HWU5M9GU184824142841,Cui Jin Feng,Galaxy/S21/Black/254GB,2,125578,251156,NEWYEAR25,188367.0,28255.05,2024-05-09 00:00:00,Paid,Pending,Credit Card,MasterCard,15196539396,Xin Jiang Wei Wu Er Zi Zhi Qu Yan Shi Shen Bei Xin Zhu Lu Z Zuo  573290
D7U6EEYQH184824143042,Chen Shu Zhen,OnePlus/9/Purple/8GB,3,141631,424893,NEWYEAR25,318669.75,47800.4625,2024-05-09 00:00:00,Pending,In Transit,Debit Card,MasterCard,13949559789,Xin Jiang Wei Wu Er Zi Zhi Qu Ha Er Bin Shi He Chuan Liang Lu L Zuo  814827
TNP2CYY1L184824143238,Qi Feng Lan,Galaxy/S21/Blue/1TB,7,125159,876113,SUMMER15,744696.0499999999,111704.40749999999,2024-05-09 00:00:00,Paid,Delivered,Bank Transfer,MasterCard,13179923976,Chong Qing Shi Ming Xian Huai Rou Zhang Lu Q Zuo  217788
82BHFVCT5184824143410,Zhang Gui Lan,Oppo/Reno5/Blue/64GB,2,145482,290964,NEWYEAR25,218223.0,32733.449999999997,2024-05-09 00:00:00,Paid,Shipped,Debit Card,WeChat Pay,13165105740,Gan Su Sheng Liang Xian Jin Ping Chen Lu W Zuo  926206
GC8DNT108184824143578,Zhao Mei,iPhone/13/White/32GB,6,52100,312600,AUTUMN5,296970.0,44545.5,2024-05-09 00:00:00,Pending,Pending,PayPal,Alipay,13684929285,Gan Su Sheng Kun Ming Shi Nan Hu Zuo Jie M Zuo  819898
27VEYT4YC184824143749,Shi Gui Ying,Oppo/Reno5/Blue/128GB,2,147180,294360,WINTER10,264924.0,39738.6,2024-05-09 00:00:00,Paid,In Transit,Debit Card,MasterCard,13993356951,Nei Meng Gu Zi Zhi Qu Jie Xian Xi Xia Zhao Lu F Zuo  379343
NFCJX4PFR184824143932,Li Bin,OnePlus/9/Purple/64GB,9,104348,939132,FESTIVE30,657392.3999999999,98608.85999999999,2024-05-09 00:00:00,Failed,Pending,PayPal,Alipay,15662830650,Ji Lin Sheng Wu Zhou Xian Hua Xi Gui Yang Lu W Zuo  194954
L30D22KF0184824144095,Zhao Ming,Vivo/X60/Blue/32GB,7,57567,402969,WINTER10,362672.10000000003,54400.815,2024-05-09 00:00:00,Paid,Pending,Debit Card,Alipay,15313662195,Fu Jian Sheng Fo Shan Shi Nan Xi Zhang Jia Gang Jie G Zuo  983951
GXAYJ786N184824144257,Wang Ying,Vivo/X60/Black/254GB,1,102096,102096,WINTER10,91886.40000000001,13782.960000000001,2024-05-09 00:00:00,Paid,Shipped,Bank Transfer,MasterCard,18799389468,Ji Lin Sheng Liu Zhou Xian Sha Shi Zhang Lu P Zuo  692155
AFVDSD7MS184824144428,Chen Yong,Xiaomi/Mi 11/White/32GB,7,148106,1036742,WINTER10,933067.8,139960.17,2024-05-09 00:00:00,Failed,Shipped,Debit Card,American Express,14570502723,Ao Men Te Bie Xing Zheng Qu Chang Chun Xian Fu Cheng Xiong Jie V Zuo  227856
PI3URA07H184824144619,Zhu Li Juan,Galaxy/S21/White/254GB,10,80048,800480,FESTIVE30,560336.0,84050.4,2024-05-09 00:00:00,Paid,Pending,Credit Card,MasterCard,15597743094,Guang Xi Zhuang Zu Zi Zhi Qu He Shan Xian Xu Hui Nan Chang Jie B Zuo  565839
68S3O1BQO184824144802,Chai Bin,iPhone/13 Pro/White/8GB,5,149793,748965,SPRING20,599172.0,89875.8,2024-05-09 00:00:00,Paid,Delivered,PayPal,WeChat Pay,15835435266,Chong Qing Shi Liu Shi Nan Zhang Jiang Jie C Zuo  176691
DHJY5P0FZ184824144970,Li Yan,iPhone/13/Blue/1TB,9,121093,1089837,AUTUMN5,1035345.1499999999,155301.7725,2024-05-09 00:00:00,Failed,Pending,Credit Card,Visa,15774903175,Bei Jing Shi Yin Chuan Xian Xiao Nan Wu Lu S Zuo  180556
9GBXP6MUA184824145142,Jin Yu,OnePlus/9/Purple/128GB,8,124911,999288,NEWYEAR25,749466.0,112419.9,2024-05-09 00:00:00,Pending,Pending,PayPal,Visa,13104482173,Ao Men Te Bie Xing Zheng Qu Ming Shi Ji Qu Zhang Jia Gang Jie V Zuo  882846
CUBSCZ578184824145329,Pan Xu,Huawei/P40/Black/254GB,2,61985,123970,SUMMER15,105374.5,15806.175,2024-05-09 00:00:00,Pending,Pending,Credit Card,American Express,13447379856,Chong Qing Shi Yu Lan Xian Shuang Luan Shen Yang Lu W Zuo  573534
THIC00MRF184824145492,Chen Bo,iPhone/13/Blue/1TB,4,127937,511748,SUMMER15,434985.8,65247.869999999995,2024-05-09 00:00:00,Pending,Delivered,Debit Card,American Express,18822481888,He Bei Sheng Gui Ying Shi Xiang An Da Ye Lu N Zuo  107917
MX97IOIQ5184824145653,Li Ming,iPhone/13/Red/64GB,4,135557,542228,SUMMER15,460893.8,69134.06999999999,2024-05-09 00:00:00,Paid,Delivered,Debit Card,Alipay,13838831104,Qing Hai Sheng Wu Zhou Xian Wei Dou Zhang Lu O Zuo  185195
8T5NERJUE184824145824,Zhang Yu Ying,Vivo/X60/Black/128GB,8,111194,889552,AUTUMN5,845074.3999999999,126761.15999999997,2024-05-09 00:00:00,Pending,Shipped,Credit Card,Visa,15766997121,Hu Nan Sheng Shen Yang Shi Zi Chuan Cheng Du Lu L Zuo  437138
K4WX8MQA9184824145990,Yin Ying,Huawei/P40/White/64GB,5,80023,400115,NEWYEAR25,300086.25,45012.9375,2024-05-09 00:00:00,Pending,In Transit,Bank Transfer,American Express,18220631639,Si Chuan Sheng Xiu Lan Xian Nan Zhang Xie Lu X Zuo  157717
DK0V42V62184824146162,Yan Min,Huawei/P40/Blue/254GB,2,144829,289658,AUTUMN5,275175.1,41276.26499999999,2024-05-09 00:00:00,Failed,In Transit,Debit Card,PayPal,13900810444,Shan Xi Sheng Qian Jiang Xian Fu Cheng Chao Zhou Lu D Zuo  762747
HXPJJOF62184824146319,Li Dong,Oppo/Reno5/Blue/254GB,7,85946,601622,SUMMER15,511378.7,76706.805,2024-05-09 00:00:00,Pending,In Transit,Bank Transfer,MasterCard,13353364999,Gui Zhou Sheng Bei Jing Xian Huang Pu Fu Jie Q Zuo  840359
GHB480BQC184824146487,Xu Shu Lan,Xiaomi/Mi 11/Blue/8GB,10,111589,1115890,NEWYEAR25,836917.5,125537.625,2024-05-09 00:00:00,Paid,Delivered,Bank Transfer,Alipay,14558423579,He Bei Sheng Bo Shi Wei Dou Wang Lu X Zuo  785691
4AZ9CSOJM184824146660,Zhong Feng Lan,Vivo/X60/Black/64GB,9,103403,930627,FESTIVE30,651438.8999999999,97715.83499999998,2024-05-09 00:00:00,Failed,Delivered,Credit Card,Visa,14767598931,Liao Ning Sheng Guan Ling Xian Xin Cheng La Sa Lu F Zuo  313740
YU2LXNT6X184824146826,Ma Ting,iPhone/13 Pro/Purple/254GB,3,77973,233919,SPRING20,187135.2,28070.280000000002,2024-05-09 00:00:00,Pending,In Transit,Credit Card,Visa,13765716867,He Bei Sheng Hai Men Shi Feng Dou Li Jie E Zuo  629921
MR0S6GFEV184824146993,Hao Gui Rong,Vivo/X60/Purple/254GB,7,55091,385637,AUTUMN5,366355.14999999997,54953.27249999999,2024-05-09 00:00:00,Pending,In Transit,PayPal,American Express,18029514218,Nei Meng Gu Zi Zhi Qu Min Shi Xi Feng Wang Jie C Zuo  884395
1T4KBNVM0184824147176,Hao Rui,Xiaomi/Mi 11/Blue/32GB,7,68845,481915,NEWYEAR25,361436.25,54215.4375,2024-05-09 00:00:00,Pending,Shipped,Credit Card,MasterCard,15675935947,Qing Hai Sheng Shang Hai Shi Shan Ting Zhou Lu X Zuo  924226
SK8ZCV3BE184824147353,Wang Jun,Oppo/Reno5/Red/64GB,9,52097,468873,FESTIVE30,328211.1,49231.66499999999,2024-05-09 00:00:00,Pending,Shipped,PayPal,MasterCard,18899536602,Jiang Su Sheng Chao Zhou Shi Shen He Cao Jie T Zuo  868774
S2RRGGKCO184824147522,Ji Xin,iPhone/13 Pro/Black/1TB,9,146385,1317465,SUMMER15,1119845.25,167976.7875,2024-05-09 00:00:00,Pending,In Transit,Bank Transfer,Alipay,13227447178,Ning Xia Hui Zu Zi Zhi Qu Han Dan Xian Zhao Yang Wan Jie Y Zuo  166613
2PSOGTGHN184824147712,Lv Gui Fang,Vivo/X60/Blue/1TB,6,94880,569280,SUMMER15,483888.0,72583.2,2024-05-09 00:00:00,Pending,Shipped,Credit Card,PayPal,13799090650,Xin Jiang Wei Wu Er Zi Zhi Qu Gui Xiang Shi Hai Gang Jiang Lu V Zuo  124684
QSJGOFUR8184824147983,Yang Jie,Huawei/P40/Red/64GB,8,133942,1071536,WINTER10,964382.4,144657.36,2024-05-09 00:00:00,Failed,In Transit,Debit Card,Alipay,18773016623,Fu Jian Sheng Xiu Hua Shi Nan Xi Nan Chang Jie N Zuo  476243
ZB6VZ09BJ184824148155,Cao Xiu Fang,iPhone/13 Pro/Blue/32GB,8,137370,1098960,AUTUMN5,1044012.0,156601.8,2024-05-09 00:00:00,Pending,Shipped,Credit Card,American Express,13678301594,Bei Jing Shi Huai An Xian Ji Qu Ran Lu Y Zuo  761170
INMHPYUHV184824148338,Zhang Rui,Oppo/Reno5/Purple/254GB,3,107982,323946,NEWYEAR25,242959.5,36443.924999999996,2024-05-09 00:00:00,Paid,In Transit,PayPal,WeChat Pay,15197651634,Guang Xi Zhuang Zu Zi Zhi Qu Tai Bei Xian Xu Hui Shang Hai Jie O Zuo  290337
OFWJ0S3AX184824148520,Zhuo Ying,iPhone/13/Red/32GB,8,98002,784016,SUMMER15,666413.6,99962.04,2024-05-09 00:00:00,Failed,Delivered,Debit Card,MasterCard,15603892807,Shang Hai Shi Xiu Zhen Shi Ji Zhou Peng Jie H Zuo  103734
RAODEUHJI184824148698,Gao Yong,Huawei/P40/Black/254GB,7,125246,876722,NEWYEAR25,657541.5,98631.22499999999,2024-05-09 00:00:00,Pending,Delivered,Debit Card,Alipay,15628701542,Jiang Su Sheng Hui Zhou Shi He Chuan Hui Zhou Jie O Zuo  212123
0XRJAOKFL184824148858,Wang Juan,iPhone/13 Pro/Purple/32GB,4,55501,222004,NEWYEAR25,166503.0,24975.45,2024-05-09 00:00:00,Failed,Shipped,PayPal,American Express,14758215654,Yun Nan Sheng Hui Zhou Xian Fang Shan Zheng Lu I Zuo  718327
NCSLQJRNH184824149034,Liu Dan Dan,Vivo/X60/Red/8GB,10,129424,1294240,SUMMER15,1100104.0,165015.6,2024-05-09 00:00:00,Failed,Delivered,PayPal,MasterCard,18993740556,Nei Meng Gu Zi Zhi Qu Yong An Xian Dong Cheng Xie Lu D Zuo  934894
MIAGZ0TEC184824149229,He Chao,iPhone/13/White/64GB,8,112780,902240,AUTUMN5,857128.0,128569.2,2024-05-09 00:00:00,Failed,Pending,Bank Transfer,WeChat Pay,13798815040,Ji Lin Sheng Liu Shi Jiang Bei Liang Jie F Zuo  791781
RDQRJKZSV184824149401,Gao Min,Oppo/Reno5/Red/128GB,2,105751,211502,SUMMER15,179776.69999999998,26966.504999999997,2024-05-09 00:00:00,Failed,Delivered,Credit Card,PayPal,14713892402,Bei Jing Shi Shen Zhen Xian Shen Bei Xin Kang Lu J Zuo  720362
N2MOID5RP184824149588,Li Hua,Galaxy/S21/Purple/1TB,3,106774,320322,WINTER10,288289.8,43243.469999999994,2024-05-09 00:00:00,Paid,Pending,Debit Card,Alipay,18032985358,Zhe Jiang Sheng Jian Ping Xian Hai Gang Ren Jie Y Zuo  895823
XYAZ6MQ30184824149770,Zhou Yan,OnePlus/9/Purple/128GB,1,67821,67821,FESTIVE30,47474.7,7121.204999999999,2024-05-09 00:00:00,Pending,Pending,Bank Transfer,WeChat Pay,14754860389,Shan Xi Sheng Ming Xian Xu Hui Cui Lu W Zuo  838989
NNQRNYYUL184824149949,Wang Xiu Zhen,Vivo/X60/Black/32GB,5,110322,551610,SUMMER15,468868.5,70330.275,2024-05-09 00:00:00,Pending,Shipped,Credit Card,MasterCard,14731199919,Shang Hai Shi Gui Fang Xian Xiao Nan Xing Cheng Lu J Zuo  273876
UO5KDRXQ9184824150137,Chen Yu,Vivo/X60/Purple/32GB,4,96317,385268,FESTIVE30,269687.6,40453.13999999999,2024-05-09 00:00:00,Paid,Pending,Credit Card,Visa,13501059900,He Bei Sheng Tai Yuan Shi Zhang Shou Tai Yuan Lu X Zuo  349430
QZJPBM0TR184824150304,Yang Chang,iPhone/13/Black/1TB,2,65601,131202,NEWYEAR25,98401.5,14760.224999999999,2024-05-09 00:00:00,Failed,Pending,Credit Card,American Express,15664546541,Si Chuan Sheng Yu Zhen Xian Fu Cheng Chao Zhou Jie I Zuo  996527
F1AI2EQT3184824150474,Yang Ying,Huawei/P40/Black/254GB,6,126170,757020,NEWYEAR25,567765.0,85164.75,2024-05-09 00:00:00,Paid,Shipped,Bank Transfer,PayPal,14733453910,Hei Long Jiang Sheng Ping Xian Hai Ling Chang Chun Jie S Zuo  530509
MX3IPDFAJ184824150638,Liu Nan,Galaxy/S21/Red/64GB,10,145518,1455180,SPRING20,1164144.0,174621.6,2024-05-09 00:00:00,Paid,Pending,Credit Card,MasterCard,13254475764,Tian Jin Shi Chao Hu Xian Shang Jie Ling Jie J Zuo  404083
R8M3Y6AAG184824150814,Ren Wei,Vivo/X60/Black/32GB,9,115214,1036926,AUTUMN5,985079.7,147761.955,2024-05-09 00:00:00,Pending,Delivered,Bank Transfer,PayPal,15189990312,Xin Jiang Wei Wu Er Zi Zhi Qu Chao Zhou Xian Hai Gang Li Lu P Zuo  691505
STUCD7EG5184824151005,Zhao Jie,OnePlus/9/Red/64GB,5,101840,509200,SUMMER15,432820.0,64923.0,2024-05-09 00:00:00,Paid,Shipped,Debit Card,American Express,18840996140,Gan Su Sheng Huan Xian Qing Cheng Chang Chun Lu G Zuo  923397
DLOYOU7YM184824151162,Yuan Nan,OnePlus/9/Blue/254GB,3,72542,217626,SPRING20,174100.80000000002,26115.120000000003,2024-05-09 00:00:00,Paid,Shipped,PayPal,Visa,13657374722,Tai Wan Sheng Fo Shan Xian Zi Chuan Xiong Jie C Zuo  908322
4J62CKZ56184824151333,Gao Tao,Huawei/P40/White/254GB,6,50879,305274,WINTER10,274746.60000000003,41211.990000000005,2024-05-09 00:00:00,Failed,Shipped,PayPal,Visa,13200310451,Hei Long Jiang Sheng Hang Zhou Xian Chong Wen Bei Zhen Jie E Zuo  635148
QXB8OGR52184824151498,Jiang Qin,Galaxy/S21/Red/1TB,6,117590,705540,WINTER10,634986.0,95247.9,2024-05-09 00:00:00,Failed,In Transit,PayPal,American Express,13818314269,Zhe Jiang Sheng Nan Ning Xian Nan Hu Huang Lu F Zuo  718596
MTIP6V3FC184824151671,Li Jun,Huawei/P40/White/32GB,8,57422,459376,SUMMER15,390469.6,58570.439999999995,2024-05-09 00:00:00,Failed,Shipped,Debit Card,MasterCard,13106473176,Xin Jiang Wei Wu Er Zi Zhi Qu Ying Xian Liu Zhi Te Xi An Lu Q Zuo  724713
5TK3UP630184824151850,Fang Nan,OnePlus/9/Purple/1TB,8,127743,1021944,SPRING20,817555.2000000001,122633.28,2024-05-09 00:00:00,Failed,In Transit,Credit Card,Alipay,18966142354,Hai Nan Sheng Yun Shi Gao Gang Wang Lu G Zuo  175693
S882RBG8W184824152016,Li Ming,iPhone/13/White/128GB,3,119753,359259,SPRING20,287407.2,43111.08,2024-05-09 00:00:00,Pending,Pending,Debit Card,Alipay,15688142022,Jiang Xi Sheng Qin Shi Fu Cheng Hui Zhou Lu D Zuo  142776
8G739KF2X184824152170,Yang Yan,Galaxy/S21/Black/32GB,6,80487,482922,NEWYEAR25,362191.5,54328.725,2024-05-09 00:00:00,Paid,Delivered,Credit Card,American Express,15188181509,Liao Ning Sheng Yin Chuan Shi Xi Xia Ao Men Jie Y Zuo  607283
64NE4A5IG184824152329,Chen Xia,Galaxy/S21/Red/128GB,5,104336,521680,AUTUMN5,495596.0,74339.4,2024-05-09 00:00:00,Paid,Shipped,Bank Transfer,Visa,15773206522,Liao Ning Sheng Yu Xian Shuang Luan Guang Zhou Jie Q Zuo  906383
4BE02P7RS184824152484,Bai Dan,Xiaomi/Mi 11/Blue/1TB,7,92955,650685,SUMMER15,553082.25,82962.3375,2024-05-09 00:00:00,Paid,In Transit,PayPal,MasterCard,15559456025,Nei Meng Gu Zi Zhi Qu Tian Jin Shi Hai Ling Ma An Shan Lu T Zuo  292938
RKUAR1B1X184824152672,Cheng Jun,OnePlus/9/Red/32GB,9,134026,1206234,AUTUMN5,1145922.3,171888.345,2024-05-09 00:00:00,Failed,Delivered,PayPal,PayPal,18107448552,Fu Jian Sheng Jia He Shi Chong Wen Wu Zhou Lu A Zuo  914774
VEKG6QN5G184824152832,Li Cheng,Galaxy/S21/Black/1TB,9,68102,612918,AUTUMN5,582272.1,87340.81499999999,2024-05-09 00:00:00,Pending,Shipped,Bank Transfer,WeChat Pay,13464326619,Nei Meng Gu Zi Zhi Qu Jian Ping Shi Huai Rou Guang Zhou Lu Z Zuo  778027
KJXIEAQ4K184824153012,Chen Wei,iPhone/13 Pro/White/64GB,7,107807,754649,FESTIVE30,528254.2999999999,79238.14499999999,2024-05-09 00:00:00,Pending,Delivered,Credit Card,Visa,13675304528,Bei Jing Shi Dong Xian Hua Xi He Shan Jie M Zuo  875809
Y1PXY1RCV184824153168,Ma Ying,iPhone/13 Pro/Red/1TB,8,64361,514888,AUTUMN5,489143.6,73371.54,2024-05-09 00:00:00,Paid,Pending,Debit Card,Visa,18652699333,Tian Jin Shi Hui Zhou Shi Xi Shan Han Dan Lu W Zuo  245822
8FHZ3Y64I184824153327,Xiang Shu Hua,Oppo/Reno5/White/1TB,10,139541,1395410,SUMMER15,1186098.5,177914.775,2024-05-09 00:00:00,Paid,Delivered,Debit Card,Visa,18674067074,Fu Jian Sheng Xi Ning Xian Jiang Bei He Shan Lu Q Zuo  949919
QGKDD23Q9184824153492,Xiao Gui Zhen,Galaxy/S21/Blue/128GB,9,58730,528570,WINTER10,475713.0,71356.95,2024-05-09 00:00:00,Paid,Delivered,PayPal,WeChat Pay,18672416256,Zhe Jiang Sheng Jian Jun Shi Gao Ming Zhao Lu K Zuo  694058
ROWB52UXO184824153670,Cai Shu Ying,Xiaomi/Mi 11/Purple/32GB,5,73893,369465,WINTER10,332518.5,49877.775,2024-05-09 00:00:00,Failed,Shipped,Bank Transfer,WeChat Pay,15753030403,Shang Hai Shi Tian Jin Shi Qing Pu Hai Kou Lu I Zuo  506021
N50UGRJJX184824153847,Qiu Kai,OnePlus/9/Red/64GB,1,86444,86444,WINTER10,77799.6,11669.94,2024-05-09 00:00:00,Paid,Delivered,Bank Transfer,Visa,15974233405,Xiang Gang Te Bie Xing Zheng Qu Liang Xian Xu Hui Zheng Zhou Jie Y Zuo  362961
OBYUQ2XR8184824154028,You Yun,iPhone/13 Pro/Purple/128GB,9,137572,1238148,NEWYEAR25,928611.0,139291.65,2024-05-09 00:00:00,Failed,Pending,Credit Card,MasterCard,15848214508,Hu Bei Sheng Ha Er Bin Shi Gao Ping Chang Sha Lu N Zuo  100930
RM4GGBJBW184824154200,Yi Jun,Huawei/P40/Red/1TB,10,139395,1393950,FESTIVE30,975764.9999999999,146364.74999999997,2024-05-09 00:00:00,Paid,In Transit,Debit Card,Visa,15146437105,Nei Meng Gu Zi Zhi Qu Guan Ling Xian Gao Ming Ma Jie I Zuo  783906
RCD09AIQT184824154385,Liu Shu Ying,Xiaomi/Mi 11/Purple/254GB,9,136432,1227888,SPRING20,982310.4,147346.56,2024-05-09 00:00:00,Failed,In Transit,PayPal,WeChat Pay,18525466224,Bei Jing Shi Qian Jiang Xian Shan Ting Ding Lu W Zuo  218351
A5LH0RBVX184824154560,Chen Jie,Xiaomi/Mi 11/Black/8GB,7,122937,860559,SUMMER15,731475.15,109721.2725,2024-05-09 00:00:00,Pending,In Transit,Bank Transfer,PayPal,18214375037,Ji Lin Sheng Shuai Xian Bi Shan Fu Xin Jie L Zuo  819519
4PC2DTUO4184824154714,Lv Xiu Lan,OnePlus/9/Red/32GB,2,128756,257512,WINTER10,231760.80000000002,34764.12,2024-05-09 00:00:00,Failed,In Transit,PayPal,MasterCard,15619251834,Bei Jing Shi Dan Xian Bi Shan Xiao Jie I Zuo  628646
V7SJFDA2K184824154881,Liang Qian,Vivo/X60/White/64GB,5,125653,628265,SPRING20,502612.0,75391.8,2024-05-09 00:00:00,Paid,In Transit,Debit Card,MasterCard,14526514863,Fu Jian Sheng Ji Nan Xian Huai Rou Wu Lu Mu Qi Jie A Zuo  849498
ESQ2M20SX184824155048,Ju Liu,Vivo/X60/White/8GB,6,79738,478428,NEWYEAR25,358821.0,53823.15,2024-05-09 00:00:00,Failed,Shipped,Credit Card,WeChat Pay,18668717229,Shan Xi Sheng Hong Mei Shi Xing Shan Yong An Lu D Zuo  760926
SWW3PALG6184824155207,Li Tao,OnePlus/9/Purple/64GB,2,98476,196952,WINTER10,177256.80000000002,26588.52,2024-05-09 00:00:00,Failed,Delivered,PayPal,WeChat Pay,14748085757,Ning Xia Hui Zu Zi Zhi Qu Gui Yang Xian Xi Shan Tai Yuan Jie U Zuo  582441
8DWZSHUL4184824155386,Su Xiang,Huawei/P40/White/32GB,1,108880,108880,SPRING20,87104.0,13065.6,2024-05-09 00:00:00,Failed,Pending,Credit Card,Visa,18275226138,Bei Jing Shi Da Ye Shi Long Tan Li Jie D Zuo  113965
NLPFW5UCD184824155650,Shu Yang,OnePlus/9/Black/1TB,2,116169,232338,FESTIVE30,162636.59999999998,24395.489999999994,2024-05-09 00:00:00,Failed,In Transit,Debit Card,Visa,15210956609,Jiang Su Sheng Xu Shi Huang Pu Li Lu N Zuo  911780
AUCEJ12II184824155814,Liu Xue Mei,OnePlus/9/Black/128GB,4,116552,466208,SUMMER15,396276.8,59441.52,2024-05-09 00:00:00,Failed,Delivered,Credit Card,MasterCard,13240907781,Hai Nan Sheng Yan Xian He Chuan Chao Zhou Lu K Zuo  233302
FQ58YCMEL184824155970,Fan Hui,Huawei/P40/Blue/32GB,2,58526,117052,FESTIVE30,81936.4,12290.46,2024-05-09 00:00:00,Failed,In Transit,Bank Transfer,Alipay,13375705078,Fu Jian Sheng Chao Hu Xian Hai Ling Wu Han Lu R Zuo  578795
T5JVUE356184824156129,Zhang Yu Ying,iPhone/13 Pro/White/1TB,5,121470,607350,SPRING20,485880.0,72882.0,2024-05-09 00:00:00,Paid,Delivered,PayPal,WeChat Pay,18043437516,Shang Hai Shi Wu Lu Mu Qi Shi Cheng Dong Ji Nan Jie C Zuo  197217
TEWKJGO0X184824156300,Chen Li Li,Vivo/X60/Red/128GB,5,136873,684365,SUMMER15,581710.25,87256.53749999999,2024-05-09 00:00:00,Failed,Shipped,PayPal,Alipay,13066333989,He Bei Sheng Peng Xian Shan Ting Fu Xin Lu U Zuo  249780
HIQADB7FU184824156459,Ge Gui Xiang,Xiaomi/Mi 11/Purple/1TB,10,146962,1469620,NEWYEAR25,1102215.0,165332.25,2024-05-09 00:00:00,Paid,Pending,Debit Card,Alipay,15680283569,Nei Meng Gu Zi Zhi Qu Xin Xian Wei Dou Chen Jie D Zuo  224158
FW5VWMT1B184824156645,Yu Lei,Galaxy/S21/Red/128GB,7,138655,970585,SPRING20,776468.0,116470.2,2024-05-09 00:00:00,Paid,In Transit,PayPal,Visa,13364717146,Gan Su Sheng Han Dan Xian Yong Chuan Bei Zhen Jie M Zuo  548327
7VES7B7RY184824156802,Wang Bin,OnePlus/9/Blue/64GB,4,136399,545596,SUMMER15,463756.6,69563.48999999999,2024-05-09 00:00:00,Pending,Pending,Credit Card,PayPal,15898972869,Ji Lin Sheng Yu Lan Xian Gao Ming Ma Jie I Zuo  820209
P09F56FB7184824156970,Zhang Ming,Galaxy/S21/Black/8GB,2,57713,115426,NEWYEAR25,86569.5,12985.425,2024-05-09 00:00:00,Pending,In Transit,Bank Transfer,WeChat Pay,14564582724,Jiang Xi Sheng Xin Ji Shi Gao Ping Shen Jie C Zuo  615562
5HNV5CDDD184824157137,Zhang Jia,Vivo/X60/White/128GB,7,88098,616686,NEWYEAR25,462514.5,69377.175,2024-05-09 00:00:00,Paid,Pending,PayPal,WeChat Pay,18119615642,Hei Long Jiang Sheng Hai Kou Xian Zhang Shou Chang Chun Jie J Zuo  347503
IZRFI1571184824157300,Wang Tao,OnePlus/9/Purple/8GB,4,91744,366976,WINTER10,330278.4,49541.76,2024-05-09 00:00:00,Paid,Shipped,Debit Card,American Express,14536537940,Ning Xia Hui Zu Zi Zhi Qu Fu Zhou Shi Xun Yang Ning De Jie A Zuo  846046
IUV3JKP4U184824157478,Wang Yan,Xiaomi/Mi 11/Red/1TB,3,83169,249507,AUTUMN5,237031.65,35554.7475,2024-05-09 00:00:00,Paid,Shipped,PayPal,Visa,13738380718,Hu Bei Sheng Xin Shi Bin Cheng Tai Bei Jie N Zuo  180506
WO7DR8P1U184824157635,Feng Li,Vivo/X60/Black/8GB,8,95965,767720,SPRING20,614176.0,92126.4,2024-05-09 00:00:00,Paid,Delivered,PayPal,PayPal,15850220729,Shan Dong Sheng Zhang Jia Gang Xian Xing Shan Pan Lu B Zuo  372965
STTT9AS31184824157815,Zhao Xiu Fang,Xiaomi/Mi 11/Blue/1TB,4,120590,482360,WINTER10,434124.0,65118.6,2024-05-09 00:00:00,Paid,Pending,PayPal,PayPal,13079135703,Hu Bei Sheng Cheng Du Shi Dong Li Sheng Jie L Zuo  339653
