Order ID,Customer Name,Mobile Model,Quantity,Price per Unit,Total Price,Promotion Code,Order Amount,GST,Order Date,Payment Status,Shipping Status,Payment Method,Payment Provider,Mobile,Delivery Address
JJMO6086U184824023283,Ji Yu Mei,Huawei/P40/Purple/64GB,5,111245,556225,WINTER10,500602.5,75090.375,2024-05-09 00:00:00,Failed,Pending,PayPal,Alipay,18237190258,Hu Nan Sheng Fu Xin Shi Xun Yang Shan Wei Jie N Zuo  630177
9DOM04527184824023500,Dan Tao,Vivo/X60/White/1TB,10,148469,1484690,SPRING20,1187752.0,178162.8,2024-05-09 00:00:00,Failed,Shipped,Credit Card,MasterCard,18584587717,Xin Jiang Wei Wu Er Zi Zhi Qu Hua Shi Zhang Shou Fu Xin Jie J Zuo  172152
QB1MSV8JU184824023686,Ceng Xiu Zhen,Vivo/X60/Red/64GB,6,146774,880644,NEWYEAR25,660483.0,99072.45,2024-05-09 00:00:00,Pending,In Transit,Debit Card,American Express,14545161792,Tian Jin Shi Xin Ji Xian Zi Chuan Yang Jie I Zuo  453043
BQYOUT9RV184824023868,Li Peng,iPhone/13/Purple/32GB,5,145093,725465,SPRING20,580372.0,87055.8,2024-05-09 00:00:00,Pending,Pending,Debit Card,PayPal,15018384180,Fu Jian Sheng Feng Shi Qing Cheng Hu Lu Y Zuo  632029
2A6C7SXSH184824024036,Wang Lei,Huawei/P40/White/32GB,8,95876,767008,SPRING20,613606.4,92040.96,2024-05-09 00:00:00,Pending,Pending,Bank Transfer,PayPal,13073425935,Ji Lin Sheng Tai Yuan Xian Jin Ping Lai Lu C Zuo  962966
IPJJ1SCIF184824024209,Zhong Chun Mei,Oppo/Reno5/Blue/64GB,1,148786,148786,WINTER10,133907.4,20086.109999999997,2024-05-09 00:00:00,Paid,Pending,PayPal,Visa,15971928219,Ning Xia Hui Zu Zi Zhi Qu He Fei Shi Zhang Shou Lu Jie R Zuo  328134
UQZYEYW4L184824024414,Zhao Ying,Oppo/Reno5/Blue/128GB,8,69016,552128,SPRING20,441702.4,66255.36,2024-05-09 00:00:00,Pending,Shipped,Debit Card,Visa,13850340121,Tai Wan Sheng Gui Zhi Shi Ping Shan Tong Liao Jie P Zuo  699248
E3PODQ8N7184824024576,Wang Hao,iPhone/13 Pro/White/1TB,7,60420,422940,AUTUMN5,401793.0,60268.95,2024-05-09 00:00:00,Pending,Pending,Debit Card,Visa,13742483824,Fu Jian Sheng Ying Xian Shen He Hang Zhou Lu Q Zuo  554915
FCTAK28VV184824024731,Zhang Lin,Oppo/Reno5/Red/254GB,5,121811,609055,FESTIVE30,426338.5,63950.774999999994,2024-05-09 00:00:00,Paid,In Transit,Bank Transfer,Visa,13989064208,Nei Meng Gu Zi Zhi Qu Min Shi Shen Bei Xin Lin Jie W Zuo  769558
96X9SRWGT184824024926,Qiu Yu Ying,Vivo/X60/Purple/32GB,2,65309,130618,SUMMER15,111025.3,16653.795,2024-05-09 00:00:00,Failed,Pending,PayPal,MasterCard,18891393281,Guang Dong Sheng Jun Shi Zi Chuan Zhang Jie I Zuo  917859
CTC2BVEHX184824025105,Wang Jian,OnePlus/9/Red/128GB,5,127403,637015,SUMMER15,541462.75,81219.41249999999,2024-05-09 00:00:00,Paid,In Transit,Bank Transfer,PayPal,15279480739,Zhe Jiang Sheng Li Hua Xian Hai Gang Li Lu D Zuo  957328
R51RQO0TO184824025289,Cao Yong,Oppo/Reno5/Black/1TB,5,92467,462335,SUMMER15,392984.75,58947.7125,2024-05-09 00:00:00,Paid,In Transit,Debit Card,MasterCard,15338911908,Xi Zang Zi Zhi Qu Hai Men Xian Gao Ming Tai Bei Lu P Zuo  744401
OBRN39U5D184824025468,Zhang Bo,iPhone/13 Pro/White/32GB,10,135233,1352330,FESTIVE30,946630.9999999999,141994.64999999997,2024-05-09 00:00:00,Pending,In Transit,Bank Transfer,Visa,13916855097,Liao Ning Sheng Lan Ying Xian Nan Hu Li Jie D Zuo  413226
UEQXZ3UU7184824025648,Gan Lan Ying,Huawei/P40/Red/1TB,7,78907,552349,NEWYEAR25,414261.75,62139.2625,2024-05-09 00:00:00,Paid,In Transit,PayPal,MasterCard,13947625926,Guang Dong Sheng Shu Hua Xian Qing He Zhang Jie E Zuo  151312
51D81BMN0184824025831,Liu Jie,Galaxy/S21/Red/1TB,9,84559,761031,SUMMER15,646876.35,97031.4525,2024-05-09 00:00:00,Failed,In Transit,Bank Transfer,PayPal,15118536334,Shan Xi Sheng Jian Xian Hai Gang Han Jie T Zuo  191463
7X8G6YYDZ184824026004,Wan Shu Zhen,iPhone/13/Purple/64GB,9,121536,1093824,SUMMER15,929750.4,139462.56,2024-05-09 00:00:00,Failed,In Transit,PayPal,PayPal,15166250788,Jiang Su Sheng Ying Shi Chong Wen Xiao Jie G Zuo  392755
I7EDCHLMI184824026176,Zhang Xiu Fang,OnePlus/9/Purple/254GB,5,87476,437380,SUMMER15,371773.0,55765.95,2024-05-09 00:00:00,Paid,In Transit,PayPal,MasterCard,18024627367,Tian Jin Shi Shang Hai Shi Long Tan Xu Lu D Zuo  209708
VVJOGLTU8184824026351,Wang Wen,Huawei/P40/Red/64GB,10,71682,716820,SPRING20,573456.0,86018.4,2024-05-09 00:00:00,Failed,Delivered,Debit Card,Visa,18106082336,Jiang Su Sheng Guang Zhou Xian Sha Shi Cai Lu T Zuo  395576
62H3YYFII184824026520,Li Nan,iPhone/13 Pro/Red/64GB,6,105186,631116,FESTIVE30,441781.19999999995,66267.18,2024-05-09 00:00:00,Failed,Delivered,Bank Transfer,WeChat Pay,13623830910,Ao Men Te Bie Xing Zheng Qu Yang Xian Sha Wan Fo Shan Jie A Zuo  736867
3DDYSEULA184824026701,Duan Chen,iPhone/13/White/254GB,6,137688,826128,AUTUMN5,784821.6,117723.23999999999,2024-05-09 00:00:00,Pending,Shipped,Credit Card,WeChat Pay,15337447479,Jiang Su Sheng Cheng Du Shi An Ci Ni Jie X Zuo  119182
E16L90VX7184824026872,Gao Fang,Vivo/X60/Red/8GB,1,86770,86770,WINTER10,78093.0,11713.949999999999,2024-05-09 00:00:00,Paid,In Transit,PayPal,PayPal,13661911210,Guang Dong Sheng Shang Hai Xian Min Xing Zhang Jia Gang Jie D Zuo  519907
CTOTPXTOT184824027047,Liu Chang,iPhone/13 Pro/Blue/8GB,5,120358,601790,WINTER10,541611.0,81241.65,2024-05-09 00:00:00,Pending,Shipped,Bank Transfer,PayPal,15550182055,Fu Jian Sheng Rui Shi You Hao Ren Lu W Zuo  470442
4W3WW586M184824027220,Bao Jun,Xiaomi/Mi 11/White/64GB,8,126942,1015536,WINTER10,913982.4,137097.36,2024-05-09 00:00:00,Pending,Pending,Bank Transfer,Visa,14500515569,Zhe Jiang Sheng Lei Xian Nan Hu Sheng Jie Y Zuo  616837
YKQI24BY8184824027383,Xu Yu Ying,Oppo/Reno5/Black/254GB,10,62127,621270,FESTIVE30,434889.0,65233.35,2024-05-09 00:00:00,Failed,Shipped,Debit Card,PayPal,15786624203,Ji Lin Sheng Bei Jing Xian Xiu Ying Xing Cheng Lu B Zuo  754093
LJPH0OQAM184824027546,Li Gui Xiang,Huawei/P40/Blue/64GB,4,101080,404320,SUMMER15,343672.0,51550.799999999996,2024-05-09 00:00:00,Failed,Pending,Debit Card,WeChat Pay,13193151045,Jiang Su Sheng Yang Shi Xiu Ying Lei Jie W Zuo  392495
TX3CI55TY184824027713,Zhang Xiu Mei,iPhone/13 Pro/Red/8GB,6,109276,655656,AUTUMN5,622873.2,93430.98,2024-05-09 00:00:00,Failed,Delivered,Bank Transfer,Alipay,15929865476,Tian Jin Shi Fo Shan Xian Shen He Yong An Lu G Zuo  821620
I8JWW3WIF184824027883,Liu Bo,OnePlus/9/Purple/8GB,4,53107,212428,SPRING20,169942.40000000002,25491.360000000004,2024-05-09 00:00:00,Pending,Pending,Bank Transfer,American Express,14748914331,Hai Nan Sheng Bei Jing Shi Xing Shan Zhu Jie O Zuo  540704
QAY6ICAO8184824028054,Ying Yan,iPhone/13 Pro/Purple/32GB,4,94941,379764,NEWYEAR25,284823.0,42723.45,2024-05-09 00:00:00,Failed,In Transit,Credit Card,Alipay,13002441224,Ji Lin Sheng Liu Zhou Xian Zhang Shou Lin Jie R Zuo  105572
IEWTSLZRN184824028235,Wu Xiu Lan,Oppo/Reno5/Purple/254GB,6,101888,611328,FESTIVE30,427929.6,64189.439999999995,2024-05-09 00:00:00,Paid,Delivered,Debit Card,PayPal,13549994332,An Hui Sheng Xin Ji Shi Chong Wen Shen Yang Lu V Zuo  836090
9XK7F8GIQ184824028406,Li Liang,iPhone/13 Pro/White/1TB,4,75741,302964,NEWYEAR25,227223.0,34083.45,2024-05-09 00:00:00,Failed,Pending,Debit Card,American Express,15186793079,Ao Men Te Bie Xing Zheng Qu Fo Shan Xian Xiu Ying Ceng Jie R Zuo  804430
NTUR6RA1Y184824028597,Ceng Xue Mei,Huawei/P40/White/128GB,1,104488,104488,AUTUMN5,99263.59999999999,14889.539999999997,2024-05-09 00:00:00,Pending,In Transit,PayPal,Alipay,18830141799,Si Chuan Sheng Jian Guo Xian Fu Cheng Xie Lu V Zuo  714548
M52STAVR0184824028772,Wang Shu Lan,iPhone/13/Purple/64GB,4,76605,306420,NEWYEAR25,229815.0,34472.25,2024-05-09 00:00:00,Pending,Shipped,Credit Card,MasterCard,15020611103,Xin Jiang Wei Wu Er Zi Zhi Qu Cheng Du Shi An Ci Guan Ling Jie Y Zuo  112837
NZMUWI4OH184824028956,Peng Peng,Galaxy/S21/Red/254GB,3,111306,333918,FESTIVE30,233742.59999999998,35061.38999999999,2024-05-09 00:00:00,Paid,Shipped,Bank Transfer,Alipay,15929775219,Xin Jiang Wei Wu Er Zi Zhi Qu Shang Hai Shi Shen Bei Xin Zhang Jie A Zuo  722538
44HMTFSTZ184824029147,Yao Xiang,Galaxy/S21/Purple/254GB,1,82866,82866,WINTER10,74579.40000000001,11186.910000000002,2024-05-09 00:00:00,Pending,Pending,Credit Card,WeChat Pay,15600501736,Xi Zang Zi Zhi Qu Rui Shi Cheng Bei Liu Lu X Zuo  886953
NCW9GRFK1184824029320,Li Chen,Galaxy/S21/Black/64GB,7,131861,923027,AUTUMN5,876875.6499999999,131531.34749999997,2024-05-09 00:00:00,Failed,Pending,Bank Transfer,WeChat Pay,18789823989,Tian Jin Shi Ting Shi Ji Zhou Liu Jie U Zuo  109109
A0S9HA8O5184824029491,Wang Yan,Huawei/P40/Red/64GB,4,73071,292284,AUTUMN5,277669.8,41650.469999999994,2024-05-09 00:00:00,Pending,Pending,Bank Transfer,WeChat Pay,13594850608,Si Chuan Sheng Tai Bei Shi Jin Ping Shen Yang Lu S Zuo  521742
BUUDKJDV0184824029657,Ding Yan,OnePlus/9/Red/64GB,2,70579,141158,AUTUMN5,134100.1,20115.015,2024-05-09 00:00:00,Pending,In Transit,PayPal,PayPal,15801647530,Hu Bei Sheng Wei Shi Shan Ting Zhang Jia Gang Jie W Zuo  717512
S9OQ5533M184824029825,Yang Jin Feng,iPhone/13 Pro/Black/64GB,3,105918,317754,WINTER10,285978.60000000003,42896.79,2024-05-09 00:00:00,Failed,Shipped,PayPal,American Express,18022261476,Xiang Gang Te Bie Xing Zheng Qu Yi Dou Xian Ping Shan Lan Zhou Lu A Zuo  919542
FVGBI5P6N184824030013,Feng Min,Vivo/X60/Red/128GB,7,109443,766101,SUMMER15,651185.85,97677.87749999999,2024-05-09 00:00:00,Pending,Pending,Credit Card,PayPal,15200469038,Hu Bei Sheng Dong Mei Xian Hua Xi Qi Jie S Zuo  247318
27M0N02H1184824030184,Tang Kai,iPhone/13/Blue/128GB,7,60832,425824,WINTER10,383241.60000000003,57486.240000000005,2024-05-09 00:00:00,Paid,In Transit,Credit Card,Alipay,13415519273,Yun Nan Sheng Liang Shi Dong Cheng Zhang Lu B Zuo  484154
HBPTTRRDA184824030349,Xin Shu Hua,iPhone/13/White/1TB,3,59662,178986,AUTUMN5,170036.69999999998,25505.504999999997,2024-05-09 00:00:00,Failed,Shipped,PayPal,MasterCard,15220228013,He Nan Sheng Ning Shi Xi Xia Bei Jing Jie S Zuo  763817
EAJ1YIQPP184824030506,Liu Yan,iPhone/13/Red/32GB,3,94749,284247,WINTER10,255822.30000000002,38373.345,2024-05-09 00:00:00,Failed,In Transit,Debit Card,WeChat Pay,18241533312,Gui Zhou Sheng Fan Shi Long Tan Zhao Jie X Zuo  961762
0KRPLP3A7184824030671,Xiao Jian,Huawei/P40/Black/1TB,9,64190,577710,SPRING20,462168.0,69325.2,2024-05-09 00:00:00,Paid,In Transit,Credit Card,American Express,15741746979,Guang Xi Zhuang Zu Zi Zhi Qu Ha Er Bin Shi Ping Shan Shi Lu P Zuo  398719
I5OYFZ8N2184824030875,Guan Yang,Vivo/X60/Red/8GB,2,75505,151010,SUMMER15,128358.5,19253.774999999998,2024-05-09 00:00:00,Paid,Shipped,Bank Transfer,WeChat Pay,18148838589,Ning Xia Hui Zu Zi Zhi Qu Xiu Zhen Xian Feng Dou Ceng Jie S Zuo  550503
L53B7742Z184824031068,Zhang Xia,iPhone/13 Pro/Red/1TB,5,50201,251005,SPRING20,200804.0,30120.6,2024-05-09 00:00:00,Paid,In Transit,PayPal,PayPal,13460477467,Gan Su Sheng Xi Ning Xian Jing An Li Lu U Zuo  227385
VR0GEI7QQ184824031237,Jiao Xia,iPhone/13/Blue/8GB,3,55838,167514,WINTER10,150762.6,22614.39,2024-05-09 00:00:00,Failed,Pending,Bank Transfer,PayPal,13040536797,Shan Xi Sheng Chen Xian Xun Yang Ha Er Bin Lu L Zuo  277163
BA86ZKMOS184824031392,Li Cheng,iPhone/13/Red/32GB,5,111026,555130,FESTIVE30,388591.0,58288.65,2024-05-09 00:00:00,Paid,Shipped,Credit Card,American Express,13748043548,Ao Men Te Bie Xing Zheng Qu Lin Xian Hua Xi Jia Jie W Zuo  409827
CPGDB2TBX184824031578,Chen Ling,Galaxy/S21/Black/8GB,6,53815,322890,WINTER10,290601.0,43590.15,2024-05-09 00:00:00,Pending,Delivered,Bank Transfer,WeChat Pay,13391704555,Jiang Su Sheng Hua Xian Xun Yang Wu Lu Mu Qi Lu Y Zuo  910437
I68ZAAJLA184824031738,Li Ting,iPhone/13/White/1TB,3,142132,426396,AUTUMN5,405076.19999999995,60761.42999999999,2024-05-09 00:00:00,Failed,Pending,Bank Transfer,PayPal,18601529992,Yun Nan Sheng Jing Men Shi Xiao Nan Zhao Jie C Zuo  688280
ZUBN9A72V184824031914,Cui Jian Guo,OnePlus/9/Purple/32GB,9,69515,625635,FESTIVE30,437944.5,65691.675,2024-05-09 00:00:00,Pending,Delivered,Credit Card,PayPal,13866070658,Shang Hai Shi Liu Zhou Xian Ji Qu Tian Jin Jie D Zuo  566959
NKB2QN6RA184824032084,Jiang Xiu Zhen,iPhone/13/Red/1TB,6,102426,614556,SUMMER15,522372.6,78355.89,2024-05-09 00:00:00,Pending,Delivered,Debit Card,Visa,13346427351,Si Chuan Sheng Yi Du Shi Jiang Bei Tai Yuan Lu Z Zuo  318922
52AK7DJIP184824032253,Chen Feng Ying,Xiaomi/Mi 11/Purple/64GB,10,77990,779900,SUMMER15,662915.0,99437.25,2024-05-09 00:00:00,Pending,Delivered,Credit Card,American Express,18558066953,Xi Zang Zi Zhi Qu Yu Ying Xian Feng Dou Nan Ning Lu T Zuo  323441
S8Q6XNDR8184824032423,Huang Bin,Huawei/P40/Purple/1TB,1,64900,64900,FESTIVE30,45430.0,6814.5,2024-05-09 00:00:00,Pending,In Transit,PayPal,MasterCard,13132025189,Xin Jiang Wei Wu Er Zi Zhi Qu Li Shi Xiu Ying Guang Zhou Jie I Zuo  852111
1AIG09DYX184824032594,Lin Gang,Oppo/Reno5/Red/128GB,8,103640,829120,WINTER10,746208.0,111931.2,2024-05-09 00:00:00,Pending,Pending,Debit Card,Alipay,13551485846,Hei Long Jiang Sheng Xing Cheng Shi Xiao Nan Chang Chun Jie L Zuo  982242
KDSRFYY0I184824032763,Zheng Gui Fang,OnePlus/9/Purple/32GB,6,66616,399696,SPRING20,319756.80000000005,47963.520000000004,2024-05-09 00:00:00,Paid,In Transit,PayPal,WeChat Pay,13465000805,Shan Xi Sheng Shen Yang Shi Qing He Hui Zhou Lu Y Zuo  816254
FY27T36R9184824032929,Chen Jian Hua,OnePlus/9/Red/254GB,5,93573,467865,WINTER10,421078.5,63161.774999999994,2024-05-09 00:00:00,Failed,Shipped,Credit Card,Alipay,18082438955,Hei Long Jiang Sheng Chong Qing Shi Chong Wen Jiang Lu O Zuo  807032
A5DK2C4KB184824033109,Wang Liu,Huawei/P40/Red/254GB,7,104901,734307,SUMMER15,624160.95,93624.14249999999,2024-05-09 00:00:00,Pending,Delivered,Credit Card,American Express,18202638691,Xin Jiang Wei Wu Er Zi Zhi Qu Xin Ji Xian Gao Gang Ji Jie E Zuo  407574
MYUSQLFBJ184824033296,Yuan Jin Feng,Galaxy/S21/Black/254GB,7,119169,834183,FESTIVE30,583928.1,87589.215,2024-05-09 00:00:00,Paid,Shipped,Debit Card,WeChat Pay,15788128709,Si Chuan Sheng Hang Zhou Xian Yong Chuan Fo Shan Lu K Zuo  622669
W0NA3ASNL184824033460,Li Yang,Vivo/X60/Purple/64GB,5,59911,299555,FESTIVE30,209688.5,31453.274999999998,2024-05-09 00:00:00,Failed,In Transit,PayPal,Alipay,13349329843,Bei Jing Shi Li Hua Xian Fang Shan Lan Zhou Jie H Zuo  575476
M9Y9O65IW184824033619,Huang Jun,iPhone/13 Pro/Purple/8GB,10,58128,581280,FESTIVE30,406896.0,61034.399999999994,2024-05-09 00:00:00,Pending,Pending,Credit Card,Visa,13642254044,Guang Dong Sheng Kun Ming Xian Shuang Luan Zhong Lu L Zuo  707554
WJGXQCV6S184824033789,Zhu Jia,iPhone/13/Purple/1TB,10,125953,1259530,WINTER10,1133577.0,170036.55,2024-05-09 00:00:00,Failed,Delivered,Credit Card,WeChat Pay,13524889541,Shan Xi Sheng Liu Zhou Shi Zhang Shou Huai An Lu G Zuo  104404
BX7CWF6SB184824033946,Huang Shu Lan,OnePlus/9/Black/254GB,7,91458,640206,NEWYEAR25,480154.5,72023.175,2024-05-09 00:00:00,Paid,Delivered,Debit Card,American Express,18575321430,Xi Zang Zi Zhi Qu Tao Shi Wei Dou Wang Jie M Zuo  379765
AC0GZ9V8Z184824034125,Bi Xiu Zhen,OnePlus/9/Blue/32GB,2,76470,152940,SUMMER15,129999.0,19499.85,2024-05-09 00:00:00,Pending,Shipped,Bank Transfer,MasterCard,13410751981,Gan Su Sheng Ting Ting Xian Xi Feng Qi Jie M Zuo  408419
SFMBG85N1184824034298,Zhang Xiao Hong,Oppo/Reno5/Red/8GB,6,107329,643974,NEWYEAR25,482980.5,72447.075,2024-05-09 00:00:00,Failed,In Transit,Credit Card,PayPal,18502882522,Si Chuan Sheng Liao Yang Xian Xiu Ying Huai An Jie Z Zuo  320907
ODW2M87TR184824034465,Zhang Huan,Oppo/Reno5/Red/1TB,2,115461,230922,AUTUMN5,219375.9,32906.384999999995,2024-05-09 00:00:00,Paid,In Transit,Credit Card,PayPal,18848093321,Guang Xi Zhuang Zu Zi Zhi Qu Lin Shi Long Tan Tai Bei Jie Q Zuo  189392
C2PDH0Q8T184824034635,Zhang Xiu Ying,Vivo/X60/Blue/8GB,7,100314,702198,AUTUMN5,667088.1,100063.215,2024-05-09 00:00:00,Pending,Delivered,Credit Card,Alipay,15975355458,Ao Men Te Bie Xing Zheng Qu Zhang Jia Gang Xian Shuang Luan Zhang Jie X Zuo  339506
AGLKU145E184824034833,Zhang Yu Mei,Oppo/Reno5/Black/8GB,4,65309,261236,SUMMER15,222050.6,33307.59,2024-05-09 00:00:00,Pending,Shipped,PayPal,American Express,13540018145,Tian Jin Shi Jia He Xian Mu Ye Bei Jing Jie F Zuo  133173
ZQ8GUWBCP184824034997,Pan Kun,OnePlus/9/Blue/32GB,10,76007,760070,FESTIVE30,532049.0,79807.34999999999,2024-05-09 00:00:00,Paid,In Transit,Bank Transfer,Alipay,13148482286,An Hui Sheng Qin Shi Cheng Bei Liu Pan Shui Jie C Zuo  982533
NL41UEIJ0184824035157,Liu Jun,Xiaomi/Mi 11/Red/64GB,4,124330,497320,WINTER10,447588.0,67138.2,2024-05-09 00:00:00,Failed,Pending,Credit Card,MasterCard,14548801603,Hu Bei Sheng Jie Xian Xing Shan Wang Jie H Zuo  611752
QP18EO9QT184824035318,Chen Xu,Oppo/Reno5/Blue/1TB,1,103727,103727,NEWYEAR25,77795.25,11669.2875,2024-05-09 00:00:00,Pending,Shipped,Credit Card,American Express,13445526644,He Bei Sheng Wu Lu Mu Qi Shi Nan Xi Yi Dou Lu W Zuo  547300
B065PFTRW184824035483,Huang Chang,Oppo/Reno5/Black/254GB,3,85805,257415,NEWYEAR25,193061.25,28959.1875,2024-05-09 00:00:00,Pending,Pending,Credit Card,American Express,18775368277,Zhe Jiang Sheng Hui Xian Ji Qu Ning De Jie Q Zuo  236905
17P2DCMEF184824035640,Zhu Ting Ting,Galaxy/S21/Red/254GB,3,68925,206775,FESTIVE30,144742.5,21711.375,2024-05-09 00:00:00,Paid,In Transit,Debit Card,MasterCard,14555855125,Zhe Jiang Sheng Xing Cheng Shi Feng Dou Fu Xin Lu V Zuo  998457
Y6ODXE4SQ184824035804,Qi Wei,Galaxy/S21/Red/1TB,4,148282,593128,SPRING20,474502.4,71175.36,2024-05-09 00:00:00,Paid,Shipped,Credit Card,American Express,15003036551,Bei Jing Shi Fu Xin Xian Xiao Nan Fan Lu K Zuo  104984
JDYWTXQBS184824035973,Zhang Lu,iPhone/13/White/254GB,4,81830,327320,SPRING20,261856.0,39278.4,2024-05-09 00:00:00,Pending,Pending,Debit Card,MasterCard,13198991873,Hu Bei Sheng Kai Xian Qing He Jia Jie H Zuo  959425
5H6L4I991184824036137,Yang Jie,Vivo/X60/Blue/8GB,10,142022,1420220,FESTIVE30,994153.9999999999,149123.09999999998,2024-05-09 00:00:00,Pending,Delivered,Debit Card,American Express,15602216747,Nei Meng Gu Zi Zhi Qu Bo Xian Xiu Ying Xu Lu J Zuo  103890
KJ3KJBZZK184824036315,Bai Yu,iPhone/13/Red/8GB,6,100792,604752,AUTUMN5,574514.4,86177.16,2024-05-09 00:00:00,Pending,In Transit,Debit Card,MasterCard,18150131401,Shan Xi Sheng Fo Shan Shi Long Tan Yang Lu Y Zuo  682955
5WN6SSBQW184824036481,Hou Jun,iPhone/13 Pro/Blue/32GB,5,70633,353165,WINTER10,317848.5,47677.275,2024-05-09 00:00:00,Pending,Delivered,PayPal,WeChat Pay,13629471870,Chong Qing Shi Yu Shi Sha Wan Ha Er Bin Jie M Zuo  806501
YIBZ949SL184824036638,He Gui Ying,Galaxy/S21/Red/128GB,5,108355,541775,NEWYEAR25,406331.25,60949.6875,2024-05-09 00:00:00,Failed,Shipped,Bank Transfer,PayPal,14711433548,Hei Long Jiang Sheng Guan Ling Xian Sha Wan Gao Jie J Zuo  152655
9T1PYRPQM184824036817,Zhang Gui Zhi,Huawei/P40/Black/254GB,1,68538,68538,NEWYEAR25,51403.5,7710.525,2024-05-09 00:00:00,Paid,Pending,PayPal,MasterCard,13382756933,Qing Hai Sheng Bo Shi Fang Shan Tian Lu H Zuo  344157
ZCAWBAXXN184824036988,Liu Hao,iPhone/13/Black/1TB,1,107617,107617,SPRING20,86093.6,12914.04,2024-05-09 00:00:00,Pending,Delivered,Debit Card,MasterCard,13834182093,Chong Qing Shi Fu Zhou Shi Nan Xi Liao Yang Jie G Zuo  744072
TDR4PVZL5184824037143,Yang Xiu Zhen,Oppo/Reno5/Purple/32GB,10,118685,1186850,SPRING20,949480.0,142422.0,2024-05-09 00:00:00,Failed,Shipped,Debit Card,WeChat Pay,13205612415,Shang Hai Shi Ting Ting Shi Jiang Bei Tian Jin Lu Z Zuo  189725
RJ8D8FLDR184824037306,Luo Gui Ying,Oppo/Reno5/Black/8GB,2,100002,200004,SUMMER15,170003.4,25500.51,2024-05-09 00:00:00,Pending,Pending,Credit Card,MasterCard,15086914278,Hai Nan Sheng Huai An Shi Fang Shan Liang Lu M Zuo  940053
2FD4511AK184824037480,Niu Bo,iPhone/13 Pro/Red/128GB,7,90883,636181,AUTUMN5,604371.95,90655.7925,2024-05-09 00:00:00,Paid,Pending,PayPal,MasterCard,15879663971,Shan Xi Sheng Jun Shi Xun Yang Chong Qing Jie I Zuo  607368
ZU4AXG0ZA184824037635,Zhang Dong Mei,Vivo/X60/Black/128GB,4,112746,450984,FESTIVE30,315688.8,47353.32,2024-05-09 00:00:00,Paid,In Transit,Bank Transfer,American Express,14514396558,Gui Zhou Sheng Nan Jing Shi Long Tan Luo Lu F Zuo  497229
DTKPIM3VD184824037811,Li Qian,OnePlus/9/White/254GB,1,140891,140891,NEWYEAR25,105668.25,15850.2375,2024-05-09 00:00:00,Pending,In Transit,Credit Card,American Express,15083539677,Xiang Gang Te Bie Xing Zheng Qu Ao Men Shi Sha Wan Yang Jie G Zuo  568629
FJIDG146E184824038000,Gu Lei,Oppo/Reno5/Red/1TB,4,84800,339200,SUMMER15,288320.0,43248.0,2024-05-09 00:00:00,Pending,Pending,Credit Card,Visa,15005033910,Hu Nan Sheng Han Dan Xian Liang Ping Tian Jin Lu Y Zuo  824745
3CUKJ8MNK184824038161,Sun Qin,iPhone/13/White/128GB,10,72422,724220,SPRING20,579376.0,86906.4,2024-05-09 00:00:00,Pending,Delivered,Debit Card,Alipay,14751577327,Si Chuan Sheng Dong Guan Shi Xiao Shan Yi Dou Lu E Zuo  512490
CUOGX42FK184824038321,Chen Fang,iPhone/13 Pro/Purple/128GB,2,111347,222694,SUMMER15,189289.9,28393.484999999997,2024-05-09 00:00:00,Pending,Delivered,Bank Transfer,Alipay,18756788128,Xiang Gang Te Bie Xing Zheng Qu Fang Xian Jiang Bei An Lu J Zuo  591817
T9UCIBRQ2184824038504,Zhang Chun Mei,Galaxy/S21/Black/254GB,1,101454,101454,SPRING20,81163.20000000001,12174.480000000001,2024-05-09 00:00:00,Pending,Delivered,Bank Transfer,WeChat Pay,15159308439,Qing Hai Sheng Yu Zhen Xian Nan Hu Tian Jin Jie Y Zuo  209630
HVZ35TB6T184824038667,Li Yu Mei,iPhone/13/White/1TB,1,146720,146720,AUTUMN5,139384.0,20907.6,2024-05-09 00:00:00,Failed,Pending,PayPal,PayPal,13567343469,Xiang Gang Te Bie Xing Zheng Qu Yan Shi Gao Ming Da Ye Jie T Zuo  807343
0HFR94GH4184824038846,Liu Li Juan,Huawei/P40/Blue/128GB,3,130704,392112,FESTIVE30,274478.39999999997,41171.759999999995,2024-05-09 00:00:00,Paid,In Transit,Credit Card,American Express,13151204560,Guang Xi Zhuang Zu Zi Zhi Qu Zhang Jia Gang Shi An Ci Wu Jie N Zuo  769674
KHSIYT5OW184824039045,Yang Long,Vivo/X60/Black/128GB,1,71553,71553,AUTUMN5,67975.34999999999,10196.302499999998,2024-05-09 00:00:00,Failed,Shipped,Credit Card,Alipay,13222745185,He Nan Sheng Zhang Chun Shi Xu Hui Tai Yuan Jie H Zuo  439875
UL39BGXMQ184824039204,Wang Dan Dan,iPhone/13 Pro/Blue/128GB,8,97179,777432,FESTIVE30,544202.4,81630.36,2024-05-09 00:00:00,Paid,Pending,Debit Card,American Express,13630823295,Zhe Jiang Sheng Fan Shi Jiang Bei Xi Ning Jie O Zuo  229452
8VQE3KH8G184824039364,Ceng Hong Xia,Oppo/Reno5/Blue/1TB,4,86305,345220,AUTUMN5,327959.0,49193.85,2024-05-09 00:00:00,Pending,In Transit,Credit Card,American Express,18127053191,An Hui Sheng Shen Yang Xian Xi Shan Nan Ning Lu C Zuo  167630
V3IP1TSYV184824039535,Sun Wei,Oppo/Reno5/Red/1TB,1,67604,67604,FESTIVE30,47322.799999999996,7098.419999999999,2024-05-09 00:00:00,Failed,In Transit,PayPal,Alipay,14509763739,Xin Jiang Wei Wu Er Zi Zhi Qu Zhang Jia Gang Xian Shang Jie Qian Jiang Jie N Zuo  441471
477W7XMQI184824039715,Lei Gui Ying,Vivo/X60/Purple/32GB,10,85293,852930,WINTER10,767637.0,115145.55,2024-05-09 00:00:00,Paid,Pending,PayPal,Visa,15317752857,Guang Dong Sheng Huan Xian Dong Cheng Xu Lu J Zuo  605558
0D4DBA0SD184824039885,Jiang Bo,Oppo/Reno5/Purple/128GB,1,82871,82871,FESTIVE30,58009.7,8701.455,2024-05-09 00:00:00,Paid,In Transit,Credit Card,MasterCard,15819173447,Shan Xi Sheng Fo Shan Xian Chong Wen Li Jie K Zuo  106503
CYLRW53OU184824040051,Chen Yu,Huawei/P40/Black/8GB,8,124658,997264,AUTUMN5,947400.7999999999,142110.12,2024-05-09 00:00:00,Pending,Shipped,Credit Card,PayPal,13049597291,Qing Hai Sheng Nan Chang Xian Xun Yang Fu Xin Lu P Zuo  851632
WUT9XXCLV184824040209,Wang Chang,Oppo/Reno5/Black/254GB,8,68982,551856,WINTER10,496670.4,74500.56,2024-05-09 00:00:00,Pending,Shipped,Credit Card,American Express,13267764497,Gan Su Sheng Ting Ting Xian Xing Shan Zhang Lu K Zuo  650422
2PPZP1OED184824040378,Chen Chen,Oppo/Reno5/Purple/254GB,3,78924,236772,AUTUMN5,224933.4,33740.009999999995,2024-05-09 00:00:00,Pending,Shipped,Bank Transfer,American Express,13991868518,Chong Qing Shi Lan Zhou Shi Min Xing Fu Zhou Lu H Zuo  207399
46PKNE3L5184824040538,Ji Yan,iPhone/13 Pro/Black/128GB,1,93833,93833,FESTIVE30,65683.09999999999,9852.464999999998,2024-05-09 00:00:00,Pending,Delivered,Debit Card,Visa,13291210121,Jiang Xi Sheng Tai Bei Xian Xi Shan Xu Jie N Zuo  536186
S2YNEA1C4184824040715,Yao Feng Ying,OnePlus/9/Purple/8GB,2,95961,191922,FESTIVE30,134345.4,20151.809999999998,2024-05-09 00:00:00,Paid,Delivered,Debit Card,PayPal,13587899245,Hu Bei Sheng Gui Ying Xian Fang Shan Guan Ling Lu H Zuo  633675
KM9HSVKO5184824040881,Wu Bin,Oppo/Reno5/Black/254GB,9,52603,473427,NEWYEAR25,355070.25,53260.5375,2024-05-09 00:00:00,Failed,Pending,Bank Transfer,Alipay,18815071944,Yun Nan Sheng Jian Jun Xian Bin Cheng Huang Jie W Zuo  127654
0QIAZLQ4A184824041054,Wang Hua,Oppo/Reno5/Black/8GB,4,117700,470800,SPRING20,376640.0,56496.0,2024-05-09 00:00:00,Paid,In Transit,Bank Transfer,MasterCard,15527206853,Hai Nan Sheng Wu Zhou Shi Zi Chuan Bei Jing Lu Q Zuo  212071
IQH3AY497184824041217,Bai Yu,Oppo/Reno5/Black/64GB,3,108178,324534,FESTIVE30,227173.8,34076.07,2024-05-09 00:00:00,Pending,In Transit,Bank Transfer,MasterCard,15357377791,Shan Dong Sheng Ting Shi Xi Xia La Sa Jie F Zuo  532636
0T60AR4XQ184824041375,Ceng Qiang,Galaxy/S21/Black/32GB,4,127562,510248,AUTUMN5,484735.6,72710.34,2024-05-09 00:00:00,Failed,Pending,Debit Card,Visa,18127265726,Tai Wan Sheng Ning De Shi Dong Li Tong Liao Jie Z Zuo  722664
42NRHT989184824041535,Tang Huan,Huawei/P40/Black/32GB,7,109770,768390,NEWYEAR25,576292.5,86443.875,2024-05-09 00:00:00,Failed,Pending,Credit Card,WeChat Pay,18036886927,Shan Dong Sheng Yang Xian He Chuan Hui Zhou Lu B Zuo  520372
B78HNT2J2184824041690,Huang Yu,iPhone/13 Pro/Blue/8GB,10,133253,1332530,SPRING20,1066024.0,159903.6,2024-05-09 00:00:00,Paid,Delivered,Credit Card,WeChat Pay,15547847215,Xin Jiang Wei Wu Er Zi Zhi Qu Xiao Hong Xian Sha Shi Han Lu L Zuo  744593
T57KSKBI9184824041905,Li Gui Fang,Oppo/Reno5/Black/254GB,9,69864,628776,SUMMER15,534459.6,80168.93999999999,2024-05-09 00:00:00,Paid,In Transit,Debit Card,MasterCard,13427419674,Xi Zang Zi Zhi Qu Nan Ning Shi Yong Chuan Liu Pan Shui Lu H Zuo  316315
